Article Title,Article Link,Article Text,Article Summary,Article Image
Two J&K teachers sacked by LG Sinha for links to LeT network,https://timesofindia.indiatimes.com/india/two-jk-teachers-sacked-by-lg-sinha-for-links-to-let-network/articleshow/124981907.cms,"Representative image

NEW DELHI: Jammu and Kashmir LG Manoj Sinha on Thursday ordered the termination of two J&K government teachers found by an internal enquiry to be part of Lashker e Taiba's (LeT) overground network in Jammu division's Reasi and Rajouri districts respectively.The two staffers -- Ghulam Hussain, who joined the J&K education department in 2004 and Majid Iqbal Dar, working there since 2009 -- were dismissed by invoking Article 311(2)(c) of the Constitution of India as part of the ongoing, broader crackdown on the terror ecosystem within the Union territory. Nearly 77 J&K govt staffers have been given marching orders under this provision since 2020.Both Hussain and Dar are currently lodged in prison in separate terror cases.Sources in J&K govt told TOI that Hussain was posted at Govt Primary School, Kalwa, Mahore, Reasi but covertly working for LeT to strengthen its terror network in Reasi and the surrounding areas.“The evidence collected by the law enforcement and intelligence agencies has revealed that he was in touch with LeT terrorists Mohd Qasim and Ghulam Mustafa through encrypted messaging applications and was carrying out terror activities at their behest.He would receive terror funds via local conduits and pass them on to families of known terrorists for support, besides using the money for terror recruitment and logistics.Ghulam was arrested in 2023. Sources, citing investigation details, said he was a highly-radicalised terror sympathiser and involved in recruitment of youth into the terror fold.Majid Iqbal Dar was appointed as a laboratory assistant in 2009 promoted as a teacher in 2019. As per the dossier on his terror links, Dar was working for LeT as an OGW and was involved in radicalising youngsters in Rajouri and surrounding areas. Investigation revealed that Dar was engaged in narco-terror activities and maintained a close link with LeT terrorist Mod Jabar. He was a reliable asset to LeT and was using drug money to finance terror activities and radicalise gullible youth, said a source.“Dar’s terror link was exposed in January 2023 when police recovered an IED planted near J&K Bank in Rajouri. During the course of investigation, the police arrested three persons including Dar. It was later revealed that Majid, along with LeT terrorists Jabar and Zohaib Shazad, had planted the IED on the instruction of an LeT handler based in Pakistan. They had received monetary compensation via a conduit,” said an officer.Sources said Dar continues to display radical tendencies inside the prison.","Ghulam hussain and majid iqbal dar were dismissed by invoking article 311(2)(c) of the constitution of india. Hussain was posted at govt primary school, kalwa, mahore, reasi but covertly working for let to strengthen its terror network. Dar was involved in radicalising youngsters in rajouri and surrounding areas.","https://static.toiimg.com/thumb/msid-124981897,width-1070,height-580,imgsize-371789,resizemode-75,overlay-toi_sw,pt-32,y_pad-40/photo.jpg"
Rashtriya Ekta Diwas: PM Modi pays tribute to Sardar Vallabhbhai Patel — Watch video,https://timesofindia.indiatimes.com/india/rashtriya-ekta-diwas-pm-modi-pays-tribute-to-sardar-vallabhbhai-patel-watch-video/articleshow/124980962.cms,"PM Modi pays tribute

NEW DELHI: Prime Minister Narendra Modi on Friday paid his tribute on ' Rashtriya Ekta Diwas ' to Sardar Vallabhbhai Patel at the Statue of Unity , located on the Narmada River in Gujarat.PM could be seen offering his prayers at the Statue at around 8am. He also paid floral tributes to the first Deputy Prime Minister of India .PM Modi also shared a video in Sardar Vallabhbhai Patel's honour, describing his life and highlighting his achievements.""India pays homage to Sardar Vallabhbhai Patel on his 150th Jayanti. He was the driving force behind India’s integration, thus shaping our nation’s destiny in its formative years. His unwavering commitment to national integrity, good governance and public service continues to inspire generations. We also reaffirm our collective resolve to uphold his vision of a united, strong and self-reliant India,"" said PM as he shared the video on X.PM Modi also witnessed the 'Rashtriya Ekta Diwas' parade on the 150th birth anniversary in Ekta Nagar, Gujarat. Then, he administered the oath of unity.Additionally, a day before, PM Modi also met the family of Sardar Patel. ""Met the family of Sardar Vallabhbhai Patel in Kevadia. It was a delight to interact with them and recall the monumental contribution of Sardar Patel to our nation,"" he said.



'Rashtriya Ekta Diwas' is celebrated in Sardar's Patel's honour, marking his birth anniversary.","Pm could be seen offering his prayers at the statue at around 8am. He also paid floral tributes to the first deputy prime minister of india. 'rashtriya ekta diwas' is celebrated in sardar's patel's honour, marking his birth anniversary.","https://static.toiimg.com/thumb/msid-124981172,width-1070,height-580,imgsize-1274817,resizemode-75,overlay-toi_sw,pt-32,y_pad-40/photo.jpg"
Bihar polls: Amit Shah says Rahul’s 'maternal roots' in Italy; accuses him of 'insulting' Chhathi Maiyya,https://timesofindia.indiatimes.com/india/bihar-polls-amit-shah-says-rahuls-maternal-roots-in-italy-accuses-him-of-insulting-chhathi-maiyya/articleshow/124980101.cms,"Amit Shah, Rahul Gandhi

NEW DELHI: Union home minister Amit Shah on Thursday criticised Congress MP Rahul Gandhi , alleging that Gandhi insulted the Chhath Puja festival as he is ignorant of India's culture since Italy is his ""maternal home"".Addressing multiple rallies in Bihar, Shah said the INDIA bloc will be ""wiped out"" and that voters would ""avenge"" what he called an ""insult to Chhathi Maiyya"". He also referred to an earlier incident where Congress workers in the state allegedly abused Prime Minister Narendra Modi’s mother.Congress leader Rahul Gandhi had held one of his election meetings in the Muzaffarpur on Wednesday, and alleged that the PM had tried to enact a ""drama"" by planning to take a dip in the Yamuna at Delhi, on the occasion of Chhath Puja.He had alleged that Modi gave up his plans to take a dip when it came to light that the spot he had chosen was a puddle created with clean, piped water, since the Yamuna was extremely polluted and not fit for a bath.""Rahul baba has said Modi and others who worshipped Chhathi Maiyya were indulging in drama. His maternal roots are in Italy, and hence he has no idea about the country's culture,"" Shah said, as quoted by PTI. He asked voters to press the EVM button on NDA symbols ""with such rage that the tremors are felt in Italy"".The home minister accused the Congress and its allies of preventing the construction of the Ram temple in Ayodhya. He said, ""thwarting for 70 years"" the construction of the temple, which he said had been a matter of struggle ""since the times of the Mughals, and continued under the British"".Shah praised the Modi government for developing a new university at Nalanda, saying ""no Bakhtiyar Khilji will be able to destroy"" it. He also mentioned an ongoing project worth about Rs 850 crore to develop Punaura Dham in Sitamarhi district, which is linked to the birthplace of Goddess Sita. ""In two years from now, you will see PM Modi performing the consecration ceremony (pran pratishtha) at Punaura Dham,"" he said.At a rally in Nalanda, Shah opened his speech with references to Chanakya and Chandragupta Maurya. He then criticised the previous RJD governments led by Lalu Prasad and Rabri Devi, saying Bihar witnessed ""over 32,000 kidnappings and 12 major massacres"" during their tenure. He said, ""Nitish Kumar ended the ‘jungle raj’... but RJD is trying to bring back ‘jungle raj’ in the state with a new face.""Shah rejected claims by Tejashwi Yadav that the NDA would take back money deposited in women’s accounts under welfare schemes. ""Nobody can dare to take that money back. RJD leaders must give up this diatribe,"" he said.The home minister said that during Nitish Kumar’s time in power, ""there has been a 20 per cent drop in murders while dacoities and kidnappings have gone down by 80 per cent"". He added, ""We are preparing the youth of Bihar to win medals in the 2036 Olympics that will happen in India.""","Amit shah said the india bloc will be ""wiped out"" and that voters would ""avenge"" what he called an ""insult to chhathi maiyya"" he asked voters to press the evm button on nda symbols ""with such rage that the tremors are felt in italy"" shah accused the congress and its allies of preventing the construction of the ram temple in ayodhya.","https://static.toiimg.com/thumb/msid-124980899,width-1070,height-580,imgsize-681244,resizemode-75,overlay-toi_sw,pt-32,y_pad-40/photo.jpg"
"NDA set for manifesto launch; focus on creating jobs in IT, MSME sectors",https://timesofindia.indiatimes.com/india/nda-set-for-manifesto-launch-focus-on-creating-jobs-in-it-msme-sectors/articleshow/124975562.cms,"Bihar polls: NDA to release joint manifesto on October 31

'NDA Coming To Power With Thumping Majority': Bihar Minister Sanjay Saraogi On Assembly Polls

PATNA: NDA is all set to release its manifesto for the assembly elections on Friday, focusing on creating jobs within the state in sectors such as IT, semiconductors and micro, small and medium enterprises and setting up a contrast with opposition alliance, Mahagathbandhan's bid to draw voters with the lure of govt jobs.The BJP-led alliance's plan presents a contrasting vision and is seen to be ambitious in a state where there is a clamour for cushy govt jobs. In contrast, private jobs, although better paying are seen as riskier, often linked to business cycles and come with features like remuneration being linked to performance.Besides, in the past govts in Bihar have been seen to be more rigid to accommodating the demands of the private sector when it comes to concessions or providing land. The IT sector and MSMEs do not require large tracts of land.With migration being a major issue, NDA's push for creating employment within the state is also likely to address the concern.""There is talent here so why not focus on IT and similar sectors given that professionals from Bihar are working in Pune, Gurgaon and Bangalore,"" said a prominent NDA politician.The focus on MSMEs is seen to be a more pragmatic commitment given that Bihar is unlikely to be able to attract large factories to be set up without having the ecosystem that can cater to the big manufacturing companies.",Bihar polls: nda to release joint manifesto on october 31. Bjp-led alliance's plan presents a contrasting vision and is seen to be ambitious. Bihar is unlikely to be able to attract large factories to be set up without having an ecosystem that can cater to the big manufacturing companies.,"https://static.toiimg.com/thumb/msid-124975773,width-1070,height-580,imgsize-156174,resizemode-75,overlay-toi_sw,pt-32,y_pad-40/photo.jpg"
Don-turned-neta killed by 'another bahubali's men',https://timesofindia.indiatimes.com/india/don-turned-neta-killed-by-another-bahubalis-men/articleshow/124975462.cms,"PATNA: Bihar don-turned-neta Dularchand Yadav, once a familiar face by RJD patriarch Lalu Prasad's side, was shot dead Thursday during a clash in Patna's Mokama Tal, allegedly by assailants linked to rival strongman Anant Singh The 75-year-old was campaigning for Jan Suraaj candidate Priyadarshi Piyush when a confrontation between his supporters and Anant's group turned violent, marking the first major political killing of an otherwise peaceful election season.Jan Suraaj members said their convoy, trailing a vehicle of Anant's supporters, was attacked by 20-25 men armed with sticks and rods. Amid the chaos, Dularchand was fatally shot, they told police.Anant, nicknamed ""Chhote Sarkar"" for his influence in the region, alleged the attack was a conspiracy by former Mokama MP Surajbhan Singh, whose wife Veena Devi is contesting from the seat on an RJD ticket. ""This is a ploy by Surajbhan to defame me ahead of the polls,"" he said, demanding an impartial probe.SP Vikram Sihag said a preliminary investigation indicated both groups first clashed at Basawanchak village under Goswari police station before guns were drawn. ""Dularchand's supporters allege he was shot and run over by a vehicle belonging to Anant Singh's men,"" he said.Tejashwi Yadav blamed Nitish and Modi for ""collapsing law and order"" in Bihar.","Bihar don-turned-neta dularchand yadav shot dead during a clash in patna's mokama tal. The 75-year-old was campaigning for jan suraaj candidate priyadarshi piyush. Anant singh, nicknamed ""chhote sarkar"" for his influence in the region, alleged the attack was a conspiracy.","https://static.toiimg.com/thumb/msid-124975512,width-1070,height-580,imgsize-514964,resizemode-75,overlay-toi_sw,pt-32,y_pad-40/photo.jpg"
"Bengaluru Road Rage: Delivery boy crushed after road rage spat; martial arts trainer, wife arrested for murder",https://timesofindia.indiatimes.com/city/bengaluru/kalaripayattu-trainer-wife-chase-delivery-agent-rams-him-to-death-over-brushed-mirror-in-bengaluru-nabbed/articleshow/124914510.cms,"Accused Manoj Kumar and Aarati Sharma rammed into food delivery agent over scratched car mirror in Nataraja Layout on Oct 25, police sources said

Bengaluru Doctor Arrested For Allegedly Killing Wife With Anesthesia Overdose Months After Wedding





BENGALURU: A Kalaripayattu trainer and his wife were arrested on charges of killing a food delivery agent in a road rage incident on Oct 25.Manoj Kumar (32) from Kerala, and his wife Aarati Sharma (30) from Jammu & Kashmir, had married five years ago. Police accused the couple of deliberately murdering food delivery agent Darshan (24) by ramming their car into his gearless scooter in a fit of rage. The couple was produced before a local court Wednesday and sent to 14-day judicial custody.Also read: Delivery boy crushed to death in Bengaluru: CCTV video shows how couple chased, murdered him with car Darshan, a bachelor and resident of Kembattalli, is survived by his parents and sister.Police investigations revealed that Darshan's scooter had brushed against Kumar's car around 9pm on Oct 25 at Nataraja Layout, slightly damaging its right-side rear-view mirror. Darshan apologised but sped away as he was going to a customer's place along with his pillion rider.An investigating officer said Kumar grew angry over the incident. ""Losing control of himself, he took a U-turn and chased Darshan's scooter. In a few minutes, he spotted Darshan. Pressing the accelerator, Kumar rammed the car into Darshan's scooter from behind and sped away. Both Darshan and Varun fell onto the road.""Locals, who saw the two youths writhing in pain, shifted them to a hospital, but the doctors declared Darshan brought dead.Darshan's sister filed a case of hit and run with JP Nagar traffic police against an unknown car driver. A team of JP Nagar traffic police collected CCTV footage from the accident site. ""To our horror, we discovered that it was not an accident but an intentional act of dashing into Darshan's scooter from behind. The driver suddenly veered to the left, dashed into the vehicle, and sped away, suggesting it was intentional,"" a senior traffic police officer explained.Jurisdictional Puttenahalli police were informed, and a fresh case of murder was registered.CCTV footage also revealed that the accused couple returned to the accident site around 9.40pm in their four-wheeler and parked it a little distance away from the site. ""The couple, wearing masks, was seen collecting parts of the car that had come off while ramming the scooter. The couple then drove back and this time, their faces were clearly visible,"" a senior police officer said.Deputy commissioner of police (South), Lokesh Jagalasar, said the couple was after the duo confessed to the crime.Another investigating officer said Kumar claimed he was alone at the time of ramming Darshan. He said his wife only accompanied him to collect the broken parts of the car. ""However, we will examine his claim. As of now, we have arrested both on murder charges,"" he said.Police investigation revealed that the couple came back to the accident spot to collect the parts of the that had come off while ramming, and CCTV cameras caught their faces.","Accused manoj kumar and aarati sharma rammed into food delivery agent over scratched car mirror in nataraja layout on oct 25, police sources said. The couple was produced before a local court wednesday and sent to 14-day judicial custody. Darshan apologised but sped away as he was going to a customer's place along with his pillion rider.","https://static.toiimg.com/thumb/msid-124928505,width-1070,height-580,imgsize-49848,resizemode-75,overlay-toi_sw,pt-32,y_pad-40/photo.jpg"
"Gold rate today: How much yellow metal costs today? Check cost of 24K, 22K gold Delhi, Bengaluru, Mumbai & other cities",https://timesofindia.indiatimes.com/business/india-business/gold-price-today-check-gold-rate-in-your-city-on-october-30-2025-delhi-mumbai-bangalore-chennai-kolkata-hyderabad-ahmedabad-jaipur/articleshow/124944255.cms,"Representative AI image

Gold Rate Today : City-wise Prices

Gold rate in Delhi today:

Gold rate in Mumbai today:

Gold rate in Bengaluru today:

Gold rate in Chennai today:

Gold rate in Kolkata today:

Gold rate in Hyderabad today:

Gold rate in Ahmedabad today:

Gold rate in Jaipur today:

Gold rate in Bhubaneswar today:

Gold rate in Kanpur today:





The shine faded from gold on Thursday after the US Federal Reserve cooled expectations of additional rate cuts in 2025. After recently breaching Rs 1.21 lakh, prices have softened over the past few sessions. On Thursday, MCX December gold futures slipped Rs 1,671 to open at Rs 1,18,995 per 10 grams.With the Fed’s guarded outlook and upcoming US–China trade talks, analysts expect volatility in the precious metal to persist. Fed Chair Jerome Powell cautioned that further rate cuts were not guaranteed, citing disruptions in economic data due to the government shutdown and deep divisions among the 19 policymakers.Meanwhile, silver also opened lower. MCX December silver futures declined Rs 1,444, or 1 per cent, to Rs 1,44,637 per kilogram.In the international market, gold prices inched higher on Thursday, supported by a slight retreat in the US dollar and a widely expected 25-basis-point rate cut by the Federal Reserve.Spot gold rose 0.4 per cent to $3,942.97 per ounce at 0050 GMT, while US gold futures for December delivery fell 1.1 per cent to $3,955 per ounce.On Wednesday, both gold and silver had settled higher in domestic and global markets. December gold futures closed at Rs 1,20,666 per 10 grams, up 0.85 per cent, while silver futures ended at Rs 1,46,081 per kilogram, gaining 1.20 per cent.Here is how much gold costs in your city today:Gold prices in Delhi stood at Rs 12,064 per gram for 24K gold and Rs 11,060 per gram for 22K gold.In Mumbai, 24K gold was priced at Rs 12,049 per gram, while 22K gold cost Rs 11,045 per gram.24K gold in Bengaluru costs Rs 12,049 per gram and 22K gold is priced at Rs 11,045 per gram.Gold prices in Delhi stood at Rs 12,109 per gram for 24K gold and Rs 11,100 per gram for 22K gold.In Kolkata, gold is priced at Rs 11,045 per gram for 22K and 24K gold stands at Rs 12,049 per gram.22K gold in Hyderabad costs Rs 11,045 per gram and 24K gold costs Rs 12,049 per gram.In Ahmedabad, 22K gold costs Rs 11,050 per gram and 24K gold stands at Rs 12,054 per gram.Gold prices in Jaipur stood at Rs 11,060 per gram for 22K gold and Rs 12,064 per gram for 24K gold.In Bhubaneswar, 22K gold costs Rs 11,045 per gram today and 24K gold is priced at Rs 12,049 per gram.22K gold in Kanpur costs Rs 11,060 per gram today and 24K gold stands at Rs 12,064 per gram.","The shine faded from gold on thursday after the us federal reserve cooled expectations of additional rate cuts in 2025. After recently breaching rs 1.21 lakh, prices have softened over the past few sessions. With the fed’s guarded outlook and upcoming us–china trade talks, analysts expect volatility in the precious metal to persist.","https://static.toiimg.com/thumb/msid-124944844,width-1070,height-580,imgsize-124944,resizemode-75,overlay-toi_sw,pt-32,y_pad-40/photo.jpg"
Mumbai hostage scare: What accused Rohit Arya said in chilling video — his demands & motive revealed,https://timesofindia.indiatimes.com/india/mumbai-hostage-scare-what-accused-rohit-arya-said-in-chilling-video-his-demands-motive-revealed/articleshow/124960555.cms,"What Arya said in the chilling video



The story behind



NEW DELHI: A scary hostage situation unfolded in Mumbai's Powai on Thursday, as 50-year-old Rohit Arya held 17 children and two adults captive inside a studio, claiming he only wanted to ""have a conversation"" with certain people. Arya was shot when he allegedly tried to harm the children with an air gun and later died in hospital, officials said.Before the police entered the studio, Arya posted a video that circulated widely online in which he explained why he had taken the children and set out what he called his demands.In the viral clip, Arya introduced himself and explained his plan in calm, measured terms. He began by saying he had chosen hostage-taking over suicide and framed his action as a means to demand answers:""I am Rohit Arya. Instead of (committing) suicide, I made a plan and have taken a few children hostage....I have very simple demands. Very moral, ethical demands. I have some questions. I want to speak to some people and on their answers, if there are any counter-questions, I want to ask them. But I want these answers. I do not want anything else. I am not a terrorist, nor do I have any demand of money. Want to make simple conversations. ""He warned of consequences if provoked and insisted his motive was to force public answers: ""I want simple conversations, and that's why I've taken these children hostage.I've held them hostage as part of a plan. If I live, I'll do it. If I die, someone else will, but it will definitely happen. It will happen to these children if they don't suffer any harm.""He also threatened an extreme response to any ""wrong move"" : ""The slightest wrong move from your end will trigger me to set this whole place on fire and die in it. Whether I die or not, the children will be unnecessarily hurt and traumatised definitely.""Arya denied responsibility for any harm should it occur and framed himself as a person seeking talk-based solutions: ""If something happens to them, I shouldn't be held responsible for it. Those who are unnecessarily triggering me should be held responsible, cause a normal person just wants to talk.""""I am going to provide a solution just by talking. Please don't trigger me to do some harm to anybody,"" he added.According to Mumbai Police , Rohit Arya had called several children including boys and girls around 15 years old to R A Studio in Powai’s Mahavir Classic building for what he claimed was an audition for a web series. The auditions had reportedly been taking place for the past two days.The situation turned grim around 1:30 pm on Thursday, when Powai police received a distress call about a man holding several people hostage inside the studio. A massive response followed — teams from the Quick Response Team (QRT), the Bomb Detection and Disposal Squad, and the fire brigade immediately rushed to the scene.""At about 1.30 pm, Powai police station received information that a person had taken 17 children hostage at Mahavir Classic building. The Mumbai Police team conducted a rescue operation and safely freed all the children. During the operation, while rescuing the children, the person got injured, was immediately rushed to the hospital and later declared dead,"" Deputy Commissioner of Police Datta Nalawade told PTI.Nalawade said the police initially tried to negotiate with Arya but were forced to act when talks failed. ""It was a challenging operation, because we were negotiating with him without any positive outcome. To save the children’s lives was our priority,"" he added.To reach the hostages, the police entered the studio through a bathroom window using a ladder provided by the fire brigade. In the operation, 17 children, a senior citizen, and another man were safely rescued.Officials said Arya was carrying an air gun and some chemicals. While police initially did not confirm that any firing took place during the rescue, Arya was declared dead at 5:15 pm at the hospital.Andheri MLA Murji Patel later visited the rescued children at Seven Hills Hospital. He said, ""I met the children at the hospital they were safe."" As per reports Arya had been shooting with the group for five days and had not appeared to threaten or intimidate them before Thursday’s incident.","Rohit arya, 50, held 17 children and two adults captive inside a studio in mumbai. He was shot when he allegedly tried to harm the children with an air gun. Arya posted a video that circulated widely online in which he explained why he had taken the children and set out his demands.","https://static.toiimg.com/thumb/msid-124962003,width-1070,height-580,imgsize-103238,resizemode-75,overlay-toi_sw,pt-32,y_pad-40/photo.jpg"
