Article Title,Article Link,Article Text,Article Summary,Article Image
"'People haven't rejected Ajit dada, rather ... ': Fadnavis on Pune win; hails leadership of PM Modi",https://timesofindia.indiatimes.com/india/people-havent-rejected-ajit-dada-rather-fadnavis-on-pune-win-hails-leadership-of-pm-modi/articleshow/126616734.cms,"Devendra Fadnavis Says BJP Created History in Maharashtra Civic Elections

Pawars meet in Pune



NEW DELHI: Maharashtra chief minister Devendra Fadnavis on Saturday dismissed suggestions that deputy chief minister Ajit Pawar had been ""rejected"" on his home turf, saying voters had instead endorsed Prime Minister Narendra Modi’s leadership and the BJP’s governance model.“I will not say that people have rejected dada, rather they have accepted the leadership of Prime Minister Modi, the BJP and us,” Fadnavis said, as quoted by PTI.Fadnavis' remarks came a day after the party’s sweeping victory in key civic polls.Ajit Pawar, popularly known as ‘dada’, had allied with his uncle Sharad Pawar’s faction of the NCP for the civic elections in Pune and Pimpri Chinchwad, long considered Pawar family strongholds. The alliance, however, failed to stem the BJP’s surge.Also Read: Mumbai BMC Election Results 2026 Live Updates: Shinde Sena moves newly elected corporators to luxury hotel Asked who now held the title of ‘dada’ in Pune politics, Fadnavis replied that authority ultimately rested with the electorate. “The people of Pune are the dada, and we are their sevaks,” he said.Thanking voters for what he described as a “landslide” mandate, Fadnavis said, “I thank the voters of Pune and Pimpri Chinchwad for reposing their faith in the BJP and giving us a landslide victory.I am not merely thanking them; I am indebted to them.” He added that while the results were encouraging, they also carried responsibility. “While we are happy with this mandate, it also reminds us of our responsibility towards these cities. ”The campaign had seen Ajit Pawar attack BJP-led civic administrations over alleged irregularities and stalled development between 2017 and 2022. Fadnavis, however, said the results had settled speculation around the contest, noting that they were “beyond the expectations of many people”.Also Read: BMC and other Maharashtra civic poll results 2026: Top 10 winners and losers He said voters had placed their trust in the BJP’s development vision and PM Modi’s leadership, adding, “We will have to work even harder to live up to the trust that people have placed in us. I will ensure that the vision we presented before the people is translated into reality immediately after the mayor is elected.”Ajit Pawar did not attend a cabinet meeting in Mumbai earlier in the day. Addressing his absence, Fadnavis said, “I had met Ajit Pawar on the voting day (January 15) when he told me that he would not be attending the cabinet meeting.”Pawar on Saturday also met his uncle Sharad Pawar. Ajit Pawar said the meeting was incidental, linked to the inauguration of an agriculture exhibition in Baramati, and stressed family unity amid merger speculation.“An agriculture exhibition was inaugurated today, and I had come to Baramati for that. I was told that (Sharad) Pawar saheb is also at his residence. So I went to his house and we all later headed for the exhibition,” he said.“We are together (as Pawar family). We go to each other’s places at required times,” he added.Congratulating the BJP, he said his party would review the defeat. Pawar dismissed allegations over EVMs and said setbacks should prompt reflection rather than discouragement, adding that alliance decisions for local polls rest with local leadership.“Voters are important, and every political party must continue its efforts. The BJP has achieved significant success, and I congratulate the party for its performance. These civic polls were fought by the BJP under the leadership of Chief Minister Devendra Fadnavis, and the other parties had to face defeat,” he said.The BJP secured 119 of 165 seats in the Pune civic body, while the Ajit Pawar-led NCP won 27 seats and the NCP (SP) managed just three. In Pimpri Chinchwad, the BJP won 84 of 128 seats, comfortably crossing the majority mark.","Devendra fadnavis: voters have accepted the leadership of prime minister modi, the bjp and us. Ajit pawar had allied with his uncle sharad pawar’s faction of the ncp for the civic elections in pune and pimpri chinchwad, long considered pawar family strongholds. The bjp secured 119 of 165 seats in the pune civic body.","https://static.toiimg.com/thumb/msid-126616983,width-1280,height-720,imgsize-574233,resizemode-6,overlay-toi_sw,pt-32,y_pad-600/photo.jpg"
"From paintings, tableau to band performances, Vande Mataram will be theme of R-Day parade; Bhairav Regiment, Robots, Drone Shakti Will Be A Big Draw",https://timesofindia.indiatimes.com/india/from-paintings-tableau-to-band-performances-vande-mataram-will-be-theme-of-r-day-parade-bhairav-regiment-robots-drone-shakti-will-be-a-big-draw/articleshow/126627467.cms,"Pinaka multi-barrel rocket launcher



India's Silent Warriors On Kartavya Path Bring Army’s Battle-Tested Animals To Republic Day Parade

NEW DELHI: This time, 150 years of Vande Mataram will be the theme of the Republic Day parade on Jan 26. A series of paintings created by Tejendra Kumar Mitra in 1923, illustrating the verses of ‘Vande Mataram’ and published in the ‘Bande Mataram Album’ (1923), will be displayed as view-cutters along Kartavya Path during the parade. Even band performances on the theme ‘Vande Mataram’ will be organised from Jan 19 to 26 by Indian Army , Navy, IAF, Indian Coast Guard, and other paramilitary forces in R-Day events across india. The performance venues will also include the ancestral home and birthplace of Bankim Chandra Chattopadhyay at Kanthalpara, Naihati, North 24 Parganas District, West Bengal, currently known as ‘Bankim Bhawan Gaveshana Kendra’. Even floral decorations at the parade dais will be based on the Vande Mataram theme.Among the seven marching contingents of the Army, the centre of attraction will be the animal contingent comprising Zansker ponies, Bacterian camel and native Indian-bred dogs like Mudhol Hound, Rampur Hound and Rajapalayam with their handlers and the newly-raised Bhairav contingent.Robotic mules and unmanned ground vehicles, Shaktiban artillery regiment, Brahmos cruise missiles, Akash missile, Drone Shakti and Glacier all terrain vehicles will be the key attractions in the mechanised columns.The Indian Army will be represented by a Mounted Column of 61 Cavalry & Battle Array Formation. President of the European Commission, Ursula von der Leyen, and President of the European Council, Antonio Costa, will be the chief guests at the parade.A total 18 marching contingents and 13 bands will take part in the show of the country’s military might on Kartavya Path. The flypast will showcase Rafale, Su-30 and MiG-29 fighters, P8i reconnaissance aircraft, C-295 tactical transport planes, Apache, LCH (Light Combat Helicopter), ALH (Advanced Light Helicopter) and Mi-17 choppers in different formations.Around 10,000 people from all walks of the society have been invited to witness the parade as special guests, including people with exemplary work in technology, innovation, start-ups, self-help groups, and best performers.A total of 30 tableaux, including 17 from states and UTs, 13 from ministries, departments and services, will roll down the Kartavya Path this year. Among the central ministries, the ministry of culture's ‘Vande Mataram: The Soul-Cry of a Nation’ tableau will anchor the central theme, while the department of military affairs will present a tri-services tableau on Operation Sindoor, symbolising jointness. The veterans’ tableau by the IAF will certainly attract attention.Themes blending tradition and innovation will dominate many displays. Odisha's ‘Soil to Silicon’ tableau will reflect growth rooted in tradition, Tamil Nadu will present India’s emergence as an EV manufacturing hub, and Kerala will highlight its Water Metro and 100% digital governance initiatives, and Nagaland's tableau will showcase the Hornbill Festival as a marker of culture, tourism, and self-reliance.","A series of paintings created by tejendra kumar mitra in 1923, illustrating the verses of ‘vande mataram’ and published in the ‘bande mataram album’ (1923) will be displayed as view-cutters along kartavya path. A total of 18 marching contingents and 13 bands will take part in the show of the country’s military might.","https://static.toiimg.com/thumb/msid-126627500,width-1280,height-720,imgsize-1363990,resizemode-6,overlay-toi_sw,pt-32,y_pad-600/photo.jpg"
"Need law to fight discrimination, says Rahul on Vemula anniversary",https://timesofindia.indiatimes.com/india/need-law-to-fight-discrimination-says-rahul-on-vemula-anniversary/articleshow/126626354.cms,"(File photo)

Indian NGO Highlights Dalits, Minorities Rights In India At UNHRC Side Event

NEW DELHI: On the 10th death anniversary of Dalit student Rohith Vemula on Saturday, Congress leader Rahul Gandhi stressed the need for an anti-discrimination law, saying Dalit youth continue to face discrimination and other challenges on campuses.Vemula, a 26-year-old student of University of Hyderabad, died by suicide on Jan 17, 2016, following alleged harassment.In a post in Hindi on X, Rahul said, ""And today? Has the reality for Dalit youth changed? The same contempt on campus, the same isolation in hostels, the same feeling of inferiority in classrooms, the same violence - and sometimes, the same death. Because caste is still the biggest admission form in this country.""That is why Rohith Vemula Act is not just a slogan but a necessity, he said. ""This fight is not just in Parliament, it is a fight of the youngsters on campuses and 'it is our fight',"" Rahul asserted.""We need an anti-discrimination law now,"" he emphasised. The Congress govts in Karnataka and Telangana were in the process of implementing the law as soon as possible, he added.Meanwhile, Congress on Saturday lashed out at the Modi govt, with party general secretary, in-charge of communications, Jairam Ramesh saying in a post on X, ""In yet another blow to the self-proclaimed Vishwaguru's self-boastful diplomacy, the US Central Command has just issued a statement saying that US and Pakistani Army soldiers have completed joint training exercises codenamed 'Inspired Gamble'.""Ramesh highlighted that US President Donald Trump ""himself has repeatedly expressed his deep admiration for Field Marshal Asim Munir, whose inflammatory and communally provocative remarks had provided the immediate backdrop to the Pakistan-orchestrated terror attacks in Pahalgam on April 22, 2025.""","Rohith vemula, a 26-year-old student of university of hyderabad, died by suicide on jan 17, 2016, following alleged harassment. Congress leader rahul gandhi said dalit youth continue to face discrimination and other challenges on campuses. ""we need an anti-discrimination law now,"" he emphasised.","https://static.toiimg.com/thumb/msid-126626424,width-1280,height-720,imgsize-1064338,resizemode-6,overlay-toi_sw,pt-32,y_pad-600/photo.jpg"
"'Life-and-death election for them': Uddhav Thackeray alleges coercion, kidnapping in BMC polls; thanks voters for backing Shiv Shakti alliance",https://timesofindia.indiatimes.com/india/life-and-death-election-for-them-uddhav-thackeray-alleges-coercion-kidnapping-in-bmc-polls-thanks-voters-for-backing-shiv-shakti-alliance/articleshow/126620765.cms,".

‘BJP Won By Betrayal’: Uddhav Thackeray’s First Reaction On Mumbai Civic Poll Results

NEW DELHI: Alleging intimidation, coercion and unprecedented political pressure, Shiv Sena (UBT) president Uddhav Thackeray on Saturday launched a scathing attack against the Mahayuti over the BMC elections , calling the January 15 civic polls a “strange” contest fought as a matter of political survival by his opponents.Addressing a press conference, Thackeray alleged that the ruling alliance left no method unused to secure a victory. “This election was very strange. It felt like this was a life-and-death election for them. They opted for all methods, from cash to kidnapping our candidates; they forced candidates to withdraw their nominations,” he said.The UBT president also raised questions over the voting process and claimed he had received several complaints from citizens about their names missing from the voter lists. He said the results at many locations were “surprising” and did not match ground-level expectations.“Where did those numbers come from? Was it from some party office? Before counting numbers were seen on TV. In future, there will be no EVM, and the direct results will be declared. I have received several complaints from voters that their names were missing from the voter list. At various locations, the results are surprising.I had doubts about the exit polls,” said Thackeray.Despite the Mahayuti alliance of the BJP and the Eknath Shinde-led Shiv Sena clinching a majority, Thackeray said the outcome reflected the resilience of Shiv Sena (UBT) on the ground. Thanking voters who stood firm despite alleged attempts to intimidate them, he said, “Voters are the saviours of democracy,” and added that those who were not scared showed that the “strength of Shiv Sena UBT” remains intact.Thackeray expressed deep gratitude to citizens who backed the Shiv Shakti Alliance, a first-time collaboration between his faction of the Shiv Sena and his cousin Raj Thackeray’s Maharashtra Navnirman Sena (MNS). He also apologised for not being able to campaign in all areas.“Yesterday, election results were announced. I could not visit many locations to campaign, but we got a good response at several places. I would at first apologise to voters where I was unable to reach. I thank those who voted for Shiv Shakti Alliance (with MNS),” he said.“The wish to have our Mayor wasn’t fulfilled, but the results have definitely shown the strength of Shiv Sena UBT,” Thackeray added.The 2026 BMC elections marked a historic political shift, ending nearly three decades of Thackeray family dominance over India’s richest civic body. The BJP emerged as the single largest party with 89 seats, while the BJP-led Mahayuti alliance crossed the halfway mark with 118 seats.Shiv Sena (UBT) secured 65 seats, polling 7,17,736 votes, which accounted for 13.13 per cent of the total votes cast. The MNS won six seats with 74,946 votes and a 1.37 per cent vote share. The Indian National Congress secured 24 seats, polling 2,42,646 votes, or 4.44 per cent of the vote share.Meanwhile, following the Mahayuti’s victory, political activity has intensified in Mumbai. Sources said the Shinde-led Shiv Sena has moved its newly elected corporators to a hotel in Bandra amid power negotiations. The party is also likely to demand the Mayor’s post in the BMC, reportedly as part of celebrations marking the centenary year of Shiv Sena founder Bal Thackeray, whose 100th birth anniversary falls on January 23.",Shiv sena (ubt) president uddhav thackeray on saturday launched a scathing attack against the mahayuti over the bmc elections. He alleged that the ruling alliance left no method unused to secure a victory. “this election was very strange. It felt like this was a life-and-death election for them.,"https://static.toiimg.com/thumb/msid-126620924,width-1280,height-720,imgsize-954133,resizemode-6,overlay-toi_sw,pt-32,y_pad-600/photo.jpg"
