Article Title,Article Link,Article Text,Article Summary,Article Image
"Monsoon session: NDA in command, opposition in disarray. Will DMK tilt the balance?",https://timesofindia.indiatimes.com/india/monsoon-session-nda-in-command-opposition-in-disarray-will-dmk-tilt-the-balance/articleshow/132310564.cms,"NDA in command, opposition in disarray. Will DMK tilt the balance?

First blow: Raghav’s rebellion stings AAP

Second blow: Mamata’s defeat and Trinamool implosion

Third blow: Shiv Sena split

Fourth blow: Congress-DMK split

'DMK may try to get even with Congress'

Misplaced confidence?

NEW DELHI: The end of the Budget session of Parliament this year marked a rare high for the opposition. The Congress-led INDIA bloc united with other opposition parties to prevent the Centre from passing a Constitution Amendment Bill. The Bill linked implementation of women's reservation to delimitation. This was on April 17. Nearly three months down the line, as parties gear up for the Monsoon session from July 20, the euphoria of this triumph has been replaced by concern among the opposition ranks.The Bill that they had managed to stop in its tracks during the Budget session could make its way back in the Monsoon session and garner greater support in Parliament. In April, 298 members supported the Bill in Lok Sabha while 230 opposed it. MPs supporting the Bill were way more than those opposing it but were short of the two-thirds majority of 352 (out of 528) needed for the passage of the Constitution Amendment Bill.So, what has changed in three months? Well, a lot. Parties have split. Opposition numbers in Parliament have come down. Long-time allies have turned into foes. The opposition camp is in disarray and the regional parties under its fold are now a weakened force.And, that is why the upcoming Monsoon session may be interesting to watch. The BJP, still smarting from the rare failure on the Constitution Amendment Bill, is reportedly working behind the scenes to ensure a two-thirds majority to push through its important pending legislations, including the delimitation bill.The Congress has accused Union home minister Amit Shah of trying to ""engineer"" a two-third majority for the BJP in Lok Sabha and alleges he is busy breaking opposition parties while making a ""complete mockery of democracy"" but his ""evil designs"" will not succeed.""Never before has anybody tried to engineer a two-third majority for his party in the Lok Sabha as the Union Home Minister is desperately doing these days in the run-up to the Monsoon Session of Parliament . The self-styled Chanakya had been humiliated on April 17 2026 when the NDA could not get the requisite two-third majority. Stung by that resounding defeat, Shah is now busy breaking opposition parties and making a complete ""mockery of democracy"", Congress general secretary in-charge communications Jairam Ramesh said in a post on X..The three months between the two sessions saw four important political developments that have together put the NDA in command and the opposition on the backfoot.On April 24, exactly seven days after NDA’s Lok Sabha setback, the opposition suffered the first blow as 7 MPs of Arvind Kejriwal’s AAP broke ranks with the party in Rajya Sabha and aligned with the BJP. Since, the breakaway group’s strength was more than two-thirds of the total 10 MPs the party had in the Upper House, the defection did not come under the purview of the anti-defection law. The rebellion, which came as a surprise to Arvind Kejriwal, reduced AAP’s strength in Rajya Sabha to 3.The second blow to opposition came from West Bengal, where BJP ended Mamata Banerjee’s 15-year-rule and successfully snatched a key state from the hands of the opposition. While the defeat stunned Mamata, what hurt her and the opposition camp more was the implosion which threatened the very existence of the Trinamool Congress. 20 MPs of the Trinamool Congress raised a banner of revolt against Mamata and her nephew Abhishek Banerjee and announced to align with the BJP in Lok Sabha. This list of 20 included several of Mamata’s loyalists and was enough to avoid any action under the anti-defection law. To make matters worse, several Rajya Sabha members of Trinamool also joined this rebellion. However, since their numbers were less, they resigned from the party and their membership from the Upper House.The opposition camp suffered another blow in June when 6 out of the 9 MPs of Uddhav Thackeray’s Shiv Sena decided to dump the party and join hands with Eknath Shinde . The six MPs submitted a letter to Lok Sabha Speaker Om Birla indicating their decision to join the Shinde camp. For Uddhav this was the second time that he faced rebellion from within the ranks. The Shiv Sena suffered a massive vertical split in 2022 when Shinde led a rebellion of party MLAs. Uddhav eventually lost control of the party and symbol.The fourth blow to the opposition camp came from Tamil Nadu. M K Stalin ’s DMK , which had aligned with the Congress, lost the 2026 assembly elections to actor-tuned-politician Vijay. Ideally, this poll upset should not have impacted the opposition’s national politics. After all, the silver lining was that the BJP-AIADMK alliance had failed in the state. But that was not to be. Vijay’s TVK got a big mandate but not enough to ensure a government on its own. Vijay needed help and the Congress was more than ready to chip in. So, the grand-old-party moved swiftly to dump DMK and join hands with TVK. This set the stage for one of the biggest disruptions in the INDIA bloc since it was formed. The DMK snapped all ties with the Congress, sought a separate seating plan in Parliament, walked out of the INDIA bloc and, if some reports are to be believed, is also flirting with the idea of some sort of coordination on its terms with the BJP.Arun Ram, Tamil Nadu Resident Editor of The Times of India, feels the prospect of DMK supporting the Union government on some bills cannot be completely ruled out.“The DMK may support the Union government on some bills to get even with the Congress or also to not appear completely friendless,” says Arun Ram.“DMK cannot go back on some of its stated positions, like on delimitation, three-language formula. But, yes on some of the bills it may back the Union government. For instance, if the BJP completely delinks the Women’s Reservation Bill from the Delimitation Bill, the DMK may support the government on Women’s Bill,” he adds.Now, that is a prospect which could deal a body blow to the INDIA bloc. DMK has 22 members in Lok Sabha and if Stalin decides even a tactical association with the NDA - it could disrupt opposition math. For now, the opposition is trying to put up a brave front knowing that two-third majority in a House of 543 translates into numbers which, at least on paper, looks beyond the reach of NDA. The Congress has claimed that it will not let the “evil designs” of BJP to succeed. But this Congress confidence could well be misplaced. What the opposition needs to understand is that two-thirds majority is a number that can change depending on how many members are present for the voting. We have already seen the BJP surprise many times when it comes to managing numbers in Parliament.","Nda in command, opposition in disarray. Will dmk tilt the balance? First blow: raghav’s rebellion stings aap. Second blow: mamata's defeat and trinamool implosion. Third blow: shiv sena split. Fourth blow: congress-dmk split. The opposition camp suffered another blow in june when 6 out of the 9 mps of uddhav thackeray’s shiv sena decided to dump the party and join hands with eknath shinde.","https://static.toiimg.com/thumb/msid-132314914,width-1280,height-720,resizemode-6,overlay-toi_sw,pt-32,y_pad-600/photo.jpg"
30% deletions in Daman & Diu SIR draft roll,https://timesofindia.indiatimes.com/india/30-deletions-in-daman-diu-sir-draft-roll/articleshow/132323298.cms,"Representative image

Final voter roll on August 11

NEW DELHI: In the Union territory of Daman and Diu and Dadra and Nagar Haveli, 29.7% of electors have been deleted from the draft electoral roll published on Friday, with officials overseeing the SIR (special intensive revision attributing the unique trend to the UT's large migrant workforce and heavily industrialised economy.The largest share of deletions - 22.5% of the electorate - comprised voters who were marked absent or untraceable as they were not found on their registered addresses despite multiple visits by BLOs. Another 4.6% had permanently shifted, 1.7% had died, 0.6% were registered at multiple places, and 0.2% were deleted under the ""others"" category.Of the UT's 4.28 lakh electors, just over 3 lakh, or 70.3%, submitted enumeration forms on June 4, when the SIR was announced. The remaining were removed from the draft roll.""The latest survey by the health department put the UT's population at 6.8 lakh, of which around 3 lakh were migrants,"" an officer involved in SIR told TOI.While 29.7% is the highest rate of deletion so far in any state/UT at the draft roll stage, it is not the final figure, as deleted names can be added back during the claims and objections period. Also, fresh enrolments (through Form 6) will also lead to some additions. The final roll will be published on August 11.","In the union territory of daman and diu and dadra and nagar haveli, 29.7% of electors have been deleted from the draft electoral roll. The largest share of deletions - 22.5% of the electorate - comprised voters who were marked absent or untraceable. The final roll will be published on august 11.","https://static.toiimg.com/thumb/msid-132323297,width-1280,height-720,resizemode-6,overlay-toi_sw,pt-32,y_pad-600/photo.jpg"
"Cancer patient dead, her plea for drug listed 57 times for hearing",https://timesofindia.indiatimes.com/india/cancer-patient-dead-her-plea-for-drug-listed-57-times-for-hearing/articleshow/132323069.cms,"Representative image

'Petitioner death exposes cost of judicial delays'

A writ petition for access to a life-saving breast cancer medicine, Ribociclib, filed before Kerala high court in June 2022 has been listed for final hearing 57 times since Jan 21, 2023, without the matter being heard.The working group on access to medicines has written to Chief Justice of India, requesting him to consider steps to expedite the hearing to ensure justice for those who need the medicine urgently.The petitioner died in the early stage of the case, after which the HC decided to continue it suo motu, given the larger public interest.The working group comprises patient advocates, patient groups, civil society organisations, academics, and lawyers.Breast cancer is one of the most common cancers among women in India. The Global Cancer Observatory report of 2022 said India reported more than 1.9 lakh new cases and 98,300 deaths.""Official data tabled in Parliament by the ministry of health and family welfare in early Feb 2026 made an estimated projection of 2.4 lakh. Among these, patients with Luminal A (HR+/HER2-) breast cancer, an invasive subtype that can spread to other parts of the body, require targeted medicines, such as Ribociclib and Abemaciclib, to save their lives.These medicines are critical for HR+HER2- patients because these medicines can be used to treat patients at an early stage. However, these medicines are prohibitively expensive as they are under patent protection (Ribociclib is over Rs 78,400 per month and Abemaciclib Rs 47,700 to 95,500 per month),"" the letter to the CJI said.The petition sought a govt use licence under Section 100 of Patent Act, which could have enabled access to Ribociclib at affordable prices. ""A govt use licence facilitates production of the generic version of the drug locally, and at an affordable price. Often, the price of the generic versions is 90%-95% cheaper than that of the originator. While the govt acknowledged the medicine's effectiveness, it refused to issue a govt use licence, stating that breast cancer did not constitute a matter of national urgency,"" the group explained in the letter. It added that the govt has not provided a reasoned response regarding access to life-saving medicines and the enjoyment of right to health.After deciding to continue the case suo motu, the court appointed an amicus curiae and the various respondents, including the Union of India, filed detailed responses.The manufacturers of the medicine were impleaded and they too filed their responses. The letter pointed out that every stakeholder has been heard and every report sought by the court has been submitted. ""The pleadings stand completed. Yet the constitutional questions on the obligations of the govt under Article 21 with regard to access to medicines remain unaddressed,"" the letter to the CJI said.""The untimely demise of the petitioner in this matter highlights the devastating human cost of judicial delays in cases involving access to lifesaving drugs,"" the letter said, adding that a swift resolution would provide hope to others suffering from the dreaded disease who do not have the means to approach the court.","A writ petition for access to a life-saving breast cancer medicine, ribociclib, filed before kerala high court in june 2022 has been listed for final hearing 57 times since jan 21, 2023. The petitioner died in the early stage of the case, after which the hc decided to continue it suo motu, given the larger public interest.","https://static.toiimg.com/thumb/msid-132323086,width-1280,height-720,resizemode-6,overlay-toi_sw,pt-32,y_pad-600/photo.jpg"
"Clear space, clear mind",https://timesofindia.indiatimes.com/india/clear-space-clear-mind/articleshow/132311851.cms,"Thirukkural with the Times explores real-world lessons from the classic Tamil text ‘Thirukkural’. Written by Tamil poet and philosopher Thiruvalluvar, the Kural consists of 1,330 short couplets of seven words each. This text is divided into three books with teachings on virtue, wealth, and love and is considered one of the great works ever on ethics and morality. The Kural has influenced scholars and leaders across social, political, and philosophical spheres. Motivational speaker, author and diversity champion Bharathi Bhaskar explores the masterpiece. Some time ago, I was in Pondicherry to participate in a meeting. One of the organisers invited me home. It was a modest old house with faint traces of French architecture. Yet, the moment I entered, I noticed that the house was extraordinarily neat. There was no shoe rack at the entrance, but the slippers stood perfectly aligned. The lady of the house invited me into the kitchen. Living rooms can be arranged for visitors; kitchens rarely lie, I believe. This one had utensils, vegetables, milagai vaththal and sundaikkai drying. Yet there was order everywhere, from the loft above to the flowers before the pictures of Sri Aurobindo and the Mother. Then she told me a story. Years ago, the Mother had once visited their home. The house was messy as most homes are. The Mother sat down but her eyes kept returning to a bureau and finally asked if she could open it. The moment it was opened, objects which had been pushed and crammed inside tumbled out. Along with the family, she began arranging them herself. That day, the family learnt something that was passed down to generations: order outside can create a certain quietness within. Cleanliness thereafter was not an act performed before guests arrived. It became a way of life. An organised space gives the mind room to breathe. Of course, friends disagree. “A house is not a museum,” they tell me. Fair enough. Some minds seem to produce their brightest ideas from beneath three newspapers, two coffee cups and one missing charger. But private clutter is one thing, and the way we leave a shared space is another. Some men turn street corners into urinals. Flight and train toilet floors are left wet. Bottles fly out of car windows. People leave food packets in buses and popcorn tubs in cinema theatres, because “someone will clean them”. And who is that “someone”? A person like us. Whose back aches. Who is waiting to go home. Who has children and worries. Who is really the ‘kuppaikaaran’, the one who litters or the one who cleans that mess? At the 2026 FIFA World Cup, after Japan’s defeat to Brazil, Japanese supporters stayed behind with garbage bags, collecting cups, wrappers and litter in the stadium. Japanese children grow up cleaning classrooms and shared spaces. There is a saying in Japan, tatsu tori ato wo nigosazu — 'a departing bird does not muddy the water’. Imagine our schools asking children to clean their classroom or playground. By the next morning, parents may besiege the management. Perhaps cleanliness is not really about dust, shoes or cupboards. It is about our relationship with spaces. Why are some people disturbed by disorder while others barely notice it? Why do some cultures clean even what others have left behind? Two thousand years ago, Valluvar found that the difference in people lie not in appearance, wealth or status, but in culture. In Kural 993, he says: “Uruppu Oththal Makkal Oppu Andraal; Veruththakka Panbu Oththal Oppadhaam Oppu.” “Among people, physiognomy is the same; But culture makes all the difference.” Perhaps the real measure of culture is not how beautifully we occupy a place, but how gently we leave it behind; for the unknown person who comes next.","Thirukkural with the times explores real-world lessons from the classic tamil text. Written by tamil poet and philosopher thiruvalluvar, the kural consists of 1,330 short couplets of seven words each. This text is divided into three books with teachings on virtue, wealth, and love.","https://static.toiimg.com/thumb/msid-132311854,width-1280,height-720,imgsize-167941,resizemode-6,overlay-toi_sw,pt-32,y_pad-600/photo.jpg"
"FCI makes distilleries accountable for subsidised rice, warns of criminal cases",https://timesofindia.indiatimes.com/india/fci-makes-distilleries-accountable-for-subsidised-rice-warns-of-criminal-cases/articleshow/132319583.cms,"Food Corporation of India

NEW DELHI: Food Corporation of India (FCI) has tightened safeguards for the lifting and use of subsidised rice supplied to distilleries under govt’s ethanol blending programme, making distilleries directly accountable for any diversion or misuse of the released grain. In case of misuse or diversion, FCI will file criminal cases.The move is aimed at preventing diversion of subsidised foodgrain and strengthening oversight of the ethanol supply chain.In its revised “operational guidelines” circulated to all field officers, FCI said before the rice is released, the depot manager will obtain a written undertaking from the authorised representative of the distillery stating that it will be solely responsible for the proper utilisation of the subsidised rice after it leaves FCI depots.“In case any other use/ misuse of the rice other than specifically indicated in the instant release order, is found on the part of the distillery, or comes to the notice/ knowledge of FCI through any source, at any stage, during or after the execution of the process/ transaction, FCI reserves the right to take appropriate action including criminal action against the party/ agency,” the guidelines said.It said for getting the allocated subsidised rice for ethanol production, an authorised representative of a distillery must approach the designated FCI depot as mentioned in the release order and furnish details of the vehicles, including their registration numbers, and the destination godowns where the rice will be transported. Depot managers and quality control officials have been directed to ensure that stocks are issued strictly on a first-in, first-out (FIFO) basis and only to the authorised representative of the distillery.","Food corporation of india (fci) has tightened safeguards for the lifting and use of subsidised rice supplied to distilleries under govt’s ethanol blending programme. In case of misuse or diversion, fci will file criminal cases. The move is aimed at preventing diversion and strengthening oversight of the ethanol supply chain.","https://static.toiimg.com/thumb/msid-132319576,width-1280,height-720,resizemode-6,overlay-toi_sw,pt-32,y_pad-600/photo.jpg"
