Article Title,Article Link,Article Text,Article Summary,Article Image
"Safeguard democracy, ensure probe agencies don't defame citizens, Mamata appeals to CJI",https://timesofindia.indiatimes.com/india/safeguard-democracy-ensure-probe-agencies-dont-defame-citizens-mamata-appeals-to-cji/articleshow/126635469.cms,"Mamata (File photo)

JALPAIGURI/KOLKATA: West Bengal chief minister Mamata Banerjee Saturday made a fervent appeal to Chief Justice of India (CJI) Surya Kant to safeguard democracy and ensure that investigative agencies do not defame citizens.""Our safety, security, history, geography, and boundaries must all be protected. The media should not conduct trials before cases are finalised... We are under your custody. You are the guardians of the Constitution,"" Mamata told the CJI during the inauguration of Jalpaiguri circuit bench of Calcutta high court.CJI Kant appreciated the vision of Calcutta high court and the state govt in setting up a circuit bench in Jalpaiguri in 2019, noting that before its establishment, people from the region had to travel nearly 600 km to Kolkata in pursuit of justice. ""Today, it has its own home. This building is designed as a sophisticated synthesis of tradition and 21st-century digital agility. It stands as a testament to judicial decentralisation,"" he said.Union law minister Arjun Ram Meghwal, who also attended the function, said Jalpaiguri circuit bench would be equipped with the latest technology, adding that ""justice should not just happen but should also be seen to happen."" He stressed the Centre's e-courts project, for which Rs 7,210 crore has been allocated in Phase III.","West bengal chief minister mamata banerjee appealed to chief justice of india surya kant to safeguard democracy. ""our safety, security, history, geography, and boundaries must all be protected. The media should not conduct trials before cases are finalised... we are under your custody,"" she said.","https://static.toiimg.com/thumb/msid-126635550,width-1280,height-720,imgsize-805602,resizemode-6,overlay-toi_sw,pt-32,y_pad-600/photo.jpg"
"After quarrel over rash riding, bikers return with friends, kill 2",https://timesofindia.indiatimes.com/india/after-quarrel-over-rash-riding-bikers-return-with-friends-kill-2/articleshow/126635372.cms,"One of the arrested men, Neelakandan, who fractured his right leg while trying to escape from police



CHENNAI: Two men were killed and another was critically injured in an attack outside a hotel in Tamil Nadu 's Tiruvallur Friday night following a road-rage incident. Police have arrested four suspects, including office-bearers of Tamilaga Vetri Kazhagam and Bahujan Samaj Party.Parthiban, 32, a bank clerk in Sevvapet, and Sugumar, 31, a private loan collection agent, died, while Kesavamoorthy, 23, who was with them, sustained serious injuries and is undergoing treatment at the Tiruvallur Govt General Hospital, police said.The men, residents of Ondikuppam in Tiruvallur, were returning from a Pongal trip to Kona Falls in Andhra Pradesh. At 7 pm, while they were standing near a bakery, two men on motorcycles, Jyotish, 34, and Vinothkumar, 36, allegedly rode past at high speed in a rash manner. When the men questioned them, a heated argument broke out.Later, Jyotish and Vinothkumar gathered their associates, including Neelakandan, 30, a BSP functionary, and Jawahar, 23, a TVK office-bearer. Allegedly under the influence of drugs, the group went in search of Parthiban and his friends.At 10 pm, when they found the men stepping out of the hotel, they surrounded them, pelted stones, and attacked them with sharp weapons.Parthiban collapsed on the spot and died. Sugumar and Kesavamoorthy were rushed to Tiruvallur govt General Hospital. Sugumar, who suffered severe injuries, died following a cardiac arrest. Kesavamoorthy remains in critical condition.Police registered cases for murder and attempted murder and later nabbed four suspects, identified as Neelakandan, Jyotish, Vinothkumar, and Jawahar.Neelakandan fractured his right leg and Jawahar fractured his right hand while trying to escape, police said. After treatment, they were produced before a magistrate on Saturday and remanded in judicial custody.SP Vivekananda Shukla said police have arrested all the accused and confirmed that no other persons were involved in the violence.","Parthiban, 32, a bank clerk in sevvapet, and sugumar, 31, a private loan collection agent, died. Kesavamoorthy, 23, who was with them, sustained serious injuries and is undergoing treatment at tiruvallur govt general hospital. Police have arrested four suspects, including office-bearers of tamilaga vetri kazhagam and bahujan samaj party.","https://static.toiimg.com/thumb/msid-126635407,width-1280,height-720,imgsize-1109137,resizemode-6,overlay-toi_sw,pt-32,y_pad-600/photo.jpg"
"Fog-induced crashes claim 8: Five tourists in Punjab, 3 labourers in UP",https://timesofindia.indiatimes.com/india/fog-induced-crashes-claim-8-five-tourists-in-punjab-3-labourers-in-up/articleshow/126635292.cms,"BATHINDA/LUCKNOW: Five tourists from Banaskantha in Gujarat, including a policewoman, died in Punjab, while three labourers were killed in UP in road accidents caused due to dense fog on Saturday morning.The tourists, all in their late 20s and early 30s, were on their way back to Banaskantha when their SUV slammed into a road divider on Bharatmala Expressway in Bathinda district. The crash took place near Gurthari village. According to Met reports, the visibility was down to 40 metres in Bathinda at the time of the accident. Even at 40kmph, reaction time would be less than four seconds in such conditions.Residents of Gurthari alerted police and began a rescue effort, along with personnel of Sadak Suraksha Force. The victims were taken to AIIMS-Bathinda, where doctors declared them dead on arrival.Bathinda city SP Narinder Singh said, ""Those who died were identified as Arjun, Satish, Bharat, Janak and Amita. Amita was a constable with Gujarat Police.""The labourers in UP were killed when a truck rammed into a pickup vehicle on Purvanchal Expressway near Sultanpur. The pickup, carrying 14 workers, hit the median crash barrier and overturned. Seven workers were injured. The truck driver fled after the collision. The deceased were identified as Ajay Kumar and Kishan Pal, both aged 30, and Rajoli, 35.","The tourists, all in their late 20s and early 30s, were on their way back to banaskantha when their suv slammed into a road divider. Met reports say visibility was down to 40 metres in bathinda at the time of the accident. Three labourers were killed in up in road accidents caused due to dense fog.","https://static.toiimg.com/thumb/msid-126635307,width-1280,height-720,imgsize-560324,resizemode-6,overlay-toi_sw,pt-32,y_pad-600/photo.jpg"
"A beautiful woman 'distracts, and rape may follow': Congress MLA",https://timesofindia.indiatimes.com/india/a-beautiful-woman-distracts-and-rape-may-follow-congress-mla/articleshow/126634845.cms,"BHOPAL: Congress MLA Phool Singh Baraiya caused outrage with his remarks on Friday that on seeing a beautiful woman ""one can get distracted and rape may follow"". The MLA had then continued in the same appalling manner, saying that women from the SC, ST and OBC communities are ""not beautiful"" but were raped because of what he believed was mentioned in the scriptures.Madhya Pradesh CM Mohan Yadav demanded an apology from Congress MP and leader of opposition in the Lok Sabha Rahul Gandhi for Baraiya's abhorrent characterisation of women, saying on Saturday, ""Senior Congress neta Rahul Gandhi is coming today. And Phool Singh Baraiya has given a statement to spread venom in society. I expect Rahul Gandhi to talk tough to his MLA, suspend him before eventually expelling him from the party so as to send across a larger message - that Congress respects all sections of society. I condemn this statement made by Baraiya. Being a public representative , I hope he will refrain from making such comments again.""Speaking to a reporter in Datia on Friday, Baraiya had proffered a self-propounded, twisted ""theory"" on why infant girls aged 4 to 10 months were victims of sexual crimes. ""In India, the maximum number of rapes are visited upon women from SC, ST and OBC categories. The theory of rape is, when a man, walking down the road, sees a beautiful, extremely beautiful woman, then his mind could be distracted, a rape may follow (sic),"" he had said.He had then asked: ""Are there any extremely beautiful women among SCs, STs and OBCs? Why are they raped then? Because such instructions are given in our religious scripts... It has been mentioned that if you have intimacy with women of these castes then it is the same as going on a pilgrimage.""Left red-faced, Congress went on the defensive. Party state president Jitu Patwari was forced to issue a statement on Saturday evening saying that a criminal who rapes women has no caste or religion. He is simply a criminal who deserves the harshest punishment under the law. ""...What Phool Singh Baraiya said is his personal opinion. Congress does not agree with such statements. He has been asked to clarify his remark. ""BJP, meanwhile, staged a protest against Baraiya at the Board Office Square on Saturday, torching his effigy.","Madhya pradesh cm mohan yadav demands an apology from congress mp rahul gandhi. Baraiya had proffered a self-propounded, twisted ""theory"" on why infant girls aged 4 to 10 months were victims of sexual crimes. He had then asked: ""are there any extremely beautiful women among scs, sts and obcs?""","https://static.toiimg.com/thumb/msid-126634920,width-1280,height-720,imgsize-434317,resizemode-6,overlay-toi_sw,pt-32,y_pad-600/photo.jpg"
"Stay united, polarisation will help BJP: TMC to people",https://timesofindia.indiatimes.com/india/stay-united-polarisation-will-help-bjp-tmc-to-people/articleshow/126634647.cms,"Abhishek Banerjee (File photo)



PM Modi Targets Mamata, Declares 'Asli Poribortan' In Malda, Says Bengal Needs BJP For Development

KOLKATA/BEHRAMPORE: Trinamool Congress national general secretary Abhishek Banerjee Saturday blamed BJP politicians and a ""new gaddar (traitor)"" for stoking violence in Beldanga, a town in Murshidabad district bordering Bangladesh, and urged residents to deny the opposition party political space.""Stop providing oxygen to BJP,"" Banerjee told a public rally in Behrampore. He warned that even limited communal polarisation could weaken the district and strengthen BJP. ""If BJP manages to sow seeds of divisive politics even in one booth, Murshidabad will weaken and BJP will become stronger. Stay united as you have since 2021,"" he said.Earlier in the day, PM Narendra Modi addressed a rally in Malda, another north Bengal district near Bangladesh. TMC used X to attack Modi, accusing his party of running on ""communal poison"" and ""daily hate broadcasts,"" and of ""planting divisive agents of chaos in Murshidabad"".It also questioned Modi's silence on alleged targeting of Bengali-speaking migrant workers in BJP-governed states. It called for action against CMs where migrants were ""tortured, detained, deported and even lynched"", and said Bengal should not be lectured on dignity while ""language, culture, identity and existence"" were criminalised.Banerjee said he had learned the Beldanga unrest was allegedly instigated by ""BJP babus and a new traitor of the soil"". Without naming anyone, he said voters had already ""shown the door"" to one traitor, whom he described as BJP's ""dummy candidate"".","Abhishek banerjee blames bjp politicians and a ""new gaddar (traitor)"" for stoking violence in beldanga. He urges residents to deny the opposition party political space. Tmc used x to attack modi, accusing his party of running on ""communal poison"" and ""daily hate broadcasts""","https://static.toiimg.com/thumb/msid-126634731,width-1280,height-720,imgsize-469539,resizemode-6,overlay-toi_sw,pt-32,y_pad-600/photo.jpg"
"Judge cites provision that doesn't exist, HC demands explanation",https://timesofindia.indiatimes.com/india/judge-cites-provision-that-doesnt-exist-hc-demands-explanation/articleshow/126634462.cms,"Representative image

PRAYAGRAJ: Allahabad high court has sought an explanation from a trial judge posted in Aligarh for allegedly citing a non-existent provision of Scheduled Castes and Scheduled Tribes (Prevention of Atrocities) Act, 1989, while summoning an accused.In the order dated April 30, 2024, the then special judge, SC/ST Act, Aligarh, invoked ""Section 3(2)(5)"" of the SC/ST Act - a provision that does not exist in the statute, the counsel for the petitioner in the HC contended.The order was challenged by the accused in the case, Rajiv Bajaj, in the HC, which on Jan 14 sought an explanation from the special judge and fixed Jan 30 as the next date of hearing.Justice Praveen Kumar Giri at the HC, who passed the order, also said if any warrant had been issued against the applicant, it shall be kept in abeyance till then. The HC expressed serious concern over the manner in which judicial power was exercised, observing that such casual and careless orders had grave consequences for an individual's personal liberty.According to the applicant, he was falsely implicated in a case under SC/ST Act and the criminal proceedings were the outcome of a property dispute that arose after he was allotted a piece of land declared industrial by Uttar Pradesh State Industrial Development Corporation.The complainant had accused the applicant of assault and offences under the SC/ST Act, following which the judicial magistrate, Aligarh, directed the registration of an FIR.Pursuant to the magistrate's order, the police registered an FIR under relevant provisions of IPC and SC/ST Act and carried out an investigation, concluding that no prima facie case was made out against the accused. Dissatisfied with this outcome, the complainant filed a petition in the special court challenging the closure report.Thereafter, the special judge (SC/ST Act), Aligarh, treated the matter as a complaint case and proceeded to record the statements of the complainant and witnesses under Sections 200 and 202 of the Code of Criminal Procedure. Subsequently, the special judge summoned the accused to face trial.","Allahabad high court has sought an explanation from a trial judge posted in aligarh. The judge allegedly cited a non-existent provision of scheduled castes and scheduled tribes (prevention of atrocities) act, 1989. The order was challenged by the accused in the case, rajiv bajaj.","https://static.toiimg.com/thumb/msid-126634510,width-1280,height-720,imgsize-744366,resizemode-6,overlay-toi_sw,pt-32,y_pad-600/photo.jpg"
"In poll-bound Bengal, PM Modi blames demographic imbalance for violence",https://timesofindia.indiatimes.com/india/in-poll-bound-bengal-pm-modi-blames-demographic-imbalance-for-violence/articleshow/126634145.cms,"PM Modi

PM Modi Targets Mamata, Declares 'Asli Poribortan' In Malda, Says Bengal Needs BJP For Development

KOLKATA/MALDA: PM Narendra Modi brought up the issue of recurring violence in Bengal's Murshidabad during his rally in neighbouring Malda district Saturday, specifying demographic imbalance and infiltration as the underlying causes.Murshidabad's Beldanga continued to see vandalism as highways and railway tracks were blocked for the second day in protest against continuing violence against Bengalis in Jharkhand and Bihar.""Infiltration is impacting local culture and language and riots in districts like Murshidabad and Malda are on the rise because of this. You have to break the nexus of infiltrators and those in office,"" Modi said at the rally, about 150km from the violence epicentre, adding ""demographic balance"" was being ""disturbed at a few places"".""Every developed nation is driving out infiltrators. It's essential in states like Bengal. But that's not possible as long as TMC is in office,"" he said, blaming ""TMC's syndicates"" for the mess. Modi blamed ""TMC's goons"" for attacks on media personnel in Beldanga. ""They have behaved indecently with a woman journalist. No one takes cognizance of women's plight in Bengal.""The PM moved on to BJP's pre-poll concerns, trying to assure Matuas and Namasudras the Constitution had given them the right to stay here.""CAA has given them full security,"" he said. BJP has faced internal dissent in the Matua belts of North 24 Parganas and Nadia, with party MPs and MLAs often speaking in different voices and the community hitting the streets to protest against their ""victimisation"" in SIR. TMC seniors, including CM Mamata Banerjee, have visited these areas to address concerns. A person from the community died this week, prompting his family to blame ""SIR worries"".Modi sought to portray TMC as a party of ""the cruel and corrupt"". ""They are Bengal's enemies. They are busy filling up their pockets,"" he said, adding TMC's days were numbered. He alluded to corruption allegations during flood relief, slamming TMC for ""looting even during a crisis"". ""Bengal will reach new heights by the ideals of Rishitulya Bankim Chandra Chattopadhyay,"" he said. Modi's ""Bankim-da"" address in Parliament a few weeks ago had prompted Trinamool to allege Modi and BJP were ""culturally alien"" to Bengal.Modi inaugurated rail and road infrastructure projects worth Rs 3,250 crore after flagging off a Vande Bharat sleeper train linking Howrah and Kamakhya and four Amrit Bharat Express trains.He blamed TMC for lack of investment in industry and farmers, alleging this was fuelling migration, and said it was the only state where people were not allowed benefits of Ayushman Bharat.","Pm narendra modi brings up recurring violence in bengal's murshidabad during his rally. He cites demographic imbalance and infiltration as the underlying causes. ""you have to break the nexus of infiltrators and those in office,"" he says. Modi blames ""tmc's goons"" for attacks on media personnel in beldanga.","https://static.toiimg.com/thumb/msid-126634247,width-1280,height-720,imgsize-721811,resizemode-6,overlay-toi_sw,pt-32,y_pad-600/photo.jpg"
Virat Kohli and Anushka Sharma buy 5-acre plot in Alibaug for Rs 37.8 crore; pay Rs 2.27cr in stamp duty,https://timesofindia.indiatimes.com/city/mumbai/virat-kohli-and-anushka-sharma-buy-5-acre-plot-in-alibaug-for-37-8cr/articleshow/126585147.cms,"Mumbai Headlines Today — The Biggest Updates You Need to Know.







MUMBAI: In another big-ticket deal in Alibaug, now considered an extension of south Mumbai, cricketer Virat Kohli and actor Anushka Sharma have purchased an over 5-acre land parcel for Rs 37.86 crore. The two adjoining plots are in Zirad village, Raigad district.According to real estate data analytics firm CRE Matrix, the transaction was registered on Jan 13 and the couple paid stamp duty of Rs 2.27 crore. Documents show that the seller is Sonali Amit Rajput, a director of Samira Land Estates.In 2022, the couple had bought an 8-acre farmhouse in Alibaug's Zirad village for Rs 19 crore.The coastal stretch of Alibaug has been pitched for its winning combination of rural idyll, increased connectivity to the city, and an option away from the concrete claustrophobia of Mumbai. A slew of celebrities and movie stars have bought properties in Alibaug in the past few years.In 2023, actor Suhana Khan, daughter of Shah Rukh Khan, bought three plots (2.79 acres) in Alibag for a total value of Rs 25.5 crore. Shah Rukh also owns property in Alibag including a sprawling coconut plantation, according to local sources.Actors Deepika Padukone and Ranveer Singh too are heavily invested in the Alibag property market.In 2021, they purchased a house in Mapgaon village of Alibaug for Rs 22 crore from Rajesh Jaggi of the Everstone Group.During the pandemic, TOI reported that the land rush here accelerated when around 150 families from Mumbai shifted to their weekend homes after the lockdown began in early 2020.Even during the pandemic, Alibaug witnessed several big-ticket property deals. In 2021, a six-acre beachfront home was sold for Rs 80 crore in Awas village of Alibaug. The sprawling property, owned by a Parsi business family, the Engineers of Atash Leasing, was purchased by Shrikantadevi Damani, wife of Radhakishan Damani, stock market investor and founder of the supermarket chain DMart. In 2020, Radhakishan and his brother Gopikishan purchased a bungalow property on Narayan Dabholkar Road in south Mumbai for a record Rs 1,001 crore. In 2015, Radhakishan Damani bought the five-star Radisson Blu Resort & Spa for Rs 135 crore.Last year, Bollywood legend Amitabh Bachchan purchased three plots in Alibaug for Rs 6.59 crore.","Cricketer virat kohli and actor anushka sharma have purchased an over 5-acre land parcel for rs 37.86 crore. The coastal stretch of alibaug has been pitched for its winning combination of rural idyll, increased connectivity to the city, and an option away from the concrete claustrophobia of mumbai.","https://static.toiimg.com/thumb/msid-126602864,width-1280,height-720,imgsize-24900,resizemode-6,overlay-toi_sw,pt-32,y_pad-600/photo.jpg"
