Article Title,Article Link,Article Text,Article Summary,Article Image
"16th judge, 2nd in 2 weeks, exits Chaturvedi case",https://timesofindia.indiatimes.com/india/16th-judge-2nd-in-2-weeks-exits-chaturvedi-case/articleshow/124491771.cms,"Justice Alok Verma

Denial of justice

, says lawyer on repeated recusals

DEHRADUN: In what is being termed an unprecedented series of recusals, another judge has decided to withdraw from a case involving Uttarakhand-cadre Indian Forest Service officer Sanjiv Chaturvedi. Justice Alok Verma of the Uttarakhand high court became the 16th judge to recuse from Chaturvedi’s case, and the second one within a fortnight. Verma’s recusal order, dated Oct 8, simply stated, “List before another bench,” without assigning any reason continuing a pattern seen in previous recusals in Chaturvedi’s matters.Sanjiv Chaturvedi’s counsel, Sudershan Goel, termed the repeated recusals “a denial of justice” and an infringement of his client’s constitutional right. “Judges usually recuse themselves when they have previously represented a party, share a familial relation, or have a financial association. Any other or non-reasoned recusal amounts to impropriety and betrayal of the constitutional oath of office,” he said.Verma’s withdrawal comes 12 days after Justice Ravindra Maithani of Uttarakhand HC similarly recused himself from hearing one of Chaturvedi’s cases. The present matter involves a contempt petition filed by Chaturvedi against CAT members and the registry for alleged wilful disobedience of a stay order.Advocate Goel said this sets a record in the judicial history of the country, as never before have so many judges recused from hearing cases of a particular person.","Justice alok verma of the uttarakhand high court became the 16th judge to recuse from chaturvedi’s case, and the second one within a fortnight. Justice ravindra maithani similarly recused himself 12 days ago. The present matter involves a contempt petition filed by chaturvesi against cat members and the registry for alleged wilful disobedience.","https://static.toiimg.com/thumb/msid-124491772,width-1070,height-580,imgsize-483304,resizemode-75,overlay-toi_sw,pt-32,y_pad-40/photo.jpg"
"MBBS student ‘gang-raped’ in West Bengal, friend held",https://timesofindia.indiatimes.com/india/mbbs-student-gang-raped-in-west-bengal-friend-held/articleshow/124491641.cms,"WB survivor’s father voices suspicion over classmate’s role



RG Kar Rape Case Anniversary: BJP's 'Nabanna Abhiyan' March Turns Violent After Police Lathicharge

Mamata has turned Bengal into a safe haven for rapists: BJP



DURGAPURA: A second-year MBBS student (23) of a private medical college in Bengal’s Durgapur was allegedly gang-raped by four to five unidentified men Friday, shortly after she stepped out for dinner with a classmate, reports Mohammad Asif. Police have detained the classmate after the survivor’s parents, from Odisha’s Balasore, alleged he and his associates were involved. The woman is undergoing treatment at hospital.Based on the woman’s complaint, police registered a case of gang rape, recorded her statement, and began questioning the detained student. The survivor said she and her classmate were accosted by a group of men who snatched her phone and demanded money. When the male student left the spot, three of the men allegedly dragged her to a secluded area and raped her. He returned later, found her wounded, and took her back to the hostel.A college press release said, “It came to light that while outside campus, the female student endured an asself claimed and reported.” The survivor’s father said he received a call from her classmate and reached Durgapur with his wife early Saturday.He voiced suspicion over the classmate’s role. Students of the college have launched a sit-in demanding an impartial investigation. “We want the principal to issue a written statement,” one protester said. The alleged assault adds to a troubling pattern of sexual violence on Bengal campuses.BJP Saturday upped the ante against Mamata Banerjeeled Bengal govt after a medical student was allegedly gangraped in Paschim Bardhaman district. BJP accused govt of turning the state into a nightmare for women’s safety through its deliberate policy of appeasement.Union minister Sukanta Majumdar posted on X: “Mamata has turned Bengal into a safe haven for rapists and criminals.”BJP IT department head Amit Malviya also attacked Mamata, claiming that the incident has triggered a massive outrage in Durgapur. “Bengal is not safe for women. Until TMC govt is held accountable, women across state will continue to live in fear. Mamata must go in 2026,” Malviya said.",Wb survivor's father voices suspicion over classmate’s role in alleged gang-rape. Bjp accused govt of turning state into a nightmare for women's safety. Union minister sukanta majumdar: “mamata has turned bengal into a safe haven for rapists and criminals”,"https://static.toiimg.com/thumb/msid-124491764,width-1070,height-580,imgsize-525588,resizemode-75,overlay-toi_sw,pt-32,y_pad-40/photo.jpg"
R-Power CFO held by ED after questioning on fake bank guarantee,https://timesofindia.indiatimes.com/india/r-power-cfo-held-by-ed-after-questioning-on-fake-bank-guarantee/articleshow/124490286.cms,"Anil Ambani

RPL, its top execs accused of alleged diversion of funds



NEW DELHI: The ED late on Friday arrested Reliance Power’s chief financial officer Ashok Pal after questioning him at its headquarters here in a case of fake bank guarantee. He was produced before a court here on Saturday and remanded in two days of ED custody. Pal, the CFO of Reliance Power Limited (RPL), an Anil Ambani Reliance group company, has been taken into custody in an ongoing money laundering probe related to banking fraud against Ambani and his group entities. “The degree of fraud can be gauged from the fact that Reliance Power group submitted a bank guarantee from FirstRand Bank, Manila, Philippines. The fact is that there exists no branch of FirstRand Bank in the Philippines,” sources said.Fake and spoofed domains of commercial banks, such as sbi.17313@s-bi.co.in a look alike of SBI email was created by inserting a hyphen to commit the fraud, an official said. Similar emails of other PSU banks have also been used by the accused. Reliance Power Limited (RPL) is a listed company where public holds more than 75% shares. The company and its top executives are accused of alleged diversion of funds. “Board resolution empowered CFO Ashok Pal and others to finalise, approve, sign and execute all documents for Solar Energy Corporation of India (SECI) BESS tender, and to use RPL’s financial capability for the bid,” the agency sources said.In a statement, RPL said, “The company & its subsidiaries acted bonafidely and are a victim of fraud, forgery and cheating conspiracy. We also wish to clarify on media reports that Anil D Ambani is not on Board of Reliance Power Limited for more than 3.5 years and is not concerned with this matter in any manner.”On Aug 1, ED had conducted searches at three premises in Bhubaneswar and one at Kolkata after its investigators found alleged evidence of Rs 68 crore fake bank guarantee provided to SECI on behalf of Reliance NU BESS Ltd/Maharashtra Energy Generation Ltd. The fake bank guarantee was generated by a shell entity registered at Bhubaneswar, allegedly linked to Anil Ambani group. Spoofed email accounts were created to make them look genuine, sources said. Besides the allegedly forged bank guarantee, Anil Ambani’s Reliance group is also being probed for alleged fake bills for commission. The agency sources alleged that Pal “played crucial role in submitting a bogus bank guarantee of over Rs 68 crore to SECI, with an intention to cheat the PSU”. The probe has revealed that Pal was instrumental in selecting Biswal Tradelink Pvt Ltd to provide fake bank guarantee. Director of BTPL Partha Sarathi Biswal was arrested earlier and is currently in judicial custody. ED also found alleged diversion of money through fake transport invoices of several crores of rupees.","Ashok pal was produced before a court here on saturday and remanded in two days of ed custody. Pal, the cfo of reliance power limited (rpl), an anil ambani reliance group company, has been taken into custody in an ongoing money laundering probe.","https://static.toiimg.com/thumb/msid-124490296,width-1070,height-580,imgsize-383069,resizemode-75,overlay-toi_sw,pt-32,y_pad-40/photo.jpg"
"Industrial-grade stuff in Coldrif, says SIT, tries to map supply chain",https://timesofindia.indiatimes.com/india/industrial-grade-stuff-in-coldrif-says-sit-tries-to-map-supply-chain/articleshow/124491827.cms,"Representative image

Sresan Pharma Owner G Ranganathan Arrested In Chennai Over Coldrif Cough Syrup Deaths

DEG test now must for finished products

SIT: Cough syrup case exposes deep systemic failures

BHOPAL: The MP SIT probing the Coldrif tragedy that claimed the lives of 20 kids from Chhindwara and three from other districts is examining the entire supply chain of the cough syrup — from procurement of raw materials to distribution of the contaminated drug — aiming to fix accountability at every stage.Investigators confirmed that Ranganathan Govindan, owner of TN-based Sresan Pharmaceuticals, had procured banned industrial-grade diethylene glycol for manufacturing Coldrif. The SIT is now trying to determine how long the chemical had been in use and whether other individuals or suppliers were complicit in the process.Ranganathan initially feigned ignorance about the cause of contamination, claiming he had delegated production responsibilities to subordinates.Drugs Controller General of India Friday made it mandatory for all raw materials and finished pharmaceutical products to be tested for diethylene glycol (DEG) and ethylene glycol (EG). Testing was earlier required only on raw materials, leaving a gap for toxic solvents to enter the manufacturing process.Ranganathan Govindan, owner of TNbased Sresan Pharmaceuticals, initially said he had no direct knowledge of how the industrial chemical entered the formulation.However, after sustained interrogation, Ranganathan reportedly confessed.“He has identified the person in charge of quality control, who will be detained soon. But this does not absolve Ranganathan of responsibility — he was the signatory authority and owner of the unit,” said a senior officer privy to the probe. The 12-member SIT, led by additional superintendent of police Anjana Tiwari, includes senior police officials and drug control officers. The team has divided its work among sub-groups — one focusing on the manufacturing trail in Tamil Nadu, another on the distribution and retail network in MP, and a third on forensic and toxicological analysis.“We are also looking into the factory’s production system — whether it was automated or semi-automated — besides examining if there was any sabotage angle,” an officer said, adding the technical team is reviewing machinery logs and batch production records to detect irregularities in the blending and testing process. Officials said more arrests are likely as the SIT expands its investigation to include the quality control team, raw material suppliers, and logistics handlers.Tamil Nadu authorities have already sealed Sresan Pharmaceuticals’ manufacturing unit in Sunguvarchatram, Kanchipuram district, after laboratory tests confirmed 48.6% DEG content in the syrup. “This case has exposed deep systemic failures — not just negligence, but a collapse of safety and compliance mechanisms. The probe will continue until every link in the chain is held accountable,” an Special Investigation Team member said. Meanwhile, three children remain in critical condition at hospitals in Nagpur. Teams of doctors and Madhya Pradesh health officials are monitoring their condition round the clock.","G ranganathan govindan, owner of tn-based sresan pharmaceuticals, had procured banned industrial-grade diethylene glycol for manufacturing coldrif. The sit is now trying to determine how long the chemical had been in use and whether other individuals or suppliers were complicit in the process.","https://static.toiimg.com/thumb/msid-124491833,width-1070,height-580,imgsize-639869,resizemode-75,overlay-toi_sw,pt-32,y_pad-40/photo.jpg"
Drug regulator tightens safety norms after cough syrup deaths,https://timesofindia.indiatimes.com/india/drug-regulator-tightens-safety-norms-after-cough-syrup-deaths/articleshow/124492394.cms,".

Deadly Cough Syrup Case: WHO Points To Regulatory Gap In India

BHOPAL: After the death of 23 children in Madhya Pradesh, including 20 from Chhindwara, following the consumption of Coldrif, a cough syrup laced with the killer chemical diethylene glycol (DEG), Drugs Controller General of India (DCGI) Friday made it mandatory to test for both DEG and ethylene glycol (EG) in all raw materials and finished pharmaceutical products.Earlier, such testing was required only for raw materials, leaving a crucial gap that allowed toxic solvents to enter finished syrups undetected. DCGI, which heads Central Drugs Standard Control Organisation (CDSCO), is responsible for approving, regulating, and monitoring the quality of medicines in India. Moved by the disaster, Madhya Pradesh Food and Drugs Administration (MPFDA) wrote to DCGI Thursday, urging it to include DEG and EG testing in the “general monograph of the Indian Pharmacopoeia” (IP) — the national rulebook that sets quality standards and test methods for medicines sold in India.Within a few hours of receiving the MPFDA letter, DCGI notified the amendment and directed Indian Pharmacopoeia Commission (IPC) — the autonomous scientific body under Union ministry of health and family welfare responsible for setting and updating India’s official drug standards — to take immediate action. IPC Friday issued ‘Amendment List-09’ to IP 2022, officially introducing DEG and EG testing as a mandatory requirement for all oral liquid formulations.It also issued a circular across India, informing all state drug controllers, CDSCO zonal offices, members of the scientific body of IPC, directors of drug testing laboratories, and major industry associations, including IDMA, OPPI, BDMA, FOPE, FSSAI, and SmallScale Industry Associations, to enforce the new testing standards without delay.The order, signed by IPC secretary-cum-scientific director Dr V Kalaiselvan, directs that the amount of DEG and EG shall not exceed 0.10% and must be determined by gas chromatography. TOI is in possession of the MPFDA’s letter to DCGI and the IPC circular. “This closes a critical regulatory loophole exposed by repeated syrup-linked deaths,” an official said, calling it a decisive step toward restoring public trust in India’s drug safety system.","Earlier, such testing was required only for raw materials, leaving a crucial gap that allowed toxic solvents to enter finished syrups undetected. Madhya pradesh food and drugs administration (mpfda) wrote to dcgi thursday, urging it to include deg and eg testing in the ‘general monograph of the indian pharmacopoeia’ (ip)","https://static.toiimg.com/thumb/msid-124492391,width-1070,height-580,imgsize-1084588,resizemode-75,overlay-toi_sw,pt-32,y_pad-40/photo.jpg"
PM Modi: Nation’s youth driving AI innovation,https://timesofindia.indiatimes.com/india/pm-modi-nations-youth-driving-ai-innovation/articleshow/124492201.cms,"PM Modi

'Best Time To Invest, Innovate And Make In India': PM Narendra Modi

NEW DELHI: PM Narendra Modi on Saturday met Dario Amodei, the CEO of Anthropic, a company dealing in safe AI systems. The company also plans to open an office in Bengaluru next year.“Glad to meet you. India’s vibrant tech ecosystem and talented youth are driving AI innovation that is human-centric and responsible,” PM Modi said in a post on X in a response to Amodei. “We welcome Anthropic’s expansion and look forward to working together to harness AI for growth across key sectors,” the prime minister said.Earlier, Amodei said he met PM Modi to discuss Anthropic’s expansion to India, where the use of its product ‘Claude Code’ has witnessed a five-fold increase since June. Anthropic was set up by former OpenAI executives and focuses on building what it describes as “safe” AI systems and counts Google among its backers.","Pm narendra modi met dario amodei, the ceo of anthropic, a company dealing in safe ai systems. The company also plans to open an office in bengaluru next year. “we welcome anthropic’s expansion and look forward to working together to harness ai for growth,” pm modi said.","https://static.toiimg.com/thumb/msid-124492197,width-1070,height-580,imgsize-610660,resizemode-75,overlay-toi_sw,pt-32,y_pad-40/photo.jpg"
"'Wife killer' steals jail chequebook, and Rs 30 lakh",https://timesofindia.indiatimes.com/india/wife-killer-steals-jail-chequebook-and-rs-30-lakh/articleshow/124491860.cms,"Representative image

Last year in May, when Ramjit Yadav, a man accused of killing his wife, walked out of UP 's Azamgarh jail on bail, he took with him the jail's chequebook.Within months, he stole Rs 30 lakh, from the prison's bank account operated by jail superintendent Aditya Kumar Singh, reports Rajeev Dikshit. The con came to light when the officer spotted a suspicious withdrawal of Rs 2.6 lakh in September. Probe revealed it had the help of jail staff, and an inmate, who forged the signature. Yadav is now absconding.","Ramjit yadav, accused of killing his wife, walked out of up's azamgarh jail on bail. He took with him the jail's chequebook. Within months, he stole rs 30 lakh, from the prison's bank account.","https://static.toiimg.com/thumb/msid-124491868,width-1070,height-580,imgsize-441987,resizemode-75,overlay-toi_sw,pt-32,y_pad-40/photo.jpg"
NDA set to make public Bihar seats pact today,https://timesofindia.indiatimes.com/india/nda-set-to-make-public-bihar-seats-pact-today/articleshow/124491852.cms,".

Bihar Assembly Polls: NDA's Trouble Mounts As Manjhi Issues Ultimatum, Paswan Shares Cryptic Post

NEW DELHI: After days of hectic parleys and hard bargaining by allies, NDA is said to have reached an agreement with its constituents for Bihar polls, and a formal announcement is likely on Sunday. The BJP central election committee (CEC) is set to finalise its candidates at a meeting on Sunday, in the presence of PM Narendra Modi. Senior BJP netas, including HM Amit Shah and party chief J P Nadda, held a meeting with party netas and those of the allies Saturday.","Nda is said to have reached an agreement with its constituents for bihar polls. The bjp central election committee (cec) is set to finalise its candidates on sunday. Senior bjp netas, including hm amit shah and party chief j p nadda, held a meeting with party netas and those of the allies saturday.","https://static.toiimg.com/thumb/msid-124491855,width-1070,height-580,imgsize-616626,resizemode-75,overlay-toi_sw,pt-32,y_pad-40/photo.jpg"
NEET aspirant gets High Court relief over delayed fee,https://timesofindia.indiatimes.com/india/neet-aspirant-gets-high-court-relief-over-delayed-fee/articleshow/124490217.cms,"Reprsentative image

JAIPUR: A single judge bench of Rajasthan high court (HC) permitted an NEET-UG aspirant to participate in counselling after he was denied admission and his security deposit forfeited due to a minor delay in fee payment. The order was issued on Wednesday during a hearing of the petition filed by the candidate, Narendra Mahala.Justice Sameer Jain's bench ruled that forfeiture of the petitioner's Rs 5 lakh security deposit by the counselling board was arbitrary and constituted ""unjust enrichment"".""The court directed the authorities to permit the student to participate in the third round of counselling and ordered his security deposit to be adjusted against fees of any college he is allotted on merit,"" Tanveer Ahamad, the petitioner's advocate, said.Ahamad said Narendra Mahala, a fatherless student from a modest background, was unable to deposit the full college fee within the stipulated deadline due to death of his great-grandmother on Sept 29, and intervening public holidays. ""Court found delay of a few hours to be bona fide and reasonable,"" Ahamad said.Criticising the mechanical approach of authorities, Justice Jain stated that rigid deadlines should not override principles of equity and welfare, especially in education.""In the tussle between merit and money, the future of bona fide aspirants should not suffer,"" the court observed.Describing the case as an ""unambiguous illustration of the principles governing unjust enrichment,"" the court also directed that a copy of the order be sent to National Medical Commission, secretary of ministry of health and family welfare, and chief secretary, Rajasthan govt, for appropriate scrutiny. It also requested its order in this case to be treated as a precedent, Ahamad said.","A single judge bench of rajasthan high court permitted an neet-ug aspirant to participate in counselling. The order was issued on wednesday during a hearing of the petition filed by the candidate, narendra mahala. Justice sameer jain's bench ruled that forfeiture of the petitioner's rs 5 lakh security deposit by the counselling board was arbitrary.","https://static.toiimg.com/thumb/msid-124490221,width-1070,height-580,imgsize-null,resizemode-75,overlay-toi_sw,pt-32,y_pad-40/photo.jpg"
"Child marriage and drugs robbing East, NE of vigour: Justice Kant",https://timesofindia.indiatimes.com/india/child-marriage-and-drugs-robbing-east-ne-of-vigour-justice-kant/articleshow/124490194.cms,"NEW DELHI: Justice Surya Kant, who will take over as CJI next month, on Saturday said that while eastern and north-eastern India are rich in diversity and potential, the young generation there faces grave challenges such as child marriage, narcotic substance abuse, and marginalisation of tribals and tea garden workers.Inaugurating the National Legal Services Authority's East-Zone Regional Conference in Guwahati, Nalsa executive chairman Justice Surya Kant said, ""Child marriage, though declining, continues to rob countless young girls of their childhood. Bihar still reports nearly 40% of women between 20 and 24 as married before 18, with Jharkhand and Assam not very far behind. The law may prohibit it, but social norms and poverty sustain it. ""He said narcotics and psychotropic substances are ""hollowing out communities,"" noting that Assam has seen a six-fold rise in NDPS cases in just four years. ""The trade flows across porous borders, destabilising states and entrapping a generation in despair,"" he said, adding that tribal communities, long guardians of ancient wisdom and ecological balance, continue to face displacement.Highlighting the plight of tea garden workers, Justice Kant said five million of them across Assam and Bengal still struggle with poor wages, inadequate housing, unsafe maternity care and alarming levels of anaemia among women and children.""These are the challenges before Nalsa,"" Justice Kant said.He added that the true measure of the conference ""will lie not in the quality of discussions but in how it translates on the ground - a child in Bihar saved from a premature marriage, a young man in Nagaland finding a path away from addiction, a tribal family in Odisha securing its forest rights, a tea worker in Assam seeing her children educated and nourished, or a family in Manipur getting timely mental health support. The solution is to think regionally but act locally. ""Praising the Northeast's natural beauty, biodiversity and cultural richness, Justice Kant said, ""It remains the cultural heartbeat of India. Yet, stark vulnerabilities persist, as development indicators reveal troubling disparities.""","Justice surya kant, who will take over as cji next month, said eastern and north-eastern india are rich in diversity and potential. But the young generation there faces grave challenges such as child marriage, narcotic substance abuse, and marginalisation of tribals and tea garden workers.","https://static.toiimg.com/thumb/msid-124490203,width-1070,height-580,imgsize-4160,resizemode-75,overlay-toi_sw,pt-32,y_pad-40/photo.jpg"
