Article Title,Article Link,Article Text,Article Summary,Article Image
‘Will not deter my fight’: Karnataka MLA Basanagouda Patil Yatnal after BJP expels him for six years over ‘anti-party’ activities,https://timesofindia.indiatimes.com/india/will-not-deter-my-fight-bjp-expels-karnataka-mla-basanagouda-patil-yatnal-for-six-years-over-anti-party-activities/articleshow/119542218.cms,"Yatnal’s response: 'Will continue to fight'

A pattern of defiance

NEW DELHI: The Bharatiya Janata Party (BJP) on Wednesday, March 26, expelled Karnataka MLA Basanagouda Patil Yatnal from the party for six years, citing repeated ""anti-party"" activities. The decision, announced by the party’s central disciplinary committee, follows multiple warnings for violating party discipline .In a letter signed by Om Pathak, secretary of BJP’s central disciplinary committee, Yatnal’s expulsion was formally communicated.""The Central Disciplinary Committee of the party has considered your response to the show-cause notice dated February 10, 2025, and has taken serious note of your repeated violations of party discipline, despite your assurances of good behavior and conduct,"" the letter read.The letter further mentioned that Yatnal was expelled from the party's primary membership and removed from all party positions with immediate effect.Reacting to the expulsion, Yatnal accused “vested interests” of orchestrating his removal and vowed to continue his political fight.""The party has rewarded me for 'Calling a Spade, a Spade' Certain vested interests have played their part in furthering their agenda successfully,"" Yatnal said on social media.""The decision to suspend me will not deter my fight against corruption, family politics, the development of North Karnataka, and Hindutva,” he further said.He also thanked his supporters, religious leaders, and family for standing by him during the controversy.Yatnal has a history of confrontations with the BJP leadership. In February 2025, he received a show-cause notice for defying party discipline. This followed a December 2024 notice over his public accusations against Karnataka BJP chief BY Vijayendra, whom he accused of “corruption” and “adjustment politics.”","Karnataka mla basanagouda patil yatnal expelled from the party for six years. The decision, announced by the party’s central disciplinary committee, follows multiple warnings for violating party discipline. In february 2025, he received a show-cause notice for defyingparty discipline.","https://static.toiimg.com/thumb/msid-119542471,width-1070,height-580,imgsize-251406,resizemode-75,overlay-toi_sw,pt-32,y_pad-40/photo.jpg"
"Eknath Shinde joke row: Cops issue second notice to comic Kunal Kamra, ask him to appear before Mumbai Police",https://timesofindia.indiatimes.com/india/eknath-shinde-joke-row-cops-issue-second-notice-to-comic-kunal-kamra-ask-him-to-appear-before-mumbai-police/articleshow/119549642.cms,"Political backlash

Kamra’s response

NEW DELHI: Mumbai Police have issued a second summons to stand-up comedian Kunal Kamra , asking him to appear for questioning over his joke referring to Maharashtra deputy chief minister Eknath Shinde as a ""gaddar"" (traitor) in his latest stand-up video, ""Naya Bharat,"" on YouTube, officials said on Wednesday.Kamra missed the first summons after his lawyer requested seven days, prompting police to issue a second notice following legal consultation. Police are also probing whether Kamra has previously made satirical comments about other politicians, actors, or public figures.""If the investigation reveals that Kunal Kamra has committed any crime through his pranks, more cases can be registered against him,"" police officials said, adding that while his lawyer is in touch, Kamra himself has not communicated with investigators.Kamra’s ""gaddar"" remark has sparked outrage, with several political leaders demanding action. Chief minister Devendra Fadnavis condemned Kamra’s statements, declaring in the Assembly, ""We accept political satire , but we do not accept freedom of expression if it leads to tyranny.""Fadnavis also criticized Kamra’s performance, calling it ""low-quality comedy"" aimed at gaining attention. ""This artist targets the Prime Minister and the Chief Justice to stir controversy,"" he said.Deputy chief minister Ajit Pawar backed Fadnavis, saying, ""Action will be taken as per the law.""On Tuesday, Kamra posted a video mocking Shiv Sena workers for vandalizing The Habitat comedy club in Mumbai, where he had previously performed.The controversy continues to escalate as Kamra faces mounting legal scrutiny and political pressure over his satirical remarks.","Mumbai police have issued a second summons to stand-up comedian kunal kamra. Police are also probing whether kamra has previously made satirical comments about other politicians, actors, or public figures. Kamra’s ""gaddar"" remark has sparked outrage, with several political leaders demanding action.","https://static.toiimg.com/thumb/msid-119550088,width-1070,height-580,imgsize-2568173,resizemode-75,overlay-toi_sw,pt-32,y_pad-40/photo.jpg"
Indian Army Investigation: Colonel Bath assault case: Indian Army demands swift probe; Punjab Police say ‘anyone found guilty will face strict legal action’,https://timesofindia.indiatimes.com/india/colonel-bath-assault-case-indian-army-demands-swift-probe-punjab-police-say-anyone-found-guilty-will-face-strict-legal-action/articleshow/119490120.cms,"Indian Army demands swift probe; Punjab Police say ‘anyone found guilty will face strict legal action’ (Picture credit: ANI)

Punjab Police’s stand

NEW DELHI: The Indian Army has called for a transparent and time-bound investigation into the alleged assault of Colonel Pushpinder Singh Bath by Punjab Police personnel in Patiala.Stressing the need for accountability, senior Army officials said those responsible should face strict legal action to maintain trust between the military and civil administration, according to the news agency PTI.Following the incident, Colonel Bath has moved the Punjab and Haryana High Court, requesting that the case be transferred to the Central Bureau of Investigation (CBI) or another independent agency.He argued that an impartial probe under the Punjab Police was unlikely.The Army has vowed to pursue the case until justice is served. “A fair and honest investigation must be conducted in a transparent and time-bound manner to ensure the guilty are punished,” said Lt Gen Mohit Wadhwa , Chief of Staff, Army Western Command.Punjab director general of police (DGP) Gaurav Yadav reaffirmed the force’s respect for the Army, assuring that those responsible would be held accountable. “Anyone found guilty of assaulting a serving Army officer will face strict legal action,” he said.To ensure a thorough probe, Punjab Police has suspended 12 personnel and set up a Special Investigation Team (SIT), led by a senior officer. The SIT has been instructed to expedite its investigation, according to ANI.According to Col. Bath’s complaint, he and his son were attacked by Punjab Police officers outside a dhaba in Patiala on the night of March 13-14. The Army was informed the next day, and Col. Bath was transferred from a civil hospital to the Command Hospital in Chandimandir for further treatment.On March 22, the Civil Lines police station in Patiala registered an FIR against the officers named in the complaint. The implicated personnel were immediately suspended and transferred out of Patiala.Lt. Gen. Wadhwa further said that the Army had taken up the issue with Punjab’s top administration. “We have engaged at the highest levels to ensure prompt investigation and justice,” he said.DGP Yadav urged the public not to view the case as an Army-versus-Police conflict. “The Army and Punjab Police remain united in their commitment to national security and justice,” he asserted.The SIT will work on a daily basis to ensure the case is investigated efficiently, officials confirmed.","Indian army demands swift probe; punjab police say ‘anyone found guilty will face strict legal action’ col. pushpinder singh bath has moved the punjab and haryana high court, requesting that the case be transferred to the central bureau of investigation. Punjab police has suspended 12 personnel and set up a special investigation team (sit)","https://static.toiimg.com/thumb/msid-119490255,width-1070,height-580,imgsize-837309,resizemode-75,overlay-toi_sw,pt-32,y_pad-40/photo.jpg"
"12 days on, cops seal storeroom at HC judge Yashwant Varma’s house",https://timesofindia.indiatimes.com/india/12-days-on-cops-seal-storeroom-at-hc-judge-yashwant-varmas-house/articleshow/119558378.cms,"Cops took a camera team with them

NEW DELHI: Delhi Police Wednesday sealed the storeroom at Justice Yashwant Varma ’s residence and conducted a videography of the premises, 12 days after a fire broke out there during which it’s alleged that a cash pile was gutted. Police also obtained footage from CCTV cameras as part of the probe into claims of foul play levelled by the judge. Police and fire dept are conducting separate inquiries to ascertain the cause of the blaze.Initial analysis of the footage did not yield anything that may point towards unauthorised entry, sources said. They said several cameras are not pointed towards the gate, and hence did not record entry and exit, the source added.Also read: Justice Yashwant Varma transfer row - Allahabad HC lawyers slam ‘betrayal’ by judiciary’s decision-makers after cash-at-home scandal Sources also mentioned that two additional CP rank officers from the special branch and special cell have prepared a report running to roughly 40 pages of call details and internet protocol details of Justice Varma’s cellphone to be given to the Supreme Court enquiry commission.On Wednesday afternoon, a police team reached the judge’s official residence at Tughlak Crescent Road . DCP Devesh Mahla, ACP Virender Jain and a camera team were at the premises for around two hours. The storeroom was videographed before being sealed.The fire broke out in the storeroom around 11.15pm on March 14. Fire department ’s incident report says cops and firefighters remained at the spot for around two hours though it was a minor fire.","Cops took a camera team with them as part of the probe. Initial analysis of the footage did not yield anything that may point towards unauthorised entry, sources said. Fire department ’s incident report says cops and firefighters remained at the spot for around two hours though it was a minor fire.","https://static.toiimg.com/thumb/msid-119558471,width-1070,height-580,imgsize-699982,resizemode-75,overlay-toi_sw,pt-32,y_pad-40/photo.jpg"
"UP CM Yogi Adityanath's chartered plane faces mid-air technical glitch, makes emergency landing in Agra",https://timesofindia.indiatimes.com/india/up-cm-yogi-adityanaths-chartered-plane-faces-mid-air-technical-glitch-makes-emergency-landing-in-agra/articleshow/119540862.cms,"NEW DELHI: Uttar Pradesh chief minister Yogi Adityanath ’s chartered plane made an emergency landing at Kheria Airport in Agra on Wednesday after developing a technical snag mid-flight.The incident occurred shortly after 3:40 pm, following the chief minister’s scheduled programs in the city. About 20 minutes after takeoff, the pilots detected a technical fault and decided to return to Agra as a precautionary measure.","The incident occurred shortly after 3:40 pm, following the chief minister’s scheduled programs in the city. The pilots detected a technical fault and decided to return to agra as a precautionary measure. Uttar pradesh chief minister yogi adityanath ’s chartered plane made an emergency landing at kheria airport.","https://static.toiimg.com/thumb/msid-119540845,width-1070,height-580,imgsize-348926,resizemode-75,overlay-toi_sw,pt-32,y_pad-40/photo.jpg"
'We are at pains': What Supreme Court said on Allahabad HC's 'grabbing breasts not rape attempt' verdict,https://timesofindia.indiatimes.com/india/we-are-at-pains-what-supreme-court-said-on-allahabad-hcs-grabbing-breasts-not-rape-attempt-verdict/articleshow/119538600.cms,"Supreme Court

What Supreme Court said:



The top court said: ""In normal circumstances, we are slow in granting stay at this stage. But since the observations in paragraphs 21, 24 and 26 are totally unknown to canons of law and depict total insensitive and inhuman approach, we are inclined to stay the said observations.""

Referring to the high court's observations, solicitor general Tushar Mehta said, ""This is one judgement I take a very serious exception.""

""It is a very serious matter,"" Justice Gavai said, ""exhibiting total insensitiveness on the part of the judge.""

""We are sorry to use such harsh words against the judge,"" the bench added.

""We have perused the order (of the high court). We are at pains to say that some of the observations made in the impugned order and particularly in paragraphs 21, 24 and 26 depicts a total lack of sensitivity on the part of the author of the judgement,"" the bench added.

""The registrar general is forthwith communate the order and place before honourable chief justice of Allahabad HC and take such matter as deemed appropriate,"" it added, according to news agency PTI.

The Allahabad HC's ruling



Family relieved after Supreme Court order

NEW DELHI: The Supreme Court on Wednesday stayed the Allahabad high court 's controversial order, which stated that ""grabbing the breast and breaking the pyjama string"" were not sufficient grounds to charge an accused with rape or attempted rape.During the hearing, a bench comprising Justices BR Gavai and AG Masih criticised the high court judge for displaying ""total insensitivity"" in handling the case.The apex court remarked that while it regretted using harsh words for the judge, the matter was serious, and the order was not issued impulsively.A few days ago, the high court passed an order in connection with a case involving two men, Pawan and Akash, who allegedly grabbed the minor’s breasts, tore her pyjama string, and attempted to drag her under a culvert while she was walking with her mother.Initially, they were charged under Section 376 of the IPC (rape) and relevant sections of the Protection of Children from Sexual Offences (POCSO) Act. However, the Allahabad HC ruled that their actions did not qualify as rape or an attempt to rape but instead fell under the lesser charge of aggravated sexual assault , punishable under Section 354(B) IPC and Section 9(m) of the POCSO Act.The high court’s ruling was based on the argument that ""an attempt to commit rape must go beyond the stage of preparation and actual attempt to commit an offence consists chiefly in the greater degree of determination.""""The specific allegation against Akash is that he tried to drag the victim beneath the culvert and broke the string of her pyjama. It is also not stated by witnesses that due to this act of the accused the victim got naked or got undressed. There is no allegation that accused tried to commit penetrative sexual assault against the victim,"" the court observed in its order.In view of this, the court opined that the allegations levelled against the accused and facts of the case hardly constituted an offence of attempt to rape in the case. Victim's family relieved after SC order.The family of the minor girl, who was the victim of an attempted rape in Kasganj district, has expressed relief after the Supreme Court stayed the high court's ruling in the case.Advocate Rachna Tyagi, who represented the family in the apex court, shared the update, stating that the survivor's mother is ""extremely relieved."" Meanwhile, the government advocate representing the survivor in the Allahabad High Court was unavailable for comment.Speaking to PTI, Tyagi said, ""The survivor's mother is extremely relieved because ever since the incident in November 2021, her FIR was not being registered. In January 2022, she had to approach the district court under Section 156(3) to file a complaint.""""Since then, for over three-and-a-half years, neither the trial court nor the high court ordered the FIR to be registered. Attempted rape is a cognisable offence and an FIR must be filed in such cases,"" she added.","The supreme court on wednesday stayed the allahabad high court's controversial order, which stated that ""grabbing the breast and breaking the pyjama string"" were not sufficient grounds to charge an accused with rape or attempted rape. A bench comprising justices br gavai and ag masih criticised the high court judge for displaying ""total insensitivity"" in handling the case.","https://static.toiimg.com/thumb/msid-119539621,width-1070,height-580,imgsize-1193667,resizemode-75,overlay-toi_sw,pt-32,y_pad-40/photo.jpg"
Violence in Hazaribag over songs played during march,https://timesofindia.indiatimes.com/india/violence-in-hazaribag-over-songs-played-during-march/articleshow/119566966.cms,"Hazaribag: Clashes erupted between members of two communities over "" objectionable songs "" played during a religious procession in Jharkhand's Hazaribag late Tuesday night, leaving many people wounded, including 10 policemen.The violence broke out on Subhash Marg when a Mangala Juloos - one of four processions leading up to Ram Navami - passed a religious site.An argument over the songs being played quickly escalated into an all-out brawl, with both sides hurling stones. ""The culprits are being identified and strict action will be taken,"" said Hazaribag DC Nancy Sahay .The state govt informed the assembly that an FIR against 10 named people and 200 unnamed was registered, with raids underway to track them down. ""The 10 people named in the FIR includes five each from both communities,"" state parliamentary affairs minister Radha Krishana Kishore said.",Violence broke out during a religious procession in jharkhand's hazaribag. An argument over the songs being played quickly escalated into an all-out brawl. The state govt informed the assembly that an fir against 10 named people and 200 unnamed was registered.,"https://static.toiimg.com/thumb/msid-119567003,width-1070,height-580,imgsize-611672,resizemode-75,overlay-toi_sw,pt-32,y_pad-40/photo.jpg"
"Delhi to get its 1st tree census, SC allows FRI to conduct it",https://timesofindia.indiatimes.com/india/delhi-to-get-its-1st-tree-census-sc-allows-fri-to-conduct-it/articleshow/119566831.cms,"New Delhi: Supreme Court on Wednesday approved the Forest Research Institute’s plan to carry out the first tree census in Delhi and also gave its nod to the Dehradun-based institute’s proposal to enhance the green cover in the city. The two exercises will be conducted simultaneously — the census in three phases over a three-and-a-half-year period and the increasing of green cover over four years.The census will help track tree populations area-wise and check illegal felling. The court took this step in view of the fact that Delhi witnesses felling of five trees per hour on an average. A bench of Justices Abhay S Oka and Ujjal Bhuyan allowed FRI to go ahead with the exercises but asked it to try to complete the tasks in a shorter span and also reduce budget.The court also accepted the submission of additional solicitor general Aishwarya Bhati that the money to undertake census should be released from the CAMPA fund. She assured that all necessary help would be provided to the institute but said the exercise should be concluded in a shorter time.As per FRI, the exercise will be carried out in three phases, with the first phase aiming at standardising the methodology for tree census — it will take 15 months. The second phase is about development of an action plan that will be done in three months, and the final phase is implementation, which will take two years.“FRI proposes an estimated budget of Rs 443 lakh for the execution of phase one and phase two on standardisation of methodology and pilot trial for the development of action plan for implementation in phase three,” the institute said in its affidavit.It said the Tree Authority and the Delhi forest department will undertake the census, and FRI will provide technical support and capacity building to the department’s officials in undertaking the exercise besides monitoring and evaluation. The final report will be submitted to the court by the authority.It said the institute will design and develop a web portal and a mobile app for the census. Regarding enhancing green cover in the national capital territory (NCT), FRI placed before the court a four-year action plan to form a base to launch a massive afforestation drive to increase the forest and tree cover of the area falling within the limits of the govt of the NCT of Delhi.National Forest Policy mandates that one-third of total land area of country should be under forest or tree cover.",The census will help track tree populations area-wise and check illegal felling. The court took this step in view of the fact that delhi witnesses felling of five trees per hour on an average. A bench of justices abhay s oka and ujjal bhuyan allowed fri to go ahead.,"https://static.toiimg.com/thumb/msid-119566828,width-1070,height-580,imgsize-495971,resizemode-75,overlay-toi_sw,pt-32,y_pad-40/photo.jpg"
"Both BJP, ADMK want to take ties forward: TN neta after Shah meet",https://timesofindia.indiatimes.com/india/both-bjp-admk-want-to-take-ties-forward-tn-neta-after-shah-meet/articleshow/119566700.cms,"Chennai: Eighteen months after snapping ties with BJP and quitting NDA, AIADMK leadership is warming up to the saffron party for a possible revival of the alliance for the 2026 assembly elections in Tamil Nadu, reports Julie Mariappan.A 45-minute meeting between an AIADMK delegation led by party general secretary Edappadi K Palaniswami and Union home minister Amit Shah in Delhi Tuesday night initiated the reconciliation, multiple sources told TOI.“Both want the relationship to be taken forward. The next course of action will follow. Shah made a strong point, saying the ‘corrupt DMK govt’ must not return in 2026,” said a senior AIADMK leader. Shah responded positively to some of AIADMK’s demands, he said.Palaniswami told reporters in Delhi that the meeting focused on Tamil Nadu issues like delimitation, the two-language policy, pending MGNREGS and SSA dues, and the Tasmac scam . He added that the alliance will be decided closer to the 2026 electionBJP national co-in-charge of Tamil Nadu P Sudhakar Reddy is scheduled to meet Shah and party national president J P Nadda on Wednesday night. BJP state president K Annamalai left for Delhi on Wednesday.Even as the AIADMK delegation was meeting Shah, the Union minister’s official X handle had a message related to the 2026 Tamil Nadu election. “As soon as the NDA govt is formed in Tamil Nadu in the year 2026, the ‘flood of liquor’ and ‘storm of corruption’ will stop.” The message was also posted in Tamil. Palaniswami acknowledged the post as reflecting Shah’s views.",Aiadmk leadership is warming up to the saffron party for a possible revival of the alliance for the 2026 assembly elections in tamil nadu. A 45-minute meeting between an aiadmk delegation led by party general secretary edappadi k palaniswami and union home minister amit shah in delhi tuesday night initiated the reconciliation.,"https://static.toiimg.com/thumb/msid-119566693,width-1070,height-580,imgsize-605565,resizemode-75,overlay-toi_sw,pt-32,y_pad-40/photo.jpg"
