Article Title,Article Link,Article Text,Article Summary,Article Image
"Follow 'correct script, diction' of national song, anthem: Centre",https://timesofindia.indiatimes.com/india/follow-correct-script-diction-of-national-song-anthem-centre/articleshow/132320529.cms,"Representative image

NEW DELHI: Govt has directed all states and UT administrations to strictly follow the ""correct script and diction"" while singing or playing the national song and national anthem In a letter to state chief secretaries and UT administrators Thursday, the home ministry said when the state song is sung or played with the national song and anthem, both the national song and national anthem shall be sung or played. ""The national song will be sung or played first followed by the national anthem,"" it said.This means that the state song - sung in some states at official functions and ceremonies - cannot be sung in between the national song and national anthem. The order will require the state song to be played first, followed by the national song and finally the national anthem.On its directive to strictly follow the correct script/text and diction/pronunciations while playing the national song - which is to be played in full, comprising all six stanzas - and national anthem, the ministry said their correct script and diction can be found on its portal.""It is requested that suitable instructions in this regard may please be issued to concerned institutions/organisations under your jurisdiction for strict compliance,"" stated the letter.","Govt has directed all states and ut administrations to strictly follow the ""correct script and diction"" while singing or playing the national song and national anthem. This means that the state song - sung in some states at official functions and ceremonies - cannot be sung in between the nationalsong and national anthem.","https://static.toiimg.com/thumb/msid-132320528,width-1280,height-720,resizemode-6,overlay-toi_sw,pt-32,y_pad-600/photo.jpg"
HC order on TMC bank a/cs may not affect ED freeze,https://timesofindia.indiatimes.com/india/hc-order-on-tmc-bank-a/cs-may-not-affect-ed-freeze/articleshow/132322798.cms,"NEW DELHI: Enforcement Directorate 's freeze on three HDFC Bank accounts, which hold Rs 440 crore of Trinamool Congress , is likely to remain in force despite a Calcutta HC order relaxing the restraint imposed by Kolkata Police on all TMC bank accounts in view of claims by the party's breakaway faction to the money.Sources in the agency said ED was not a party to the petition on which the HC gave its judgment, and that the court was dealing with Kolkata Police's action in restraining the two TMC factions from operating the accounts. The freeze on three of 18 TMC accounts by ED under Section 17 of PMLA was not the matter being decided by the HC.Section 17 deals with the directorate's powers to conduct search and seizure, while Section 17(1A) empowers it to seize assets. The merit of ED's actions is then decided by the adjudicating authority. The legal process under PMLA allows for appeal to higher judicial authority after the adjudicating authority has given its order.The remaining TMC accounts include seven with Indian Bank in Kolkata, four with SBI - two each in Delhi and Kolkata - and an account with Union Bank's Dharmatala branch in Kolkata.ED's freezing of accounts is based on its claim to have found evidence of Rs 160 crore allegedly laundered by some TMC members through an aviation company to purchase a plane and a helicopter.ED had claimed Wednesday its ""investigation revealed that around Rs 160 crore was transferred from TMC bank accounts to Carewell Aviation India and its related entity, mostly between April 2023 to June 2026"".""Carewell Aviation routed Rs 82.9 crore to another newly incorporated related entity for purchasing an aircraft Embraer Legacy 600 and one chopper Agusta 109 Grand New and Rs 112 crore was used for making the said purchases,"" it had said.In addition, it said $1.7 million was arranged as an unsecured loan from one Cayman Islands based entity to purchase the helicopter. It is probing the Cayman Island connection with the aircraft and chopper purchased using the TMC funds.Meanwhile, in Kolkata, TMC's breakaway group led by Ritabrata Banerjee said it will challenge the HC order by filing a special leave petition before SC, and make ED a party to the case.","Three hdfc bank accounts, which hold rs 440 crore of trinamool congress, likely to remain in force. Calcutta hc order relaxing restraint imposed by kolkata police on all tmc bank accounts. Ed's freezing of accounts is based on its claim to have found evidence of rs 160 crore allegedly laundered.","https://static.toiimg.com/thumb/msid-132322802,width-1280,height-720,resizemode-6,overlay-toi_sw,pt-32,y_pad-600/photo.jpg"
SC: Even a snail can question pace of trials,https://timesofindia.indiatimes.com/india/sc-even-a-snail-can-question-pace-of-trials/articleshow/132320479.cms,"Supreme Court

NEW DELHI: Noting that a commercial suit filed in 2015 was still at the evidence stage in Delhi HC, Supreme Court said even a snail would question the speed at which the trial was proceeding.The court passed the observation while rejecting a plea by Levitate Mobile Technologies Pvt Ltd (LMT) to introduce additional documents in its suit against Standard Chartered Bank.""The suit in question was filed in 2015. As of 2026, plaintiff's evidence is ongoing. We may say that even a snail may question the speed at which this trial is proceeding. When this reality is juxtaposed with the intent of the legislation and the malady it sought to cure within civil and specifically business litigation in India, the contrast is stark,"" the bench said.SC said all the documents had been in LMT's possession. ""That apart, when we consider the reasons for filing of additional documents in the first round, we find that they are substantially simil-ar to the grounds raised in the present application,"" it said.""The suit was originally initiated on May 27, 2015, was renumbered and registered as a commercial suit under Commercial Courts Act on Jan 30, 2018, the very same date on which the appellant's first application for placing on record the additional documents stood allowed,"" SC said, adding that on Nov 18, 2023, a subsequent application taking the same plea was filed. This petition stood rejected on Feb 12 2025, ""finding LMT not to have furnished any reasonable cause or justifiable explanation,"" it said.",Supreme court said even a snail would question the speed at which the trial was proceeding. The court passed the observation while rejecting a plea by levitate mobile technologies pvt ltd to introduce additional documents in its suit against standard chartered bank. Sc said all the documents had been in lmt's possession.,"https://static.toiimg.com/thumb/msid-132320477,width-1280,height-720,resizemode-6,overlay-toi_sw,pt-32,y_pad-600/photo.jpg"
"After Farooq’s protest invite, Mirwaiz calls for Art 370 inclusion, BJP shreds NC over 2010 killings",https://timesofindia.indiatimes.com/india/after-farooqs-protest-invite-mirwaiz-calls-for-art-370-inclusion-bjp-shreds-nc-over-2010-killings/articleshow/132318741.cms,"Mirwaiz Umar Farooq (File photo)

Omar says CJP got Jantar Mantar protest permit, NC still waits

SRINAGAR: National Conference president Farooq Abdullah’s invitation to 52 national and regional politicians to join the July 20 protest at Jantar Mantar in New Delhi to demand the restoration of Jammu & Kashmir’s statehood has evoked strong reactions. Hurriyat Conference chairman Mirwaiz Umar Farooq called for broadening the protest’s agenda, while BJP tore into NC, saying it would not join separatists and those responsible for the deaths of Kashmiri teenagers during the 2010 unrest.On Thursday, Farooq sent letters to 52 people, describing the abrogation of Article 370 and bifurcation of J&K state into two Union Territories on Aug 5, 2019, as a “deeply flawed decision”, and appealing to them to join NC’s “peaceful, democratic protest” for the “cause of federalism”. The recipients included Sonia Gandhi, Rahul Gandhi, Mamata Banerjee, M K Stalin, Mehbooba Mufti, Ghulam Nabi Azad, Mirwaiz Umar Farooq and J&K BJP chief Sat Sharma, among others.Addressing the Friday gathering at Srinagar’s Jamia Masjid, Mirwaiz said the protest should have been for restoration of Articles 370 and 35A, the release of “hundreds of Kashmiri political prisoners lodged in different jails” across the country, and also for seeking peaceful “political resolution of Kashmir issue”.PDP confirmed the invite to Mehbooba and said the party would respond after due deliberation.BJP, however, rejected the invite and went all guns blazing at Omar Abdullah govt. “Why should we go with NC, a party neck deep in corruption? Why should we stand with those who fired at the chests of Tufail Mattoo and Wamiq Farooq?” leader of opposition Sunil Sharma said, referring to the 2010 unrest.Wamiq and Tufail were among more than 100 people, mostly youths, killed in police firing during the 2010 unrest, when NC govt headed by Omar Abdullah was in office. The deaths triggered months of widespread protests across Kashmir.“Why should we go with those who killed 110 people... who fired on children and then filed a report that they were drug peddlers,” Sharma said.“They have no moral right to ask us to join them,” the BJP legislator added. “They are going (to Delhi for the protest) with those who spread separatism in J&K and Mirwaiz is its first example.”Sharma said the restoration of statehood was part of the BJP manifesto and the party would fulfil its promise.J&K CM Omar Abdullah Friday said NC was yet to get permission for its July 20 protest at Jantar Mantar in New Delhi. “We have been seeking permission for the past five days. It took 24 hours for the ‘Cockroach Party’ to get permission, and we are still waiting for the past five days,” he said.Omar also alleged attempts to disrupt the NC protest. “They have changed their dates and proposed holding their programme on the same day as ours,” he said.","National conference president farooq abdullah invited 52 national and regional politicians to join the july 20 protest at jantar mantar in new delhi. The recipients included sonia gandhi, rahul gandhi, mamata banerjee, m k stalin, mehbooba mufti, ghulam nabi azad and j&k bjp chief sat sharma.","https://static.toiimg.com/thumb/msid-132318725,width-1280,height-720,resizemode-6,overlay-toi_sw,pt-32,y_pad-600/photo.jpg"
Rajpal Yadav gets 3-month jail in cheque-bounce cases,https://timesofindia.indiatimes.com/india/rajpal-yadav-gets-3-month-jail-in-cheque-bounce-cases/articleshow/132322173.cms,"In February, the High Court directed Rajpal Yadav to surrender before the concerned jail authorities.

NEW DELHI: Delhi HC Friday upheld the conviction of actor Rajpal Yadav in multiple cheque-bounce cases and sentenced him to three months' imprisonment. ""Law is not a script that can be rewritten at the will of an actor, nor can legal positions be altered with every change of strategy, whosoever the litigant may be,"" Justice Swarana Kanta Sharma observed.HC ordered Yadav to pay over Rs 1 crore to the complainant in each of the seven cases. The Rs 2 crore (approx.) already paid by the actor shall be adjusted, HC said, keeping the sentence in abeyance for two months to allow Yadav time to appeal. HC also fined the actor's wife, Radha Rajpal Yadav, around Rs 5.5 lakh in each case, payable to the complainant, and warned of a three-month jail term if she fails to pay.In a 108-page verdict, HC said Yadav repeatedly failed to honour his undertakings on making payment to the complainant, M/s Murali Projects Pvt Ltd, and while the court made ""earnest efforts"" to facilitate an amicable resolution in the matter, the actor ultimately categorically refused to make any further payment.During the hearing, Yadav stated that he would rather go to jail five times than return the money, to which Justice Sharma responded that if a litigant wished to choose imprisonment rather than abide by multiple undertakings he submitted in court, it was his choice.According to the 2013 complaint, Yadav tendered seven cheques towards settlement of Rs 5 crore financial assistance to him for a film in 2010, which were dishonoured.","In february, the high court directed rajpal yadav to surrender before the concerned jail authorities. ""law is not a script that can be rewritten at the will of an actor,"" justice swarana kanta sharma observed. Yadav repeatedly failed to honour his undertakings on making payment to the complainant, m/s murali projects pvt ltd.","https://static.toiimg.com/thumb/msid-132322120,width-1280,height-720,resizemode-6,overlay-toi_sw,pt-32,y_pad-600/photo.jpg"
"Breast cancer survival rate up, but India lags behind rich nations: WHO",https://timesofindia.indiatimes.com/india/breast-cancer-survival-rate-up-but-india-lags-behind-rich-nations-who/articleshow/132320503.cms,"World Health Organization

NEW DELHI: The breast cancer survival rate has steadily improved in India over the years, yet only about two of three women diagnosed with the disease survive for at least five years, according to World Health Organization 's first country-wise survival estimates, underscoring the need for earlier diagnosis and timely treatment.India's estimated five-year breast cancer survival rate for women diagnosed during 2017-2021 stands at 65.7%, compared with a global median of 77.8%, according to the WHO estimates published in 'Nature Medicine'. Survival reaches 87.3% in high-income countries, 88.5% in the WHO region of the Americas and 84% in the European region.The study is the first to estimate five-year breast cancer survival for all 194 WHO member states, providing countries with a baseline to measure progress under WHO Global Breast Cancer Initiative, which aims to reduce premature breast cancer mortality by 2.5% every year and save 2.5 million lives by 2040.Earlier, Indian research had also shown improving breast cancer survival. A 2024 National Cancer Registry Programme study reported that five-year survival had increased from 31-54% among women diagnosed in the 1990s to 66.4% for those diagnosed during 2012-2015, although researchers noted that India continues to have scope for improvement through earlier diagnosis and better access to quality cancer care.""India's estimated five-year breast cancer survival rate of 65.7% reflects gaps across the cancer care continuum, not just treatment. Survival has improved with community-based screening and Ayushman Bharat-PMJAY, but many women still present with advanced disease due to low awareness, stigma, financial barriers, and delays in diagnosis. Disparities in access to pathology, imaging, radiotherapy, systemic therapy and follow-up care, especially between urban and rural areas, continue to affect outcomes. Strengthening early detection, timely diagnosis and equitable access to quality treatment is essential to improve survival,"" said Abhishek Shankar, assistant professor of radiation oncology at AIIMS.The WHO report found wide disparities in survival across regions and income groups, reflecting differences in early detection, timely diagnosis and access to treatment. Median five-year survival was 87.3% in high-income countries, compared with 78.7% in upper-middle-income, 60.1% in lower-middle-income and 41.9% in low-income countries.Breast cancer is now the most common cancer among women in 158 countries and caused an estimated 6.9 lakh deaths globally in 2024, with nearly 70% occurring in low- and middle-income countries. WHO said survival depends largely on early diagnosis and timely access to surgery, radiotherapy and cancer medicines, with the stage at diagnosis remaining one of the strongest predictors of survival.The estimates were derived using survival data from cancer registries in 67 countries and statistical modelling for countries lacking complete registry data, incorporating factors such as stage at diagnosis, access to cancer medicines, radiotherapy and mammography capacity, and overall adult mortality.","India's estimated five-year breast cancer survival rate for women diagnosed during 2017-2021 stands at 65.7%, compared with a global median of 77.8%. Survival reaches 87.3% in high-income countries, 88.5% in the who region of the americas and 84% in europe.","https://static.toiimg.com/thumb/msid-132320501,width-1280,height-720,resizemode-6,overlay-toi_sw,pt-32,y_pad-600/photo.jpg"
Women activists: Govt must implement 33% women’s quota at current strength of Parliament,https://timesofindia.indiatimes.com/india/women-activists-govt-must-implement-33-womens-quota-at-current-strength-of-parliament/articleshow/132320383.cms,"Representative image

NEW DELHI: Ahead of the monsoon session scheduled to start from July 20, a group of women organisations and activists under the banner of ‘National Coalition for Women’s Reservation’ have demanded “unconditional and immediate” implementation of 33% women’s reservation in the Parliament and state legislatures at the existing strength from the next round of elections.They have called upon the govt to bring a Constitutional Amendment Bill in the upcoming session to delink women’s reservation from census and delimitation. They have also sought that the opposition parties should support their demand and take up the issue in Parliament.The Coalition members are reaching out to all MPs in their constituencies to seek their support for their demands. They will be holding joint dharnas (demonstration) across the country on July 20-21 and have announced that they will hold daily dharnas from Monday to Friday throughout the monsoon session of Parliament in the Capital. The sit-in to be held at Jantar Mantar. A national conference with women MPs is also planned by the Coalition.Some of the organisations that are part of the coalition include All India Democratic Women’s Association, National Federation of Indian Women - the women’s wing of Communist Party of India, YWCA, Indian Christian Women’s Movement, All India Progressive Women’s Association, Unity In Compassion, ANHAD and activists associated with various campaigns including Anjali Bhardwaj from Satark Nagrik Sangathan.Meanwhile a statement floated by the Coalition has so far been endorsed by over 1500 signatories including activists, lawyers, academics, students, former civil servants and concerned citizens from diverse walks of life.At a press conference in Delhi on Friday, Annie Raja from NFIW and other speakers asserted that women’s right to political representation cannot be indefinitely postponed by linking it to ""unrelated and politically contentious"" processes like delimitation or increasing the number of seats in the Lok Sabha.""We want the opposition to putforth this demand of the women forcefully in Parliament and demand that the govt bring a Bill to delink women’s reservation from census and delimitation. Women organisations have been meeting the MPs in their constituencies including those from the BJP to emphasise the need to implement women's reservation at the current strength and without any further delay,"" she said.Transparency activist Anjali Bhardwaj emphasised the need for transparency and demanded that if the govt was trying toThe Coalition recounted the decades long national women’s movement demanding 33% reservation in Parliament and Assemblies. The first ever bill was introduced in 1996- 30 years ago. Finally when the Women’s Reservation Act was passed in 2023, it linked the issue of reservation with census and delimitation.Representatives of various organisations condemned the govt accusing it of using women’s reservation as a front for its political agenda of delimitation. ""It is a matter of shame that less than 14% MPs are women and the figure across state assemblies is even more abysmal- 10%,"" the Coalition said in its statement.""In 2023, when the Women’s Reservation Act [formally the Constitution (One Hundred and Sixth Amendment) Act, 2023] was passed, it deferred the implementation of women reservation till a census and delimitation were conducted. Many Members of Parliament and women’s collectives had questioned this conditional reservation. Had this condition not been imposed, 33% of MPs inthe current Lok Sabha would have been women,"" the Coalition states.""It is clear that the government is using women’s reservation as a front to push its political agenda of delimitation and increasing the number of seats in the Lok Sabha. This was reconfirmed in 2026, when the government suddenly called a special session of Parliament to ostensibly pave the way for 33% reservation for women in the Lok Sabha and state assemblies from 2029, but did not delink women’s reservation from the politically contentious issue of delimitation,"" they added.Activist Anjali Bhardwaj emphasised the need for transparency and demanded that if the govt was trying to bring back the delimitation bill then it must first put it up for public consultation as the provisions impacts everyone.""The promise of women’s representation continues to remain unfulfilled due to reservation being made conditional upon delimitation and census. This prolonged delay exposes a deep-seated patriarchal reality that systematically stalls women's political empowerment,"" the Coalition asserts in its statement.Prominent signatories include: actor Sharmila Tagore, Mallika Sarabhai (acclaimed dancer and activist), Syeda Hameed (National Federation of Indian Women), Zakia Soman (Bharatiya Muslim Mahila Andolan), Zoya Hasan (professor emeritus JNU), Shabnam Hashmi (social activist), Najeeb Jung (former Lt. Governor of Delhi), Rajeev Dhyani – satirist, Aruna Roy (Mazdoor Kisan Shakti Sangathan), Harsh Mander (Karwan e Mohabbat) and Shailesh Gandhi (former Central Information Commissioner) among others.",National coalition for women’s reservation demands 33% women's reservation in parliament and state legislatures. They have called upon the govt to bring a constitutional amendment bill in the upcoming session. Coalition members are reaching out to all mps in their constituencies to seek their support for their demands.,"https://static.toiimg.com/thumb/msid-132320398,width-1280,height-720,resizemode-6,overlay-toi_sw,pt-32,y_pad-600/photo.jpg"
