Article Title,Article Link,Article Text,Article Summary,Article Image
'I love Muhammad': 5 write slogans on temples to frame Muslims; 4 held,https://timesofindia.indiatimes.com/india/5-write-slogans-on-temples-to-frame-muslims-4-held/articleshow/124974807.cms,"‘I Love Mahadev’ Allowed, But ‘I Love Muhammad’ Targeted: Owaisi Hits Out At Govt

Misspelt slogans led UP cops to suspects trying to frame Muslims





AGRA: Four men have been arrested in Aligarh for allegedly writing ""I love Muhammad"" on the walls of four temples to falsely implicate their Muslim neighbours over property dispute. Aligarh SSP Neeraj Jadon identified the four as Jishant Kumar, Akash Kumar, Dilip Kumar, and Abhishek Sarswat, all aged between 30 and 35.Police said the the fifth accused, identified as Rahul, is absconding.Police said the slogans were found scribbled on four shrines on Oct 25. A complaint was filed by a member of a right-wing organisation, naming Muslim men.Police rushed to the spot with senior officers, erased the graffiti and calmed the crowd. A case was then registered against Maulvi Mustaqeem, Gul Mohammad, Suleman, Sonu, Allabaksh, Hasan, Hamid and Yusuf,"" SSP Jadon said.But police soon noticed something odd. The slogans were misspelled, and all in the same way. The mistake didn't match the way I love Muhammad had appeared on banners during protests in Bareilly in September. That difference led investigators to suspect mischief.Police teams used technical surveillance to track down the actual culprits. A case under BNS was registered against the men, and they were sent to jail. SSP Jadon said police found the men had personal disputes with some of the Muslims they tried to frame.","Misspelt slogans led up cops to suspects trying to frame muslims over property dispute. Police said the slogans were found scribbled on four shrines on oct 25. A complaint was filed by a member of a right-wing organisation, naming muslim men. The slogans were misspelled, and all in the same way.","https://static.toiimg.com/thumb/msid-124974994,width-1070,height-580,imgsize-608712,resizemode-75,overlay-toi_sw,pt-32,y_pad-40/photo.jpg"
"17 kids rescued, man shot dead after Mumbai studio hostage drama",https://timesofindia.indiatimes.com/india/17-kids-rescued-man-shot-dead-after-mumbai-studio-hostage-drama/articleshow/124973870.cms,"Hostage Drama At Powai Studio: Mumbai Police Rescues 17 Kidnapped Children, Accused Killed

'Police's response was measured, safety of those held captive was priority'





MUMBAI: A 45-year-old documentary filmmaker from Pune held 17 children, aged 12-15, a 75-year-old woman and his staffer hostage for two hours at a recording studio in Powai Thursday afternoon after calling them for auditions for a web series. The crisis ended after a police commando team stormed the studio following failed negotiations and shot him in the chest purportedly in self-defence after he fired from an air gun. He was declared dead in hospital.The hostage drama played out after the captor, Rohit Aarrya, who had been living in a relative's flat in Chembur for the past few days, released a video saying he wanted ""simple answers"" to some questions and threatened to set the place ablaze if there was any move made to challenge him. In the clip, which was circulated to many media outlets, he said he was not a terrorist and only wanted ""to be heard"". ""Instead of dying by suicide, I have held some children hostage,"" he said.Police officials said they spent nearly two hours trying to negotiate with Aarrya and gauge his demands, but he refused to cooperate, even after one of the girls' parents said she suffered from seizures.An official said Rohit Aarrya appeared calm when police spoke to him, but at no stage did he elaborate on his motives.City police commissioner Deven Bharti maintained that Aarrya fired first, prompting retaliatory police firing. ""Regardless of his demands, we couldn't let him play with lives. He fired first at police. Our team fired back in self-defence. There was no other option."" Other officials reiterated that the safety of those held captive was the top priority, adding that the police team's response was measured and as per the protocol.The death prompted calls by legal experts for a magisterial inquiry, as laid down by law, to verify the claim of retaliatory police firing.While Aarrya did not elaborate on his motive in the video or during police's attempts at negotiations, it emerged that Aarrya had sat on a hunger strike against former school education minister Deepak Kesarkar of Shiv Sena in 2024 over alleged dues of Rs 2 crore for a state-sanctioned school cleanliness project. Kesarkar said he personally gave him some money as a ""gesture of sympathy"" even though the school education department maintained that Aarrya had collected payment directly from some children. He said Aarrya should have taken up the issue with the department instead of holding children hostage.The city crime branch took over the probe. Those rescued were taken to SevenHills Hospital for medical examination.","Rohit aarrya, 45, held 17 children, aged 12-15, a 75-year-old woman and his staffer hostage for two hours at a recording studio in powai. The crisis ended after a police commando team stormed the studio following failed negotiations and shot him in the chest purportedly in self-defence. He was declared dead in hospital.","https://static.toiimg.com/thumb/msid-124974110,width-1070,height-580,imgsize-1731033,resizemode-75,overlay-toi_sw,pt-32,y_pad-40/photo.jpg"
"4 on death row for CRPF terror attack acquitted, victim's kin slam verdict; court cites prosecution's failure to prove culpability in crime",https://timesofindia.indiatimes.com/india/4-on-death-row-for-crpf-terror-attack-acquitted-victims-kin-slam-verdict-court-cites-prosecutions-failure-to-prove-culpability-in-crime/articleshow/124974328.cms,"Court cites prosecution's failure to prove culpability in crime



PRAYAGRAJ/MEERUT: Allahabad high court has acquitted four men, including two Pak nationals, convicted as terrorists and sentenced to death for killing eight CRPF personnel and wounding five in a 2007 attack on their camp in UP's Rampur. The bench instead held the four guilty under the Arms Act.The family of one of the slain CRPF constables reacted with anger. ""How can terrorists who killed so many security personnel with automatic weapons be acquitted? It's unbelievable. I lost my father, and now the killers walk free. Is this justice?"" asked Deepa Chaudhary (26), daughter of CRPF constable Manveer Singh (35), who was among those killed in the 2007 attack.Allahabad HC bench noted in the verdict that the ""case would have met a different result had the investigation and prosecution been conducted by more trained police"".The court cited the prosecution's ""failure to prove beyond reasonable doubt"" their culpability in the crime. Justices Siddhartha Varma and Ram Manohar Narayan Mishra acknowledged the ""magnitude"" of the terrorist attack on the CRPF camp on the night of Dec 31, 2007, but said they were ""constrained"" by prosecutorial failure to overturn the death sentence pronounced by a trial court in 2019 against Mohd Sharif, Sabauddin, Imran Shahjad and Md Farooq under sections 302 and 149 of IPC.The bench instead held the four guilty under Section 25 (1-A) of the Arms Act, based on the seizure of AK-47 rifles from them, and sentenced them to 10 years of rigorous imprisonment along with a fine of Rs 1 lakh each. A fifth convict serving a life sentence in the case - Jang Bahadur Khan, alias Baba - was acquitted of terrorism charges and convicted for illegal possession of weapons.""The period of imprisonment undergone by the appellants will be adjusted towards the above sentence awarded to them,"" states the order. While observing that it could not deny that the CRPF camp was attacked, ""the defect in investigation ultimately culminated in the acquittal of the accused persons"".""Proving the principal offence beyond reasonable doubt is a golden rule that runs through the web of criminal jurisprudence. The state would be at liberty to deal appropriately with the lapses in investigation and proceed against the guilty police officers under law,"" says the order.Deepa's mother, Pinki Devi, said, ""The investigators were so careless that they let such men go free. I lost my husband, and I still haven't come to terms with the loss. Now this verdict - it's despicable.""(With inputs from Shubham Yadav)","Court cites prosecution's failure to prove culpability in crime. The family of one of the slain crpf constables reacted with anger. ""i lost my father, and now the killers walk free. Is this justice?"" Asked deepa chaudhary.","https://static.toiimg.com/thumb/msid-124974595,width-1070,height-580,imgsize-921092,resizemode-75,overlay-toi_sw,pt-32,y_pad-40/photo.jpg"
Kanpur: Man killed over Rs 40 lakh insurance money; mother among 3 held,https://timesofindia.indiatimes.com/india/kanpur-man-killed-over-rs-40-lakh-insurance-money-mother-among-3-held/articleshow/124971495.cms,"Kanpur: A 47-year-old widow was arrested Thursday after her alleged lover and his brother were rounded up for allegedly murdering her 22-year-old son to claim Rs 40 lakh from four life insurance policies taken in his name, UP police said Thursday. Mamta Devi allegedly conspired with Mayank Katiyar, 33, and his brother Rishi Katiyar, 28, to kill her son Pradeep Sharma on the night of Oct 26-27 in Angadpur village of Kanpur Dehat.SP Shraddha Narendra Pandey said Pradeep, who worked in Andhra, had returned home to celebrate Diwali when his mother. ""Mamta and Mayank planned the murder to claim the insurance money,"" Pandey said.Police said Mayank and Rishi picked Pradeep up on pretext of having dinner and drove him to a deserted stretch where they allegedly attacked him with a hammer. His body was dumped on the highway to stage it as a road accident and cash in on the insurance policies purchased by Mamta in her son's name, police said.","Mamta devi allegedly conspired with mayank katiyar and his brother to kill her son. Pradeep sharma, 22, had returned home to celebrate diwali. His body was dumped on the highway to stage it as a road accident, police said.","https://static.toiimg.com/thumb/msid-124971635,width-1070,height-580,imgsize-630736,resizemode-75,overlay-toi_sw,pt-32,y_pad-40/photo.jpg"
'Mohammad's son': Owaisi raises Muslim leadership demand; will it dent Mahagathbandhan prospects in Bihar elections?,https://timesofindia.indiatimes.com/india/mohammads-son-owaisi-raises-muslim-leadership-demand-will-it-dent-mahagathbandhan-prospects-in-bihar-elections/articleshow/124933555.cms,"Photo/Agencies

Chirag Paswan Accuses Owaisi of Dividing Muslims Through Fear Politics

Tejashwi avoids reaction to Owaisi

NEW DELHI: AIMIM chief Asaduddin Owaisi has increased his attack on the opposition Mahagathbandhan, questioning why the alliance has not named any Muslim leader as its deputy chief minister face for the Bihar elections Addressing supporters, Owaisi said, ""Sitting next to Tejashwi Yadav, Mukesh Bhai of the VIP Party, confident in his community's history, declared that the Malla community is with Tejashwi. The Malla community represents 3% of Bihar's population. He declared that if they gain power, he will become the deputy CM... If a Malla's son will become the deputy chief minister, what will the 17% minority community in Bihar do? Are they only to spread 'Dari ' (carpet)?""He added, ""If a Malla's son can become the deputy chief minister, then Mohammad's son can also become the Prime Minister or chief minister. Nothing can stop us from achieving our goals. Remember, the more you dream, the more you trust in Allah's will, and the more you strive along the way, the more you will see the clearer the path will become.""On Tuesday, Owaisi had raised a similar question. He said, ""Why cannot a Muslim, who represents 17 per cent of the state's population, become the chief minister? After all, they seem to have no problem with promising the deputy CM's post to a person who represents only three per cent of the population.""He criticised Congress, RJD and Samajwadi Party, saying these parties seek Muslim votes without offering leadership roles. Owaisi said, ""Parties like Congress, RJD and Samajwadi Party seek votes of Muslims, cashing in on the minority community's fear of the BJP. These parties have not been able to stop the BJP but are still trying to get the votes of Muslims under the same pretext.""He also targeted the BJP. Owaisi said, ""Prime Minister Narendra Modi claims to take all along and strive to work for the progress of all. But his party fails to give tickets, in elections, to a single Muslim.""RJD leader Tejashwi Yadav declined to respond to Owaisi’s remarks. When asked, he said, ""Leave it. What can I say about it?"" Tejashwi is the Mahagathbandhan’s declared chief minister candidate.In the previous assembly elections, AIMIM contested 19 seats and won five, though four of its MLAs later moved to the RJD.In the 2020 Bihar Assembly elections, AIMIM contested 20 seats and won five, all from the Seemanchal belt. Seemanchal includes Araria, Katihar, Kishanganj and Purnia, located close to the West Bengal border. The Muslim population in Bihar is around 17.7%, and Muslims form about 40% of the population in at least 11 constituencies. They have a decisive influence on around 47 seats.The four districts of Kishanganj, Araria, Purnia and Katihar have 24 seats that will go to polls in the second phase. These districts have a high Muslim population. For many years, this region was seen as a strong area for the RJD and Congress. Owaisi first contested here in 2015 but did not win.Before the 2020 elections, AIMIM won a bypoll seat in Kishanganj. In 2020, the party won five seats — two each in Kishanganj and Purnia, and one in Araria. This changed the electoral maths in multiple seats, reducing the RJD-Congress vote share. The NDA finally defeated the Opposition by a slim margin, where a difference of only 12,000 votes separated the two sides in the final seat tally.The Mahagathbandhan released its manifesto on Tuesday, titled 'Bihar Ka Tejashwi Pran'. It promises that within 20 days of forming the government, a law will be passed to give one government job per family.The 2025 Bihar assembly elections will take place between the National Democratic Alliance (BJP, JD-U, Lok Janshakti Party (Ram Vilas), Hindustani Awam Morcha (Secular) and Rashtriya Lok Morcha) and the Mahagathbandhan (RJD, Congress, CPI-ML, CPI, CPM and VIP).Polling will be held in two phases, on November 6 and 11. Counting of votes will take place on November 14.","Aimim chief asaduddin owaisi has increased his attack on the opposition mahagathbandhan. He questioned why the alliance has not named any muslim leader as its deputy chief minister face for the bihar elections. The muslim population in bihar is around 17.7%, and muslims form about 40% of the population in at least 11 constituencies.","https://static.toiimg.com/thumb/msid-124939761,width-1070,height-580,imgsize-878294,resizemode-75,overlay-toi_sw,pt-32,y_pad-40/photo.jpg"
'Already a subject of public ridicule': Red Chillies on Sameer Wankhede’s defamation suit over Bads of Bollywood; terms claim 'misconceived',https://timesofindia.indiatimes.com/india/already-a-subject-of-public-ridicule-red-chillies-on-sameer-wankhedes-defamation-suit-over-bads-of-bollywood-terms-claim-misconceived/articleshow/124954404.cms,"Sameer Wankhede Claims His Family Is Receiving Threats After Case Against Aryan Khan

NEW DELHI: Red Chillies Entertainment has told the Delhi high court that Indian Revenue Service officer and former NCB Mumbai zonal director Sameer Wankhede's defamation suit against its Netflix series The Bads of Bollywood is ""misconceived,"" arguing that the show is ""a work of situational satire"" and that Wankhede’s reputation had already been under public ridicule long before its release.In its detailed reply, the Shah Rukh Khan-owned production house said the web series does not name or depict Wankhede, nor does it contain any defamatory material, adding that ""the plaintiff cannot claim reputational harm where none existed to begin with,"" news agency ANI reported.The affidavit stated that Wankhede's public image had already suffered following the 2023 CBI FIR against him for alleged extortion and corruption, undermining his claim of an ""unblemished record.""""The existence of the FIR and the necessity for interim protection belie the plaintiff’s assertions,"" the reply said, adding that he ""was already the subject of public ridicule and adverse commentary"" prior to the show’s release.Red Chillies maintained that The Bads of Bollywood is a satire on the Hindi film industry, exploring themes of celebrity culture, nepotism, and sensationalism through humor and exaggeration — forms of expression protected under Article 19(1)(a) of the Constitution.Challenging the maintainability of the case, the company also argued that the Delhi high court lacks jurisdiction, since both Wankhede and the principal defendants, including Netflix, are based in Mumbai.Referring to a brief, one-minute-forty-eight-second scene that Wankhede objected to, Red Chillies said it “merely portrays an overzealous officer” and carries no defamatory reference.Quoting the Bonnard v. Perryman principle, the reply urged the court to avoid pre-trial injunctions in defamation cases as they amount to prior restraint on free speech.“Satire allows the satirist to criticise in the harshest terms and is not intended to harm reputation. Whether the comment is malicious or artistic can only be determined at trial,” it said.The company further argued that as a public servant, Wankhede “must not be too thin-skinned” and should withstand fair comment and parody. His petition, it said, was an “attempt to stifle legitimate artistic expression.”The Delhi high court has listed the matter for hearing on November 10, after directing all parties to file written submissions.(With ANI inputs)","Sameer wankhede has filed a defamation suit against red chillies entertainment. The production house says the show is ""a work of situational satire"" the delhi high court has listed the matter for hearing on november 10, after directing all parties to file written submissions.","https://static.toiimg.com/thumb/msid-124954343,width-1070,height-580,imgsize-29724,resizemode-75,overlay-toi_sw,pt-32,y_pad-40/photo.jpg"
Next CJI: Justice Surya Kant appointed as 53rd top Justice; oath on Nov 24,https://timesofindia.indiatimes.com/india/justice-surya-kant-appointed-as-53rd-cji-oath-on-nov-24/articleshow/124954478.cms,"Who is Justice Surya Kant ?



NEW DELHI: The government appointed Justice Surya Kant as the 53rd Chief Justice of India (CJI), the law ministry announced on Thursday.He will formally take oath on November 24, succeeding Chief Justice Bhushan Gavai, and will become the first top justice from Haryana.Born on February 10, 1962, in Petwar, a small village in Hisar district of Haryana, he grew up in a modest household. Until Class VIII, he studied in a village school that had no benches, and students sat on the floor.Justice Kant graduated from Government Post Graduate College, Hisar in 1981 and earned his Bachelor’s degree in Law (LLB) from Maharishi Dayanand University, Rohtak in 1984.He began his legal career that same year at the District Court, Hisar, before moving to Chandigarh in 1985 to practice at the Punjab and Haryana High Court.On July 7, 2000, he was appointed the youngest Advocate General of Haryana, at just 38 years of age, a record in the state’s legal history. A year later, in March 2001, he was designated as a Senior Advocate.Justice Kant was elevated as a Judge of the Punjab and Haryana High Court on January 9, 2004.He continued his academic journey alongside his judicial duties, earning a Master's degree in Law from Kurukshetra University in 2011, where he graduated first class first.In October 2018, Justice Kant was appointed the Chief Justice of the Himachal Pradesh High Court, before being elevated to the Supreme Court on May 24, 2019.He also served two consecutive terms on the Governing Body of the National Legal Services Authority (NALSA) between 2007 and 2011, contributing significantly to improving access to justice for the underprivileged.","Justice surya kant is the 53rd chief justice of india (cji) he will formally take oath on november 24, succeeding chief justice bhushan gavai. He will become the first top justice from haryana.","https://static.toiimg.com/thumb/msid-124954504,width-1070,height-580,imgsize-25280,resizemode-75,overlay-toi_sw,pt-32,y_pad-40/photo.jpg"
"Cong erased Patel's legacy, PM Modi restored his rightful place: Amit Shah",https://timesofindia.indiatimes.com/india/cong-erased-patels-legacy-pm-modi-restored-his-rightful-place-amit-shah/articleshow/124975416.cms,"In Khagariya, Amit Shah Frames Bihar Poll As Choice Between NDA's Five Pandavas And RJD's Jungle Raj

EKTA NAGAR, NARMADA: Attacking the Congress for “leaving no stone unturned to erase Sardar Vallabhbhai Patel’s legacy” and overlooking his contribution in uniting the country after Independence, home minister Amit Shah on Thursday said the Narendra Modi govt accorded him due recognition by erecting his 182-ft ‘ Statue of Unity ’ at Kevadia, now called Ekta Nagar, and organising an annual parade of all state and Central police forces at the site on his birth anniversary.This year being the 150th birth anniversary of Sardar Patel, the Rashtriya Ekta Diwas parade will get grander. Presided over by the prime minister, it has been upgraded to the scale of the Republic Day parade. It will feature march-past by various state police and Central paramilitary contingents, each led by woman officers, as well as salute by Shaurya Chakra awardees of CRPF and 16 BSF personnel awarded police medals for their valour during Operation Sindoor. Also on display will be heroic stunts by BSF’s Indian breed dogs, daredevilry by motorcycle-borne personnel of the Assam police and BSF’s camel show. Just like the Republic Day parade, tableaux of different state police and paramilitary forces will be part of the parade. Cultural performances, including a grand closing show of dances from various parts of the country featuring 900 artistes, will enthrall the audience as they watch the spectacle with Sardar Patel’s towering statue as the perfect backdrop.A flypast by IAF’s Suryakiran team will match from the sky, the show of colour and talent on the ground.Shah, while addressing a conference on the event in Patna, said the grand parade will not be a one-off event and shall be organised every year on October 31, “similar to the Republic Day parade on January 26”. He said that this parade will serve as a strong medium to inspire the youth of the nation and educate them about Sardar Patel’s principles and his immense contributions to the country.The 150th year tribute to the ‘Iron Man of India” shall continue well beyond Friday. A ‘Bharat Parv’ is being organised here in Ekta Nagar from Nov 1 and shall conclude on the birth anniversary of tribal icon Bhagwan Birsa Munda. “This program will showcase a wonderful synthesis of the cultural diversity, food, costumes, crafts, folk art and music of tribes from across the country,” shared Shah.Hailing the role of Sardar Patel in uniting the country’s 562 princely states into one nation as Independent India’s first home minister, Shah said it is unfortunate that after his demise, the opposition left no stone unturned to erase his legacy. “He was awarded the Bharat Ratna after a delay of 41 years and no monument was built in his honour. It was only when Shri Narendra Modi became the chief minister of Gujarat that he conceptualised the Statue of Unity,” he said adding that Ekta Nagar is now an attractive tourist destination with 14 added attractions like the Valley of Flowers, Ekta Nagar Township, Lake Circuit, Light and Sound Show, Patel Garden, Ekta Cruise, Butterfly Garden, Jungle Safari, Ekta Mall and the Glow Torch Viewpoint.","This year being the 150th birth anniversary of sardar patel, the rashtriya ekta diwas parade will get grander. Presided over by the prime minister, it has been upgraded to the scale of the republic day parade. It will feature march-past by various state police and central paramilitary contingents, each led by woman officers.","https://static.toiimg.com/thumb/msid-124975451,width-1070,height-580,imgsize-33294,resizemode-75,overlay-toi_sw,pt-32,y_pad-40/photo.jpg"
