Article Title,Article Link,Article Text,Article Summary,Article Image
"PM's Bihar talking points: Twin-engine govt, devpt, Rahul's insult to goddess",https://timesofindia.indiatimes.com/india/pms-bihar-talking-points-twin-engine-govt-devpt-rahuls-insult-to-goddess/articleshow/124975285.cms,"PM Modi Targets RJD-Congress Over Rahul Gandhi's Chhath 'Nautanki' Remark, Calls Out Jungle Raj

PATNA: Prime Minister Narendra Modi said on Thursday that fulfilling the dreams of Bihar's youth was the ""sankalp"" (resolve) of both ""Narendra and Nitish"", even as he attacked Congress MP Rahul Gandhi for allegedly insulting Chhathi Maiya (goddess).Addressing twin election rallies in Muzaffarpur and Chhapra, Modi wove together the promise of youth empowerment with sharp criticism of the opposition, accusing them of misleading voters and disrespecting Bihar's culture and faith.In Muzaffarpur, Modi questioned, ""Will Bihar and Hindustan forgive those who insulted even Chhathi Maiya for votes?"" He was referring to Rahul's recent remark that Modi could even dance on stage for votes and had done ""drama"" in the name of Chhath. ""While your son Modi is trying to get Chhath registered on the Unesco heritage list, Congress-RJD people are insulting Chhathi Maiya for votes. Will Bihar, Hindustan and the mothers and sisters who fast without water during Chhath tolerate such insults and not punish them,"" Modi asked. He added that such comments would not be forgiven ""for hundreds of years to come"".In Chhapra, the PM struck the developmental chord. ""Your dream is my resolution.Narendra and Nitish will realise it. It's time to undertake Bihar's journey from good governance to prosperity. It's your duty to maintain its continuity,"" he said.The PM assured that youth would soon find jobs within the state after the NDA returned to govt, promising to stop migration by creating local employment opportunities. However, he warned young voters against ""false promises"" made by the opposition. ""Their manifesto is nothing but their rate list for what they intend to get in return,"" he said.Targeting RJD and Congress, Modi said their leaders avoided visiting Ayodhya because of ""appeasement and vote-bank politics"". He added that the NDA was committed to blending development with heritage, as seen in projects like the Hariharnath corridor being developed on the lines of Kashi, which he said had boosted tourism and the livelihoods of small vendors. ""Our govt is connecting the treasures of Bihar with employment,"" he said.Modi said while NDA stood for ""padhai, kamai, davai and sichai"", the RJD-Congress symbolised ""katta, krurta, katuta, kushasan and corruption"". ""Law and governance suffer where there is katta and krurta, and social justice is not possible amid corruption,"" he said. The PM asked, ""Can people bring back to power those responsible for jungle raj?""","Pm modi wove together the promise of youth empowerment with sharp criticism of the opposition. He accused them of misleading voters and disrespecting bihar's culture and faith. ""will bihar and hindustan forgive those who insulted even chhathi maiya for votes?"" He asked.","https://static.toiimg.com/thumb/msid-124975393,width-1070,height-580,imgsize-1266827,resizemode-75,overlay-toi_sw,pt-32,y_pad-40/photo.jpg"
Karnataka allows RSS march on Mallikarjun Kharge turf,https://timesofindia.indiatimes.com/india/karnataka-allows-rss-march-on-mallikarjun-kharge-turf/articleshow/124971714.cms,"'Room Taken By Strangers Must Be Taken Back By India': RSS Chief's PoK Warning Draws Applause

YADGIR/BENGALURU: Days after Karnataka HC stayed state govt order restricting public gatherings of more than 10 people, Yadgir district administration on Wednesday granted conditional permission for a RSS 'path sanchalan' (route march) in Gurmitkal, which happens to be a political stronghold of Congress president Mallikarjun Kharge The permission comes with 10 conditions, including ban on provocative slogans, roadblocks and carrying of weapons. It is unclear whether RSS volunteers will be allowed to carry their batons during the procession.Plans to hold a similar march in neighbouring Chittapur, represented by Kharge's son and IT minister Priyank Kharge, on November 2 will have to wait for now.","Karnataka hc stayed state govt order restricting public gatherings of more than 10 people. Yadgir district administration on wednesday granted conditional permission for a rss 'path sanchalan' (route march) in gurmitkal. The permission comes with 10 conditions, including ban on provocative slogans, roadblocks and carrying of weapons.","https://static.toiimg.com/thumb/msid-124971971,width-1070,height-580,imgsize-868798,resizemode-75,overlay-toi_sw,pt-32,y_pad-40/photo.jpg"
"After nearly 5 yrs in jail, woman acquitted of murdering 7-year-old",https://timesofindia.indiatimes.com/india/after-nearly-5-yrs-in-jail-woman-acquitted-of-murdering-7-year-old/articleshow/124970446.cms,"MOHALI: After spending nearly five years in jail, a woman accused of murdering a seven-year-old boy was acquitted by a Mohali court on Thursday, which said the prosecution had failed to establish motive, connect circumstantial evidence, or prove murder beyond reasonable doubt.Amandeep Kaur, a resident of Gharuan village, remained in judicial custody for four years, eight months and 12 days as no one came forward to stand surety for her bail, her counsel C S Bawa said.""The entire evidence leads this court to an inference that the deceased might have died accidentally. The suspicion, however grave, cannot take the place of cogent proof,"" the court said, acquitting Amandeep of all charges. The court emphasised adherence to the 'Panchsheel principle' of circumstantial evidence, which requires all circumstances must be fully established and form a complete chain pointing only to the guilt of the accused.The court said while the evidence suggested the boy may have drowned in the drum found in the accused's house, there was nothing to show the drowning was intentional or that Amandeep was responsible. ""The evidence on record proves that on the date of occurrence, the deceased went to the house of the accused. But what happened inside that house was never proved by the prosecution. There is no eyewitness in the case, and the circumstantial evidence is insufficient to conclude that Amandeep caused the boy's death,"" the court stated.","Amandeep kaur remained in judicial custody for four years, eight months and 12 days. No one came forward to stand surety for her bail, her counsel c s bawa said. The court emphasised adherence to the 'panchsheel principle' of circumstantial evidence.","https://static.toiimg.com/thumb/msid-124970582,width-1070,height-580,imgsize-786508,resizemode-75,overlay-toi_sw,pt-32,y_pad-40/photo.jpg"
Hit-&-run case against Punjab judicial officer shifted to Delhi,https://timesofindia.indiatimes.com/india/hit-run-case-against-punjab-judicial-officer-shifted-to-delhi/articleshow/124970369.cms,"NEW DELHI: Supreme Court transferred on Thursday the trial in a hit-and-run case involving death of a motorcyclist from Phagwara in Punjab to Rohini courts in Delhi after his widow expressed apprehensions over fairness of the trial in a state where the accused is a probation judicial officer.A bench of Justices Surya Kant and Joymalya Bagchi said file of the case, in which the judicial officer driving a car allegedly caused death of a person travelling from Hoshiarpur to Phagwara on a bike, would be transferred from court of judicial magistrate at Phagwara to chief judicial magistrate at Rohini courts.However, the bench acceded to the request from the counsel for the judicial officer to exempt him from personal appearance after he undertook that he would have no objection if the Delhi court recorded statements of witnesses in the presence of his counsel, who shall mandatorily attend the proceedings on every scheduled date of hearing.SC asked the accused to mark his attendance before the Rohini court through video conferencing and told him that under no circumstances should his counsel seek adjournment of trial proceedings. The victim's wife had moved SC seeking transfer of the trial.It said Delhi trial court shall decide the woman's plea for further investigation by CBI. The court also transferred the widow's compensation claim before a Motor Accident Claims Tribunal at Himachal's Kullu to MACT in Rohini courts.",Trial in hit-and-run case involving death of a motorcyclist moved to delhi. Victim's widow expressed apprehensions over fairness of the trial in punjab. Accused is a probation judicial officer driving a car allegedly causing death.,"https://static.toiimg.com/thumb/msid-124970393,width-1070,height-580,imgsize-744312,resizemode-75,overlay-toi_sw,pt-32,y_pad-40/photo.jpg"
