Article Title,Article Link,Article Text,Article Summary,Article Image
'This network is very big': UGC-NET whistleblower alleges paper leak racket,https://timesofindia.indiatimes.com/india/this-network-is-very-big-ugc-net-whistleblower-alleges-paper-leak-racket/articleshow/132324984.cms,"The latest allegations come at a time when the NEET-UG paper leak had triggered a major political storm and forced govt to promise stricter safeguards in high-stakes exams

New Delhi: An organised examination racket is operating across several states, according to Haryana-based advocate and student leader Deepak Dhankhar, who claims the UGC-NET Sociology question paper was circulated to candidates just hours before the exam, with students reportedly cramming from the leaked material overnight.In an exclusive interview, Dhankhar said the investigation started almost by accident. One of his associates was approached by people claiming to have access to exam papers, and at first, the group assumed it was a scam.""We thought it was a cheating racket trying to dupe candidates,"" Dhankhar said. ""But then we realised this could be an opportunity to expose them.""The alleged operators kept in touch with his associate, insisting they could arrange papers for various exams. Dhankhar says he now has phone numbers, names and financial details tied to these individuals.The first paper the group handed over turned out to be fake. ""Not a single question matched. We thought it was just a gang extorting money from students,"" Dhankhar recalled. But the network didn't disappear, instead, it doubled down, claiming it had access to the real paper through a longer chain of contacts, and set up another round of ""preparation"" sessions for candidates.That's where things escalated. The most serious allegation concerns the Sociology paper held on June 30. During a late-night session, Dhankhar says his associate spotted a pen drive with what looked like exam material on it.""The Sociology PDF was open on their laptop. Taking advantage of a brief opportunity, my associate forwarded the file and immediately deleted the trace. They never realised the paper had reached us,"" he said.Candidates who sat the exam the next day told him the questions matched almost exactly what they'd studied the night before. One student, he says, walked out of the hall and told him bluntly: ""These were the exact questions. They matched completely.""Dhankhar alleges the operation isn't confined to Haryana, the same people claimed to have active teams in Rajasthan, Delhi, Bihar and Uttar Pradesh. ""If they can bring original papers, it shows how extensive the network is,"" he said.He's also frustrated with the response, or lack of one, from authorities. ""Every investigating agency has had my contact details for years. Nobody approached me to collect evidence. Instead, there appears to be pressure to ensure this issue does not reach the public,"" he alleged.The claims picked up national attention after Lok Sabha opposition leader Rahul Gandhi referenced them in a social media post. So far, neither the National Testing Agency nor law enforcement has confirmed anything publicly, and no official probe has established that the paper was actually leaked.For now, the allegations remain just that, allegations. But they've put exam security, and the durability of paper-leak networks in India, back in the spotlight.","Haryana-based advocate and student leader deepak dhankhar claims the ugc-net sociology question paper was circulated to candidates just hours before the exam. He says he has phone numbers, names and financial details tied to these individuals. No official probe has established that the paper was actually leaked.","https://static.toiimg.com/thumb/msid-132325002,width-1280,height-720,resizemode-6,overlay-toi_sw,pt-32,y_pad-600/photo.jpg"
Why BJP replaced its Bankipur bypoll nominee before face-off with Prashant Kishor,https://timesofindia.indiatimes.com/india/why-bjp-replaced-its-bankipur-bypoll-nominee-before-face-off-with-prashant-kishor/articleshow/132324929.cms,"Why Abhishek Kumar Sinha backed out

NEW DELHI: Bharatiya Janata Party on Friday handed an early edge to its opponents in the upcoming Bankipur Assembly bypoll after its candidate, Abhishek Kumar Sinha, pulled out of the contest, citing ""family reasons. ""The move gave fresh ammunition to the opposition, which claimed that the saffron party was ""jittery at the prospect of a defeat"" in the seat vacated by BJP national president Nitin Nabin.""Because of family reasons, I am unable to contest the bypoll. But I will continue to work for the party as a committed worker. I have conveyed the same to state president Sanjay Saraogi,"" Sinha said while addressing a press conference, where he took no questions.Minutes later, the BJP national headquarters in New Delhi announced that the party's central election committee had decided to field 32-year-old Neeraj Kumar Sinha.Reportedly, Abhishek Kumar Sinha's announcement came shortly after a meeting of the BJP-led NDA held at chief minister Samrat Choudhary's residence.""Negative inputs"" about the candidate may have been the reason behind the decision, news agency PTI reported, citing sources.BJP sources, speaking on the condition of anonymity, said that a close family member of Abhishek Kumar Sinha was convicted in the fodder scam, and the party was wary that Jan Suraaj founder Prashant Kishor could put it on the back foot once he got wind of the ""tainted background"".The upcoming bypoll in the Bankipur constituency is expected to be a high-voltage contest, with Kishor also throwing his hat into the ring.PK, who is expected to file his nomination papers on Monday has been campaigning intensively, calling upon voters to register their dissatisfaction with the BJP by defeating the party in the bypoll.""I know that even if I win, the NDA, which enjoys a brute majority, will not lose power. But the people had voted for (JDU president) Nitish Kumar. They can make the BJP top brass understand their displeasure by defeating it in Bankipur. I promise that just one MLA of the Jan Suraaj Party will outweigh the remaining 242 ones,"" has been a common refrain of Kishor.When Kishor was asked about the perception, he said: ""I do not know about the NDA meeting. But Bankipur is witnessing a meeting of the people who are determined to vote against the Samrat Choudhary government. I shall not brag that the BJP is scared of me. But they are certainly scared of the public anger. They have begun to realise that before the will of the people, the ED, CBI and the entire power machinery is powerless. """"So, it is an admission on the part of the BJP that it fields corrupt people. All the more reason for the people not to vote for the party,"" Kishor said.RJD spokesperson Shakti Yadav claimed that Abhishek Kumar Sinha ""has not withdrawn his candidature of his own accord, but was forced to pull out at the instance of the BJP high command"".Congress spokesperson Asit Nath Tiwari, whose party is an RJD ally, said in a statement: ""Nitin Nabin had given the ticket to one of his close associates, believing that as national president he was in a position to call the shots. But he got tattled upon by his detractors and received a dressing down from Union Home Minister Amit Shah.""The Bankipur bypoll was necessitated by the resignation of Nitin Nabin. Polling will be held on July 30, while the counting of votes is scheduled for August 3.","Abhishek kumar sinha pulls out of the contest, citing ""family reasons"" opposition claims that the saffron party is ""jittery at the prospect of a defeat"" polling will be held on july 30, while the counting of votes is scheduled for august 3. Jan suraaj founder prashant kishor also throwing his hat into the ring.","https://static.toiimg.com/thumb/msid-132324995,width-1280,height-720,resizemode-6,overlay-toi_sw,pt-32,y_pad-600/photo.jpg"
Parliamentary panel to review NEET conduct on July 16 after re-test,https://timesofindia.indiatimes.com/india/parliamentary-panel-to-review-neet-conduct-on-july-16-after-re-test/articleshow/132323993.cms,"On July 15, the panel will meet to discuss the affordability and accessibility of healthcare facilities in the public and private sectors.

NEW DELHI: The Parliamentary Standing Committee on Health and Family Welfare will meet on July 16 to discuss the conduct of the National Eligibility-cum-Entrance Test (NEET) under the National Medical Commission (NMC) Act, 2019, weeks after the medical entrance examination was re-conducted following the cancellation of the original test over alleged paper leak.The panel, headed by Rajya Sabha MP Ram Gopal Yadav, will also examine the organisational structure, mandate and functional proficiency of regulatory institutions under the Union health ministry.The original NEET-UG examination, held on May 3, was cancelled after allegations of a paper leak and was re-conducted on June 21. The July 16meeting is expected to review the examination process and the role of regulators under the NMC Act.A day earlier, on July 15, the panel will meet to discuss the affordability and accessibility of healthcare facilities in the public and private sectors.","The panel, headed by rajya sabha mp ram gopal yadav, will also examine the organisational structure, mandate and functional proficiency of regulatory institutions under the union health ministry. The original neet-ug examination, held on may 3, was cancelled after allegations of a paper leak and was re-conducted on june 21.","https://static.toiimg.com/thumb/msid-132324215,width-1280,height-720,resizemode-6,overlay-toi_sw,pt-32,y_pad-600/photo.jpg"
Drugs containing over 12% alcohol need prescription,https://timesofindia.indiatimes.com/india/drugs-containing-over-12-alcohol-need-prescription/articleshow/132323934.cms,"The ministry said the products covered include certain herbal and medicinal liquid preparations, including cardamom and ginger tinctures.

NEW DELHI: Oral medicinal formulations containing more than 12% ethyl alcohol and sold in bottles larger than 30 ml will soon require a doctor's prescription after the Centre amended the Drugs Rules to curb their misuse.Officials said the move follows complaints from states, including Uttar Pradesh and Madhya Pradesh, that certain medicinal tinctures were allegedly being misused. Traditionally, tinctures containing ingredients such as cardamom and ginger were intended as medicinal preparations, largely used as digestive aids. However, some products allegedly contained 60-80% ethyl alcohol and were allegedly being sold as medicinal products despite containing very high levels of ethyl alcohol and were reportedly being misused like liquor.The ministry said the products covered include certain herbal and medicinal liquid preparations, including cardamom and ginger tinctures. These are concentrated herbal extracts prepared using ethyl alcohol as a solvent, not the kitchen spices themselves. While cardamom and ginger have long been used in traditional medicine, particularly for digestive and other therapeutic purposes, some tincture formulations contain 80-90% ethyl alcohol, making them vulnerable to misuse for intoxication.The health ministry has notified the Drugs (Tenth Amendment) Rules, 2026, under which such formulations will no longer be exempt from licensing requirements under Schedule K of the Drugs Rules, 1945. Instead, they will be brought under Schedule H1, meaning they can be sold only against the prescription of a registered medical practitioner. Pharmacies will also have to maintain records of every sale. The rules will come into force six months after their publication in the Official Gazette.With the amendment, oral medicinal formulations containing more than 12% ethyl alcohol will no longer be able to claim exemption under Schedule K merely because they contain ingredients such as cardamom, ginger or other spices.Existing provisions under the Drugs Rules already prescribe ethyl alcohol limits for several traditional systems of medicine. Ayurvedic, Siddha and Unani syrups are permitted to contain up to 16% ethyl alcohol, while Homoeopathic medicines are limited to 12%. Officials said the latest amendment seeks to create a uniform regulatory framework for medicinal products containing high levels of ethyl alcohol.According to the ministry, the amendment is aimed at strengthening regulatory oversight of medicines containing high levels of ethyl alcohol, ensuring they are supplied only through the regulated pharmaceutical supply chain and reducing the possibility of diversion and misuse while ensuring they remain available for genuine therapeutic use.","Oral medicinal formulations containing more than 12% ethyl alcohol will soon require a doctor's prescription. The move follows complaints from states, including uttar pradesh and madhya pradesh. Traditionally, tinctures containing ingredients such as cardamom and ginger were intended as medicinal preparations, largely used as digestive aids.","https://static.toiimg.com/thumb/msid-132323980,width-1280,height-720,resizemode-6,overlay-toi_sw,pt-32,y_pad-600/photo.jpg"
"Petitioner hurls papers, 'orders' SC to file FIR",https://timesofindia.indiatimes.com/india/petitioner-hurls-papers-orders-sc-to-file-fir/articleshow/132323331.cms,"Supreme Court

Despite criminal contempt, SC refrains from taking action

NEW DELHI: A ""petitioner-in-person"", Prabal Pratap, on Friday caught a Supreme Court bench and advocates by surprise when he ""ordered"" the judges to register a case against a police officer in Lucknow, threw a bunch of papers in the courtroom and then went on to swear at the CJI.Appearing along with co-petitioner Chandra Bhan before a bench of Justices K V Viswanathan and Alok Aradeh, Pratap said: ""Mr Judicial Servant, I order you to order registration of FIR against ACP, Vikas Nagar, Lucknow.""""You are ordering us?"" asked a surprised Justice Viswanathan. Unfazed, Pratap who, like Chandra Bhan, was attired like an advocate, continued brandishing 185 pages of documents against Duplex Technologies, which, he alleged, is running a syndicate.He tossed the bundle into the air. As the papers scattered, he then used a cuss word, prompting security personnel to physically remove him from the courtroom.However, despite the criminal contempt, the bench did not initiate any action. The bench said, ""As far as the merit of this case is concerned, we have perused the records, we find no good ground to interfere with the impugned judgement/order(s). The special leave petition is, accordingly, dismissed,"" it said.Pratap had challenged Allahabad high court's April 6 order refusing to entertain his writ petition seeking quashing of the February 21 order of special chief judicial magistrate (custom), Lucknow, which had converted his application under Sec 173(3) of Bharatiya Nagarik Suraksha Sanhita into a private complaint case along with subsequent proceedings arising from the case Prabal Pratap Vs Duplex Technologies Services.He had also sought a direction to the Lucknow police commissioner to take over the investigations into his allegations against Duplex Technologies Services. The high court had dismissed his writ petition saying the chief judicial magistrate's order could be challenged in accordance with law.","Supreme court bench and advocates caught by surprise when ""petitioner-in-person"" prabal pratap ""ordered"" the judges to register a case against a police officer in lucknow. He then threw a bunch of papers in the courtroom and then went on to swear at the cji.","https://static.toiimg.com/thumb/msid-132323335,width-1280,height-720,resizemode-6,overlay-toi_sw,pt-32,y_pad-600/photo.jpg"
'She asked for help': New CCTV footage shows 'bullying' moments before Jaipur schoolgirl's death,https://timesofindia.indiatimes.com/city/jaipur/she-asked-for-help-new-cctv-footage-shows-bullying-moments-before-jaipur-schoolgirls-death/articleshow/132302822.cms,"Fresh CCTV footage has been released by a family alleging bullying caused their daughter's death.

(With PTI inputs)

Poll Vote & Share your view Should the school principal and founder be held accountable in this case? Yes, they should be included in the chargesheet. No, they should not be implicated. 3k+ users shared opinion today 5k+ users already voted today 3k+ users shared opinion today Share Opinion





JAIPUR: Nearly eight months after a nine-year-old girl allegedly died by suicide by jumping from the fourth floor of Jaipur's Neerja Modi School, her family has released fresh CCTV footage claiming it captures repeated bullying inside the classroom shortly before the incident.The footage, released by the family of Class 4 student Amaira Meena, has been cited as evidence supporting their long-standing allegation that sustained bullying by classmates and the school's alleged failure to intervene contributed to her death.According to the family, the CCTV footage shows Amaira entering the classroom normally, greeting a classmate and participating in a dance activity before allegedly being subjected to repeated bullying by other students. They claimed the child showed visible signs of distress and sought help, but did not receive adequate intervention from teachers.The family renewed its demand for action against all those responsible under the Juvenile Justice (Care and Protection of Children) Act and sought the inclusion of abetment-related charges wherever legally applicable.Amaira allegedly jumped from the fourth floor of the school building on November 1, 2025.She was rushed to a nearby hospital, where doctors declared her dead on arrival.The development comes days after Jaipur Police filed a chargesheet in the case. However, Amaira's parents, Vijay Meena and Shivani Meena, alleged that the investigation was incomplete and questioned the omission of school principal Indu Dubey and founder Saurabh Modi from the chargesheet despite what they described as evidence of institutional negligence.Addressing a press conference along with members of the Sanyukt Abhibhavak Sangh, the parents alleged that investigators failed to adequately examine findings of a CBSE inspection report, which they claimed pointed to irregularities, including the appointment of underqualified teachers.""Filing the chargesheet is an important step, but justice will remain incomplete unless every person responsible is made an accused and arrested in accordance with the law,"" Vijay Meena said.The family also alleged that police failed to properly investigate what transpired inside the classroom and demanded a fresh, impartial probe into the circumstances leading to their daughter's death.Supporting the family's demands, Sanyukt Abhibhavak Sangh president Arvind Agrawal said the case raised larger questions about accountability in private schools. The parents' body called for mandatory anti-bullying protocols, appointment of qualified counsellors, comprehensive CCTV surveillance and stricter enforcement of child safety norms.The family's allegations could not be independently verified.","Fresh cctv footage has been released by a family alleging bullying caused their daughter's death. Amaira meena allegedly jumped from the fourth floor of the school building on november 1, 2025. The development comes days after jaipur police filed a chargesheet in the case.","https://static.toiimg.com/thumb/msid-132302828,width-1280,height-720,resizemode-6,overlay-toi_sw,pt-32,y_pad-600/photo.jpg"
Cong demand for seat parity highlights fault line with SP,https://timesofindia.indiatimes.com/india/cong-demand-for-seat-parity-highlights-fault-line-with-sp/articleshow/132322792.cms,"NEW DELHI: The new Congress in-charge for UP, Rajendra Pal Gautam, kickstarted his innings with a demand for parity and respect from Samajwadi Party for the coming UP elections, accentuating the fault line of ""seat distribution"" that has dogged the alliance in the past. It has raised concerns in some quarters that such debate is distracting from serious issues to corner the governing BJP.Congress's focus on its organisational building across the state - a shorthand for larger seat share - defies the urgency that SP has sought to insert in the preparation for the state elections scheduled for Feb 2027.Only days ago, SP chief Akhilesh Yadav had litigated the issue in the meeting of INDIA bloc by making a forceful plea that Congress show a big heart toward regional parties. It echoed the unease among sections of the UP alliance over the delay in finalising the seat-sharing arrangement.In the meeting, sources said, Akhilesh had asked Congress to give primacy to regional parties on their turfs - which could be seen as a plea to Congress to be ""reasonable"". Apparently giving the example of 2024 Lok Sabha deal, he argued that allocating 17 seats to Congress against a lesser planned tally hampered the alliance's ability to secure better results.A senior opposition member said the SP chief even named specific constituencies which the alliance lost but could have won.Interestingly, he is said to have pleaded with Congress that it should trust the judgment of the regional parties in states, per the senior INDIA bloc member. The remarks appeared to press for an early start and conclusion of tie-up formalities to kickstart the UP campaign, as Akhilesh is said to have noted that the challenge for opposition has increased after the defeat of like-minded parties in Bihar and Bengal.What seems to worry sections of UP allies is that Congress' ""easy approach"" is made worse by repeated remarks from its functionaries seeking a high share of seats from SP - which has triggered a constant to-and-fro among local functionaries of the two camps.The mistrust has grown to a level that when Gautam, as AICC SC department chairman, and MP Tanuj Punia made an unscheduled visit to BSP head Mayawati's residence in May and sought a meeting, it triggered a controversy. While Mayawati did not meet Gautam and Punia, many saw it as Congress's attempt to pressure SP. Later, Congress had to give clarification.",Congress's focus on its organisational building across the state is a shorthand for larger seat share. Akhilesh yadav made a forceful plea that congress show a big heart toward regional parties. The mistrust has grown to a level that when gautam and mp tanuj punia made an unscheduled visit to bsp head mayawati's residence.,"https://static.toiimg.com/thumb/msid-132322793,width-1280,height-720,resizemode-6,overlay-toi_sw,pt-32,y_pad-600/photo.jpg"
'We'll expose you' for trial delay: SC to Maharashtra,https://timesofindia.indiatimes.com/india/well-expose-you-for-trial-delay-sc-to-maharashtra/articleshow/132320521.cms,"Supreme Court

NEW DELHI: Putting a premium on the liberty of arrested people, Supreme Court Friday said though it was endemic for states to oppose bail pleas tooth and nail, no corresponding steps were taken to expedite trials despite the apex court's repeated rulings that accused have a fundamental right to a speedy trial.Days after imposing a fine of Rs 50,000 on the Amritsar SP after finding Punjab was not taking steps to produce an accused before the trial court to expedite the proceedings but was opposing his bail plea even though he had been in custody for a long period, a bench of Justices Ahasanuddin Amanullah and Sheel Nagu found Maharashtra remiss on a similar count.Disapproving the negligent attitude that dents the right to a speedy trial, the bench said, ""Every day we get cases of this nature from Maharashtra - oppose bail tooth and nail but not take steps to expedite trial. When we examine the case, the evidence is weak. We will expose you (the state) in public.""The man in question has been in jail for four years, and only two of 34 witnesses have been examined so far, the bench said. The accused, foreign national Kelvin Chindozie Okoro, was arrested in May 2022 for kidnapping and murder. HC had rejected his bail plea twice - in June 2024 and on March 17 this year.Okoro said he had been in custody for four years and his case was listed before the trial court on 86 dates, but he was not produced before the court on 53 occasions.The bench said it would not grant bail to the accused on merit but there was a serious lapse on the part of Maharashtra in not producing the accused before the trial court on every date of hearing. Referring to repeated SC rulings on an accused's fundamental right to speedy trial, the bench said, ""We are feeling embarrassed. Only two of the 34 witnesses have been examined in four years. This aspect has been bothering this court for some time. When the state opposes bail pleas tooth and nail, it has a corresponding duty to conduct the trial smoothly, but it is found lacking.""When Maharashtra's counsel said the state was lacking earlier but had now achieved a 100% rate in the production of the accused on every date of hearing before trial courts, SC said it was a pan-India problem. ""States must come out with a specific policy on expediting trials,"" it said. In the Punjab case, the Justice Amanullah-led bench had observed, ""Let at least four witnesses be examined per week and let the record of this order be placed before the trial court. If such cases are brought to notice in future, similar stringent orders shall be passed.""","Supreme court said it was endemic for states to oppose bail pleas tooth and nail. Justices ahasanuddin amanullah and sheel nagu found maharashtra remiss on a similar count. The accused, foreign national kelvin chindozie okoro, was arrested in may 2022 for kidnapping and murder.","https://static.toiimg.com/thumb/msid-132320520,width-1280,height-720,resizemode-6,overlay-toi_sw,pt-32,y_pad-600/photo.jpg"
