Article Title,Article Link,Article Text,Article Summary,Article Image
"80-year-old Sikh, inspired by Fauja Singh, to run London Marathon for first time",https://timesofindia.indiatimes.com/world/uk/80-year-old-sikh-inspired-by-fauja-singh-to-run-london-marathon-for-first-time/articleshow/130341124.cms,"80-year-old Sikh, inspired by Fauja Singh, to run London Marathon for first time

Baldev Singh running

Poll Would you consider participating in a charity marathon? Yes, for a good cause Only if I trained for it No, not interested Maybe, if I had the time







An 80-year British Sikh man is running the London Marathon for the first time on April 26, inspired by Fauja Singh who encouraged him to take up walking initially.Baldev Singh Bains is doing the marathon to raise money for the Fauja Singh Clubhouse, being built in Fauja’s memory in Redbridge, on the route Fauja used to run.Fauja, the oldest marathon runner in the world, died last July after being hit by a car in his native village Beas Pind at the age of 114. He had discovered running in his 80s and ran his first marathon aged 89.Baldev knew Fauja as they lived in the same London borough, Redbridge, and went to the same gurdwara.“When Fauja improved his running, I decided I wanted to improve my health. Fauja told me to start walking, and then running, and to change my diet and think positively,” Baldev said.As recommended by Fauja, he started off by walking around the periphery of Beal High School Redbridge.“At that time I was on medication for diabetes and other conditions and overweight. Now I have lost 30kg and my doctor has now taken me off virtually all my medication.”Baldev hired Fauja’s coach, Harmander Singh, last year to train him, and he is also a member of the Sikhs in the City running club, where Fauja trained. Harmander (66) is also running the London Marathon to raise funds for the clubhouse, which will cost £1 million. It was given planning permission on April 1, which would have been Fauja’s 115th birthday.Baldev was born in Thana, a village in Garhshankar Tehsil in Hoshiarpur district, Punjab. He read engineering at Delhi University before moving to the UK. “The way Fauja helped me, I hope this will inspire others,” Baldev said.","80-year-old sikh, inspired by fauja singh, to run london marathon for first time. Baldev singh bains is doing the marathon to raise money for the fauja singh clubhouse, being built in his memory in redbridge.fauja, the oldest marathon runner in the world, died last july.","https://static.toiimg.com/thumb/msid-130348873,width-1280,height-720,imgsize-778154,resizemode-6,overlay-toi_sw,pt-32,y_pad-600/photo.jpg"
IShowSpeed steals WrestleMania spotlight by putting Logan Paul through table after hitting Cristiano Ronaldo celebration,https://timesofindia.indiatimes.com/world/us-streamers/ishowspeed-steals-wrestlemania-spotlight-by-putting-logan-paul-through-table-after-hitting-cristiano-ronaldo-celebration/articleshow/130375271.cms,"Logan Paul and IShowSpeed (Image Via Getty)

WWE

broadcast footage and live audience reactions

IShowSpeed and Logan Paul create viral WrestleMania moment with table spot and Cristiano Ronaldo celebration

Dexerto on X







Something unexpected happened at WrestleMania this year, and it had nothing to do with a planned storyline. Popular streamer IShowSpeed suddenly stepped into the ring and became part of the action. In a moment that quickly spread online, he jumped from the top rope and slammed Logan Paul through a table. The crowd inside the arena reacted instantly, and the clip started gaining attention across social media within minutes.What made the moment even more interesting was what happened just before the move. Speed paused, looked around, and performed Cristiano Ronaldo’s famous “Siuuu” celebration. That small detail turned a shocking wrestling spot into something fans from both wrestling and football could connect with. As shared by, the entire sequence felt more like a crossover moment than a regular match interruption.The moment happened during one of the ongoing matches at WrestleMania, which is known as WWE’s biggest show of the year. While the focus is usually on professional wrestlers, this time the spotlight shifted quickly. Speed ran into the ring without much warning, climbed up, and delivered the move that sent Logan Paul crashing through a table placed inside the ring.Logan Paul, who has become a regular part of WWE shows, is known for mixing entertainment with athletic moments.But this time, he found himself on the receiving end of a viral highlight. The timing, the jump, and the table impact all came together in a way that felt intense but also very real to the audience watching live.Right before the jump, Speed made sure to do something that his followers instantly recognized. He performed Cristiano Ronaldo’s “Siuuu” celebration with full energy. It was quick, but it added personality to the moment. Fans in the arena reacted loudly, and many could be heard cheering even before he leaped.As clips started circulating online, the moment gained traction fast. Platforms like X and Instagram saw the video spread widely, with users pointing out how unusual it was to see a streamer take part in such a major wrestling event. According to clips shared by, the reaction online matched the energy inside the stadium.This crossover between streaming and wrestling shows how entertainment is changing. Moments like these are not just about sports anymore. They mix internet culture, live events, and global icons into one scene that people remember.","Streamer ishowspeed jumped from the top rope and slammed logan paul through a table. The crowd inside the arena reacted instantly, and the clip started gaining attention across social media within minutes. Speed paused, looked around, and performed cristiano ronaldo’s famous “siuuu’ celebration.","https://static.toiimg.com/thumb/msid-130375239,width-1280,height-720,imgsize-34914,resizemode-6,overlay-toi_sw,pt-32,y_pad-600/photo.jpg"
