Article Title,Article Link,Article Text,Article Summary,Article Image
Did Brock Lesnar retire? Here’s what his WrestleMania 42 gesture means,https://timesofindia.indiatimes.com/sports/wwe/top-stories/did-brock-lesnar-retire-heres-what-his-wrestlemania-42-gesture-means/articleshow/130380348.cms,"Brock Lesnar. Image via: Rich Freeda/WWE via Getty Images

Brock Lesnar hints at WWE retirement

Brock Lesnar hints at retirement. Image via: WWE

Oba Femi defeated Brock Lesnar in WrestleMania 42



Brock Lesnar's WWE legacy



Watch Brock Lesnar's WWE Debut Brock Lesnar's WWE Debut

Brock Lesnar will forever be counted among the greats, as he had a stellar resume and an astonishing career in the promotion. Of course, nothing lasts forever, and things go on. After his loss to Oba Femi, it appears that he is all set to say goodbye to his wrestling career.Lesnar showed his rare side; he appeared to be in tears and with a heavy heart. Certainly, it was a rare sight for any WWE fan. Fans inside Allegiant Stadium watched closely as one of WWE’s most dominant figures stood still, almost reflective, before making a gesture that instantly shifted the mood in the arena.It didn’t come with a speech or a formal announcement. Instead, it came through silence, body language, and a series of actions that longtime viewers recognize all too well.The moment arrived right after his defeat to Oba Femi. Brock Lesnar sat up, stared ahead, then slowly removed his gloves. A pause followed. Then the boots came off. He placed both in the center of the ring, kissed the mat, and embraced Paul Heyman. The crowd responded with a mix of shock and appreciation as Lesnar waved before walking away.Ariel Helwani captured the emotion of the scene: “An emotional Brock Lesnar has removed his gloves and shoes after losing to Oba Femi at Mania.He put them in the middle of the ring and waved to the crowd. And then a big hug with his long-time friend, Paul Heyman. Is this really it? Sure seemed that way.”Even within the industry, the reaction was immediate. Kurt Angle wrote, “Love you my brother. There will only be one like you. Enjoy retirement Brock.” Mark Kaboly added, “Brock Lesnar sure doesn't seem to be a guy who will come back for one more match. This one will be talked about for ages. #wrestlemania”Still, WWE has not confirmed anything officially.The match itself told a surprising story. Oba Femi controlled long stretches and absorbed Lesnar’s signature offense, including the F5. That alone raised eyebrows. The finish came when Femi delivered a chokeslam followed by a powerful Fall From Grace to secure a decisive pin.Reports suggest Lesnar personally chose Femi as his opponent months ago, which adds another layer to the result. If this was meant to pass the torch, it did so in a dramatic way. Still, the one-sided nature of the finish left some questioning whether a legend like Lesnar deserved a more competitive farewell.Michael Cole hinted during commentary that this “could probably be goodbye,” though he stopped short of confirming anything.Lesnar debuted in 2002 and quickly became the youngest WWE Champion of his time. Across multiple runs, he captured world titles, won Royal Rumbles, and headlined WrestleMania on five occasions.His career stretched beyond WWE as well. A run in the UFC brought him the heavyweight title, adding to his already rare résumé. In 2014, he delivered one of wrestling’s most shocking moments by ending The Undertaker’s undefeated WrestleMania streak.Yet, away from the spotlight, Lesnar often kept things simple. “For me, none of my championships or none of my accolades, they all mean nothing, boys,” he once said. “My kids are my legacy.”That perspective now feels more relevant than ever as questions swirl about his future.",Brock lesnar lost to oba femi at wrestlemania 42. Lesnar appeared to be in tears and with a heavy heart. He removed his gloves and shoes and embraced paul heyman. Wwe has not confirmed anything officially about lesnar's future.,"https://static.toiimg.com/thumb/msid-130380358,width-1280,height-720,imgsize-52978,resizemode-6,overlay-toi_sw,pt-32,y_pad-600/photo.jpg"
"Vaibhav Sooryavanshi: 'Jitni der crease par hoon, match chheen sakta hoon': Vaibhav Sooryavanshi's bold warning to rivals - WATCH",https://timesofindia.indiatimes.com/sports/cricket/ipl/ipl-2026/jitni-der-crease-par-hoon-match-chheen-sakta-hoon-vaibhav-sooryavanshis-bold-warning-to-rivals-watch/articleshow/130380446.cms,"Vaibhav Sooryavanshi (Image credit: BCCI/IPL)

Watch Bombay Sport Exchange: Munaf Patel on Gautam Gambhir, Virat vs Bumrah & Indian bowling. Bombay Sport Exchange: Munaf Patel on Gautam Gambhir, Virat vs Bumrah & Indian bowling.

NEW DELHI: See the ball and launch it over the ropes - that’s the mantra young batting sensation Vaibhav Sooryavanshi follows whenever he is at the crease. After setting the Under-19 World Cup on fire, where he scored a blazing 175 in the final to power India to the title win earlier this year, Sooryavanshi is now carrying on his fiery form in the IPL 2026.In IPL 2026, the 15-year-old from Samastipur, Bihar, is doing what he does best - sending bowlers on a leather hunt with his power-hitting.Sooryavanshi is Rajasthan Royals ’ highest run-getter in IPL 2026 so far, scoring 246 runs in 6 matches at an average of 41.00 and a breathtaking strike rate of 236.54.In fact, Sooryavanshi himself confessed in an interview that if he stays at the crease for long, he can take the game away from the opposition.""Main jitni der bhi ground pe hoon, utni der mein dominate karke agar khelu, to match unke haath se chheen sakta hoon [For whatever duration I am on the ground, as long as I am using my skills, dominate and play, I can snatch the match from opponents’ hands],"" Sooryavanshi said on Doordarshan.""Maine apne father se bhi baat ki - hamesha bola ki mera aadha dream poora ho gaya hai, aadha abhi baaki hai. Senior level par World Cup khelna har player ka ek hi dream hota hai - India ke liye khelna aur jeetna.Abhi mera poora focus isi par hai ki senior India ke liye jitna ho sake utna contribute karun [I also spoke to my father. He said I have fulfilled half of his dream, but half is still left, I need to play in the World Cup for the senior Indian team. Of course, every player shares the same dream: to play for the seniors and win for their country, India. That is my focus for India],"" he said.In 13 IPL matches so far in his career, he has scored 498 runs at an average of 38.30, with a strike rate of 220.35, including a century and three fifties. He has smashed 42 fours and 44 sixes off 226 balls.Sooryavanshi also drew praise from former India cricketer Irfan Pathan, who called him a ""special player"" with a bright future ahead.He added that the youngster has the potential to stay at the top level for many years if he continues developing at this pace and temperament.""The theory of Vaibhav Suryavanshi needing big-name bowlers in the opposition is proving true again ;) This kid is a special player with many years at the top level ahead of him,"" Pathan wrote in an X post.","Sooryavanshi is rajasthan royals’ highest run-getter in ipl 2026 so far. He has scored 246 runs in 6 matches at an average of 41.00 and a strike rate of 236.54. Former india cricketer irfan pathan called him a ""special player"" with a bright future.","https://static.toiimg.com/thumb/msid-130380441,width-1280,height-720,imgsize-36598,resizemode-6,overlay-toi_sw,pt-32,y_pad-600/photo.jpg"
Afghanistan's Rashid Khan was offered Indian citizenship by 'high-ranking official'; here's how he responded,https://timesofindia.indiatimes.com/sports/cricket/ipl/ipl-2026/afghanistans-rashid-khan-was-offered-indian-citizenship-by-high-ranking-official-heres-how-he-responded/articleshow/130375422.cms,"Rashid Khan

Rashid Khan: From Streets to Stardom

Watch Bombay Sport Exchange: Munaf Patel on Gautam Gambhir, Virat vs Bumrah & Indian bowling. Bombay Sport Exchange: Munaf Patel on Gautam Gambhir, Virat vs Bumrah & Indian bowling.

Rashid Khan was approached by two countries, including India, with offers of citizenship and a chance to represent them, but he turned them down and chose to continue playing for Afghanistan, according to a new book.In, set to be released on Monday, Rashid told author Mohammad Haand Jafar that both India and Australia made such offers.""I received such offers (citizenship and playing) from both Australia and India. But I told them, ‘If I don’t play for my country, I won’t play for any other country either,"" Khan is quoted as saying in the book, news agency PTI reported.While he did not go into details about the Australian offer, the 27-year-old described the Indian approach during the 2023 IPL season.Rashid, who plays in the IPL for Gujarat Titans, said a team official told him that a “high-ranking official from the Indian Cricket Board” wanted to meet him.""I went over and greeted him. We started talking, and he said: ‘The situation in your country (Afghanistan) is very bad. Come stay in India. We will give you Indian documents, live here, play cricket here.’ I was surprised by what he was saying and didn't know how to respond.But I smiled and said, ‘Thank you very much. I am playing for my country, Afghanistan,'"" Khan said.Rashid’s stance on representing Afghanistan has come up earlier as well.As mentioned in the book, during the 2018 IPL, while playing for Sunrisers Hyderabad against Kolkata Knight Riders, he delivered an all-round performance, scoring 34 off 10 balls and taking three wickets.The performance led to social media posts in India asking the government to grant him citizenship, with users tagging then External Affairs Minister Sushma Swaraj.Responding to those posts, Swaraj tweeted: “I saw all your tweets. But citizenship matters are dealt with by the Ministry of Home Affairs.”The issue also drew a reaction from former Afghan President Ashraf Ghani, who said Rashid was a matter of national pride and would not be given to another country.Rashid later thanked him and said he would continue to represent Afghanistan.The book follows Rashid’s journey from Nangarhar to international cricket. It covers how he missed out on an Afghanistan U-19 trial before becoming one of the country’s leading players and later being named the ICC’s Player of the Decade in 2020.","Rashid khan says he was offered citizenship and a chance to play for india and australia. But he chose to continue playing for afghanistan, according to a new book. The 27-year-old was named the icc’s player of the decade in 2020.","https://static.toiimg.com/thumb/msid-130375815,width-1280,height-720,imgsize-35522,resizemode-6,overlay-toi_sw,pt-32,y_pad-600/photo.jpg"
"Brock Lesnar: WWE WrestleMania 42 Night 2 Results & Highlights: Roman Reigns wins World title after 2 years, Brock Lesnar signals retirement, and more",https://timesofindia.indiatimes.com/sports/wwe/top-stories/wwe-wrestlemania-42-night-2-results-highlights-roman-reigns-wins-world-title-after-2-years-brock-lesnar-signals-retirement-and-more/articleshow/130380420.cms,"Image via WWE

Brock Lesnar vs. Oba Femi

Six-Pack Challenge Ladder Match



Sami Zayn vs. Trick Williams

""The Demon"" Finn Balor vs. Dominik Mysterio



Jade Cargill vs. Rhea Ripley

Roman Reigns vs. CM Punk

WrestleMania 42 was back in the Allegiant Stadium for the second night of The Show of Shows. The event kicked off with John Cena once again welcoming the audience, and then a huge collision between two dominant forces. Following that, the show saw some classic in-ring showdowns and moments. Finally, WrestleMania Sunday was capped off with the main event showdown that saw Roman Reigns defeat CM Punk and become the World Champion after two years.This was the opening match for WrestleMania Sunday. Brock Lesnar and Oba Femi clashed in a major match. Despite being a newcomer, Femi showed fierceness against The Beast and did not back down. Following a hellicious in-ring encounter, the ending saw Femi counter the F-5 and take down Lesnar with the Fall From Grace to win the match. After that, Lesnar left his boots and gloves in the ring and shared an emotional moment with Paul Heyman, hinting at retirement.Penta defended his WWE Intercontinental title against Rey Mysterio, JD McDonagh, Rusev, Je'Von Evans, and Dragon Lee. It was a highly classic ladder match that saw jaw-dropping spots, feats, and moves executed by all superstars.In the final moments, Penta hit the Destroyer on Evans and climbed the ladder to grab his title.Sami Zayn defended his WWE United States Championship against Trick Williams, with Lil Hatchy. The new rising star and the Underdog from the Underground delivered an exceptional match. It came to a close after Williams countered Zayn in the corner and hit the Trick Shot for the win.Finn Balor brought back his alter-ego, The Demon King, to battle Dominik Mysterio in a Street Fight. Balor clearly handed the upper hand throughout the match and ended with a victory after delivering a Coup de Grâce through the table on Mysterio.Rhea Ripley challenged Jade Cargill for the WWE Women's Championship. The match saw interference from Cargill's allies, B-Fab and Michin, but was neutralized by Ripley's ally, IYO Sky. In the end, Ripley snuck out of a Jaded attempt and planted Cargill with the Riptide to win the match and become the new champion.The main event of the night saw CM Punk defend his World Heavyweight Championship against Roman Reigns. It was one of the most captivating main events in WrestleMania history. Both men inflicted major damage on each other as the World title hung in the balance. The final moments of the showdown saw Reigns delivering multiple spears on Punk and scoring the pinfall to become the new World Champion.Also read: Did Brock Lesnar retire? Here’s what his WrestleMania 42 gesture means",Wrestlemania 42 was back in the allegiant stadium for the second night of the show of shows. Brock lesnar and oba femi clashed in a major match. Sami zayn defended his wwe united states championship against trick williams. Finn balor brought back his alter-ego to battle dominik mysterio in a street fight.,"https://static.toiimg.com/thumb/msid-130380554,width-1280,height-720,imgsize-2148128,resizemode-6,overlay-toi_sw,pt-32,y_pad-600/photo.jpg"
Kl Rahul: KL Rahul's long-standing record shattered! Priyansh Arya creates history in style,https://timesofindia.indiatimes.com/sports/cricket/ipl/ipl-2026/ipl-2026-priyansh-arya-breaks-kl-rahuls-massive-ipl-record/articleshow/130380570.cms,"Priyansh Arya and KL Rahul (Image credit: BCCI/IPL)

Watch Bombay Sport Exchange: Munaf Patel on Gautam Gambhir, Virat vs Bumrah & Indian bowling. Bombay Sport Exchange: Munaf Patel on Gautam Gambhir, Virat vs Bumrah & Indian bowling.

Priyansh Arya

KL Rahul

NEW DELHI: Star young batter Priyansh Arya seems to love clearing the ropes - and he does it against any bowling attack. During the IPL 2026 clash against Lucknow Super Giants, Arya unleashed brutal hitting, smashing 93 off just 37 balls to power Punjab Kings to a mammoth 254/7. He was well supported by fellow left-hander Cooper Connolly, who struck 87 off 46 deliveries.At a packed Maharaja Yadavindra Singh International Cricket Stadium, PBKS defended their season-high total of 254/7 by restricting LSG to 200/5. With this win, the in-form Punjab Kings extended their strong run to stay at the top of the points table, while LSG slumped to their third straight defeat and dropped to eighth place.Arya, who hammered four boundaries and nine sixes, tore into the LSG bowlers from the outset and raced to his fifty in just 19 deliveries with relentless strokeplay.In the process, he went past KL Rahul for the most fifties scored in under 20 balls in the franchise’s history. Arya’s 93 came at a stunning strike rate of 251.35, and he looked set for a well-deserved century before falling seven runs short - caught at long-off by Mitchell Marsh off Manimaran Siddharth.Arya was adjudged Player of the Match for his explosive knock.He now has three fifties in under 20 balls - including a 19-ball half-century against LSG this season, a 16-ball effort against Sunrisers Hyderabad, and another 19-ball fifty against Chennai Super Kings last season.Rahul, in comparison, had recorded a 14-ball half-century against Delhi Capitals in 2018 and a 19-ball fifty against Chennai Super Kings in 2019.In five innings for PBKS this season, Arya has scored 211 runs at an average of 42.20 and a strike rate of 248.23, including two fifties. He has smashed 14 fours and 20 sixes so far.Overall, in 22 matches for Punjab Kings, Arya has accumulated 686 runs at an average of 31.18 and a strike rate of 196.00, with a century and four fifties.Batters with multiple 50+ scores in under 20 balls for Punjab Kings in IPL history:- 3(vs LSG Today | vs SRH 2026 | vs CSK 2025)- 2(vs CSK 2019 | vs DD 2018)",Priyansh arya smashed 93 off just 37 balls to power punjab kings to 254/7. Arya went past kl rahul for the most fifties scored in under 20 balls in the franchise’s history. He was adjudged player of the match for his explosive knock.,"https://static.toiimg.com/thumb/msid-130380596,width-1280,height-720,imgsize-70120,resizemode-6,overlay-toi_sw,pt-32,y_pad-600/photo.jpg"
'My bat is the prize': Shreyas Iyer reveals dressing-room contest behind Punjab Kings run-fest,https://timesofindia.indiatimes.com/sports/cricket/ipl/ipl-2026/my-bat-is-the-prize-shreyas-iyer-reveals-dressing-room-contest-behind-punjab-kings-run-fest/articleshow/130380271.cms,"Image credit: BCCI/IPL

Watch Bombay Sport Exchange: Munaf Patel on Gautam Gambhir, Virat vs Bumrah & Indian bowling. Bombay Sport Exchange: Munaf Patel on Gautam Gambhir, Virat vs Bumrah & Indian bowling.

NEW DELHI: Punjab Kings captain Shreyas Iyer was all smiles when he came for the post-match presentation after his side registered a big 54-run win over Lucknow Super Giants in Mullanpur on Sunday. With this win, Punjab Kings jumped to the top of the table with 5 wins in 6 matches, 11 points, and a net run rate of +1.420.After the massive victory, Iyer revealed that a light-hearted six-hitting contest inside the dressing room has been the reason behind Punjab Kings' batting blitz.Devastating batters Priyansh Arya and Cooper Connolly made a mockery of the Lucknow Super Giants bowlers and powered their team to a mammoth 254/7 in 20 overs.Arya and Connolly smashed 93 and 87 respectively as PBKS posted 254/7 - the highest total of this IPL season. The duo added 182 runs in just 13.2 overs for a hugely entertaining second-wicket stand, taking PBKS past Royal Challengers Bengaluru’s 250/3 - the previous highest total this season.In reply, LSG managed 200/5 and suffered a 54-run defeat.""Exceptional partnership, some shots were jaw-dropping. Hitting fast bowlers off the back-foot straight.Composure in the middle overs was sensational,"" Iyer said during the post-match presentation.""Was talking with Cooper and Arya, said let's compete for the most no. of sixes. Prize is my bat, doesn't make sense but hope it'll make us happy. When you let players be, I think they just deliver. That's our mantra.""""I don't tell them how to go about their specific innings, they have their patterns set. Ricky Ponting motivates just before the game, I chip in, boys come in and deliver.""Punjab Kings will next face Delhi Capitals on April 25.",Shreyas iyer's punjab kings beat lucknow super giants by 54 runs. Priyansh arya and cooper connolly hit 93 and 87 respectively. Pbks posted 254/7 - the highest total of this ipl season. Iyer reveals light-hearted six-hitting contest inside dressing room.,"https://static.toiimg.com/thumb/msid-130380269,width-1280,height-720,imgsize-46080,resizemode-6,overlay-toi_sw,pt-32,y_pad-600/photo.jpg"
"WWE WrestleMania 42: List of winners, top performers, shocking moments, and more",https://timesofindia.indiatimes.com/sports/wwe/top-stories/wwe-wrestlemania-42-list-of-winners-top-performers-shocking-moments-and-more/articleshow/130380652.cms,"Image via WWE

WWE WrestleMania 42 list of winners:

Night 1:

Randy Orton vs. Cody Rhodes (c)- Singles match for the Undisputed WWE Championship

Winner: Cody Rhodes

Winner: Liv Morgan vs. Stephanie Vaquer (c)-Singles match for the WWE Women’s World Championship

Winner: Liv Morgan

Winner: Seth Rollins vs. Gunther:

Winner: Gunther

Winner: The Vision (Logan Paul & Austin Theory) & IShowSpeed vs. The Usos & LA Knight- Six-man tag team match

Winners: The Usos and LA Knight

Winners: The Irresistible Forces (Nia Jax and Lash Legend) (c) vs. Charlotte Flair and Alexa Bliss vs. Bayley and Lyra Valkyria vs. Brie Bella & Paige- Fatal four-way tag team match for the WWE Women's Tag Team Championship

Winners: Paige and Brie Bella

Winners: AJ Lee (c) vs. Becky Lynch- Singles match for the WWE Women's Intercontinental Championship

Winner: Becky Lynch

Winner: Drew McIntyre vs. Jacob Fatu- Unsanctioned match

Winner: Jacob Fatu

Night 2:

CM Punk vs. Roman Reigns (c)- Singles match for the WWE World Heavyweight Championship

Winner: Roman Reigns

Winner: Rhea Ripley vs. Jade Cargill (c)-Singles match for the WWE Women’s Championship

Winner: Rhea Ripley

Winner: Brock Lesnar vs. Oba Femi

Winner: Oba Femi

Winner: Penta (c) vs. Je'Von Evans vs. Dragon Lee vs. JD McDonagh vs. Rusev vs. Rey Mysterio-Six-pack ladder match for the WWE Intercontinental Championship

Winner: Penta

Winner: Sami Zayn (c) vs. Trick Williams- Singles match for the WWE United States Championship

Winner: Trick Williams

Winner: ""The Demon"" Finn Bálor vs. Dominik Mysterio- Street Fight

Winner: Finn Balor

Who were the top performers of WrestleMania 42?

Oba Femi: The young and dominant upstart scored one of the biggest wins of his WWE career by defeating a legend like Brock Lesnar on The Grandest Stage of Them All.

The young and dominant upstart scored one of the biggest wins of his WWE career by defeating a legend like Brock Lesnar on The Grandest Stage of Them All. Roman Reigns: The OTC reigned supreme in the main event of WrestleMania 42 Sunday and claimed the World title once again after two years.

The OTC reigned supreme in the main event of WrestleMania 42 Sunday and claimed the World title once again after two years. Je'Von Evans: The 21-year-old star displayed excellent athleticism in his ladder match, despite not emerging as the winner.

The 21-year-old star displayed excellent athleticism in his ladder match, despite not emerging as the winner. Seth Rollins: The Visionary showed incredible in-ring acumen and feats during his match against Gunther.

What were the shocking moments from WrestleMania 42?

Paige's return: She made her return to WWE after four years to replace the injured Nikki Bella and team up with Brie Bella.

She made her return to WWE after four years to replace the injured Nikki Bella and team up with Brie Bella. Bron Breakker's return: The Wolf Dog showed up and speared Seth Rollins in the final moments of his match against Gunther.

The Wolf Dog showed up and speared Seth Rollins in the final moments of his match against Gunther. Oba Femi's victory: The former NXT Champion defeated Brock Lesnar in the opening match of WrestleMania 42 Sunday.

The former NXT Champion defeated Brock Lesnar in the opening match of WrestleMania 42 Sunday. Brock Lesnar hints at retirement: After Brock Lesnar lost, he left his gloves and boots in the ring, signaling the end of his career.

What happened in the main event matches of both nights of WrestleMania 42?

WrestleMania 42 presented a two-night blockbuster show from the Allegiant Stadium in Las Vegas, Nevada. Officiated by John Cena, WWE put up stellar matches for their biggest show of the year and saw shocking returns and moments, making it a grand spectacle for the Stamford-based company.WrestleMania Saturday main event saw Cody Rhodes retain his Undisputed WWE Championship against Randy Orton. However, The Viper stood tall in the end after he delivered a punt kick to Rhodes to close Night 1 of the show. In the main event of WrestleMania Sunday, Roman Reigns ended the title reign of CM Punk and became the new World Heavyweight Champion.Also read: Did Brock Lesnar retire? Here’s what his WrestleMania 42 gesture means",Randy orton vs. cody rhodes (c)- singles match for the undisputed wwe championship. Liv morgan vs. stephanie vaquer (c) for the wwe women’s world championship. Brock lesnar vs. oba femi for wwe world heavyweight championship. Rhea ripley vs. jade cargill for wwe women's championship.,"https://static.toiimg.com/thumb/msid-130381031,width-1280,height-720,imgsize-2934724,resizemode-6,overlay-toi_sw,pt-32,y_pad-600/photo.jpg"
