Article Title,Article Link,Article Text,Article Summary,Article Image
Ashok Sharma: India's 150kmph bowling hope still lives in village without roads - Inside Ashok Sharma's dream,https://timesofindia.indiatimes.com/sports/cricket/ipl/ipl-2026/indias-150kmph-bowling-hope-still-lives-in-village-without-roads-inside-ashok-sharmas-dream/articleshow/130364699.cms,"Ashok Sharma of Gujarat Titans celebrates after taking a wicket (AP)

Unki Thar nikal jaati hai, aapki bhi nikal jayegi

Watch Kagiso Rabada press conference: On Shubman Gill, GT win and net run-rate Kagiso Rabada press conference: On Shubman Gill, GT win and net run-rate

Sharam aati hai logon ko bulaane mein. Raasta hi nahi hai

Ashok Sharma's father Nathulal Sharma (left) and his elder brother Akshay Sharma (Photo Credit: Pratyush Raj)

Sukoon hai idhar

Kuch bhi ho jaaye, apna gaon nahi chhodenge

Ashok loves it here. He wakes up at 5, goes to the ground for running, trains for three hours, comes back at 8 and then sleeps again. He has become very conscious of his diet, especially after the knee injury he suffered during his stint with KKR. Akshay Sharma

Gehun ki katai chal rahi hai

Ashok Sharma's father Nathulal Sharma with his electric scooter gifted by his son. (Photo Courtesy: Pratyush Raj)

chaanch

ye Akshay aur Ashok ko bhi kaafi pasand hai, ghanton cricket khelne ke baad

I used to enjoy intimidating batters. It gave me a sense of satisfaction, and when they got scared, it felt like I had achieved something. Akshay Sharma

Akshay with his daughter Raja in her lap, while his father Nathulal Sharma watches on (Photo Courtesy: Pratyush Raj)

Ashok was always breaking things. He broke so many items. Because of him, Akshay used to get beaten up. Lali Devi

Nahi

Dar lagta hai inko

Jaroor jayenge plane mein ek din

Ashok Sharma (left) with his elder brother Akshay Sharma (Special Arrangement)

Agar Akshay shaant hai toh Ashok shaitaan

Tod phod poore din bas. Kitna samaan toda hai usne. Uske chakkar mein Akshay ki pitai ho jaati thi

Ek baar toh papa ne belt se bhi peeta tha iske chakkar mein

Ashok Sharma's mother Lali Devi (Photo Courtesy: Pratyush Raj)

Ashok Sharma's dream car Thar outside his home in Rampura.

In 2023, when he was with KKR, towards the end of the season I asked him what he wanted for his birthday. He immediately said, I want a Thar. If you do not buy it, I will not come home. Akshay Sharma

Ashok Sharma with his late coach Vivek Yadav (Ashok Sharma | Instagram)

Rampura (Jaipur): ""(His car gets through, yours will too),"" a young boy quips when asked about the location of India's new pace sensation Ashok Sharma's house.Ashok Sharma may be making a lot of noise with his pace in the ongoing Indian Premier League (IPL), but reaching his village, around 35 km from Rajasthan's capital Jaipur, is an uphill task. There is a sudden exit on the Delhi-Mumbai Expressway and a few kilometres down that dusty lane, after carefully navigating the hastily operated railway crossings, the road disappears. That is when you understand the true meaning of ""tighten your seatbelts"" and the divide between the two Indias.(I feel embarrassed to invite people over. ""There isn’t even a proper road,"" says Akshay Sharma, Ashok's elder brother, while welcoming us to his home. The location pin ends a few hundred metres before the residence, requiring crafty maneuvering on the narrow lanes with several hairpin turns.Ashok's village reflects a true sense of rural India. There are double-storey houses, coolers remain a prized asset, and proper roads have not yet reached the village.Yet, there is a sense of peace, which Akshay says is the reason the family has chosen not to leave their roots.(It is peaceful here). Ashok also loves it. Everything started from here, whether it was me playing cricket or him taking big strides. Ashok always says, '' (Whatever happens, we will never leave our ancestral village),"" says Akshay, while dusting off the charpai under one of the two neem trees in front of their house. The front yard still remains a comfortable space in the Sharma household, offering ample space to house two 'charpaais' and host guests in shade, with the birds offering a soothing background score.It is rare to see a present-day Indian cricketer, who has already played Ranji Trophy and the IPL, still living in his village. The amount of money Indian cricketers earn, especially with the advent of the IPL, is massive, and a luxurious lifestyle often follows. However, Ashok Sharma believes in simplicity and focuses entirely on his performance. Akshay says his brother is not concerned about such luxuries.""He loves it here. He wakes up at 5, goes to the ground for running, trains for three hours, comes back at 8 and then sleeps again. He has become very conscious of his diet, especially after the knee injury he suffered during his stint with KKR. He always says that he would exchange the lavish five-star life for this any day. His diet is also simple. He loves homemade food. Diet, recovery, and sleep are the three most important parts of his training routine now,"" he adds.Early in the chat, Ashok and Akshay's father, Nathulal Sharma, joins the conversation from his electric scooter, a gift from his younger son. Wearing a torn shirt and mud-stained trousers, he had just returned from a shift in the fields and caught his breath before settling into the charpai. ""(The wheat harvest is underway),"" he says with a smile.In the meantime, Lali Devi, Ashok's mother, brings a glass offor everyone. The traditional steel glass, the drink's thick texture, and the right amount of home spices made it refreshing at the first sip. Lali Devi had a smile on her face when the drink was gulped within seconds and she offered a refill before adding, """" (This is something Akshay and Ashok also really like, especially after playing cricket for hours).Ashok has always looked up to Akshay as his inspiration. Akshay sowed the seed of fast bowling in his younger brother, starting with the satisfaction they received in instilling fear in the batters heads. What started as fun in the nearby fields soon became an obsession to set the speed gun on fire.""We both were quick. Batters ko daraane mein maza aata tha, ek tasalli milti thi, aur jab wo darte the toh lagta tha ki kuch kiya hai (I used to enjoy intimidating batters. It gave me a sense of satisfaction, and when they got scared, it felt like I had achieved something),"" recalls Akshay.Fast bowling came naturally to the Sharma brothers. Growing up, they had heard stories of their uncle, Ram Dayal Sharma, a fearsome fast bowler in the village. He still lives in the opposite house and would be proud to see his nephew carry on the intimidating tradition.""I have not even seen him bowl. He quit cricket long ago, but we have heard he was very quick. He used to get special invitations to play in nearby villages. He had long hair, just like MS Dhoni,"" he says.Nathulal Sharma, sitting nearby and keeping an eye on his two-year-old granddaughter Raja, lit up at the mention. ""My brother was quick. These two have followed in his footsteps,"" he adds.For the Sharma family, Ashok is living the unfulfilled dreams of his uncle and brother. On March 30, the family learned that Ashok, who had previously been with Kolkata Knight Riders and Rajasthan Royals, would make his IPL debut for Gujarat Titans.Excited, the family drove to Chandigarh, around 450 km from their village, and reached just in time to watch Ashok play live for the first time.""We have been to the stadium before as well. He had given us passes when he was with Rajasthan Royals, but this felt different,"" says Akshay.A day later, Ashok invited his family to Ahmedabad for Gujarat's second match. Instead of taking a flight, they chose to travel by train, a journey of nearly 10 hours from Jaipur.When asked if he had ever travelled by flight, Nathulal Sharma gently nods and says, ""(not yet)."" Akshay jokingly adds, ""(He is scared of flying)."" Lali Devi, who has been listening quietly, joins in and says, ""(We will travel by flight someday).""For the village, Ashok has become a superstar. Anyone you ask proudly directs you to his house, because he is one of their own. But for Nathulal and Lali Devi, he remains the mischievous child, and everyone has a an almost similar story.Nathulal Sharma says, ""(If Akshay is calm, then Ashok is mischievous).""Akshay quickly adds, ""He used to bunk school. He always came up with some strange excuse to leave early.""Lali Devi further adds, ""(He was always breaking things. He broke so many items. Because of him, Akshay used to get beaten up).""Akshay smiles and adds, ""(Once, Papa even beat me with a belt because of him).""Despite all his mischief, Ashok, the youngest sibling, remains the family's favourite child.""In 2023, when he was with KKR, towards the end of the season I asked him what he wanted for his birthday. He immediately said, 'Thar chahiye. Nahi doge toh ghar nahi aaunga' (I want a Thar. If you do not buy it, I will not come home),"" laughs Akshay.Ashok's dream car now stands covered outside their house and is a major attraction for the children in the village. Considering the state of the roads in the village, an off-road capable vehicle was a smart choice.The family remains grateful to Ashok's mentor Vivek Yadav, a former Ranji Trophy cricketer, who took him under his wing and was immediately impressed by his pace.""In 2019, when he was 17, I took him to the Aravali Cricket Academy, where Vivek bhaiya was impressed by his pace. Ashok was erratic, but he directly placed him in the senior team. He asked me to let Ashok stay at the academy, and it helped him become a better cricketer,"" says Akshay.However, the Covid pandemic changed everything. The lockdown forced Ashok to return home, where the road in front of his house became his training ground. The biggest blow came on May 5, 2021, when Vivek Yadav, a two-time Ranji Trophy champion with Rajasthan, passed away due to complications.""He did not speak for weeks. We thought the dream was over. No one knew us and we were clueless. But Vikas bhaiya called and told us that he would fulfil his brother's dream, and the academy would do everything to help him reach his potential,"" recalls Akshay.After being picked by Gujarat Titans for Rs 90 lakh last year, Ashok had shared an emotional message about his mentor.""It was the last time I cried. I thought my career was over. He wanted me to play for India. He used to say, 'You will play for India very soon, you will play top-level cricket very soon',"" Ashok had said.It is going to be a long road for Ashok to achieve that dream. But the 23-year-old fast bowler, definitely knows the importance of patience and perseverance, and that he is just off the blocks.At the Aravali Cricket Academy, coaches Vikas Yadav, Jagminder Singh, and others remain hopeful that Ashok will fulfil Vivek Yadav's dream. Back home, Akshay, who gave up cricket for his brother, hopes that with Ashok's success, a proper road will finally reach Rampura, a village which might end India's prolonged wait for an out-and-out fast bowler.","Ashok sharma's village is 35 km from rajasthan's capital jaipur. He wakes up at 5, goes to the ground for running, trains for three hours, comes back at 8 and then sleeps again. He has become very conscious of his diet, especially after the knee injury he suffered during his stint with kkr.","https://static.toiimg.com/thumb/msid-130364726,width-1280,height-720,imgsize-27324,resizemode-6,overlay-toi_sw,pt-32,y_pad-600/photo.jpg"
Aryna Sabalenka fiancé Georgios Frangulis addresses critics questioning his presence during her tennis matches,https://timesofindia.indiatimes.com/sports/international-sports/aryna-sabalenka-fianc-georgios-frangulis-addresses-critics-questioning-his-presence-during-her-tennis-matches/articleshow/130361445.cms,"Aryna Sabalenka and Georgios Frangulis (Image Via Getty)

Money Buys Happiness podcast



Aryna Sabalenka and Georgios Frangulis relationship and response to criticism explained

Esquire

There has been a lot of talk around Aryna Sabalenka and her fiancé Georgios Frangulis. Many fans have noticed him sitting in the stands during her matches, and not everyone has been supportive. Some people even questioned how he manages his business while attending so many games. Now, Georgios has finally responded, and his message was very direct.In a video shared by theon Instagram, Georgios made it clear that he is not bothered by the criticism. He spoke openly about his relationship and how they support each other. At the same time, he also pushed back at people who keep judging his choices and his presence during Sabalenka’s matches.Aryna Sabalenka and Georgios Frangulis started dating in 2024, and earlier this year, they announced their engagement. Since then, Georgios has often been seen in her player box during big matches. While many fans enjoy seeing that support, others have raised questions about his work and time.Georgios addressed this directly in his statement. He said, “For me to have someone that I love that trusts me and looks up to me.I can teach and learn from, with my fiancé. With Aryna it’s all upside. I don’t see any downside.”He then spoke about the criticism he receives and how he handles his work. He explained that watching matches does not stop him from managing his responsibilities. He said, “Believe me I get criticism. How can he run the company. He’s always watching tennis. You see me on TV and I am watching tennis. It’s a two-hour match. Like I was doing a meeting before I’m gonna do another after. Not your business what I am doing.”Georgios also praised Sabalenka’s success and their shared understanding. He added, “She’s super accomplished. We can enjoy each other’s success, help each other’s failures.”On the other side, Sabalenka has also spoken about how important this relationship is for her. In an interview with, she shared a simple lesson she has learned. She said, “You see that each area of life takes the same dedication, discipline, and hard work.”While all this is happening off the court, Sabalenka’s form on the court has been strong. She started the season by winning the Brisbane International and then reached the final of the Australian Open. She later completed the Sunshine Double by winning both Indian Wells and the Miami Open, beating top players like Elena Rybakina and Coco Gauff.She was set to play at the Stuttgart Open but pulled out due to an injury picked up in Miami. Even so, both her performance and her personal life continue to stay in the spotlight.","Aryna sabalenka and georgios frangulis started dating in 2024. Georgios has often been seen in her player box during big matches. While many fans enjoy seeing that support, others have raised questions about his work and time.","https://static.toiimg.com/thumb/msid-130361439,width-1280,height-720,imgsize-39320,resizemode-6,overlay-toi_sw,pt-32,y_pad-600/photo.jpg"
Connor McDavid’s wife Lauren Kyle celebrates emotional milestone as Oilers captain gears up for electrifying Stanley Cup playoff run,https://timesofindia.indiatimes.com/sports/nhl/news/connor-mcdavids-wife-lauren-kyle-celebrates-emotional-milestone-as-oilers-captain-gears-up-for-electrifying-stanley-cup-playoff-run/articleshow/130364134.cms,"Connor McDavid’s wife (Getty Images)

Connor McDavid’s wife reacts to milestone ahead of Oilers’ high-stakes playoff campaign

The Edmonton Oilers closed their regular season with purpose, delivering a 6-1 win over the Vancouver Canucks that did more than pad the standings. It set a tone. At the center of it, Connor McDavid dictated play with four assists, wrapping up another elite campaign. The result secured second place in the Pacific Division and home-ice advantage for the opening round. Off the ice, the moment carried a personal note as Lauren Kyle shared her pride publicly.Connor McDavid’s final outing wasn’t just productive. It felt controlled, almost routine for a player operating at this level. His four assists helped power an early surge, including a standout opening period where Matt Savoie recorded his first NHL hat trick. The Oilers never looked back from there.After the game, McDavid didn’t overstate it, but he made it clear the win mattered beyond the scoreboard. “It was an important one. We wanted to start here at home and give ourselves the best chance in the first round. The start was great,” he said.That clarity extended to his line’s development. There has been a noticeable shift in chemistry, especially with Savoie and Zach Hyman alongside him. “(Me and Savoie are) building something a little bit, playing together for a little while now.We’re starting to understand each other a little bit. (Zach Hyman) came in and did exactly what he does, forechecks hard and fills that net-front spot, which frees up a lot of space for us. ”Numbers back up the impact. McDavid secured the Art Ross Trophy with 138 points, his sixth time leading the league. That places him alongside Mario Lemieux and Gordie Howe, trailing only Wayne Gretzky in all-time scoring titles. It’s rare company, and it adds weight to what already feels like a defining stretch in his career.Away from the numbers, Lauren Kyle’s posts from Rogers Place gave a glimpse into the moment. A shot of the scoreboard came with a simple line, “Off to the playoffs!!” Another message, just as direct, read, “So proud of you.” It wasn’t elaborate, but it didn’t need to be. The context spoke for itself.Edmonton’s wider performance also offered encouragement. Ryan Nugent-Hopkins contributed offensively, while Colton Dach added a Gordie Howe hat trick. Cleaner puck movement and sharper finishing stood out, areas that had wavered at times earlier in the schedule.The focus now shifts quickly. A first-round matchup with the Anaheim Ducks begins April 20. McDavid’s form is a given at this point. The question is whether the rhythm building around him holds under playoff pressure.","Edmonton oilers beat vancouver canucks 6-1 to clinch second place in the pacific division. Connor mcdavid had four assists in the win, his sixth art ross trophy. His wife, lauren kyle, posted a message to her husband from rogers place.","https://static.toiimg.com/thumb/msid-130364144,width-1280,height-720,imgsize-46210,resizemode-6,overlay-toi_sw,pt-32,y_pad-600/photo.jpg"
India's next T20I captain? 'Self-aware' Shreyas Iyer breathing down Suryakumar's neck,https://timesofindia.indiatimes.com/sports/cricket/ipl/ipl-2026/indias-next-t20-captain-self-aware-shreyas-iyer-breathing-down-suryakumars-neck/articleshow/130364760.cms,"Shreyas Iyer (Image credit: AFP Photo)

Watch Ajinkya Rahane press conference: On another defeat, Cameron Green and more Ajinkya Rahane press conference: On another defeat, Cameron Green and more

Watch Bombay Sport Exchange: Munaf Patel on Gautam Gambhir, Virat vs Bumrah & Indian bowling. Bombay Sport Exchange: Munaf Patel on Gautam Gambhir, Virat vs Bumrah & Indian bowling.

Poll Who do you think has been the more impactful captain in IPL history? Gautam Gambhir Ricky Ponting Shreyas Iyer

NEW CHANDIGARH: Shreyas Iyer first tasted IPL captaincy in turbulent circumstances. In an awkward press conference midway through the 2018 season, flanked by head coach Ricky Ponting , Delhi Daredevils (now Delhi Capitals) stalwart Gautam Gambhir stood down owing to woeful form and the team’s embarrassing run. Gambhir announced Iyer as his successor.Iyer went on to blossom as a captain and a batter under Ponting at Capitals before moving to Kolkata Knight Riders in 2022, when the Delhi franchise shifted leadership to Rishabh Pant. He reunited with Gambhir at KKR in 2024 and guided the franchise to the IPL title. The triumph saw Gambhir graduate to India’s head coach within a month, and Iyer depart the franchise.Even as Gambhir went into overdrive to reshape India’s T20I setup, Iyer remained out of contention. Turbulence has followed his career despite sustained consistency. Now reunited with Ponting at Punjab Kings — both nursing scars from their Capitals exit — Iyer is stirring a campaign that could knock on the door of Gambhir’s champion T20 unit.On Sunday evening here, Iyer will come up against Pant, now leading Lucknow Super Giants and fighting an uphill battle to reclaim his India spot after being sidelined post the triumphant T20 World Cup campaign in 2024.But Iyer’s race is no longer against Pant. World Cup-winning captain Suryakumar Yadav ’s prolonged slump has triggered one of the trickiest phases for Gambhir and the selection committee.Sources told TOI that Iyer is the most obvious replacement for Surya if and when selectors decide to move on. His authority at No. 4 in T20 cricket is unmatched in Indian cricket at present. The selectors showed little leniency with Pant and Shubman Gill in the format. But conviction around Surya’s successor — particularly as captain — remains key.“Iyer last played a T20I in 2023. He has not been part of the current setup. It’s a big call to bring him back and hand him the captaincy straightaway,” a BCCI source told TOI. “The focus has shifted towards the 2027 ODI World Cup, which has given selectors breathing space to plan for a T20I leadership transition.”At Punjab Kings, Iyer has been branded the sarpanch. His swagger and carefree demeanour fit the aura. It stems from self-awareness. Bowling coach James Hopes, a Ponting mainstay since their Capitals days, has witnessed a flamboyant 23-year-old evolve into a 31-year-old leader in complete command.“He’s very aware of what his perceived weaknesses were over the years. He’s come into this season having really nailed them. When he got hurt in Australia (in Oct last year), he was starting to nailing them in international cricket as well,” Hopes said here on Saturday. “Once he finds his way back into the Indian team, you’ll see the batter he’s going to be for the rest of his career. Captaincy improves his batting,” Hopes added.Iyer has always been in a comfort zone around Ponting. As a captain, there’s no need for handholding anymore. “He was very young when he was captaining Delhi. He’s very well planned, but still follows his gut,” Hopes said.“Ricky and Shreyas work well together. When we get into our meetings, he’s the captain. He steps up and he’s got his own ideas, he’s willing to listen,” he added.Iyer is already the vice-captain of the ODI team. It’s about how the Indian team management and the selectors find a place for him in the T20 team.","Shreyas iyer first tasted ipl captaincy in turbulent circumstances. Delhi daredevils stalwart gautam gambhir stood down owing to woeful form. Iyer went on to blossom as a captain and a batter under ricky ponting. He’s very well planned, but still follows his gut,” hopes said. Iyer is already the vice-captain of the odi team.","https://static.toiimg.com/thumb/msid-130364776,width-1280,height-720,imgsize-34360,resizemode-6,overlay-toi_sw,pt-32,y_pad-600/photo.jpg"
