Article Title,Article Link,Article Text,Article Summary,Article Image
"Ipl 2026 Schedule: IPL 2026 schedule this week (April 6 to April 12): Full list of matches, dates, timings, venues and results",https://timesofindia.indiatimes.com/sports/cricket/ipl/top-stories/ipl-2026-schedule-this-week-6-12-april-full-list-of-matches-dates-timings-venues/articleshow/130051892.cms,"RCB and MI players

IPL 2026 schedule

this week (6-12 April):

Watch Devdutt Padikkal press conference: Chinnaswamy pitch, Tim David’s power & RCB’s batting strategy Devdutt Padikkal press conference: Chinnaswamy pitch, Tim David’s power & RCB’s batting strategy

Go Beyond The Boundary with our YouTube channel.

Full schedule of IPL 2026 this week (6-12 April): Matches, dates, timings, venues & results

Date Day Home Team Visiting Team Time (IST) Venue Result April 6 Monday KKR PBKS 7:30 PM Kolkata Washed out April 7 Tuesday RR MI 7:30 PM Guwahati RR win by 27 runs April 8 Wednesday DC GT 7:30 PM Delhi GT win by 1 run April 9 Thursday KKR LSG 7:30 PM Kolkata LSG win by 3 wickets April 10 Friday RR RCB 7:30 PM Guwahati RR win by 6 wickets April 11 Saturday PBKS SRH 3:30 PM New Chandigarh PBKS win by 6 wickets April 11 Saturday CSK DC 7:30 PM Chennai CSK win by 23 runs April 12 Sunday LSG GT 3:30 PM Lucknow GT win by 7 wickets April 12 Sunday MI RCB 7:30 PM Mumbai RCB win by 18 runs

After nine thrilling matches last week, a trend is beginning to emerge on which teams are on a roll and which are still struggling to settle into the new season. So far, 15 matches have been played in the new season of the IPL , and four teams have already set the early marker in the race for the playoffs.With four wins in four matches, Rajasthan Royals sit at the top of the points table. Punjab Kings are at second after two wins and a no result due to rain. They are followed by defending champions Royal Challengers Bengaluru, Delhi Capitals and Lucknow Super Giants, who have two wins each so far. Meanwhile, Chennai Super Kings and Kolkata Knight Riders are two winless teams in IPL 2026.With a win each, Sunrisers Hyderabad, Mumbai Indians, and Gujarat Titans have opened their account in the standings and will look to challenge the top four in coming fixtures.The ongoing IPL season has already witnessed multiple weather disruptions across the country. The KKR vs PBKS clash in Kolkata was washed out, while the RR vs MI encounter had to be curtailed to just 11 overs per side in which Rajasthan Royals outclassed Mumbai Indians by 27 runs. And on Wednesday, GT held their nerves to beat hosts DC by one run in a last-ball thriller.KKR lost their 3rd match in a row after Mukul Choudhary pulled off a record breaking chase for LSG in the last-ball thriller.Rajasthan Royals and Royal Challengers Bengaluru, face off in Guwahati on Friday.The weekend double-headers will see Punjab Kings take on Sunrisers Hyderabad and Chennai Super Kings face Delhi Capitals on Saturday, followed by Lucknow Super Giants vs Gujarat Titans and Mumbai Indians vs Royal Challengers Bengaluru on Sunday.There is likely to be plenty of shuffling in the points table this week.","Rajasthan royals and royal challengers bengaluru, face off in guwahati on friday. Chennai super kings and kolkata knight riders are two winless teams in ipl 2026. Sunrisers hyderabad, mumbai indians, and gujarat titans have opened their account in the standings.","https://static.toiimg.com/thumb/msid-130052075,width-1280,height-720,imgsize-83970,resizemode-6,overlay-toi_sw,pt-32,y_pad-600/photo.jpg"
"Will Anderson Jr: NFL news: Will Anderson Jr signs $150 million extension with Houston Texans, becoming highest paid non QB",https://timesofindia.indiatimes.com/sports/nfl/news/nfl-news-will-anderson-jr-signs-150-million-extension-with-houston-texans-becoming-highest-paid-non-qb/articleshow/130341530.cms,"NFL news: Will Anderson Jr signs $150 million extension with Houston Texans, becoming highest paid non QB (Image via Getty)

Will Anderson Jr. earns record deal after dominant 2025 season

Will Anderson Jr. and Danielle Hunter lead Texans defense under DeMeco Ryans

NFL Network has reported a big update, and it’s hard to miss. The Houston Texans have locked in their young star Will Anderson Jr. with a three-year, $150 million extension. As per insider Ian Rapoport, the deal includes $134 million guaranteed and even a non-trade clause. That makes Anderson the highest-paid non-quarterback in NFL history right now.This deal didn’t come out of nowhere. Will Anderson Jr. just had the best season of his career in 2025, and it showed in every stat. He finished with 12 sacks, which was his highest so far. On top of that, he added three forced fumbles, 54 tackles, 20 tackles for loss, and 23 quarterback hits.Then there’s pressure, something not everyone notices at first. According to Next Gen Stats, Anderson had 85 quarterback pressures, the second-most in the entire league. That tells you how often he was disrupting plays, even when he didn’t get the sack.Because of this, he earned First-Team All-Pro honors for the first time in his career. He also finished second in Defensive Player of the Year voting, just behind Myles Garrett.If you look at his growth, it’s clear. He had seven sacks as a rookie in 2023, then 11 in 2024, and now 12.Every year, he’s getting better. That steady rise made this contract feel like the next logical step.Another reason behind this deal is how well Anderson has worked with Danielle Hunter. The two have formed one of the most dangerous pass-rush duos in the league.In 2025, both players finished in the top 10 in sacks. Together, they combined for 27 sacks, which made life very hard for opposing quarterbacks. Just last month, on March 5, the Texans gave Hunter a one-year $40.1 million extension. So now, both stars are secured.Head coach DeMeco Ryans has built this team around defense. That identity is clear. And right now, Anderson is at the center of it.Since being drafted No. 3 overall in 2023, he has delivered right away. He won Defensive Rookie of the Year, made the Pro Bowl twice, and quickly became one of the most important players on the team.The Texans see him as a long-term leader. This contract proves it. They are not just rewarding past performance, they are betting on what he will keep doing in the future.","Will anderson jr. has signed a three-year, $150 million extension with the houston texans. The deal includes $134 million guaranteed and even a non-trade clause. It makes anderson the highest-paid non-quarterback in nfl history right now.","https://static.toiimg.com/thumb/msid-130341452,width-1280,height-720,imgsize-778613,resizemode-6,overlay-toi_sw,pt-32,y_pad-600/photo.jpg"
"Antonio Felix Da Costa: After Formula E wins, Antonio Felix da Costa set for WEC comeback at 6 Hours of Imola",https://timesofindia.indiatimes.com/sports/formula-e/after-formula-e-wins-antonio-felix-da-costa-set-for-wec-comeback-at-6-hours-of-imola/articleshow/130340765.cms,"Antonio Felix Da Costa (Image credit: Instagram)

Antonio Felix da Costa returns for 6 Hours of Imola



Antonio Felix da Costa’s Formula E performance



Antonio Felix da Costa is riding high after securing two consecutive wins in Formula E this season. The Jaguar TCS Racing driver triumphed in Jeddah before going on to win the maiden Madrid E-Prix. The 34-year-old has now confirmed his return to the World Endurance Championship, with a drive in the 6 Hours of Imola.Antonio Felix Da Costa’s return to the World Endurance Championship was confirmed via the series’ official social media channels. An Instagram post read: “Return of the DAC. After two seasons away, @afelixdacosta is back in WEC, this time with @alpine_endurance_team. Could a podium be on the cards this weekend?”Da Costa simply replied “Voilà” in the comments. He will take part in the iconic Imola race as part of the Alpine team. The event is scheduled to take place at Italy’s Autodromo Internazionale Enzo e Dino Ferrari from 17–19 April, with the race set to begin at 1 pm local time on 19 April.Da Costa last competed in the championship in 2023 with Hertz Team Jota in the Hypercar category.Antonio Felix Da Costa currently sits fourth in the Formula E Drivers’ Standings with 64 points following his back-to-back victories. He is just one point behind his team-mate Mitch Evans.After a slow start with Jaguar TCS Racing following his move from Porsche, da Costa secured his first win with the team in Round 5 in Jeddah. He followed that up with another victory in Round 6 in Madrid.Speaking after his double win, da Costa said, “Back-to-back wins, a 1–2 for the team - that doesn’t happen often! Massive congratulations to all the boys and girls back in the UK providing us with these cars. It’s kind of a home race for me. I have a lot of friends and family here and it’s a bit of a dream day. We’re both winners, we both wanted to win, we just got different messages. We’ll work it out. I’m happy for Mitch [Evans], he must have done an amazing race, I’ve got to go back and watch that because he came from the back! I’m happy with what we executed today, and it’s a dream day. ”He is using the current break in the Formula E calendar to compete in the World Endurance Championship. He will return to Formula E action for the Berlin double-header, scheduled from 1–3 May.Also read: Exclusive interview: Edoardo Mortara shines for Mahindra Racing this season, says “important to keep your feet on the ground”",Antonio felix da costa will drive in the 6 hours of imola. The 34-year-old last competed in the championship in 2023 with hertz team jota. He is currently fourth in the formula e drivers’ standings with 64 points.,"https://static.toiimg.com/thumb/msid-130341062,width-1280,height-720,imgsize-43744,resizemode-6,overlay-toi_sw,pt-32,y_pad-600/photo.jpg"
Steven Miller: Arizona State coach Steven Miller dies at 29 after recent medical incident at practice,https://timesofindia.indiatimes.com/sports/international-sports/arizona-state-coach-steven-miller-dies-at-29-after-recent-medical-incident-at-practice/articleshow/130339941.cms,"Steven Miller (Image Via Getty)

Steven Miller remembered by Arizona State community after medical incident and sudden passing at age 29

Arizona State is dealing with heartbreaking news. Steven Miller, a 29-year-old assistant football coach, has died just days after a medical incident during practice. The university confirmed his passing on Wednesday night and quickly canceled its spring practice as the team tried to process the loss. For many around the program, the news came suddenly and has left a deep impact.Miller had been facing health issues in the days before his death. Reports say he suffered a medical episode after practice on April 7. He missed two sessions but returned to the field about a week later. While the exact cause of death has not been officially shared, it is known that he had been living with epilepsy. The situation has raised concern and sadness across the college football community.Steven Miller was not just a coach. He had been part of the Arizona State football family for years. Before stepping into coaching, he played for the Sun Devils from 2015 to 2019. He was an offensive lineman who showed steady growth during his time with the team.He played in 49 games and started 35 of them, taking roles at both tackle and guard. After redshirting in 2015, he slowly became a regular presence on the field. One of his final moments as a player came in the 2019 Sun Bowl, where Arizona State secured a win over Florida State.After his playing career ended, Miller moved into coaching. He worked as a graduate assistant at Louisiana Lafayette and later at the University of Florida. Still, Arizona State remained close to him. About three years ago, he returned to join the staff again, working under head coach Kenny Dillingham at Mountain America Stadium.Following his passing, the university shared a message on X. It read, “The Sun Devil Football family mourns the passing of Steven Miller. We extend our thoughts to those who knew and loved him.” The words reflected how much he meant to the people around him.Head coach Kenny Dillingham also shared his thoughts. He said, “Praying for everyone who knew Steve. He had a joy for people that was unmatched and impacted so many lives. We lost a good one!”Those who knew Miller often speak about his energy and the way he connected with others. Whether as a player or a coach, he brought the same passion to the field every day.Right now, the focus is on remembering him and supporting his family, friends, and teammates. His journey, though short, left a strong mark on everyone he worked with.","Steven miller, a 29-year-old assistant football coach at arizona state, died on wednesday. He had been facing health issues in the days before his death. Reports say he suffered a medical episode after practice on april 7. He missed two sessions but returned to the field about a week later.","https://static.toiimg.com/thumb/msid-130339860,width-1280,height-720,imgsize-70624,resizemode-6,overlay-toi_sw,pt-32,y_pad-600/photo.jpg"
Shane Lowry Interview: Shane Lowry shares honest reason behind avoiding Rory McIlroy Masters celebration after tough Augusta finish ruined his week,https://timesofindia.indiatimes.com/sports/international-sports/shane-lowry-shares-honest-reason-behind-avoiding-rory-mcilroy-masters-celebration-after-tough-augusta-finish-ruined-his-week/articleshow/130339492.cms,"Shane Lowry shares honest reason behind avoiding Rory McIlroy Masters celebration after tough Augusta finish ruined his week (Image via Getty)

Shane Lowry explains why he skipped Rory McIlroy celebration after Masters heartbreak at Augusta National

Rory McIlroy and Shane Lowry friendship stays strong despite Masters week ups and downs

Shane Lowry had a hard time after the Masters. Even though his close friend Rory McIlroy won big at Augusta, Lowry said he could not celebrate with him. McIlroy made history by winning back-to-back titles at Augusta National Golf Club, something last done by Tiger Woods in 2002. But for Lowry, the moment felt very different.Lowry was in a strong place after three rounds. He was fourth and still in the fight. But Sunday changed everything. He had a very tough final round and finished far down the leaderboard after shooting six over.Because of that, he said he did not feel right celebrating. Speaking to Golf Channel, as reported by the Irish Independent, Lowry shared his honest feelings.“I texted him on Sunday night, and I said, ‘Honestly, I am so happy for you, but I do not have it in me tonight to go over and celebrate.’”He added that he felt low after the round and chose to stay home instead of joining McIlroy. He said he would see him later in Florida.This is not the first time emotions ran high. Last year, Lowry was upset when reporters kept asking him about McIlroy while he was still trying to win his own round. He made it clear he wanted to focus on his game. Still, their bond is strong. They are close friends on tour and spend time together with family as well.Off the course, McIlroy and Lowry share a strong friendship. They often play together and even team up in events. In fact, they won the Zurich Classic of New Orleans in 2024 on their first try.During Masters week, they were also seen enjoying time with family at the Par-Three contest. Their wives — Erica McIlroy, Wendy Lowry, and Clare Fleetwood — walked the course together while kids ran around, showing a lighter side of the game.Lowry also created a special moment earlier in the week. He made a hole-in-one on the sixth hole. With that, he became the first player ever to record more than one ace at the Masters. His first came back in 2016.Even after the tough Sunday, Lowry said he played good golf overall but did not get the result he wanted. He returned to action at the RBC Heritage and shot one under in the opening round, still trying to find his rhythm again.Meanwhile, McIlroy skipped that event after his emotional win.",Shane lowry shared honest reason behind avoiding rory mcilroy masters celebration after tough augusta finish ruined his week. Lowry was in a strong place after three rounds but had a very tough final round and finished far down the leaderboard after shooting six over.,"https://static.toiimg.com/thumb/msid-130339480,width-1280,height-720,imgsize-952965,resizemode-6,overlay-toi_sw,pt-32,y_pad-600/photo.jpg"
“Three-against-one situation”: El Rubius opens up on being “targeted” in MrBeast’s viral $1M challenge,https://timesofindia.indiatimes.com/world/us-streamers/three-against-one-situation-el-rubius-opens-up-on-being-targeted-in-mrbeasts-viral-1m-challenge/articleshow/130054402.cms,"El Rubius reacted honestly after his elimination from MrBeast’s $1 million challenge, calling it “unfair” and claiming he was targeted in a three-against-one situation. Despite his frustration, he thanked fans and gave away his $50,000 winnings. His response felt real and balanced, especially after MrBeast’s team later sent him a cake, softening the moment.

El Rubius reflects on a tough and “unfair” exit







El Rubius did not just walk away from MrBeast’s $1 million streamer challenge. He opened up. Soon after his elimination, the Spanish creator shared a raw reaction with fans, giving them a closer look at what the experience felt like from inside the game. It was not polished or carefully framed. It felt real, and that is exactly why it caught attention so quickly.The clip and his response have since fueled conversations across the streaming space. Some viewers believe intense competitions like this naturally lead to uneven situations. Others feel Rubius may have had a point about being singled out. Either way, his words have added a human layer to a challenge that many only saw as entertainment.Speaking through an Instagram Story, Rubius did not hide his frustration, but he also made sure to thank his supporters. He said, ""Guys, I just got knocked out of the game. It was a bit of an unfair elimination, but hey, at least I managed to walk away with $50,000 for you all, which I’ve already distributed. It went to the mods, the subs, and the non-subs alike.""He further added, ""I’m happy, of course, though admittedly, it was incredibly tough.I wasn't really a fan of the challenge itself, either. But then again... it was basically a three-against-one situation the entire time. I mean, they were targeting me specifically the whole way through. I kept trying to go after RaKai, but, well, he actually just got eliminated in the end. So, at least justice was served for Abraham. Abraham, if you’re watching this, we were all rooting for you, and standing right there with you.""His message carried mixed emotions. There was disappointment, yes, but also pride in how he handled things. Giving away his $50,000 winnings to his community stood out as a gesture that meant more than the result itself.He continued with another honest note, saying, ""And in the end, karma finally caught up with that little punk. Sorry, I’m being a bit toxic right now, but let's just hope the MrBeast team doesn't see this! Guys, thank you all so much. Seriously, thank you for all the support and for just being there.""He added, ""Every time I asked for something in the chat or whatever it was, you guys were right there. You’re incredible. I’m a little disappointed in myself, personally, mostly for not performing better, but hey, I gave it my all, and we still walked away with $50,000, so we’ve got to look on the bright side. All right, guys, big hugs to all my brothers out there!""Interestingly, the story did not end with frustration. Later that day, Rubius revealed that MrBeast’s team had sent him a cake after his exit. It was a small gesture, but it shifted the mood. It showed that even in a high-pressure challenge, there is still room for respect.In the end, Rubius’ reaction felt honest and grounded. That is what stayed with people.","El rubius was eliminated from mrbeast's $1 million challenge. He called it ""unfair"" and said he was targeted in a three-against-one situation. Despite his frustration, he thanked fans and gave away his $50,000 winnings.","https://static.toiimg.com/thumb/msid-130054402,width-1280,height-720,imgsize-47272,resizemode-6,overlay-toi_sw,pt-32,y_pad-600/photo.jpg"
Ipl Ticket Scam: IPL craze costs techie Rs 1.46 lakh in fake RCB vs CSK ticket scam,https://timesofindia.indiatimes.com/sports/cricket/ipl/top-stories/ipl-craze-costs-techie-rs-1-46-lakh-in-fake-rcb-vs-csk-ticket-scam/articleshow/130059549.cms,"Image credit: AI generated pic

Watch Devdutt Padikkal press conference: Chinnaswamy pitch, Tim David’s power & RCB’s batting strategy Devdutt Padikkal press conference: Chinnaswamy pitch, Tim David’s power & RCB’s batting strategy

RCB register their second win

Poll Do you think the demand for IPL tickets is too high every season? Yes, it's excessive. No, it's just right.

NEW DELHI: IPL comes and the demand for tickets and passes go soaring up by the fans. The desperation to get inside the stadium to watch their favourite teams in action in the IPL go high and high. When the tickets get sold out, the demand gets too hig, and the cricket fans even ask for tickets in black. But for a 25-year-old techie the craze for IPL tickets for RCB vs CSK turned too costly and he was duped for a massive Rs. 1.46 lakh.The techie, a resident of B Narayanapura, fell into a trap by a post posted by a fraudster who posed himself as a ticket seller on Instagram.As per a report in Deccan Herald, the techie alleged in a complaint to Mahadevapura Police that an individual claiming to be Sumit Biswal promised he could arrange IPL tickets along with food coupons.As per the techie, Biswal was introduced him as a senior supervisor for ticket counter at M Chinnaswamy Stadium""He asked me to come near the stadium gate number 10, saying someone would deliver the tickets within minutes, and even sent an email confirmation to gain my trust,"" the complainant told Deccan Herald.""Initially, I agreed to buy two tickets for Rs 3,700 each,but he kept asking for more money under various pretexts such as refundable security deposits, additional ID cards and food coupons.Trusting him, I made multiple payments - even using my mother’s bank account after exhausting my own limits—and ended up transferring around Rs 1.46 lakh,"" he added.Bhuvneshwar Kumar’s incisive spell of 3-41, coming after a marauding batting show from Tim David, Rajat Patidar and Devdutt Padikkal, propelled Royal Challengers Bengaluru (RCB) to a commanding 43-run victory over Chennai Super Kings (CSK) in their IPL 2026 encounter at the M Chinnaswamy Stadium on Sunday.The contest saw RCB’s batting unit dismantle CSK’s attack with relentless hitting, as David’s 70 not out off just 25 balls and Patidar’s unbeaten 48 off only 19 balls provided for the late fireworks after Padikkal’s fluent 50 off 29 balls had set the tone for the daunting total.Their combined effort lifted RCB to a daunting 250/3, thus setting a new record for highest total in IPL 2026. In reply, CSK faltered under scoreboard pressure, with Sarfaraz Khan’s 50 off 24 balls and Prashant Veer’s 43 the lone acts of resistance amid a string of failures from the top order.Bhuvneshwar was at his disciplined best and even crossed the 200-mark in terms of wickets in IPL, with others also chipping in as CSK were bowled out for 207 in 19.4 overs. The comprehensive win also meant RCB have registered four consecutive triumphs over CSK for the first time in the IPL’s history.","Royal challengers bengaluru (rcb) beat chennai super kings (csk) by 43 runs. Tim david, rajat patidar and devdutt padikkal all scored half-centuries. Rcb set a new record for highest total in ipl 2026 with 250/3.","https://static.toiimg.com/thumb/msid-130059719,width-1280,height-720,imgsize-95752,resizemode-6,overlay-toi_sw,pt-32,y_pad-600/photo.jpg"
