Article Title,Article Link,Article Text,Article Summary,Article Image
5 months after Mark Zuckerberg shocked the tech industry by hiring ScaleAI's founder and many top employees; company's CFO has a message: We are ...,https://timesofindia.indiatimes.com/technology/tech-news/5-months-after-mark-zuckerberg-shocked-the-tech-industry-by-hiring-scaleais-founder-and-many-top-employees-companys-cfo-has-a-message-we-are-/articleshow/125100366.cms,"Image courtesy: LinkedIn

Scale AI CFO pushes back: “We are alive and well”





Mark Zuckerberg unveils three new Meta AI smart glasses

Business is still booming





Moving ahead without Alexandr Wang





Facebook-parent Meta stunned the Silicon Valley in June this year by announcing a $14.3 billion investment in AI startup — Scale AI. Meta CEO Mark Zuckerberg made this investment to primarily onboard Scale AI founder Alexandr Wang and other top executives of the company. This move by Meta trigged an immediate speculation about the Scale AI’s viability, with major clients like OpenAI, Google, and Elon Musk’s xAI reportedly pausing work with the startup. The industry insiders also felt that the company had been effectively acquired, leaving its future uncertain. However, after almost five months after the investment made by Meta, Scale AI CFO Dennis Cinelli has pushed back this speculation. Speaking to CNBC in an interview, Cinelli said that ‘We are a company that signed some of the best deals we have had in the history of our company, just in the last two or three months. We are not a Zombie.”Emphasising on the fact that Scale AI has signed some of its best deals in recent months, Cinelli told CNBC, “We’re not a zombie company,”. Along with this, he also dismissed the claims that the investment made by Meta was a licensing or acquihire deal.He emphasised that Scale AI is still an independent and completely operational.Founded in 2016, ScaleAI is known for its data-labelling services and custom AI applications for governments and enterprises. Cinelli told CNBC that both the divisions of the company are growing with revenue “well into the nine figures.” He also revealed that Scale AI recently secured two major contracts with the US Department of Defense which value $99 million and $100 million in August and September, respectively.Scale AI fired about 14% of its workforce in July, soon after Meta made the investment of $14.3 billion, but the company started the process of hiring and has hired 200 new employees. Along with this, the AI company is also working on expansion and is opening new offices in New York, Washington D.C., St. Louis, and London. Despite alls this, the San Francisco still remains the largest hub of the company where it is occupying 180,000 square feet of former Airbnb space.The departure of Alexandr Wang from the company was considered to a major loss. He was the world’s youngest self-made billionaire until October but Cinelli insists the “vast majority” of employees remain. Facebook-parent Meta now owns 49% stake in ScaleAIwhich is valued around $29 billion, but the company has no voting power or product integration. “Scale’s data business has grown every month since the Meta deal, and its applications business has doubled in the second half of 2025 compared with the first half. Scale expects the applications unit to be the primary revenue driver for the company in the future,” Cenelli told CNBC.",Scale ai cfo pushes back: “we are alive and well” facebook-parent meta made a $14.3 billion investment in ai startup scale ai. The move by meta trigged an immediate speculation about the scale ai’s viability. The industry insiders felt that the company had been effectively acquired.,"https://static.toiimg.com/thumb/msid-125100362,width-1070,height-580,imgsize-21460,resizemode-75,overlay-toi_sw,pt-32,y_pad-40/photo.jpg"
Zerodha CEO Nithin Kamath on SEBI notice on Digital Gold: Safest and easiest ways to get exposure to Gold is ...,https://timesofindia.indiatimes.com/technology/tech-news/zerodha-ceo-nithin-kamath-on-sebi-notice-on-digital-gold-safest-and-easiest-ways-to-get-exposure-to-gold-is-/articleshow/125291262.cms,"‘Gold ETFs remain one of the safest and easiest to invest in gold’



SEBI’s advisory in digital gold



Read SEBI’s advisory here:



SEBI has enabled investments in gold and gold related instruments through various SEBI regulated gold products. These are exchange traded commodity derivative contracts, Gold Exchange Traded Funds (ETFs) offered by Mutual Funds and Electronic Gold Receipts (EGRs) tradeable on stock exchanges. Investments in these SEBI regulated gold products can be made through SEBI registered intermediaries and are governed by the regulatory framework prescribed by SEBI.

It has come to the notice of SEBI that some digital/online platforms are offering investors to invest in ""Digital Gold/E-Gold Products'. Digital Gold is being marketed as an alternative for investment in physical gold.

In this context, it is informed that such digital gold products are different from SEBI regulated gold products as they are neither notified as securities nor regulated as commodity derivatives. They operate entirely outside the purview of SEBI. Such digital gold products may entail significant risks for investors and may expose investors to counterparty and operational risks.

Investors/ participants are made aware that none of the investor protection mechaims under securities market purview shall be available for investments in such Digital Gold/ E-Gold products.





Zerodha CEO Nithin Kamath has now issued a cautionary note for the investors following SEBI’s recent advisory on digital gold. For those unaware, earlier this week SEBI issued a an advisory on digital gold calling it an unregulated and inefficient way to gain exposureto the precious metal. Now Kamath shared a post of social media platform X (formerly known as Twitter) advising the users to not to go after digital gold and instead opt for the one of the safest and easiest ways — gold ETFs if they want to inset in gold. “Most people don’t realize that nobody regulates digital gold, and if something were to happen to the platforms or companies selling it, there’s not much you can do,” wrote Kamath.In a post shared on X, Kamath emphasised that digital gold is not regulated by any financial authority, which means that investors have limited recourse if the platforms selling it collapse or default. He noted that most buyers are unaware of this regulatory gap. “Most people don’t realize that nobody regulates digital gold, and if something were to happen to the platforms or companies selling it, there’s not much you can do,” Kamath wrote.Along with this, Kamath also pointed out the high upfront costs associated with digital gold purchases such as a 3% GST, plus 2–3% in spreads, which in tern means that the investors will lose another 6% immediately after buying digital gold, even before the regulatory risks kick in.Kamath also said that with Sovereign Gold Bonds going away, the only safest and easiest way to invest in gold is through gold exchange-traded funds (ETFs). “Now that Sovereign Gold Bonds (SGBs) have stopped, gold ETFs remain one of the safest and easiest ways to get exposure to gold,’ Kamath.The remarks made by Kamath align with the Securities and Exchange Board of India’s (SEBI) recent warning about the risks of investing in digital gold. SEBI cautioned that these products are not covered under its regulatory framework and urged investors to exercise due diligence.","Zerodha ceo nithin kamath has issued a cautionary note for the investors following sebi’s recent advisory on digital gold. ‘most people don’t realize that nobody regulates digital gold, and if something were to happen to the platforms or companies selling it, there's not much you can do,’ wrote kamath.","https://static.toiimg.com/thumb/msid-125291255,width-1070,height-580,imgsize-40120,resizemode-75,overlay-toi_sw,pt-32,y_pad-40/photo.jpg"
"OnePlus 15 to launch in India on November 13: Features, expected price and more",https://timesofindia.indiatimes.com/technology/mobiles-tabs/oneplus-15-to-launch-in-india-on-november-13-features-expected-price-and-more/articleshow/125273577.cms,"OnePlus 15 features confirmed

OnePlus 15 expected price





OnePlus is all set to launch its latest flagship smartphone — OnePlus 15 in India. The company has already confirmed that it will launch the smartphone on November 13 in the country. Ahead of the launch event the company has revealed the features of the upcoming high-end smartphone. The OnePlus 15 promises to deliver exceptional speed, visual clarity, and endurance, thanks to a triple-chip architecture, a 1.5K 165Hz LTPO display, and a massive 7300mAh battery—the largest ever on a OnePlus device. Designed for gamers and heavy users alike, the device also comes with enhanced cooling, superfast charging, and improved reliability.OnePlus 15 will be equipped with an industry-first 1.5K 165Hz LTPO display, offering ultra-smooth visuals and precise color accuracy. The 6.78-inch screen supports 165fps gaming in titles like Call of Duty: Mobile and Brawl Stars, ensuring seamless gameplay. With up to 1800 nits of peak brightness and TÜV Rheinland Intelligent Eye Care 5.0 certification, the display promises clear visibility under sunlight and comfortable viewing at night.Under the hood, the phone will run on Qualcomm’s Snapdragon 8 Elite Gen 5 processor, paired with a dedicated touch response chip and a standalone Wi-Fi chip as part of its triple-chip system. This setup enhances multitasking, connectivity, and gaming responsiveness. OnePlus claims the device can maintain always-on 120fps gameplay with zero frame drops.The 360° Cryo-Velocity Cooling System integrates a large vapor chamber and aerospace-grade aerogel insulation to keep the phone cool during extended gaming or multitasking sessions. The result is consistent, high-end performance even under heavy load.OnePlus 15 will pack a 7,300mAh Silicon NanoStack battery, supporting 120W SUPERVOOC wired and 50W AIRVOOC wireless charging. A new Bypass Charging feature lets users power the device directly during gaming, reducing heat and preserving battery life. OnePlus says the battery retains over 80% health after four years of regular use and performs reliably even in extreme temperatures as low as -20°C.The device will also boast IP66, IP68, IP69, and IP69K ratings, offering top-tier protection against dust, water, and high-pressure jets—making it one of the most durable OnePlus smartphones yet.On the pricing front, the OnePlus 15 is rumoured to launch in the Rs 65,000–Rs 70,000 range in India. Exact pricing will be announced by the company on November 13.","Oneplus 15 is set to launch in india on november 13. The company has revealed the features of the upcoming high-end smartphone. The oneplus 15 promises to deliver exceptional speed, visual clarity, and endurance. The device also comes with enhanced cooling, superfast charging, and improved reliability.","https://static.toiimg.com/thumb/msid-125273565,width-1070,height-580,imgsize-11752,resizemode-75,overlay-toi_sw,pt-32,y_pad-40/photo.jpg"
"Apple releases new iPhone Pocket accessory starting at Rs 13,000: What it is, how it works, and where to buy",https://timesofindia.indiatimes.com/technology/technology-news/apple-releases-new-iphone-pocket-accessory-starting-at-rs-13000-what-it-is-how-it-works-and-where-to-buy/articleshow/125279218.cms,"iPhone Pocket

What is iPhone Pocket





iPhone Pocket: Two strap styles, colourways and sizing options





iPhone Pocket functionality: What it holds and how it’s used





iPhone Pocket pricing and availability





Model / Strap length US Price (USD) India Price (Rs) Availability: Online and select stores (initial markets) Short strap design (8 colours) $149.95 ₹12,900* On sale from Friday, 14 November 2025 at select Apple Store locations and on apple.com in France, China, Italy, Japan, Singapore, South Korea, the UK, and the US. Long strap design (3 colours) $229.95 ₹20,300* Same launch date and markets as above. Apple Specialists will assist with styling in-store.

*Conversion approximations for India based on industry reports: short strap = ₹12,900; long strap = ₹20,300.

(Note: Prices in India are approximate conversions from USD and reported by independent media.

Apple has not published an official Indian price or launch date for this accessory at the time of writing.)

iPhone Pocket manufacturing and collaboration background





Styling, use cases and pairing of iPhone Pocket with Apple devices





iPhone Pocket care, durability and expected user experience





How Apple positions iPhone Pocket in its product ecosystem





Retail experience and purchase process at launch









Apple and Japanese fashion house ISSEY MIYAKE have jointly introduced iPhone Pocket, a 3D-knitted textile accessory designed to be worn or carried and to hold an iPhone plus other small everyday items. The product is described as a “piece of cloth” reimagined as a flexible pocket: its ribbed, open-knit fabric expands to enclose a device and lets users glimpse the display when stretched. iPhone Pocket is available in two strap lengths and multiple colours, and Apple frames it as a special-edition accessory that complements iPhone design and personal style. The launch is positioned as both a fashion collaboration and a product engineered for universal fit and everyday utility.iPhone Pocket is a singular, 3D-knitted construction developed by ISSEY MIYAKE in close collaboration with Apple Design Studio. Crafted in Japan, the textile draws inspiration from the brand’s iconic pleats and is intended to function as an additional, wearable pocket for iPhone and other “pocketable items” such as AirPods. The knit’s ribbed open structure allows the textile to expand and subtly reveal contents when stretched, while fully enclosing items when relaxed.Apple and ISSEY MIYAKE describe the material as engineered for both look and function, combining traditional craft with modern textile R&D.iPhone Pocket is a singular, 3D-knitted construction developed by ISSEY MIYAKE in close collaboration with Apple Design Studio. Crafted in Japan, the textile draws inspiration from the brand’s iconic pleats and is intended to function as an additional, wearable pocket for iPhone and other “pocketable items” such as AirPods. The knit’s ribbed open structure allows the textile to expand and subtly reveal contents when stretched, while fully enclosing items when relaxed. Apple and ISSEY MIYAKE describe the material as engineered for both look and function, combining traditional craft with modern textile R&D.According to Apple, the iPhone Pocket is sized and structured to fit any iPhone model as well as small everyday items. The open knit expands to accommodate slightly bulkier contents and lets users peek at the iPhone display without removing the phone fully. Apple highlights multiple ways to use the accessory: handheld, attached to a bag, or worn on the body. The product is positioned as a fashion accessory as much as a utility item, emphasising styling and personal expression alongside practical carrying.Apple’s Newsroom states the iPhone Pocket was crafted in Japan and that its development and design unfolded through collaboration between ISSEY MIYAKE’s research and development teams and Apple Design Studio. The piece references ISSEY MIYAKE’s longstanding practice of pleating and textile innovation as the inspiration for the accessory’s knit structure. Apple quotes design leads from both organisations to underline the shared approach to simplicity, craftsmanship and adaptability.Apple positions iPhone Pocket as both fashion and function: the open knit and colour palette were explicitly selected to mix and match with iPhone finishes and to let users create personal combinations. Apple images show Pocket paired with iPhone 17, iPhone 17 Pro and iPhone Air models in complementary colours. Practical use cases emphasised by Apple include carrying the iPhone and small items together, wearing the Pocket across the body for hands-free use, and tying it to other bags or accessories. Retail staff will assist customers in stores in selecting strap length and colour combinations.Apple’s announcement emphasises the crafted textile quality and the 3D-knitted construction, but does not publish a formal care guide in the Newsroom piece. Because iPhone Pocket is a textile accessory made in Japan using ISSEY MIYAKE’s knit techniques, consumers should expect typical fabric care considerations gentle handling, avoiding sharp objects, and following any care instructions included in product packaging or on Apple’s online product pages after purchase. For definitive care and warranty details, customers should consult Apple’s product page or in-store specialists at launch.Apple frames iPhone Pocket as a special-edition accessory that complements iPhone design language and expands how users carry and style their devices. The product is intended to sit alongside Apple’s existing accessory portfolio rather than replace protective cases: it emphasises wearability, textile design, and aesthetic pairing. Apple highlights the accessory’s ability to carry other small items (for example, AirPods) and to visually coordinate with iPhone finishes.Apple’s announcement lists the specific Apple Store locations where iPhone Pocket will be available at launch and notes that both online and in-store purchase options will be offered beginning November 14, 2025. Apple Specialists will help customers mix and match lengths and colours with their iPhone and demonstrate styling options. Customers outside the initial launch markets should monitor apple.com for availability updates.","Iphone pocket is a 3d-knitted textile accessory designed to be worn or carried and to hold an iphone plus other small everyday items. The product is described as a “piece of cloth” reimagined as a flexible pocket. Its ribbed, open-knit fabric expands to enclose a device and lets users glimpse the display when stretched.","https://static.toiimg.com/thumb/msid-125279319,width-1070,height-580,imgsize-78794,resizemode-75,overlay-toi_sw,pt-32,y_pad-40/photo.jpg"
"BGMI 4.1 update launches in India on November 13: Release time, new features and other things to know",https://timesofindia.indiatimes.com/technology/gaming/bgmi-4-1-update-launches-in-india-on-november-13-release-time-new-features-and-other-things-to-know/articleshow/125216134.cms,"BGMI 4.1 update release time

Google Play (Android):

30% Release: 06:30 AM IST

50% Release: 09:30 AM IST

100% Release: 11:30 AM IST

App Store (iOS):

100% Release: 09:30 AM IST

Official Website:

Full APK Release: 12:30 PM IST

BGMI 4.1 update expected features





Krafton has officially confirmed the release of Battlegrounds Mobile India (BGMI) 4.1 update in India. As announced by the company, the BGMI 4.1 update will be rolled out on November 13 in the country. The upcoming BGMI 4.1 update is set to introduce new content, improved gameplay features, and key system upgrades that have already created a buzz among players. Here’s what you need to know about the BGMI 4.1 update launching on November 13, 2025As revealed by Krafton India, BGMI 4.1 update will start rolling 6:30 am onwards. Here’s the full schedule below:The upcoming BGMI 4.1 update is said to deliver a winter-themed gameplay experience called Frosty Funland Mode. Players will explore icy areas like Penguinville and Penguin Towns, featuring snow-covered landscapes and settlements built by penguins. These locations will offer interactive exploration, themed loot, and weather effects that affect movement and combat.New mechanics and items aim to make battles more exciting. Leaks suggest Magic Ice Skates that let players glide and jump across frozen surfaces, and Penguin Snowmobiles, a four-seater vehicle capable of firing snowballs that slow down opponents.A new NPC Crests System will allow players to collect tokens during matches and redeem them for rewards.Frosty Funland will transform classic maps such as Erangel into a winter wonderland. Players may encounter Salted Fish Rocket Launchers that leave icy traps, Enhancement Elixirs crafted by Apothecary Penguins for temporary boosts, and other festive effects. The seasonal update is expected to include themed rewards, mythic outfits, and a new Royale Pass to complete the experience.","Battlegrounds mobile india (bgmi) 4.1 update will be rolled out on november 13. The upcoming bgmi 4. 1 update is said to deliver a winter-themed gameplay experience. The seasonal update is expected to include themed rewards, mythic outfits, and a new royale pass to complete the experience.","https://static.toiimg.com/thumb/msid-125216316,width-1070,height-580,imgsize-43134,resizemode-75,overlay-toi_sw,pt-32,y_pad-40/photo.jpg"
Kai Cenat becomes first streamer ever to hit 20 million followers on Twitch,https://timesofindia.indiatimes.com/world/us-streamers/kai-cenat-becomes-first-streamer-ever-to-hit-20-million-followers-on-twitch/articleshow/125310045.cms,"Kai Cenat becomes first streamer ever to hit 20 million followers on Twitch (Image via Getty)

How Kai Cenat reached this big Twitch milestone





Kai Cenat has made a new record on Twitch. He is now the first streamer in history to reach 20 million followers on the platform. Twitch has confirmed this number. This is a big moment in the streaming world because it shows how huge and powerful online streaming has become. People from all around the world follow Kai Cenat for his fun energy, simple jokes, and the way he talks to everyone in the chat.He did not grow this fast by luck. Kai Cenat worked very hard for years. He started streaming a few years ago and slowly became one of the biggest names on Twitch. Even with other famous streamers like Ibai, Ninja, and AuronPlay, Kai Cenat still rose to the top. His special events, called “Mafiathon,” helped him grow very fast. These long streams had games, fun moments, and many celebrity guests. These events made people talk about him everywhere.In September 2025, during Mafiathon 3, Kai Cenat also became the first Twitch streamer to reach 1 million subscribers at the same time. This was confirmed by Twitch and shared by big pages like Instagram and Epidemic Sound. After this, his follower numbers kept going up every day until he finally hit the huge 20 million mark.Kai Cenat grew up in the Bronx, New York. He started streaming on Twitch a few years ago. His rise became very fast because he talks in a simple, friendly way that feels real and not fake. People like watching him because he laughs a lot, reacts in funny ways, and makes his chat feel like family.During his “Mafiathon” events, he streamed for many days. He also invited very big celebrities like Snoop Dogg, Kim Kardashian, and LeBron James. These big moments brought millions of new followers to his channel. Many clips from these events went viral on Instagram and other social media pages.One surprising thing is that Kai Cenat keeps growing even when he takes long breaks. Sometimes he is not live for weeks, but people still follow him and keep watching his old videos. This shows how strong and loyal his fanbase is.Also Read: Old Resurfaced Clip Of Asmongold Triggers Controversy After Intense Pressure On Donald Trump Around Epstein Files Rises With New Unexpected Twists Today, Kai Cenat stands at the very top of Twitch. His journey shows that you can reach big goals with hard work, new ideas, and a fun style that people enjoy watching. His success has also changed how brands look at streamers. Now, big companies pay close attention to Twitch because creators like Kai Cenat prove how powerful streaming can be.",Kai cenat has made a new record on twitch. He is the first streamer in history to reach 20 million followers on the platform. This is a big moment in the streaming world because it shows how huge and powerful online streaming has become.,"https://static.toiimg.com/thumb/msid-125310060,width-1070,height-580,imgsize-421707,resizemode-75,overlay-toi_sw,pt-32,y_pad-40/photo.jpg"
