Article Title,Article Link,Article Text,Article Summary,Article Image
"YouTube CEO Neal Mohan on Nikhil Kamat's 'Google offering him $100 million not to quit' question: 'I wanna see where...""",https://timesofindia.indiatimes.com/technology/tech-news/youtube-ceo-neal-mohan-on-nikhil-kamats-google-offering-you-100-million-not-to-quit-question-i-wanna-see-where-/articleshow/121468708.cms,"What the original report claimed about $100 million offer to Neal Mohan

Twitter also tried to hire Google CEO Sundar Pichai

This call will steal your money: ""Family Scam"" working & how to protect yourself!

YouTube CEO Neal Mohan has responded to a report claiming that Google paid him $100 million over a decade ago to prevent him from leaving the company during a 'talent war' in Silicon Valley. The topic came up during a recent episode of Zerodha co-founder Nikhil Kamath ’s podcast, where Mohan joined as a guest.Kamath referenced a widely-circulated story from 2011, saying, “I remember reading this thing about Google offering you $100 million not to quit. Not today, but 15 years ago, which was a lot of money.”Mohan, notably, did not deny the claim but laughingly said, ""I wanna see where you're going to take this.""At the time, Mohan was playing a key role in shaping Google’s advertising strategy and product roadmap for YouTube. According to a 2011 TechCrunch report, the tech giant made the offer in the form of restricted stock units vesting over several years, in a bid to stop him from leaving for Twitter, now known as X.Twitter was reportedly eyeing Mohan for the position of Chief Product Officer, encouraged by his former boss at DoubleClick, David Rosenblatt, who had joined Twitter's board.Mohan, a Stanford-educated electrical engineer, started his career at Andersen Consulting, before moving to NetGravity. After NetGravity was acquired by DoubleClick, he rose through the ranks to become VP of Business Operations. When Google acquired DoubleClick in 2007 for $3.1 billion, Mohan joined Google and eventually became one of the most influential figures in its ad business.The 2011 retention offer seems to have paid off. Mohan continued to climb the ranks and was appointed YouTube CEO in 2023, succeeding Susan Wojcicki .Interestingly, Mohan wasn't the only executive Twitter had tried to poach. The company had also reportedly approached Sundar Pichai , then head of Chrome and Chrome OS, around the same time. Google, in response, offered Pichai a $50 million stock grant to keep him onboard. Pichai later became CEO of Google in 2015 and CEO of Alphabet in 2019.","Youtube ceo neal mohan responded to a report claiming that google paid him $100 million over a decade ago to prevent him from leaving the company. The topic came up during a recent episode of zerodha co-founder nikhil kamath ’s podcast, where mohan joined as a guest.","https://static.toiimg.com/thumb/msid-121468703,width-1070,height-580,imgsize-105680,resizemode-75,overlay-toi_sw,pt-32,y_pad-40/photo.jpg"
Sanskrit for coding? DU introduces course to explore ancient language’s role in modern computing,https://timesofindia.indiatimes.com/city/delhi/sanskrit-for-coding-du-introduces-course-to-explore-ancient-languages-role-in-modern-computing/articleshow/121503163.cms,"Image generated using AI: TOI/TIL Denny





NEW DELHI: Amid the debate around Sanskrit being a suitable language for coding - with some even citing Nasa's supposed use of the ancient language - Delhi University has introduced a course that brings the idea closer to the classroom.Offered by DU's Department of Sanskrit as a discipline-specific elective paper, titled ""Computer Applications for Sanskrit"", the course aims to equip students with modern computing techniques to develop tools using the Sanskrit language.Discipline-specific electives are optional courses that students can select from a range of available choices. This particular course will be accessible as an elective option to all Sanskrit students enrolled across various colleges in DU.Subhash Chandra, a faculty member at the Sanskrit department who developed the course and teaches computational linguistics, said the aim is to show students how Sanskrit can be integrated with technology.""We also have a website where we display some tools that we have developed using coding in Sanskrit. Some of these include language analysers, grammar checkers, speech tools - similar to those in Hindi that convert speech to text - and a Sanskrit research database.In this course, we will teach students coding to develop such tools,"" he said.The course syllabus will cover web-based tools development, Hypertext Markup Language (HTML) and webpage creation, alongside Unicode typing in Devanagari, OCR applications, and text digitisation and preservation. It will introduce students to interactive Sanskrit learning platforms and discuss the need for such tools in Sanskrit education. The module also includes e-learning concepts and multimedia basics.A dedicated section on Unicode will focus on typing in Devanagari script (alphabet used for Sanskrit, Hindi and other Indian languages), introducing students to relevant software and keyboard tools. Another unit is centred on the tools and techniques used for text processing and preservation of Sanskrit texts. The final unit explores Optical Character Recognition (OCR) applications for Sanskrit and other Indian languages, offering insights into the current technologies and developments in the field.While the course does not teach full-fledged programming, it introduces basic coding and digital skills to help students create interactive tools and platforms in Sanskrit - aligning, in part, with the broader narrative of giving ancient Indian languages a technological future. It is open to fourth-semester students with a working knowledge of Sanskrit and draws from tools developed by DU's Computational Linguistics Group and texts on software theory and logic.The objective of the paper, as stated in the syllabus, is to ""introduce the current researches and developments in Sanskrit computing. The primary emphasis will be on tools and techniques developed under govt and private funding and on exploring new technologies for Sanskrit"".The learning outcomes add: ""The students will get an overview of computational works undertaken in the field of Sanskrit and a clear idea about how a range of practical linguistic tasks of Sanskrit can be done by developing CL systems. And, they will also know how CL tools can facilitate the learning and teaching process in the field of Sanskrit.""On May 4, chief minister Rekha Gupta, speaking at the closing ceremony of a 10-day Sanskrit learning initiative, voiced support for the potential the language holds in the field of coding. ""Even Nasa scientists have written papers on Sanskrit and confirmed that it is a scientific language. Coding can be done in Sanskrit. It is the most computer-friendly language,"" she said.Such assertions have sparked renewed discussions on the applicability of Sanskrit in contemporary computing, with DU's course now offering a practical academic framework to explore the language's digital possibilities.The Computational Linguistics Research and Development for Sanskrit initiative at DU's Department of Sanskrit was launched in 2014 under the supervision of Chandra. The group focuses on developing e-learning tools, creating digital content for Sanskrit scientific texts, building language analysis tools, and digitising Sanskrit literature for searchable online access. The department also runs a summer school that invites students from other universities to participate in a programme termed the ""emerging intersection of Sanskrit and technology"".",Delhi university has introduced a course that brings the idea of coding in sanskrit closer to the classroom. The course aims to equip students with modern computing techniques to develop tools using the sanskrit language. It is open to fourth-semester students with a working knowledge of sanskrit.,"https://static.toiimg.com/thumb/msid-121503262,width-1070,height-580,imgsize-145512,resizemode-75,overlay-toi_sw,pt-32,y_pad-40/photo.jpg"
Microsoft CEO Satya Nadella to employees in Town Hall: 6000 job cuts were related to…,https://timesofindia.indiatimes.com/technology/tech-news/microsoft-ceo-satya-nadella-to-employees-in-town-hall-6000-job-cuts-were-related-to/articleshow/121502710.cms,"Microsoft CEO Satya Nadella



Microsoft announces AI deal with Barclays and others



iPhone 16e: 5 Reasons to buy the most affordable iPhone 16 series model!

Microsoft CEO Satya Nadella addressed recent job cuts during the company’s latest Town Hall event with its employees, a report claims. At the event, he reportedly revealed that the latest round of job cuts was due to “reorganisation rather than performance,”. This clarification comes from the company weeks after it announced plans to lay off 6,000 employees, which is roughly 3% of its workforce. These terminations significantly impacted product development roles, indicating that even engineering jobs are not immune to changes in the era of artificial intelligence (AI). During a companywide town hall, Nadella also focused Microsoft's focus on accelerating the adoption of its Copilot AI assistants across customer workforces.According to a report by Bloomberg, Microsoft has also announced a new AI deal with Barclays Plc, a significant development in its effort to sell artificial intelligence tools to corporate customers.Judson Althoff , the company’s Chief Commercial Officer, informed employees that Barclays agreed to purchase 100,000 licenses for Microsoft’s Copilot AI assistants, according to people familiar with the event.Althoff also stated that numerous other customers, including Accenture Plc, Toyota Motor Corp., Volkswagen AG, and Siemens AG, already have over 100,000 Copilot users. These details were shared by individuals who requested anonymity as they discussed internal remarks, the report added.At the listed price of $30 per user per month, the deals mentioned by Althoff could be valued at tens of millions of dollars annually, though large customers often receive bulk discountsWhile the company has shared numerous anecdotes about businesses adopting Copilot, it has yet to disclose total customer figures or the financial impact of those sales.As per the report, some enterprise clients say the tools demand significant internal adjustments and employee training. As a result, many are approaching Copilot adoption cautiously, viewing it as a gradual rollout and testing phase rather than a full-scale deployment of the premium software.Microsoft is seen as a key player in AI through its partnership with OpenAI and integration of Copilot into productivity tools. The company also expects its AI offerings to generate at least $13 billion annually. However, investors remain eager for clearer proof of returns on its major AI investments.","Microsoft ceo satya nadella addressed recent job cuts during the company’s latest town hall event with its employees, a report claims. At the event, he reportedly revealed that the latest round of job cuts was due to “reorganisation rather than performance,”. This clarification comes from the company weeks after it announced plans to lay off 6,000 employees.","https://static.toiimg.com/thumb/msid-121502844,width-1070,height-580,imgsize-29856,resizemode-75,overlay-toi_sw,pt-32,y_pad-40/photo.jpg"
Victoria's Secret site down after security breach,https://timesofindia.indiatimes.com/world/us/victorias-secret-site-down-after-security-breach/articleshow/121501775.cms,"Representative image (Picture credit: X/@VictoriasSecret)





Victoria's Secret's website remained offline on Thursday, days after the lingerie company was hit by a cyberattack that has disrupted its online sales and sent its stock price lower.The company said it had taken its website and some in-store services down as a precaution, with teams working around the clock to restore operations. Its physical stores remained open.As of Thursday morning, its share price had fallen 8% since Tuesday. The company did not confirm when the security incident took place, but shoppers reported seeing effects of the outage earlier this week.It was unclear who perpetrated the attack on the Ohio-based company.","The company said it had taken its website and some in-store services down as a precaution. As of thursday morning, its share price had fallen 8% since tuesday. The company did not confirm when the security incident took place, but shoppers reported seeing effects of the outage earlier this week.","https://static.toiimg.com/thumb/msid-121501807,width-1070,height-580,imgsize-70926,resizemode-75,overlay-toi_sw,pt-32,y_pad-40/photo.jpg"
"European companies cut costs, scale back investments in China as its economy slows",https://timesofindia.indiatimes.com/world/china/european-companies-cut-costs-scale-back-investments-in-china-as-its-economy-slows/articleshow/121457517.cms,"AP Image





European companies are cutting costs and scaling back investment plans in China as its economy slows and fierce competition drives down prices, according to an annual survey released Wednesday. Their challenges reflect broader ones faced by a Chinese economy hobbled by a prolonged real estate crisis that has hurt consumer spending. Beijing also faces growing pushback from Europe and the United States over surging exports.""The picture has deteriorated across many key metrics,"" the European Union Chamber of Commerce in China said in the introduction to its Business Confidence Survey 2025.The same forces that are driving up Chinese exports are depressing the business outlook in the Chinese market. Chinese companies, often enticed by government subsidies, have invested so much in targeted industries such as electric vehicles that factory capacity far outpaces demand.The overcapacity has resulted in fierce price wars that cut into profits and a parallel push by companies into overseas markets.In Europe, that has created fears that growing imports from China could undermine its own factories and the workers they employ.The EU slapped tariffs on Chinese EVs last year, saying China had unfairly subsidised electric vehicle production.""I think there's a clear perception that the benefits of the bilateral trade and investment relationship are not being distributed in an equitable manner,"" Jens Eskelund, the president of the EU Chamber in China, told reporters earlier this week.He applauded efforts by China to boost consumer spending but said the government must also take steps to ensure that supply growth doesn't outpace that in demand.The survey results show that the downward pressure on profits increased over the past year and that a fall in business confidence has yet to bottom out, Eskelund said. About 500 member companies responded to the survey between mid-January to mid-February.""It is just very difficult for everyone right now in an environment of declining margins,"" he said.","European companies are cutting costs and scaling back investment plans in china. Fierce competition drives down prices, according to an annual survey released wednesday. Their challenges reflect broader ones faced by a chinese economy hobbled by a prolonged real estate crisis.","https://static.toiimg.com/thumb/msid-121457481,width-1070,height-580,imgsize-null,resizemode-75,overlay-toi_sw,pt-32,y_pad-40/photo.jpg"
"Punches, kicks and code: China hosts world’s first humanoid robot kickboxing match",https://timesofindia.indiatimes.com/world/china/punches-kicks-and-code-china-hosts-worlds-first-humanoid-robot-kickboxing-match/articleshow/121426724.cms,"China Media Group (CMG) World Robot Competition, Mecha Fighting Series (Video credits: X @CollinRugg





In a first-of-its-kind event, humanoid robots took center stage in a kickboxing match in Hangzhou, China. The competition, part of the China Media Group (CMG) World Robot Competition – Mecha Fighting Series, was held on May 25 and marked the debut of robotic fighters in a full-fledged combat sport.The robots were developed by Unitree Robotics, a Chinese tech company known for its advanced humanoid machines. Four Unitree G1 robots took part in the fight, each about 132 centimeters tall and weighing 35 kilograms, reported Asia Times.They were remotely controlled by human trainers using joysticks, and the match was broadcasted by China Central Television (CCTV).While the event sparked excitement among viewers, one social media user commented humorously, “The part that confuses me most is the referee in the ring.”Videos from the match showed the robots exchanging punches and kicks with surprising coordination. Although the strikes were more like soft pushes than real hits, the movements displayed impressive balance and speed for machines.The match was part of a larger effort to test and showcase the growing abilities of AI and robotics in dynamic settings.Earlier this year, a Unitree robot was seen in a viral video aggressively reacting to its handlers during a demo, raising safety concerns.In another case, during February’s Spring Festival Gala in Tianjin, a robot reportedly charged toward a crowd, alarming attendees.Such incidents, including a recent case at Tesla's factory in Texas where a robot allegedly injured a worker, have sparked growing concern over AI safety and the potential risks of advanced robotics. Experts have pointed to software glitches and inadequate testing as common causes, highlighting the need for strict quality control in AI development.","Humanoid robots took center stage in a kickboxing match in hangzhou, china. Four unitree g1 robots took part in the fight, each about 132 centimeters tall and weighing 35 kilograms. Match was part of the china media group (cmg) world robot competition.","https://static.toiimg.com/thumb/msid-121427367,width-1070,height-580,imgsize-5219885,resizemode-75,overlay-toi_sw,pt-32,y_pad-40/photo.jpg"
