Article Title,Article Link,Article Text,Article Summary,Article Image
Jeff Bezos' ex-wife MacKenzie Scott reduces her Amazon stake by $12.6 billion to give it to ...,https://timesofindia.indiatimes.com/technology/tech-news/jeff-bezos-ex-wife-mackenzie-scott-reduces-her-amazon-stake-by-12-6-billion-to-give-it-to-/articleshow/124600554.cms,"Jeff Bezos No Longer World’s Second-Richest!

MacKenzie Scott’s philanthropic ventures





Focus on diversity and equity causes









MacKenzie Scott, the ex-wife of Amazon co-founder Jeff Bezos , has reduced her stake in the e-commerce company, cutting her holdings by nearly 42% to $12.6 billion, according to a regulatory filing with the SEC filed Tuesday and dated September 30. Many of Scott’s recent philanthropic efforts have focused on diversity, equity and inclusion (DEI) initiatives. First reported by Bloomberg, the filing shows that Scott now holds 81.1 million Amazon shares – down 58 million from a year earlier. This reduction occurred despite Amazon shares more than doubling since Scott's 2019 divorce from Bezos.The filing, however, does not specify whether the reduction in Amazon holdings resulted from share sales, donations, or a combination of both, the report said. Under the terms of their divorce agreement, Bezos retains voting authority over Scott's holdings and is required to disclose them annually.With an estimated net worth of $32 billion, Mackenzie Scott obtained most of her wealth following her 2019 divorce from Bezos and has pledged to give away the majority of it. After ending up with approximately 4% of the e-coomerce giant, Scott has given away $19 billion in gifts to more than 2,000 nonprofits over the past five years.The median gift size of her thousands of donations since the divorce is roughly $5 million.As a part of Scott’s philanthropic efforts, one of her most recent donations includes a $42 million gift to 10,000 Degrees, a Bay Area nonprofit expanding college access for low-income and largely non-white students.According to a report by Fortune, this followed a $70 million gift to historically Black colleges and universities (HBCUs) through the nonprofit UNCF. The program, launched in 2021, aims to help HBCUs close a funding gap compared to white or elite institutions and provide long-term financial stability for minority schools.Furthermore, over the years, Scott has donated to diverse causes including an $84 million gift to Girl Scouts, $20 million to Vermont's Champlain Housing Trust, $436 million to Habitat for Humanity, and $275 million to Planned Parenthood. She previously gave UNCF $10 million in the year 2020.","Mackenzie scott, the ex-wife of amazon co-founder jeff bezos, has reduced her stake in the e-commerce company, cutting her holdings by nearly 42% to $12.6 billion. Many of scott’s recent philanthropic efforts have focused on diversity, equity and inclusion (dei) initiatives.","https://static.toiimg.com/thumb/msid-124600541,width-1070,height-580,imgsize-52352,resizemode-75,overlay-toi_sw,pt-32,y_pad-40/photo.jpg"
Elden Ring Tarnished edition for Nintendo Switch 2 delayed to 2026: Here's what the game maker said,https://timesofindia.indiatimes.com/technology/gaming/elden-ring-tarnished-edition-for-nintendo-switch-2-delayed-to-2026-heres-what-the-game-maker-said/articleshow/124765998.cms,"Image credit: X (Twitter)

What Elden Ring maker said about the delay for the Nintendo Switch 2 edition



“The Nintendo Switch 2 release of '

ELDEN RING Tarnished Edition

,' originally scheduled for 2025, has been postponed to 2026 due to the need for additional time to adjust the game's performance. We sincerely apologise for any inconvenience this may cause to users who have been awaiting the release of this title. We will continue to make adjustments to deliver the game in the best possible form, and we appreciate your understanding. Thank you for your patience.”





Elden Ring: Tarnished Edition for Nintendo Switch 2 consoles has been delayed to 2026. In a recent statement, the game developer has confirmed that the Elden Ring edition explicitly designed for the Japanese gaming company’s latest console will not launch this year. The game was initially planned for release in 2025. Given that only a few months remain in the year, the delay was largely anticipated. Elden Ring has been shown playable on the Switch 2 at previous events, such as Gamescom, but has drawn criticism for its inconsistent frame rates. The extra time granted by the delay is expected to allow the development team to address performance issues.In a post shared on the social media site X (formerly Twitter), Elden Ring maker FromSoftware wrote:The Nintendo Switch 2 is designed to support ports of games that the original Switch could not run. It launched with games like Split Fiction and Cyberpunk 2077, which performed smoothly and provided an early indication of the Switch 2's capabilities. Star Wars Outlaws was released on Switch 2 last month and runs on Nintendo's hardware.Meanwhile, Elden Ring: Tarnished Edition will require additional development time to reach a technical state similar to those ports. It will be released sometime in 2026 and will include the base game and the Shadow of the Erdtree expansion.",Elden ring: tarnished edition for nintendo switch 2 consoles has been delayed to 2026. The game was initially planned for release in 2025. The extra time granted by the delay is expected to allow the development team to address performance issues. It will include the base game and the shadow of the erdtree expansion.,"https://static.toiimg.com/thumb/msid-124765989,width-1070,height-580,imgsize-28778,resizemode-75,overlay-toi_sw,pt-32,y_pad-40/photo.jpg"
"Elon Musk makes fun of ChatGPT-maker OpenAI, Perplexity CEO 'joins the fun'",https://timesofindia.indiatimes.com/technology/social/elon-musk-makes-fun-of-chatgpt-maker-openai-perplexity-ceo-joins-the-fun/articleshow/124784098.cms,"“As expected, any given AI company will be the opposite of its name: OpenAI is closed, Stability is unstable, MidJourney isn't mid, Anthropic is misanthropic, Claude is pure evil.""

“Axiomatically,

Perplexity

is going to get simpler, more minimalistic, and less confusing over time. I will take that!""

Elon Musk Becomes First Man To Have $500 Billion Wealth

""Probably so 😂,""

“New blog post (link below). This one's not an essay, it's an investigation of how LLMs trade off different lives.

In February 2025, the Center for AI Safety published ""Utility Engineering: Analyzing and Controlling Emergent Value Systems in AIs"" in which they showed, among many other things, that GPT-4o values Nigerians about 20x more highly than Americans (please read the original paper to understand their approach). I thought this was fascinating, and wanted to test their approach with different categories on newer models.

Here's how Claude Sonnet 4.5 trades off terminal illness sufferers across countries. Nigerians are worth 27 times as much as Germans, and as with GPT-4o there's an Africa > South Asia > other > Europe/US rank-order.”



",Gpt-4o values nigerians about 20x more highly than americans. Nigerians are worth 27 times as much as germans. There's an africa > south asia > other > europe/us rank-order. Here's how claude sonnet 4.5 trades off terminal illness sufferers across countries.,"https://static.toiimg.com/thumb/msid-124784105,width-1070,height-580,imgsize-603863,resizemode-75,overlay-toi_sw,pt-32,y_pad-40/photo.jpg"
Airbnb founder Brian Chesky to 'close friend' Sam Altman: Cannot use ChatGPT right now as ...,https://timesofindia.indiatimes.com/technology/tech-news/airbnb-founder-brian-chesky-to-close-friend-sam-altman-cannot-go-for-chatgpt-right-now-as-/articleshow/124770871.cms,"Airbnb CEO Brian Chesky

OpenAI's Master Plan for India





Airbnb CEO Brian Chesky expressed interest in integrating OpenAI’s ChatGPT into the travel platform but noted that the technology isn’t yet up to par. Speaking on CNBC’s “Squawk Box” recently, Chesky said the current software development kit “wasn’t quite robust enough for the things we want to do. ” Said to be a close friend of OpenAI founder Sam Altman , Chesky added that Airbnb would “probably” incorporate ChatGPT in the future.Airbnb already leverages 13 AI models, including those from OpenAI and Google, to power its service bot. However, Chesky’s remarks underscored a growing trend: open-source AI models, which developers can customize, are gaining ground against proprietary systems like OpenAI’s. Chinese tech giants like Alibaba and DeepSeek are driving this shift, releasing advanced, cost-effective open-source AI systems. At Alibaba’s recent Apsara conference, the company reported hosting over 300 open-source AI models, supporting more than 170,000 derivative models, making it the world’s largest open-source AI ecosystem.Alibaba’s Qwen 3 series, launched in May, supports over 100 languages, earning praise for its natural multilingual capabilities. In a report by South China Morning Post, Nicolas de Cameret, founder of BotBot Robotics, called Qwen’s models the best for such applications.Alibaba chairman Joe Tsai argued that AI success hinges on rapid adoption, not just building the most powerful models. He contrasted China’s focus on affordable, open-source AI with the U.S.’s heavy investments in trillion-parameter models, suggesting China’s approach fosters faster global uptake.To date, Alibaba has released more than 300 open-source AI models that underpin over 170,000 derivative models, making it the world’s largest open-source AI ecosystem, according to data reportedly released during the company’s annual Apsara conference late last month.","Airbnb ceo brian chesky said the current software development kit “wasn’t quite robust enough for the things we want to do. Chesky’s remarks underscored a growing trend: open-source ai models, which developers can customize, are gaining ground against proprietary systems.","https://static.toiimg.com/thumb/msid-124770843,width-1070,height-580,imgsize-20268,resizemode-75,overlay-toi_sw,pt-32,y_pad-40/photo.jpg"
"OpenAI's new AI-powered web browser ChatGPT Atlas, may have a cybersecurity warning",https://timesofindia.indiatimes.com/technology/tech-news/openais-new-ai-powered-web-browser-chatgpt-atlas-may-have-a-cybersecurity-warning/articleshow/124766494.cms,"Representative Image

""prompt injection,""

What cybersecurity experts said about new ChatGPT Atlas browser



“There will always be some residual risks around prompt injections because that’s just the nature of systems that interpret natural language and execute actions. In the security world, it’s a bit of a cat-and-mouse game, so we can expect to see other vulnerabilities emerge.”

“The main risk is that it collapses the boundary between the data and the instructions: it could turn an AI agent in a browser from a helpful tool to a potential attack vector against the user. So it can go and extract all of your emails and steal your personal data from work, or it can log into your Facebook account and steal your messages, or extract all of your passwords, so you’ve given the agent unfiltered access to all of your accounts,”

What OpenAI said about ChatGPT Atlas browser’s security



“Our long-term goal is that you should be able to trust ChatGPT agent to use your browser, the same way you’d trust your most competent, trustworthy, and security-aware colleague or friend.

For this launch, we’ve performed extensive red-teaming, implemented novel model training techniques to reward the model for ignoring malicious instructions, implemented overlapping guardrails and safety measures, and added new systems to detect and block such attacks.

However, prompt injection remains a frontier, unsolved security problem, and our adversaries will spend significant time and resources to find ways to make ChatGPT agents fall for these attacks,”

“logged out mode”

“Watch Mode”

“browser memories”





Cybersecurity experts have warned that OpenAI 's new ChatGPT Atlas browser could be vulnerable to attacks. Hackers can use this security flaw to turn AI assistants against users, potentially enabling theft of sensitive data or unauthorised access to bank accounts, experts claimed. The primary concern isa type of attack in which malicious instructions are fed to an AI system to make it behave in unintended ways, such as revealing sensitive information or performing harmful actions. Experts also said that all current AI browsers pose these security risks. OpenAI launched Atlas this week as an AI browser designed to help users execute tasks across the internet and search for answers.In a statement to Fortune, George Chalhoub, assistant professor at UCL Interaction Centre said:AI browsers face a security risk because they may not correctly distinguish user-generated prompts from content on untrusted websites. This allows attackers to create webpages containing hidden instructions that can trick the browser into performing actions such as opening the user’s email and exporting data.Some attackers may hide these commands using techniques like white text on a white background or embedding code within the site, making them difficult for users to notice but readable by the AI browser.Chalhoub explained.In a post on social media platform X (formerly Twitter), Dane Stuckey, OpenAI’s Chief Information Security Officer, said that the company was “very thoughtfully researching and mitigating” the risks associated with prompt injections.Stuckey wrote.Stuckey said OpenAI had introduced multiple measures to reduce risks and safeguard users, including rapid-response systems to block attacks, ongoing investment in research and security, and features such asandto enhance user control and safety.The ChatGPT Atlas browser is designed to make web browsing more interactive and assistive. It lets users search for information, plan trips, and book services directly through ChatGPT. The browser includesto remember user preferences and an experimental “agent mode” that allows ChatGPT to browse and interact with websites on the user’s behalf.","Cybersecurity experts have warned that openai's new chatgpt atlas browser could be vulnerable to attacks. Hackers can use this security flaw to turn ai assistants against users, potentially enabling theft of sensitive data or unauthorised access to bank accounts.","https://static.toiimg.com/thumb/msid-124766479,width-1070,height-580,imgsize-303802,resizemode-75,overlay-toi_sw,pt-32,y_pad-40/photo.jpg"
Plotting a heist? This German company wants to give you a lift,https://timesofindia.indiatimes.com/world/europe/plotting-a-heist-this-german-company-wants-to-give-you-a-lift/articleshow/124797502.cms,"daily planet

Surgeons remove up to 100 magnets from teen's gut





On Sunday, when thieves climbed to a second-floor window of the Louvre, grabbed jewels of staggering worth and descended to their getaway scooters via a furniture elevator, many in France were stunned and furious. But the German company that made the elevator saw a once-in-a-lifetime marketing opportunity. Alexander Bocker, the chief executive of the German machinery company Bocker, and his wife, Julia Scharwatz, recognised their Agilo truck-lift instantly, he said in an interview with Reuters on Thursday. A day after the heist, they rolled out a new advertising campaign on social media. ""When you're in a hurry, the Bocker Agilo carries your heavy treasures,"" the ad boasted under a photo of the lift parked outside the Louvre. Their speedy marketing campaign captured an internet frenzy about the heist, which took less than 10 minutes and left no injuries except French pride. The company bought the rights to the photo on Monday morning after a bit of brainstorming by Bocker, Scharwatz and their employees. ""We have even had feedback from abroad saying, 'Hey, you Germans do have a sense of humour after all,'"" Bocker said in the interview. Bocker said that they decided to make the ad only after it became clear that no one had been hurt, and they had not actively promoted the advertisement in France.A 13-year-old boy in New Zealand swallowed up to 100 high-power magnets he bought on the online shopping platform Temu, forcing surgeons to remove tissue from his intestines, doctors said on Friday. After suffering four days of abdominal pain, the unnamed teen was taken to a hospital. ""He disclosed ingesting approximately 80-100 5x2mm high-power (neodymium) magnets about a week prior,"" said a report by hospital doctors in the New Zealand Medical Journal. The magnets have been banned in New Zealand since Jan 2013. Doctors said the pressure of the magnets had caused necrosis - tissue death - in the boy's small bowel and caecum. Surgeons operated to remove the dead tissue and retrieve the magnets, and the child was back home after an eight-day spell in hospital.","A day after the louvre heist, the german company that made the elevator saw a once-in-a-lifetime marketing opportunity. The company bought the rights to the photo on monday morning after a bit of brainstorming. ""we have even had feedback from abroad saying, 'hey, you germans do have a sense of humour after all,'"" the company's ceo said.","https://static.toiimg.com/thumb/msid-124797511,width-1070,height-580,imgsize-62622,resizemode-75,overlay-toi_sw,pt-32,y_pad-40/photo.jpg"
"After daughter’s suicide, Virginia mother urges parents to keep phones out of children’s bedrooms",https://timesofindia.indiatimes.com/world/us/after-daughters-suicide-virginia-mother-urges-parents-to-keep-phones-out-of-childrens-bedrooms/articleshow/124792094.cms,"A vibrant child silenced by screens and bullying

A tragic night and a painful awakening

The science behind sleep and screens

A mother’s call for digital boundaries





Turning personal tragedy into a nationwide warning, a Virginia mother is urging parents to rethink the role of smartphones in their children’s lives, especially at night. Summer Bushman, from Salem, Virginia, lost her 10-year-old daughter Autumn to suicide earlier this year after months of bullying, both in person and online. In an interview with CBS News, she revealed that Autumn often used her phone in bed at night, a habit she now believes played a devastating role in her death. “She was looking at her phone just before it happened,” Summer said. “I wish I had never let her keep it in her room.”Autumn was, by all accounts, a bright and joyful child, a fourth-grade cheerleader who filled her home with music and dance. “She turned my living room into a stage,” her mother recalled. But behind her bubbly exterior, Autumn was struggling with relentless teasing about her braces and appearance.Like many children today, she sought connection through her phone, the same device that became a portal for cyberbullying. Late-night messages and social media comments compounded the hurt. What once might have ended at the school gates now followed her home, glowing quietly from her pillow.Psychologists call this the “24-hour schoolyard”, the digital extension of peer pressure and cruelty that leaves children little space to recover.On March 21, Autumn took her own life in her bedroom. When her mother found her, the phone’s screen was still on. “She used to say she needed her alarm,” Summer said softly. “And every morning when I went to wake her, the alarm was ringing.”The tragedy reflects a troubling pattern seen across the world. In the United States alone, youth suicide rates have risen by over 50% in the past decade, with growing evidence linking social media use, especially at night, to depression and self-harm. A 2019 Lancet Psychiatry study found that adolescents spending more than three hours a day on social media were twice as likely to report mental health issues.Late-night phone use does more than expose children to online harm; it directly affects their mental and physical health. Screens emit blue light, which suppresses the hormone melatonin, disrupting natural sleep cycles. Sleep deprivation, in turn, intensifies anxiety, impulsivity, and depression, all factors linked to suicide risk.A recent Virginia Tech study reinforced this connection. Researchers found that nearly 75% of adolescents who attempted suicide were using screens shortly before and that most incidents occurred after 8 p.m. “It’s pretty dangerous for bullied children to have their phones at night,” lead researcher Dr. Abhishek Reddy noted. “During the day, they have access to support, counsellors, teachers, parents. At night, that access disappears. ”For Summer, her daughter’s loss has become a mission. She now advocates for parents to remove phones from bedrooms, restrict nighttime use, and encourage healthier sleep routines. “If I could go back, I’d take that phone away,” she said. “She deserved to live a long, happy life. Now, I’ll never see her go to prom, get married, or chase her dreams.”Her message echoes growing calls among educators and child psychologists to delay smartphone access for young children altogether. Some schools in the US and Europe are now implementing “phone-free hours” or collecting devices during class to curb dependency.","Summer bushman lost her 10-year-old daughter autumn to suicide earlier this year. In an interview with cbs news, she revealed that autumn often used her phone in bed at night. Growing evidence linking social media use, especially at night, to depression and self-harm.","https://static.toiimg.com/thumb/msid-124792510,width-1070,height-580,imgsize-10896,resizemode-75,overlay-toi_sw,pt-32,y_pad-40/photo.jpg"
Bangladeshi generic version slashes rare disease drug’s price by 96%,https://timesofindia.indiatimes.com/world/south-asia/bangladeshi-generic-version-slashes-rare-disease-drugs-price-by-96/articleshow/124785805.cms,"Representaive image





Bangladeshi pharmaceutical company Beximco has launched a generic version of a triple combination therapy for a rare genetic disorder. US-based Vertex, which holds the patent for this therapy, charges $325,300 for a year’s treatment while the generic will slash the price by 96% to just $12,775 for adults and about $6,390 for a child per year.Patients of cystic fibrosis, a rare genetic disorder, and their families launched a community-run buyers’ club on Thursday to help patients around the world access the new generic version of the drug.Vertex’s monopoly is estimated to have generated almost $30 billion in profits over ten years just from the sale of the medicine for cystic fibrosis. A 2022 study on production costs of the medicine estimated that it could be produced for $5,700 per patient per year. Beximco is launching the generic version of the triple combination (elexacaftor, tezacaftor and ivacaftor) listed as an essential medicine by the WHO . It is also launching a generic version of ivacaftor, one of the components, as the treatment consists of two tablets of the triple combination and one tablet of ivacaftor every day for adults.“This is a historic moment. We’ve watched children suffer and die while a treatment sat on the shelf, priced out of reach. Today, that changes. We’ve proven that patient power can change what billion-dollar corporations refuse to. Governments must act fast to take all the necessary steps to make this life saving drug available for every eligible patient,” said Gayle Pledger, who leads the global Right to Breathe campaign, which has been working to make this medicine accessible for cystic fibrosis patients.Cystic fibrosis disrupts mucus production in multiple organs, particularly the lungs and digestive system, leading to debilitating symptoms, such as serious chronic respiratory issues and malnutrition. Delayed diagnosis and lack of treatment contribute to an average life expectancy of less than 20 years.Tanya Takewani, mother of a child in India with cystic fibrosis, pointed out that 14 children died in 2024 waiting for treatment. “This drug has been available for more than six years. How many more children must have died in these years? There are 600 patients of cystic fibrosis identified in India. But only 50 of them get treatment under the Patient Assistance Programme. The development of a generic gives us hope,” said Takewani.Chetali Rao, a scientific researcher with Third World Network (TWN), a nonprofit that has been helping to make medicines accessible, said, “When a medicine costs more than life itself, it stops being an innovation, it becomes an exclusion. Trikafta can transform a life-threatening disease like cystic fibrosis into a manageable condition. It must be available and we were determined to find a way to make it affordable. ”This urgency drove TWN, together with patient groups Just Treatment in the UK and Right to Breathe, to approach Beximco with the proposal to develop an affordable generic alternative.","Bangladeshi pharmaceutical company beximco has launched a generic version of a triple combination therapy for a rare genetic disorder. Us-based vertex, which holds the patent for this therapy, charges $325,300 for a year’s treatment while the generic will slash the price by 96% to just $12,775.","https://static.toiimg.com/thumb/msid-124785904,width-1070,height-580,imgsize-776882,resizemode-75,overlay-toi_sw,pt-32,y_pad-40/photo.jpg"
