Article Title,Article Link,Article Text,Article Summary,Article Image
Russell Wilson’s wife Ciara opens up about her bold fashion statements and being a cool mom to their four children,https://timesofindia.indiatimes.com/sports/nfl/news/russell-wilsons-wife-ciara-opens-up-about-her-bold-fashion-statements-and-being-a-cool-mom-to-their-four-children/articleshow/124785181.cms,"(Image via Getty: Russell Wilson and Ciara)

Taking risks equals having fun, expressing yourself, being bold, and fearless

Ciara’s son Future did not want to learn dance steps for a TikTok video from her

NFL WAG does not want to get left behind

Also Read:

Ciara, the wife of Russell Wilson , is known for sporting bold fashion—from daring silhouettes like see-through gowns and body-hugging couture with thigh-high slits to biker jackets and faux-fur headpieces. She’s also known for being not a “regular mom” but a “cool mom” to her four children. In a recent interview with PEOPLE at True Religion’s Holiday Party, Ciara talked about taking risks with her fashion choices and whether she considers herself a cool mom to her four children.A PEOPLE interviewer asked the American singer: “Do you consider yourself a risk taker when it comes to fashion?”The 39-year-old mom-of-four said that fashion wouldn’t be fashion if there were no risks involved—“I think so, I think CiCi would like to take a little risk sometimes when it comes to fashion. I think fashion wouldn’t be fashion if you didn’t take risks. Sometimes, you may not get it right, but I think the risk is always worth it when it comes to fashion because it’s about having fun, it’s about expressing yourself, and it’s about being bold and fearless, so I, one hundred percent, yes, I’m a risk taker. ”A PEOPLE interviewer questioned the NFL WAG, “Do you identify as a cool mom? You’re a cool mom.”Ciara is known for wearing many hats at once—actress, dancer, record producer, singer, songwriter, fashion model, composer, and music video director.But when it comes to teaching her own kids, she learned a hard lesson. Her eldest son, Future, was recording a TikTok video with her, but when she tried to show him a few steps, he stopped her. “Mom, you don’t know what you’re talking about,” he told her.Ciara shared the humorous exchange: “You know, it's funny because my kids, you know especially my eldest, he’s reaching that stage where it’s like—we were doing a TikTok and I’m telling Future, do the dance like this, trust me, do your legs like this…and he’s like, ‘Mom, you don’t know what you’re talking about,’ I’m like, ‘Do you know who your Mama is, boy? Do you know your Mama will teach you all the dance moves that you need to know?’”The multifaceted mother further shared that her kids are reaching an age where they want to hold her hand as much anymore. But despite that, she feels she’s ‘tapped in’ with her kids, alright.“You get to that phase, and my friends told me about it,” Ciara explained. “When your kids start reaching a certain age, they don’t wanna hold your hand so much anymore. They’re like, ‘Mom, okay, give me 50 feet.’ So I think it (being a cool mom) depends on the child you have, but I do —I think I do alright. I think Mama’s tapped in, I think I’m tapped in with my kid community right now. I wanna make sure I’m on top of my stuff because I don’t want to get left behind. ”","Ciara, the wife of russell wilson, is known for sporting bold fashion. She’s also known for being not a “regular mom” but a ‘cool mom’ to her four children. Her eldest son, future, was recording a tiktok video with her, but when she tried to show him a few steps, he stopped her.","https://static.toiimg.com/thumb/msid-124785239,width-1070,height-580,imgsize-56968,resizemode-75,overlay-toi_sw,pt-32,y_pad-40/photo.jpg"
"Khamzat Chimaev net worth in 2025: UFC champion’s salary, earnings, brand deals, lifestyle and more",https://timesofindia.indiatimes.com/sports/international-sports/khamzat-chimaev-net-worth-in-2025-ufc-champions-salary-earnings-brand-deals-lifestyle-and-more/articleshow/124794750.cms,"Khamzat Chimaev net worth in 2025 (Image via Getty)

Khamzat Chimaev net worth and UFC earnings

Khamzat Chimaev brand deals and endorsements

Khamzat Chimaev lifestyle and public image



Khamzat Chimaev latest updates and future plans

Khamzat Chimaev is one of the most dominant UFC fighters today. He became the UFC middleweight champion in 2025 after defeating Dricus du Plessis at UFC 319 in Chicago. The UFC confirmed he won with a huge 50–44 score on all judges’ cards. This article explains his net worth situation, how he makes money, his endorsements, lifestyle, and recent updates, all in very simple language.As of 2025, Khamzat Chimaev is estimated by reliable sports finance sources to be worth around 4 to 5 million dollars. UFC does not officially reveal full fighter salaries, but Khamzat Chimaev earns money from base fight purse, win bonus, performance bonus, and UFC Venum sponsorship payout.His biggest payday came at UFC 319 against Dricus du Plessis, where reports suggest he made over 1.8 million dollars including bonuses and sponsorship money. Before this, he also earned big checks from his fights against Gilbert Burns, Kamaru Usman, and others.Khamzat Chimaev makes strong money from sponsorships. He is linked with brands like Smilodox, Dragon Energy, Superz Budapest, YOFLEET, Pain Pen, and Venum.These are fitness and combat sports brands.His massive social media presence, including over 10.9 million Instagram followers, helps him get premium brand deals. These brands pay him hundreds of thousands of dollars each year, pushing his total net worth higher.Khamzat Chimaev lives a very private and disciplined life. He got married in Chechnya in 2022 but has never revealed his wife’s identity publicly. He spends most of his time in training camps and rarely attends parties or media shows.However, he sometimes posts pictures of luxury cars, gym sessions, and travel moments on Instagram. His image is a mix of humble fighter and silent killer, focused completely on becoming one of the greatest in UFC history.In 2024, Khamzat Chimaev was forced to pull out of a fight against Robert Whittaker due to a serious illness. But he returned strong and won the middleweight belt at UFC 319 in early 2025.Also Read: Andre Agassi And Steffi Graf’s Daughter Jaz Posts Sweet Anniversary Wish As Parents Celebrate 24 Years Together He has recently shown interest in fighting Alex Pereira to become a two-division UFC champion. If he wins one more world title, his net worth could easily cross 7 million dollars within the next year. He is currently at the peak of his career with massive growth expected ahead.","Khamzat chimaev is one of the most dominant ufc fighters today. He became the ufc middleweight champion in 2025 after defeating dricus du plessis at ufc 319 in chicago. He earns money from base fight purse, win bonus, performance bonus, and ufc venum sponsorship payout.","https://static.toiimg.com/thumb/msid-124794749,width-1070,height-580,imgsize-652755,resizemode-75,overlay-toi_sw,pt-32,y_pad-40/photo.jpg"
Superwoman gets a Dr prefix: Popular YouTuber Lilly Singh gets honorary doctorate from alma mater,https://timesofindia.indiatimes.com/world/us/superwoman-gets-a-dr-prefix-popular-youtuber-lilly-singh-gets-honorary-doctorate-from-alma-mater/articleshow/124669878.cms,"Lilly Singh’s rise as an cultural icon

A Little Late with Lilly Singh

Gen Z and Millennials Squash the Beef (w/ Maitreyi Ramakrishnan)

Why it matters

Types of Kids at School

What’s next for her





Canadian entertainer and digital creator Lilly Singh has been officially recognised with an honorary doctorate by her alma mater, York University, a milestone that highlights her transformation from online sensation to mainstream cultural influencer. The award, bestowed during the university’s Fall Convocation on 14 October 2025, reflects Singh’s impact on pop culture, media representation, and diversity advocacy, signalling the growing significance of digital platforms in shaping global cultural narratives.Singh’s career illustrates a broader trend in global media where social media platforms have become launching pads for internationally recognised cultural figures. Beginning as a teenager posting humorous sketches on YouTube under the moniker ‘Superwoman’, she cultivated a large following through content combining comedy, personal reflection, and commentary on cultural identity. This digital prominence opened doors to mainstream television, literature, and public advocacy.Her recognition also highlights evolving metrics of influence. Universities and institutions increasingly acknowledge contributions beyond traditional academic or professional achievements, valuing social reach, advocacy, and public engagement.Singh’s honorary Doctor of Laws degree is emblematic of this shift, recognising the societal and cultural impact of digital creators in ways that transcend conventional accolades.Globally, Singh’s work resonates beyond entertainment. She has amplified conversations about gender equity, representation of minorities in media, and mental health awareness, reaching audiences across North America, Europe, and Asia. Her trajectory offers a lens into how online personalities can shape social norms and public discourse, bridging cultural gaps and challenging stereotypes.On 14 October 2025, York University conferred the honorary Doctor of Laws degree on Singh during its Fall Convocation ceremony. The award cited her “contributions to community building and accomplishments in pop culture and entertainment.” Singh, who graduated from York in 2010 with a degree in psychology, described the honour as “immense”, noting the irony of fulfilling her parents’ long-held expectations of having a ‘doctor’ in the family, albeit in an unconventional manner.Singh’s speech to the graduating class underlined her philosophy on failure and growth. She encouraged students to embrace uncertainty and to view setbacks as teaching moments, asserting that “having it all figured out is a false narrative.” Her address also highlighted her experiences as the child of Indian immigrants navigating cultural expectations while forging a career in entertainment, a journey marked by creativity, resilience, and humour.The milestone comes amid Singh’s continued presence in mainstream media. Beyond her YouTube success, she hostedin 2019, becoming the first woman of Indian descent to lead a late-night talk show on a major American network. She has also authored bestselling books blending personal anecdotes with practical advice, further consolidating her influence across multiple platforms.Singh’s recognition signals the increasing legitimacy of digital creators in shaping cultural narratives. In a media ecosystem historically dominated by traditional broadcast networks and print outlets, social media personalities now influence public opinion, social norms, and even policy discussions on inclusivity and diversity.Her work also underscores the importance of representation. By foregrounding South Asian identity, gender equity, and minority experiences, Singh provides a template for how entertainers can leverage visibility to challenge stereotypes and promote social inclusivity. This has implications not only for entertainment but for broader societal attitudes, encouraging younger audiences to pursue unconventional paths while advocating for equity.Economically, figures like Singh exemplify the monetisation potential of digital platforms. Her trajectory highlights how online content can generate significant revenue streams, sponsorships, and brand partnerships, reshaping employment and entrepreneurship in creative industries. The honorary doctorate amplifies her credibility, reinforcing the notion that influence and impact extend beyond formal qualifications.In a wider sense, platforms such as YouTube, Netflix, and other streaming networks are indirectly implicated, as Singh’s career reinforces the significance of digital-first pathways in the entertainment ecosystem. Social media companies stand to gain from the visibility and credibility conferred upon creators, while advertisers and sponsors can capitalise on the extended reach of influential figures like Singh.Singh’s trajectory is rooted in the rise of social media as a dominant form of entertainment. Launching her YouTube channel as a teenager, she capitalised on the platform’s global reach, producing content that resonated across demographics. Her channel, Superwoman, addressed universal themes of identity, family dynamics, and humour, building a subscriber base of millions within years.The transition from digital creator to mainstream television host represents a significant milestone in entertainment history, reflecting broader shifts in audience behaviour. Singh’s entry into late-night television in 2019 mirrored an era where streaming platforms and online communities began to rival traditional media in shaping celebrity culture and public discourse.Her literary contributions further illustrate this shift. By authoring bestselling books, Singh transformed personal experiences into a public narrative, extending her influence beyond screen-based content and validating digital creators as authors and thought leaders in contemporary culture.Looking ahead, Singh’s recognition is likely to encourage other digital creators to pursue multi-platform careers, blending online content, traditional media, and advocacy. Institutions may increasingly confer honours upon influencers who achieve societal impact, signalling an expanded understanding of cultural contribution.As digital influence continues to evolve, Singh’s journey exemplifies how a YouTuber can transition from niche online content to mainstream recognition, bridging cultural, generational, and geographical divides in the process.","Lilly singh has been officially recognised with an honorary doctorate by her alma mater, york university. The award reflects singh’s impact on pop culture, media representation, and diversity advocacy. Her career illustrates a broader trend in global media where social media platforms have become launching pads for internationally recognised cultural figures.","https://static.toiimg.com/thumb/msid-124670159,width-1070,height-580,imgsize-40290,resizemode-75,overlay-toi_sw,pt-32,y_pad-40/photo.jpg"
Hailee Steinfeld embraces a new digital chapter as she brings ‘Beau Society’ to Substack and reflects on new beginnings with Josh Allen,https://timesofindia.indiatimes.com/sports/nfl/news/hailee-steinfeld-embraces-a-new-digital-chapter-as-she-brings-beau-society-to-substack-and-reflects-on-new-beginnings-with-josh-allen/articleshow/124797121.cms,"Actress and singer Hailee Steinfeld has moved her lifestyle newsletter Beau Society to Substack. This platform offers fans a closer look at her world. Steinfeld shares reflections on love, purpose, and personal growth. The move signifies a new chapter in her creative journey. She continues to explore balance and her evolving vision for the platform.

The actress and singer expands her creative platform and opens up about personal growth

Hailee Steinfeld opens up about finding balance in her new chapter



Hollywood star Hailee Steinfeld is blending creativity and authenticity in a new way. The actress and singer, who recently tied the knot with Buffalo Bills quarterback Josh Allen , has officially moved her lifestyle newsletter Beau Society to Substack, giving fans an even closer look at her world. The move marks a new chapter in Steinfeld’s creative journey as she continues to explore love, purpose, and personal growth while maintaining her signature privacy.Hailee Steinfeld’s digital lifestyle space, Beau Society, has long been her personal project, a blend of introspection, wellness, and fashion through her own words. But this week, she announced a major transition: the newsletter, which began a year ago, is now officially hosted on Substack.In her announcement, the Spider-Man: Across the Spider-Verse star expressed excitement for what’s ahead. “Surprise! We’re on Substack now! After delivering this letter to all of you for the past year, I felt it was time to move! I’m really excited about it. I love Substack... Plus, there are so many incredible features Substack offers, so the party’s bound to be more fun here,” she wrote to her 87,000 subscribers.The move reflects Steinfeld’s evolving vision for the platform, which she describes as “a creative space born at my kitchen table.”Named after her family nickname, Beau, the newsletter offers curated glimpses into her private world from her May 31 wedding to Josh Allen to her reflections on self-discovery and balance.In a recent post, Steinfeld posed a deeply personal question: “Can you really have it all?” She admitted the thought had been lingering in her mind since her marriage and reflected on how career pressures and personal happiness often intertwine.Through Beau Society, the 27-year-old artist has become more than an actress and singer, she’s emerged as a thoughtful storyteller. By sharing reflections on love, creativity, and womanhood, she’s connecting with fans on her own terms, a refreshing rarity in celebrity culture.As Josh Allen gears up for the Buffalo Bills’ Week 8 matchup, Steinfeld’s creative energy continues to flourish off the field. Her Substack move isn’t just a digital upgrade, it’s a symbol of growth, freedom, and the power of owning one’s story.Also Read: Tyreek Hill’s estranged wife Keeta Vaccaro flaunts $94,500 Hermès Birkin bag amid divorce proceedings abuse allegations","Actress and singer hailee steinfeld has moved her lifestyle newsletter beau society to substack. This platform offers fans a closer look at her world. Steinfeld shares reflections on love, purpose, and personal growth. The move signifies a new chapter in her creative journey.","https://static.toiimg.com/thumb/msid-124797121,width-1070,height-580,imgsize-28702,resizemode-75,overlay-toi_sw,pt-32,y_pad-40/photo.jpg"
"ScaleAl, in which Mark Zuckerberg invested $14.3 billion, lays off an entire team; then invites employees to..",https://timesofindia.indiatimes.com/technology/tech-news/scaleal-in-which-mark-zuckerberg-invested-14-3-billion-lays-off-entire-team-then-invites-staff-to-/articleshow/124634153.cms,"Scale AI Severance and alternative opportunities for laid off employees









Scale AI shut down an entire team of contractors in its Dallas office this week, marking the latest restructuring at the startup since Mark Zuckerberg's Meta invested $14.3 billion in the company in June. The shuttered team, known internally as the NPO or New Projects Organization, had over a dozen members who focused on generalist tasks such as improving the writing ability of artificial intelligence (AI) chatbots.Scale AI attributed the cuts to an industry shift toward more technical, expert-level training work, according to Business Insider. As AI chatbots improve, they increasingly require input from humans with specialised skills in fields like medicine, robotics, and finance, rather than generalist contractors.“Scale wound down a small experimental onsite program in Dallas staffed by a contract workforce,” Scale AI spokesperson Natalia Montalvo said.“This reflects an industry shift toward higher skill, expert data work. It only affects a small fraction of our overall workforce and has no impact on customer delivery,” Montalvo was quoted as saying.Scale AI offered the laid-off workers four weeks of severance pay and healthcare coverage through October, according to an email from HireArt, a staffing agency used extensively by Scale AI.The recently terminated workers were also invited to join Scale's gig-work platform, Outlier, where thousands of freelancers help train AI models.“As you navigate this transition, we want to ensure you are aware of alternative opportunities,” the email stated.Montalvo added that Scale AI continues to expand expert-level programmes and that broader groups of contractors continue to work in Dallas.The Dallas layoffs represent the latest in a series of cuts at Scale AI since the Meta investment. xAI has also made similar moves to focus on specialised AI training, recently downsizing its team of generalist AI tutors in September.",Scale ai shut down an entire team of contractors in its dallas office this week. The shuttered team focused on generalist tasks such as improving the writing ability of artificial intelligence (ai) chatbots. Mark zuckerberg's meta invested $14.3 billion in the company in june.,"https://static.toiimg.com/thumb/msid-124634273,width-1070,height-580,imgsize-19672,resizemode-75,overlay-toi_sw,pt-32,y_pad-40/photo.jpg"
"OpenAI CEO Sam Altman says: Those who lost their jobs to AI weren't actually doing a job, because …",https://timesofindia.indiatimes.com/technology/tech-news/openai-ceo-sam-altman-says-those-who-lost-their-jobs-to-ai-werent-actually-doing-a-job-becuase-/articleshow/124606647.cms,"Representative Image

""real work""

“very likely would look at what you do and I do and say, ‘that’s not real work’.""

""a little less worried""

What OpenAI CEO Sam Altman said about the jobs that AI may take away





""farmer""

“The thing about that farmer,”

“they very likely would look at what you do and I do and say, ‘that’s not real work.’”

“a little less worried”

“more worried in some other ways.”

“real work.”

“playing a game to fill your time”

“real job.”

“it’s very possible that if we could see those jobs of the future,”

“maybe our jobs were not as real as a farmer’s job, but it’s a lot more real than this game you’re playing to entertain yourself.”

“fake.”

“real”

“I’m so willing to bet on human drives being what they are,”

“And I think we’ll find plenty of things to do.”





OpenAI CEO Sam Altman has suggested that the types of jobs that are being eliminated or transformed by artificial intelligence (AI) may not be consideredin the long run. During an interview with Rowan Cheung at OpenAI ’s recent DevDay conference, Altman was asked about the possibility of AI destroying almost a billion knowledge-worker jobs before new ones are created. Altman used a thought experiment about a farmer from half a century ago to explain the situation. He said that a farmerAltman suggested that this perspective makes him feelabout the job losses. The conversation was centred on the uncertainty of what new jobs AI will create in the coming decades, similar to how a farmer in the past could not have imagined the jobs created by the internet.Sam Altman took up theanalogy when asked about the possibility of a billion jobs being destroyed before new ones are realised.Altman said, is not only that they wouldn’t believe you, howeverAltman explained that this perspective makes him feelbutHe compared the nature of work across eras, noting that a farmer performs essential labour by producing food and sustaining life, which he calledHe suggested that from a farmer’s perspective, many modern occupations might seem likerather than aLooking ahead, Altman added thatwe might feel thatAltman’s main point seems to be that jobs evolve. So, people shouldn’t stress too much about losing their jobs to AI, because, as he suggests, even a farmer from the past may see today’s jobs asBut then again, future workers may see our jobs as morethan whatever they’ll be doing in the AI era. This suggests that Altman believes things will eventually work themselves out.Altman said.",Openai ceo sam altman has suggested that the types of jobs that are being eliminated or transformed by artificial intelligence may not be considered in the long run. Altman used a thought experiment about a farmer from half a century ago to explain the situation.,"https://static.toiimg.com/thumb/msid-124606644,width-1070,height-580,imgsize-30536,resizemode-75,overlay-toi_sw,pt-32,y_pad-40/photo.jpg"
