Article Title,Article Link,Article Text,Article Summary,Article Image
German company shares photo of forklift used in Louvre heist to promote itself,https://timesofindia.indiatimes.com/world/europe/german-company-shares-photo-of-forklift-used-in-louvre-heist-to-promote-itself/articleshow/124788478.cms,"From crime scene to clever campaign

‘We don’t move people, only goods’

Internet reacts to the bold move



Turning humour into brand strength





Turning crisis into opportunity was never this epic. When a Böcker Agilo forklift, built by the German company Böcker Maschinenwerke GmbH, was used in a daring daylight robbery at the Louvre Museum in Paris, the manufacturer decided not to hide from the spotlight. Instead, it embraced the unexpected publicity with humour. The company shared a photo of the same forklift used by the thieves and turned it into a cheeky advertisement with the caption, “When things need to be done quickly.” The move quickly caught global attention and went viral online.The forklift, designed to lift goods, was reportedly used by robbers to access the Louvre’s upper floors and steal several pieces of priceless jewellery in a heist that lasted just a few minutes. Rather than treating the association as negative publicity, Böcker’s management team saw a creative opportunity.Alexander Böcker, the company’s managing director, and his wife decided to use the image from the heist in an online post highlighting the forklift’s efficiency and power. The caption humorously pointed out the lift’s speed, capacity (up to 400 kilograms), and quiet motor — the very qualities that made it a perfect, if unintended, tool for the robbers.Amid the growing online buzz, Böcker clarified that the Agilo lift is meant solely for transporting materials, not humans. The company said the ad was intended as a lighthearted response, not an endorsement of criminal behaviour. “It was a humorous way to acknowledge the situation,” a company statement read.Despite the controversy, the post struck a chord with many people who appreciated the company’s ability to laugh at an absurd situation while keeping its brand voice intact.The campaign sparked mixed reactions on social media. Some users praised Böcker’s sense of humour and marketing creativity, calling it “a masterclass in PR under pressure.” Others found it inappropriate, arguing that making light of a museum theft involving cultural artefacts was in poor taste.Still, the post achieved what few marketing efforts can — it went viral worldwide, appearing on platforms like Instagram, Facebook, and LinkedIn, and even being covered by international news outlets.The incident has now become a case study in how companies can turn unexpected moments into branding opportunities. By turning a potentially damaging situation into a playful, confident message, Böcker managed to boost its visibility across global markets.While the Louvre robbery investigation continues, one thing is clear: the forklift that once helped thieves make a quick getaway has now lifted Böcker’s marketing game to new heights.“When they said lift your brand, Böcker took it literally.”",A böcker agilo forklift was used in a daring daylight robbery at the louvre museum in paris. The manufacturer decided not to hide from the spotlight and embraced the unexpected publicity with humour. The company shared a photo of the same forklift used by the thieves and turned it into a cheeky advertisement.,"https://static.toiimg.com/thumb/msid-124788614,width-1070,height-580,imgsize-89212,resizemode-75,overlay-toi_sw,pt-32,y_pad-40/photo.jpg"
Watch: Louvre museum thieves’ slow getaway with France’s crown jewels; caught on camera,https://timesofindia.indiatimes.com/world/europe/watch-louvre-museum-thieves-slow-getaway-with-frances-crown-jewels-caught-on-camera/articleshow/124777746.cms,"Louvre museum thieves caught on camera escaping with the jewels.

Caught on Camera: Louvre Thieves Make BIZARRELY Slow Getaway After $102M Jewel Heist | WATCH





A video has emerged showing two thieves calmly escaping the Louvre Museum in Paris with an estimated €88 million (£76 million) worth of France’s crown jewels — in what is being described as one of the country’s most spectacular heists in decades.The 36-second clip, verified by Le Parisien, shows two men dressed in black — one wearing a yellow hi-vis vest, the other a motorcycle helmet — descending on a furniture lift from the museum’s Apollo Gallery, where the jewels were displayed.The video, apparently filmed from a nearby window, captures them leaving the scene on scooters parked along the Quai François Mitterrand, where a stolen truck with a 30-metre extendable ladder and basket lift had been stationed earlier.“They are going to leave,” a voice, thought to be that of a security guard, is heard saying on a walkie-talkie. Moments later, another voice adds: “Damn, there we go — the police.”Two members of a four-man gang broke into the gallery at 9.30 am on Sunday, shortly after the museum opened. They smashed an unsecured window and used disc cutters to open two display cases, seizing eight historic pieces, including an emerald and diamond necklace gifted by Napoleon I to Empress Marie Louise, and a diadem that once belonged to Empress Eugénie, wife of Napoleon III.The heist, executed in under seven minutes, saw the men inside the gallery for just under four minutes.France’s Interior Minister Laurent Nuñez said more than 100 investigators have been assigned to the case. Speaking before French senators, Louvre director Laurence des Cars called the theft a “terrible failure,” admitting that security camera coverage of the museum’s exterior walls was ‘highly insufficient’.",Louvre museum thieves caught on camera escaping with the jewels. Caught on camera: louvre thieves make bizarrely slow getaway after $102m jewel heist. Watch the full video here: http://www.dailymail.co.uk/news/features/article-362052/louvre-museum-thieves-caught-on-camera.html#storylink=cpy.,"https://static.toiimg.com/thumb/msid-124781282,width-1070,height-580,imgsize-3267558,resizemode-75,overlay-toi_sw,pt-32,y_pad-40/photo.jpg"
UAE signs $1.8 billion deal with US firm to boost global critical minerals supply,https://timesofindia.indiatimes.com/world/middle-east/uae-signs-1-8-billion-deal-with-us-firm-to-boost-global-critical-minerals-supply/articleshow/124783522.cms,"The UAE signs a $1.8B deal with the US and Orion to secure minerals that power batteries, EVs, and everyday tech / Image Credit: File

UAE-US $1.8 billion critical minerals investment

What is Orion Resource Partners?

Targeting production-ready projects

Strategic implications and global partnerships



Future prospects and industry impact





On October 23, 2025, the UAE and U.S. governments, in partnership with Orion Resource Partners, announced a $1.8 billion investment to strengthen global access to critical minerals such as lithium, copper, and rare earth elements. These minerals are essential for electronics, renewable energy, electric vehicles, and defense technologies.In a significant move to bolster global access to essential minerals, the U.S. and Abu Dhabi governments, in collaboration with Orion Resource Partners, have announced a joint investment of $1.8 billion. This initiative aims to enhance the supply of critical minerals such as lithium and rare earth elements, which are vital for various industries including electronics, renewable energy, and defense.The investment is structured through the newly formed Orion Critical Mineral Consortium, with each partner contributing $600 million. The consortium's goal is to expand its fund to $5 billion by attracting additional global investors. The focus is on investing in mining and refining projects that are either already in production or can commence operations in the near term, ensuring a swift increase in mineral supply to the U.S.and its allies.Orion Resource Partners is a U.S.-based private investment firm, established to specialize in natural resources and the mining sector. Since its inception, Orion has focused on investing in mining, refining, and supplying critical minerals such as lithium, copper, nickel, and rare earth elements. The firm’s mission is to provide long-term capital to projects that are ready to quickly bring essential minerals to the global market. In the UAE-US critical minerals consortium, Orion plays a key role by managing investments, identifying production-ready mining projects, and ensuring these minerals reach industries that rely on them, including electronics, renewable energy, and defense.Unlike traditional exploration ventures, the consortium is concentrating on projects that are ready for immediate development. This approach aims to expedite the availability of critical minerals, addressing the growing demand and reducing dependency on restricted sources. Frank Fannon, managing partner at Orion, emphasized the importance of focusing on production-ready projects to quickly meet market needs.The consortium's strategy includes investing in regions with established mining operations, thereby minimizing exploration risks and accelerating the timeline for bringing minerals to market. This targeted approach is designed to strengthen the supply chain for critical minerals, ensuring a more resilient and diversified global marketThis investment aligns with broader geopolitical objectives, as countries seek to secure access to critical minerals amid increasing global demand and supply chain uncertainties. By collaborating with Orion and the U.S. International Development Finance Corporation (DFC), the UAE is positioning itself as a key player in the global effort to diversify and secure mineral supplies. The initiative also reflects a growing trend of international partnerships aimed at enhancing resource security. Such collaborations are seen as essential in mitigating risks associated with supply chain disruptions and geopolitical tensions that can affect the availability of critical minerals.The establishment of the Orion Critical Mineral Consortium marks a proactive step toward addressing the challenges in the global supply of critical minerals. By focusing on projects that can quickly enter production, the consortium aims to alleviate supply bottlenecks and support industries reliant on these essential materials.As the consortium seeks to expand its fund to $5 billion, it is expected to attract additional investors interested in securing access to critical minerals. This expansion could lead to increased competition in the mining sector, potentially driving innovation and efficiency in mineral extraction and processing technologies.Overall, this strategic investment underscores the importance of securing a stable and diversified supply of critical minerals to support technological advancements and economic growth in the coming decades.","The uae signs a $1.8b deal with the us and orion to secure minerals that power batteries, evs, and everyday tech. These minerals are essential for electronics, renewable energy, electric vehicles, and defense technologies. The investment is structured through the newly formed orion critical mineral consortium, with each partner contributing $600 million.","https://static.toiimg.com/thumb/msid-124785268,width-1070,height-580,imgsize-1116395,resizemode-75,overlay-toi_sw,pt-32,y_pad-40/photo.jpg"
"Dubai launches AI system to link signals directly to vehicles, cutting congestion by up to 37%",https://timesofindia.indiatimes.com/world/middle-east/dubai-launches-ai-system-to-link-signals-directly-to-vehicles-cutting-congestion-by-up-to-37/articleshow/124778177.cms,"Dubai’s RTA is launching AI-powered smart signals that talk to cars, promising smoother drives, shorter waits, and less congestion citywide / AI-generated illustration

V2X: What the new system is and why it matters?

Israeli Teen Jailed For Refusing To Serve IDF Over 'GAZA GENOCIDE' Gets Support | WATCH

Countdown Timers: A live display showing the remaining green light duration or the expected delay on the red light.

Optimal Speed Advice: Recommended speeds for drivers approaching an intersection to ensure a smooth, non-stop crossing.

Instant Alerts: Notifications for accidents, road closures, congestion, or necessary detours ahead.

AI-powered traffic management

Real-Time Analysis: The system uses computer vision to analyze footage from roadside cameras. It instantly detects congestion patterns, counts the volume and type of vehicles, and even monitors pedestrians and cyclists.

Intelligent Coordination: The system doesn't just manage one intersection; it coordinates entire road corridors to move ""platoons"" of vehicles smoothly across multiple traffic lights. This network management drastically reduces unnecessary stops.

Digital Twin Simulation: Before any new timing strategy is applied in the real world, the system tests it using a digital twin—a virtual copy of the road network. This ensures all adjustments are optimized and effective.

Possible roll-out date

Phase 1 Completion (UTC-UX Fusion): The AI-driven dynamic system is on track for full implementation across roughly 300 major intersections by the third quarter of 2026.

V2X Rollout (Vehicle-to-Infrastructure): The new V2X network is scheduled for full deployment and integration across all 620 signalized intersections between 2027 and 2028.

Will my new car be ready?

For New Cars: The RTA is actively collaborating with international car manufacturers to ensure that new vehicles entering the Dubai market are factory-equipped with the necessary built-in connectivity to talk to the V2X network.

For Older Cars: If you own an older vehicle, you will still benefit from the overall congestion reduction and can likely access key information through add-on devices or popular smartphone integration applications like CarPlay and Android Auto that display live traffic data on your screen.





The Roads and Transport Authority (RTA) in Dubai is rolling out a massive upgrade that will fundamentally change how residents drive. By integrating Artificial Intelligence (AI) and a new technology called V2X (Vehicle-to-Everything), the city is moving beyond simple timed signals. This next-generation system promises to cut congestion by up to 37% and deliver real-time traffic information directly to your vehicle’s dashboard, making the experience smoother, safer, and faster.The Roads and Transport Authority (RTA) in Dubai has announced a new smart traffic system, labelled the V2X-network (Vehicle-to-Everything) that will link traffic signals directly to vehicles. It will send real-time information from intersections and traffic lights directly to car dashboards in connected vehicles. For older vehicles, the RTA says add-on devices or compatible apps (via CarPlay/Android Auto) will allow drivers to access the live traffic data.Drivers will receive crucial, real-time information, including:The core of this transformation is the advanced traffic signal control system known as UTC-UX Fusion. Unlike older systems that operate on fixed timers, this innovation uses cutting-edge technology to manage the road network dynamically.Here’s how the AI system is already making a difference:The results from early phases are impressive: intersection efficiency has already improved by up to 37% in key areas like Jumeirah Street, with an overall reduction in travel times across the city ranging from 10% to 20%.This massive undertaking aligns perfectly with Dubai's overarching vision to be a global leader in intelligent and sustainable mobility.Yes, the system is designed for the future of cars.Dubai’s RTA is moving ahead with its vision of smart mobility by launching a system that links traffic signals directly to vehicles, powered by AI, digital twin simulations and V2X communications. For drivers, this means the dashboard might soon become your real-time co-pilot: showing signal changes, delays, recommended speeds and helping avoid unnecessary stops.","Dubai’s rta is launching ai-powered smart signals that talk to cars, promising smoother drives, shorter waits, and less congestion citywide. The new v2x network is scheduled for full deployment and integration across all 620 signalized intersections between 2027 and 2028.","https://static.toiimg.com/thumb/msid-124778414,width-1070,height-580,imgsize-1399885,resizemode-75,overlay-toi_sw,pt-32,y_pad-40/photo.jpg"
‘Oh My God’: UAE lottery releases heartfelt audio of Dh100 million jackpot winner,https://timesofindia.indiatimes.com/world/middle-east/oh-my-god-uae-lottery-releases-heartfelt-audio-of-dh100-million-jackpot-winner/articleshow/124774392.cms,"The UAE Lottery shared the emotional phone call revealing Anilkum** B** as Dh100 million winner/Representative Image

Anilkum





The UAE Lottery has released the real audio of the phone call informing its latest jackpot winner — a UAE resident identified as* B*** — that he had won a record-breaking Dh100 million in the October 18 draw. The short clip captures an extraordinary moment of disbelief and emotion as the winner realises he has just claimed the country’s biggest-ever lottery prize.The UAE Lottery gave audiences a rare behind-the-scenes glimpse of what it sounds like when a life changes in an instant. In a teaser posted on Instagram on Thursday night, the organisation shared the actual call made to the lucky participant who beat odds of more than one in 8.8 million to secure the historic Dh100 million jackpot.The audio begins with a quiet greeting. “Hello,” the winner answers softly. On the other end, a calm, professional voice introduces himself: “Hi, this is Shah from the UAE Lottery.” The winner replies politely, “Good evening.” Moments later comes the announcement that stops him in his tracks: “You are our lucky jackpot winner of Dh100 million.”A few seconds of stunned silence follow before the emotion bursts through.“Oh my God!” the winner exclaims, his voice shaking. The simple, raw reaction struck a chord online, quickly spreading across social media. One Instagram user commented, “His voice excited to see the lucky winner,” while others shared their excitement ahead of the full reveal.The post’s caption read: “What does it sound like to win AED 100,000,000? Stay tuned — the reveal is coming soon.” According to organisers, the winner’s full identity and story will be officially unveiled on Monday, bringing an end to a week of speculation following the October 18 live draw.The Dh100 million prize marks a milestone for the UAE Lottery, which has already made four residents millionaires since its launch. For now, the winner’s name remains partially hidden as verification continues, in line with the operator’s privacy policy for large prizeholders.The brief audio, however, has already captured public attention. It offers a genuine, unscripted glimpse into a life-altering moment — the instant an ordinary participant learns he has become Dh100 million richer.",The uae lottery shared the emotional phone call revealing anilkum** b** as dh100 million winner. The short clip captures an extraordinary moment of disbelief and emotion as the winner realises he has just claimed the country’s biggest-ever lottery prize.,"https://static.toiimg.com/thumb/msid-124774430,width-1070,height-580,imgsize-615154,resizemode-75,overlay-toi_sw,pt-32,y_pad-40/photo.jpg"
Dubai opens retail leasing inside metro and tram stations: How can businesses apply,https://timesofindia.indiatimes.com/world/middle-east/dubai-opens-retail-leasing-inside-metro-and-tram-stations-how-can-businesses-apply/articleshow/124772393.cms,"RTA's offers public and private businesses to open retail shops at Dubai Metro stations. Image: AI Representative Image.

RTA leasing process : How to apply online for metro and tram station retail spaces

Applicants must first visit rta.ae and navigate to the Business and Corporate section. Under Invest with RTA, users can find a dedicated page for Investment Opportunities listing available spaces across metro and tram stations.

Each listing includes information about rent, area, electricity provisions, and any restrictions on business types. The website also features an interactive 360-degree digital view, allowing applicants to examine each unit virtually before applying.

Interested parties can register their interest by logging in with an RTA account and submitting their proposal. Additional inquiries can be directed to the contact details provided on the RTA website.

RTA business model to support domestic business





Local and international businesses now have the opportunity to operate inside Dubai’s bustling metro and tram stations, as the Roads and Transport Authority (RTA) opens retail and commercial leasing opportunities across the network.The initiative aims to boost economic activity and give daily commuters easier access to services while strengthening partnerships between the public and private sectors. RTA said that several successful collaborations with private firms in the past have encouraged the expansion of this investment model.Businesses interested in setting up shop in the emirate’s transport hubs can apply online through RTA’s official portal:Among the latest opportunities are retail outlets at metro stations along the Route 2020 extension, which serves fast-growing residential and commercial areas such as Jebel Ali, The Gardens, Discovery Gardens, Al Furjan, Jumeirah Golf Estates, Dubai Investment Park, and the Expo 2020 site. The RTA has allocated 40 retail outlets spanning 15,860 square feet and five sales kiosks for commercial use across these stations. The 15-kilometre Route 2020 corridor was designed to serve over 270,000 residents, with capacity for 46,000 riders per hour in both directions.According to RTA projections, daily ridership is expected to reach 125,000 passengers initially and 275,000 passengers per day by 2030. The Expo Station alone is forecast to handle around 35,000 weekday visitors and 47,000 visitors on weekends, accounting for nearly 30% of Expo’s total daily attendance.The Jumeirah Golf Estates Station, at 27,000 square metres, is the largest station on the network and can accommodate up to 250,000 riders per day. The facility serves neighbouring communities including Dubai Production City and Dubai Sports City.RTA officials said retail outlets along metro lines not only enhance the commuter experience but also stimulate local business by integrating urban mobility with trade. Abdul Mohsen Ibrahim Younes, CEO of RTA’s Rail Agency said, “Offering retail outlets in Route 2020 is in line with RTA’s endeavours to stimulate the domestic trade and inject fresh growth prospects. The success that marked retail outlets of the Dubai Metro stations on both the Red and Green Lines stems from the success and excellence of the Dubai Metro project. ”Since the launch of metro operations in 2009, retail establishments within stations have proved successful, becoming high-traffic business nodes. The expansion into Route 2020 is designed to sustain this model and attract further private investment.",Rta's offers public and private businesses to open retail shops at dubai metro stations. Rta officials said retail outlets along metro lines not only enhance the commuter experience but also stimulate local business. The expansion into route 2020 is designed to sustain this model and attract further private investment.,"https://static.toiimg.com/thumb/msid-124773373,width-1070,height-580,imgsize-225003,resizemode-75,overlay-toi_sw,pt-32,y_pad-40/photo.jpg"
