Article Title,Article Link,Article Text,Article Summary,Article Image
Inside Lauren Kyle McDavid’s upcoming Bar Trove: A chic new lounge opening soon in Edmonton,https://timesofindia.indiatimes.com/sports/nhl/news/inside-lauren-kyle-mcdavids-upcoming-bar-trove-a-chic-new-lounge-opening-soon-in-edmonton/articleshow/121500430.cms,"Lauren Kyle McDavid, wife of Connor McDavid, is launching Bar Trove in Edmonton's historic Canada Permanent Building on June 6 (Getty Images)

A sophisticated bar experience inspired by European charm

More than a bar — it’s a curated lifestyle destination





One of Edmonton’s most buzzworthy new venues is set to open its doors next week, and the anticipation is building. Lauren Kyle McDavid — the wife of NHL superstar Connor McDavid — is launching Bar Trove, an elegant new bar located in the historic Canada Permanent Building in downtown Edmonton. With an opening date set for June 6, this upscale addition to the city’s hospitality scene is already turning heads with its stylish concept and refined ambiance.Bar Trove isn’t your average night-out spot. The vision behind it draws deeply from the timeless sophistication of Parisian and London lounges. Visitors can expect an atmosphere where historical charm meets modern luxury — a rare blend in the city’s bar landscape. The design features include wood-panelled walls, plush furniture, and artfully selected fixtures, each contributing to the warm, intimate vibe of the space.This attention to detail isn’t surprising, considering Lauren Kyle McDavid is a well-known interior designer with her own firm. She has also co-founded Trove Living, a curated furniture showroom that launched alongside the bar.What sets Bar Trove apart is its fusion of design, hospitality, and social experience. It’s not just about sipping cocktails — it’s about being immersed in a thoughtfully crafted environment. Kyle McDavid explained the concept clearly in a statement shared with Dished earlier this year:“Bar Trove felt like a natural extension of Trove Living – giving people a place to gather, experience beautiful design, and enjoy incredible food and drinks in a curated setting.”The space offers a social haven for those who appreciate both aesthetics and atmosphere — something that has been missing from Edmonton’s bar scene.While the full menu remains under wraps for now, early hints suggest that Bar Trove will feature premium cocktails, a selection of fine wines and spirits, and elevated shareable dishes like oysters and caviar. The focus appears to be on quality and sophistication, promising an upscale yet approachable experience for discerning locals and visitors alike.Also Read: Patrik Laine’s fiancée Jordan Leigh throws shade at Justin Bieber as Hailey Secures billion-dollar deal without his help With its grand opening just days away, Bar Trove is poised to become one of the most sought-after destinations in Edmonton — not just for what’s in your glass, but for the design-driven atmosphere that surrounds it.",Lauren kyle mcdavid is launching bar trove in edmonton's historic canada permanent building on june 6. The vision behind it draws deeply from the timeless sophistication of parisian and london lounges. Visitors can expect an atmosphere where historical charm meets modern luxury — a rare blend in the city’s bar landscape.,"https://static.toiimg.com/thumb/msid-121501265,width-1070,height-580,imgsize-26202,resizemode-75,overlay-toi_sw,pt-32,y_pad-40/photo.jpg"
"Vince McMahon's net worth in 2025, current source of income, life after WWE, and more",https://timesofindia.indiatimes.com/sports/wwe/top-stories/vince-mcmahons-net-worth-in-2025-current-source-of-income-life-after-wwe-and-more/articleshow/121490854.cms,"(Image via WWE)

Vince McMahon’s net worth in 2025

Vince McMahon’s source of income



Vince McMahon’s life after WWE



Also Read

Vince McMahon, the former CEO of WWE and executive chairman of TKO, is one of the celebrated figures of WWE. The former chief of the Stamford-based promotion served as a promoter, commentator, film producer, and sometimes even stepped into the ring himself.McMahon's journey with WWE began as a commentator during the 1970s. He has immensely contributed to American professional wrestling and made WWE a popular household name.Though McMahon has been one of the celebrated figures of the company, he has landed himself in many controversies, too, including Janel Grant's lawsuit, where he was accused of sexual misconduct, including a coerced sexual relationship, sex trafficking, and repeated sexual assault.Let’s take a look at his WWE journey so far, his net worth, source of income, and more.According to Forbes, Vince McMahon's net worth in 2025 is estimated at $3 billion. It is believed that the former WWE Chief has amassed such a fortune due to McMahon unloading a lot of stock in recent years. He mainly earns from his TKO Holdings and also owns his independent entertainment company, Alpha Entertainment. Courtesy to his huge wealth, Vince enjoys an equally luxurious lifestyle, with his lavish mansions and noteworthy car collections.Reports suggest that Vince McMahon has more than $670 million worth of TKO Holdings shares in 2023. It is to be noted that TKO Holdings is the new brand name for the combined WWE and Ultimate Fighting Championship. In March 2024, he again sold off a slew of TKO shares for $412 million.Not long after, in early April 2024, he sold off $311 million worth of stock, followed by the final sale later that same month through which he earned $776 million for his last remaining TKO shares, meaning McMahon is no longer officially associated with the WWE.However, some rumors suggest that Vince McMahon might be currently earning from the shares of WWE and the TKO group that he may still be holding. Vince McMahon ’s life after WWE became tumultuous. His career ended after allegations of sexual misconduct and infidelity surfaced. He reportedly used nearly $19.6 million in company funds for settlements to suppress these claims.The latest complaint has come from Janel Grant , who has filed a complaint against McMahon of 'physical and emotional abuse, sexual assault, and trafficking.Janel Grant has filed a lawsuit against WWE and John Laurinaitis. Though Laurinaitis has been removed in the new filing submitted on May 28, 2025, Vince McMahon remains a defendant. Meanwhile, his former co-defendant has agreed to provide substantial evidence to Grant’s legal team, related to the case.With this development, it will now be interesting to witness where this case takes McMahon further, after Laurinaitis provides evidence as part of the confidential settlement.","Vince mcmahon, the former ceo of wwe and executive chairman of tko, is one of the celebrated figures of wwe. The former chief of the stamford-based promotion served as a promoter, commentator, film producer, and sometimes even stepped into the ring himself. According to forbes, vince mcmahon's net worth in 2025 is estimated at $3 billion.","https://static.toiimg.com/thumb/msid-121493059,width-1070,height-580,imgsize-778273,resizemode-75,overlay-toi_sw,pt-32,y_pad-40/photo.jpg"
Taylor Swift’s dad despise Blake Lively— Why is Scott Swift protecting Justin Baldoni? Fans question shocking move,https://timesofindia.indiatimes.com/sports/nfl/news/taylor-swifts-dad-despise-blake-lively-why-is-scott-swift-protecting-justin-baldoni-fans-question-shocking-move/articleshow/121464748.cms,"Scott Swift stepped in to shield Taylor Swift from the Blake Lively-Justin Baldoni legal drama (Getty Images)

Scott Swift intervenes to protect Taylor Swift from legal fallout







In a dramatic twist to the ongoing legal battle between actors Blake Lively and Justin Baldoni Taylor Swift 's father, Scott Swift, has reportedly stepped into the spotlight with a bold move to protect his daughter. According to an explosive report by the Daily Mail, Scott approached Baldoni’s legal team voluntarily, revealing that Lively allegedly threatened to leak Taylor Swift’s private messages unless the pop star supported her publicly.The revelation comes amid a tense $400 million legal standoff in which Justin Baldoni is suing Blake Lively for defamation and extortion following her sexual harassment allegations against him. Now, Scott Swift’s involvement has added a new layer of intensity to the already volatile feud.A source told Daily Mail, “Scott Swift did not want his daughter to be dragged into this any further and he voluntarily gave up this information as part of a deal that would include [Baldoni’s team] withdrawing their subpoena for Taylor."" This alleged backdoor deal helped pull Taylor Swift out of the legal spotlight and led to Justin Baldoni dropping his subpoena.The claims surfaced in court documents filed by Baldoni’s attorney, Bryan Freedman, who alleged that Lively’s lawyer, Michael Gottlieb, had contacted Taylor’s legal team with a disturbing demand. According to the filings, Lively wanted Swift to release a statement supporting her. If she refused, private and potentially damaging text messages in Lively’s possession would be made public.It was also alleged that Lively asked Swift to delete the messages—fueling further speculation about the nature of their content.Freedman claimed that the threat was revealed during a phone call with someone “very closely linked"" to Swift, later identified by sources as Scott Swift. “The message could not have been clearer. Baldoni was not just dealing with Lively. He was also facing Lively’s ‘dragons,’ two of the most influential and wealthy celebrities in the world,” the documents stated, referring to Swift and Lively’s husband, Ryan Reynolds Though the judge ruled that Taylor's involvement was ""improper"" and ""irrelevant"" to the case, the damage may already be done. The pop icon has denied all ties to the movie It Ends With Us, stating she had no role in production or creative input.Also Read: Taylor Swift’s dad exposes Blake Lively’s alleged threat in explosive legal twist, shielding daughter from $400M scandal Meanwhile, in a subtle but telling move, Taylor Swift’s boyfriend Travis Kelce unfollowed Ryan Reynolds on Instagram—fueling speculation that personal and professional relationships are unraveling in the fallout.","Scott swift stepped in to shield taylor swift from the blake lively-justin baldoni legal drama. Scott approached baldoni's legal team voluntarily, revealing that lively allegedly threatened to leak taylor swift’s private messages unless the pop star supported her publicly.","https://static.toiimg.com/thumb/msid-121467807,width-1070,height-580,imgsize-49688,resizemode-75,overlay-toi_sw,pt-32,y_pad-40/photo.jpg"
"GTA 6 to launch on May 26, 2026: Likely India price, map, trailer and more",https://timesofindia.indiatimes.com/technology/gaming/gta-6-to-launch-on-may-26-2026-likely-india-price-map-trailer-and-more/articleshow/121434547.cms,"Source: Rockstar Games

GTA 6: Likely price



GTA 6: The expansive new map



Leonida Keys: A tropical archipelago reminiscent of the Florida Keys.

Grassrivers: Swampy regions teeming with wildlife, including alligators.

Ambrosia: An industrial district with a gritty, blue-collar atmosphere.

Mount Kalaga National Park: A lush natural haven offering hiking trails and wildlife encounters.

Port Gellhorn: A once-popular vacation spot now in decay, hinting at a darker underbelly.

GTA 6 trailer hints at modern Vice City and first female lead

A return to Vice City in a modern, social media-influenced world

A Bonnie-and-Clyde-style crime duo narrative

Vast explorable map with surrounding rural areas and wetlands

Day-night cycles and dynamic weather systems

In-game parody of social media and modern internet culture

Rockstar Games the creator of GTA series has officially confirmed that Grand Theft Auto 6 (GTA 6) will release on May 26, 2026. With over a decade having passed since the release of Grand Theft Auto V in September 2013, GTA 6 has become one of the most eagerly awaited video game sequels in history. The initial expectation had targeted a release in late 2025, but Rockstar has now pushed the launch into the following year, citing quality standards and development needs as the primary reasons. This long-awaited update confirms the studio’s commitment to delivering a title that meets the expectations set by its predecessor and decades of innovation in the open-world gaming genre.The game will launch simultaneously across multiple regions, with North America's East Coast seeing the release at midnight on May 26, 2026, and the West Coast at 9 PM on May 25, 2026. Europe and Asia will gain access at midnight local time.For Indian gamers, the standard edition of GTA 6 is projected to be priced around Rs 5,999. Those looking for more exclusive content can expect deluxe or collector's editions to climb to approximately Rs 7,299 or higher. Internationally, the game could retail for as much as $100.GTA 6 will take players to the fictional state of Leonida, featuring the neon-lit streets of Vice City and its surrounding areas. The game follows Jason and Lucia, a duo caught in a high-stakes criminal conspiracy, navigating the darkest side of America’s sunniest place.Beyond the urban sprawl, players will explore a diverse landscape including:Despite the long development timeline, Rockstar has released only one official trailer for GTA 6—premiering in December 2023. The trailer introduced players to a modern-day Vice City, Rockstar’s fictional version of Miami, Florida. The game is expected to feature dual protagonists, reportedly named Lucia and Jason, marking the first time a female playable lead will be included in the series.Key details from the trailer and Rockstar’s previous statements include:Although no new images or footage were released alongside the May 2025 release date announcement, Rockstar has promised more information will be shared “soon.”","Rockstar games has confirmed that grand theft auto 6 will release on may 26, 2026. The game will take players to the fictional state of leonida, featuring the neon-lit streets of vice city and its surrounding areas. Gta 6 is expected to feature dual protagonists, reportedly named lucia and jason, marking the first time a female playable lead will be included in the series.","https://static.toiimg.com/thumb/msid-121434538,width-1070,height-580,imgsize-74580,resizemode-75,overlay-toi_sw,pt-32,y_pad-40/photo.jpg"
"Tata Digital CEO Naveen Tahilyani steps down, likely to join Prudential Plc",https://timesofindia.indiatimes.com/technology/tech-news/tata-digital-ceo-naveen-tahilyani-steps-down-likely-to-join-prudential-plc/articleshow/121360256.cms,"Tahilyani’s role was gradually narrowed as plans emerged to carve out BigBasket and 1mg for separate fundraises and eventual IPOs

Tata Digital CEO Naveen Tahilyani steps down

Naveen Tahilyani , the CEO and MD of Tata Digital has stepped own just after a year of being appointed by Tata Sons chairman N Chandrasekaran to lead the company’s digital commerce ambitions. Tahilyani’s departure marks the exit of another top level executive. As reported by Economic Times, Hardeep Guru, the chief financial officer of Tata Digital is being considered as the frontrunner for the position. Guru is said to be a close aide of Saurabh Agarwal, Group CEO, Tata Sons. While Tahilyani’s exit from Tata Digital was abrupt, reports suggest that he is transiting to Prudential Plc , with Tata Digital undergoing strategic changes.Tahilyani’s exit comes as Tata Sons seeks leadership stability to drive execution and growth across its consumer-facing digital businesses. The Economic Times report indicate that Hardeep Guru, the current CFO of Tata Digital is being considered for the role of CEO.The report also mentions that Tata Sons chairman N Chandrasekaran informed the staff in a town hall meeting about the exit of Tahilyani. Chandrasekaran also informed the CEO’s of Taga Digital portfolio companies about the change in the leadership.Tahilyani was tasked with reviving Tata Neu , the group’s super app launched in April 2022. Despite a 109% increase in gross merchandise value (GMV) and a user base of 140 million, Neu has struggled with cross-platform traction, contributing to less than 10% of BigBasket and 1mg’s gross sales.His tenure saw backend integration paused to preserve individual brand identities, while Tata Digital explored new revenue streams, including quick commerce under the Flash brand.Tahilyani’s departure coincides with Tata Group’s plans to raise $1.3 billion for BigBasket and 1mg, signaling a shift toward independent fundraising and IPOs for these businesses.Meanwhile, Tata Digital has renewed its IPL title sponsorship for five years, aiming to strengthen Neu’s brand presence and support new initiatives like Flash.","Tahilyani’s role was gradually narrowed as plans emerged to carve out bigbasket and 1mg for separate fundraises and eventual ipos. Hardeep guru, the chief financial officer of tata digital is being considered as the frontrunner for the position.","https://static.toiimg.com/thumb/msid-121360240,width-1070,height-580,imgsize-20326,resizemode-75,overlay-toi_sw,pt-32,y_pad-40/photo.jpg"
"What is Nvidia CEO Jensen Huang’s net worth? Know about this education, career and other details",https://timesofindia.indiatimes.com/technology/tech-news/what-is-nvidia-ceo-jensen-huangs-net-worth-know-about-this-education-career-and-other-details/articleshow/121490494.cms,"

Jensen Huang's net worth and recent surge

Jensen Huang’s early life and education

Jensen Huang's career and Nvidia’s foundation

Personal life and lifestyle of Jensen Huang

Jensen Huang is the co-founder and CEO of Nvidia, a company that has become a global leader in AI technology and advanced graphics processing. Known for his visionary leadership, Huang has transformed Nvidia from a gaming-focused chipmaker into a trillion-dollar tech powerhouse. As of May 2025, his net worth stands at approximately 11,830 crore USD or $118.3 billion. This massive fortune places him among the richest people in the world. Huang’s wealth recently surged after Nvidia signed a landmark AI chip deal with Saudi Arabia, further cementing his influence in the global AI boom.As of May 2025, Jensen Huang’s net worth is estimated at $118.3 billion. This surge came after Nvidia signed a major AI chip deal with Saudi Arabia. The deal involves supplying thousands of advanced chips to the Saudi startup Humain. Huang owns about 86 million Nvidia shares which is around 3.5 percent of the company, making him the largest individual shareholder.Huang’s total compensation in 2025 is nearly $50 million. This includes a base salary of $1.5 million, a $3 million bonus, and equity awards worth up to $27.5 million depending on performance. Most of his wealth comes from the rapid increase in Nvidia’s stock price.Jensen Huang was born in Tainan, Taiwan in 1963. He moved to the United States as a child and grew up in Oregon. Huang earned a bachelor’s degree in electrical engineering from Oregon State University and a master’s degree from Stanford University. His early interest in technology helped shape his future career in the tech industry.In 1993, Huang co-founded Nvidia with Chris Malachowsky and Curtis Priem. Originally focused on gaming graphics cards, Nvidia expanded under Huang’s leadership into a leader in GPU technology. These chips are now essential for AI, data centers, and autonomous systems. His decision to shift Nvidia’s focus to AI during the 2010s transformed the company into a trillion-dollar giant.Huang maintains a low profile despite his wealth. He is known for his trademark black leather jacket and calm demeanor. He is married with two children and lives in the San Francisco Bay Area in a high-value estate. Huang also donates to educational and healthcare causes.Jensen Huang is a transformative leader who turned Nvidia from a gaming chipmaker into a cornerstone of the AI economy. With Nvidia valued at over $3 trillion and demand for AI chips growing, Huang’s influence on technology and innovation is set to keep increasing.","Jensen huang is the co-founder and ceo of nvidia, a global leader in ai technology and advanced graphics processing. As of may 2025, his net worth stands at approximately 11,830 crore usd or $118.3 billion. Huang’s wealth recently surged after nvidia signed a landmark ai chip deal with saudi arabia, further cementing his influence in the global ai boom.","https://static.toiimg.com/thumb/msid-121490583,width-1070,height-580,imgsize-953838,resizemode-75,overlay-toi_sw,pt-32,y_pad-40/photo.jpg"
"Billionaire Mark Cuban on why he does not drive his Tesla, but much cheaper Kia EV6: On the Tesla you've got to find ...",https://timesofindia.indiatimes.com/technology/tech-news/billionaire-mark-cuban-on-why-he-does-not-drive-his-tesla-but-much-cheaper-kia-ev6-on-the-tesla-youve-got-to-find-/articleshow/121418068.cms,"Mark Cuban calls Elon Musk ‘thin skinned’

Elon Musk announces his exit from DOGE

Billionaire investor Mark Cuban has said that he is not impressed with the design choices of Tesla. Speaking at ""Your Mom's House"" podcast in March, he was asked ‘what's your favorite car?’. Cuban, who owns a Tesla replied with a grin “A Kia. EV6.” He further added “I like it. I'm comfortable with it.”Revealing that he hasn’t sold his Tesla ‘yet’, Mark Cuban explained: “On the Tesla you've got to find [the turn signal] and push the button… while you're driving. You can't pay attention to the road as much.”Praising Kia, he said: “It doesn't try to be too fancy. Your turn signal is like… a turn signal”.While Mark Cuban doesn’t mind driving a ‘cheaper’ Kia EV6, but his 15-year-old son isn’t impressed. When Cuban suggested handing down the car for driving practice, his son quickly shut it down, saying, “It’s not cool, Dad.” He even called it a “nerd car.” Cuban’s response? “Exactly,” he said, embracing the label.Mark Cuban is a known Elon Musk critic. Earlier this year on the ""Club Shay Shay"" podcast, Cuban admitted that he likes provoking Musk because he has ""really thin skin and it just makes it easy.""In another interview earlier this year, Cuban said “I have no problem throwing Elon under the bus, but I'll save it for when it's truly deserved.”Last year, when Musk encouraged users to share more positive content on X, Cuban wasted no time in delivering a sharp retort. “Please post a bit more positive, beautiful or informative content on this platform,” the Tesla CEO then wrote. Cuban commented “You first”.In a latest update, Musk has announced his exit from the Department of Government Efficiency (DOGE). In an X post, he wrote: “As my scheduled time as a Special Government Employee comes to an end, I would like to thank President @realDonaldTrump for the opportunity to reduce wasteful spending. The @DOGE mission will only strengthen over time as it becomes a way of life throughout the government.”","Billionaire investor mark cuban has said that he is not impressed with the design choices of tesla. Speaking at ""your mom's house"" podcast in march, he was asked ‘what's your favorite car?’ cuban, who owns a tesla replied with a grin ‘a kia. Ev6’","https://static.toiimg.com/thumb/msid-121418064,width-1070,height-580,imgsize-23096,resizemode-75,overlay-toi_sw,pt-32,y_pad-40/photo.jpg"
