Article Title,Article Link,Article Text,Article Summary,Article Image
Saudi Ministry of Interior unveils “Wing Drone” at Hajj conference to enhance pilgrim safety and security,https://timesofindia.indiatimes.com/world/middle-east/saudi-ministry-of-interior-unveils-wing-drone-at-hajj-conference-to-enhance-pilgrim-safety-and-security/articleshow/125266469.cms,"The Ministry’s Wing Drone monitors Hajj routes to Makkah and Madinah with AI-powered cameras/Representative Image



Deployment and purpose



Advanced technological features

Thermal and night-vision cameras: Capable of detecting activity in low-light or adverse weather conditions.

Artificial intelligence algorithms: Enable automated analysis of live footage to identify potential security threats or violations.

Real-time imagery transmission: Data is streamed directly to operations rooms and monitoring centers, ensuring officials can respond promptly and make informed decisions.

Public showcase at the Hajj conference



Impact on Hajj security and operations





Enhance monitoring along pilgrim routes.

Ensure compliance with Hajj regulations.

Provide rapid situational awareness to support decision-making.

Reduce the risks associated with large-scale gatherings.





The Saudi Ministry of Interior is highlighting its cutting-edge unmanned aerial vehicle, the “Wing Drone,” at the Hajj Conference and Exhibition in Jeddah. The drone is designed to enhance the security and monitoring of pilgrims traveling to Makkah and Madinah, using advanced technology to ensure compliance with Hajj regulations and support swift decision-making in the field.During the last Hajj season, the Ministry deployed the Wing Drone along major routes leading to the holy cities of Makkah and Madinah. Its primary purpose was to monitor violations of Hajj regulations and strengthen overall security surveillance. By patrolling these critical areas, the drone supports authorities in maintaining the safety and orderliness of the pilgrimage, which sees millions of visitors each year.The Wing Drone is equipped with sophisticated technology that allows it to operate in various conditions and provide real-time intelligence:These features combine to create a highly efficient surveillance tool, enhancing situational awareness for security personnel during one of the world’s largest annual gatherings.At the Ministry’s pavilion during the Jeddah exhibition, visitors can observe and learn about the Wing Drone’s capabilities firsthand.The demonstration emphasizes how the integration of AI and advanced imaging technologies improves operational efficiency and strengthens security oversight. This public display also underlines Saudi Arabia’s commitment to leveraging innovative solutions for the safety and well-being of pilgrims.By deploying drones like the Wing Drone, the Ministry of Interior aims to:The drone represents a significant advancement in the Kingdom’s approach to crowd management and safety during Hajj, combining technology with strategic oversight to protect millions of visitors each year.","The ministry’s wing drone monitors hajj routes to makkah and madinah with ai-powered cameras. Data is streamed directly to operations rooms and monitoring centers, ensuring officials can respond promptly and make informed decisions. The drone represents a significant advancement in the kingdom's approach to crowd management and safety during hajj.","https://static.toiimg.com/thumb/msid-125266581,width-1070,height-580,imgsize-616932,resizemode-75,overlay-toi_sw,pt-32,y_pad-40/photo.jpg"
"'Forced labor, withholding visa documents': H-1B visa holder from India sues US company; 'Squid Game for Indians'",https://timesofindia.indiatimes.com/world/us/forced-labor-withholding-visa-documents-h-1b-visa-holder-from-india-sues-us-company-squid-game-for-indians/articleshow/125254569.cms,"An H-1B visa holder from India has sued his US company, led by an Indian-origin CEO, for forced labor.

Big Relief For Indians: Donald Trump Clarifies $100K H-1B Fee Won’t Apply To Existing Visa Holders





Amrutesh Vallabhaneni, an H-1B visa holder in the US, has brought a lawsuit against his employer, accusing the company of forced labor, labor trafficking and withholding visa documents, Breitbart News reported. Jay Palmer, Vallabhaneni's consultant who prepared the lawsuit, said it is a Squid Game for Indian workers in the US job market, as the ultimate goal is to stay in America, surviving the exploitative culture, created by Indian CEOs. These Indian-origin CEOs import their ""home-country caste discrimination politics"" to their workplaces in the US, Palmer said.According to the report, Vallabhaneni studied in India, got an F-1 student visa and a loan to attend a US college in 2015. Then he got OPT (Optional Practical Training), worked at a New Jersey company and then in 2018 moved to the company that he sued. He moved to the company as they promised him H-1B. The lawsuit said that the company violated laws and asked Vallabhaneni to pay his own salary for a period of six months. They also did not pay Vallabhaneni the prevailing wage.But after all this, Vallabhaneni was not free to leave the company as they allegedly threatened to withdraw his H-1B if he did not comply with their requests.The company also promised a green card but continued to pressure Vallabhaneni to accept their terms and conditions; otherwise he would have to leave the US.""Despite being guaranteed a wage by the DOL, AV (Amrutesh Vallabhaneni) often barely had enough money for rent and living expenses for himself and his family. Because of the broken promises and inconsistent pay, his health insurance lapsed, he missed credit card payments, and he and his wife lacked access to needed healthcare. At one point, AV suffered a serious leg injury, but he couldn’t see a doctor,"" the lawsuit said.The company extracted a huge amount of money from AV, forcing him to pay all the visa fees and keeping him on the hook. The report said Vallabhaneni is still working with the company as he waits for the Green Card.","Amrutesh vallabhaneni, an h-1b visa holder in the us, has brought a lawsuit against his employer. He accused the company of forced labor, labor trafficking and withholding visa documents. The lawsuit said that the company violated laws and asked him to pay his own salary for six months.","https://static.toiimg.com/thumb/msid-125254544,width-1070,height-580,imgsize-38518,resizemode-75,overlay-toi_sw,pt-32,y_pad-40/photo.jpg"
OpenAI used lyrics in violation of copyright laws: German court,https://timesofindia.indiatimes.com/world/europe/openai-used-lyrics-in-violation-of-copyright-laws-german-court/articleshow/125263120.cms,".

OpenAI's Master Plan for India





MUNICH: OpenAI’s chatbot ChatGPT violated German copyright laws by reproducing lyrics from songs by best-selling musician Herbert Groenemeyer and others, a court ruled on Tuesday, in a closely watched case against the firm over its use of lyrics to train its language models. The regional court found that the company trained its AI on protected content from nine German songs, including Groenemeyer’s hits “Maenner” and “Bochum”. The case was brought by German music rights society GEMA.Presiding judge Elke Schwager ordered OpenAI to pay damages for the use of copyrighted material, without disclosing a figure.OpenAI had argued that its language models did not store or copy specific training data but, rather, reflected what they had learned based on the entire training data set.Since the output would only be generated as a result of user inputs known as prompts, it was not the defendants, but the users who would be liable, OpenAI had argued. However, the court found that both the memorisation in the language models and the reproduction of the song lyrics in the chatbot’s outputs constitute infringements of copyright exploitation right.“We disagree with the ruling and are considering next steps,” a spokesperson for OpenAI said. “The decision is for a limited set of lyrics and does not impact the millions of people who use our technology every day.”REUTERS",Openai's chatbot violated german copyright laws by reproducing lyrics from songs by best-selling musician herbert groenemeyer and others. The case was brought by german music rights society gema. Presiding judge elke schwager ordered openai to pay damages for the use of copyrighted material.,"https://static.toiimg.com/thumb/msid-125263116,width-1070,height-580,imgsize-438326,resizemode-75,overlay-toi_sw,pt-32,y_pad-40/photo.jpg"
Shein and Temu continue march across Europe as sales rise,https://timesofindia.indiatimes.com/world/europe/shein-and-temu-continue-march-across-europe-as-sales-rise/articleshow/125253910.cms,"Picture source: Deutsche Welle

Ultracheap and still duty-free

Millions of packages from China

Protecting consumers in the EU

EU authorities are not sitting still

EU countries are not sitting still either





When Chinese fast-fashion online retailer Shein opened its first boutique last week, there were both protests and a crowd of shoppers.The brick-and-mortar shop inside the BHV Marais department store in central Paris hit a nerve and not just because it is in the home of haute couture. It was a love-hate response to the company seen in many other areas.Shein, which is often put in the same category as the Temu online platform that allows manufacturers to sell much more than just fashion directly to consumers, has been criticized for things like counterfeits, aggressive marketing, poor working conditions, and unsafe products. Despite that, many are happy with more shopping options and the cheap prices.Though the two companies are different and have different business models, the result is often the same: a flood of cheap Chinese goods and the packaging to go along with it.Besides simply being ultracheap, another factor that played in the companies' favor is the European Union 's exemption from import duties for packages valued under €150 ($174).The US had a similar loophole for packages valued under $800 (€691), but has changed its regulations leading to a reduction in shipments.The EU is in the final stages of passing a similar rule to close its own low-value loophole, though it may not come into force until 2028.In the first half of 2025, Temu had an average of 115 million monthly active users in the EU and Shein had 145 million, according to their own numbers. For both platforms, this is around 12% more than the previous six months.One of the biggest concerns about these Chinese e-commerce platforms is sustainability. A majority of goods bought on their platforms are sent directly to consumers around the world from manufacturers in China. These individually packed goods are flown in for quick delivery and overwhelm customs authorities and often cannot be returned.Environmental groups are concerned about the clothing waste caused by cheap fast fashion, the plastic and cardboard packaging trash, plus the emissions from all those flights to move the goods around the world. And the numbers are indeed huge.In 2024, around 4.6 billion low-value items were imported into the EU, according to a report published in February by the EU executive Commission. That is twice the number in 2023 and more than triple the number in 2022.Of these 12 million packages a day, 91% are from China. Not all of these packages are from Temu or Shein, but together they have a huge share of the pie.""Europe is inundated by a tsunami of small parcels coming from China, and it's not about to stop,"" Agustin Reyna, director general of the Brussels-based European Consumer Organization (BEUC), told DW.Besides sustainability issues, consumer protection watchdogs and the European Commission have repeatedly warned of unsafe products that don't meet EU standards.New test results published on October 30 by Stiftung Warentest, an independent organization based in Berlin that specializes in product testing, reinforce what many fear.The tests, which were conducted with groups from Belgium and Denmark, showed dramatic results. Together, they looked into necklaces, USB chargers and baby toys.Of the 162 items purchased from manufacturers selling through Temu and Shein, 110 were not up to EU standards, and around a quarter were potentially dangerous. Some of the items had high levels of formaldehyde or heavy metals like cadmium. Some of the USB charges simply got too hot.The European Consumer Organisation thinks flouting safety regulations leads to unfair competition since some companies sell products that do not meet European safety standards, while local companies must follow such rules.In May, the EU Commission notified Shein about practices on its platform that infringe EU consumer law. Among the complaints are fake discounts, pressuring consumers to complete purchases, misleading information about consumers' legal rights, deceptive product labels and misleading sustainability claims.In July, the Commission preliminarily found that Temu is in breach of its obligations under the Digital Services Act by not doing enough to stop the sale of illegal products. Further investigations are ongoing and could lead to a large fine.In October, Germany's antitrust authority, the Cartel Office, initiated proceedings against Temu. They want to see if the platform is possibly influencing the pricing on its German online marketplace, including setting the final selling prices.In August, Shein was fined €1 million by Italy's competition authority for using misleading environmental claims.In July, Shein was fined €40 million by France's competition agency for misleading discounts and environmental claims. That brings total French fines for the company this year to €191 million.France has gone a step further and is working on new regulations for fast-fashion companies like Temu and Shein. If approved, it would ban their ads in France, force them to report on the environmental effects of their goods and add a levy of up to €10 for each garment bought.Big fines and more regulations may slow Chinese e-commerce giants but will not stop them.""Europe needs to get its act together and make Temu and Shein accountable,"" said Agustin Reyna. ""We need clear responsibilities and deterrent consequences when the products they sell break our rules.""To make this happen, the EU needs ambitious customs reform and market surveillance. But if the EU allows packages valued under €150 to come in duty-free until 2028, companies will continue to take advantage of the loophole and European customers will likely keep shopping.","In 2024, around 4.6 billion low-value items were imported into the eu. Of these 12 million packages a day, 91% are from china. European consumer organization: ""europe is inundated by a tsunami of small parcels coming from china"" in october, germany's antitrust authority initiated proceedings against temu.","https://static.toiimg.com/thumb/msid-125253928,width-1070,height-580,imgsize-24802,resizemode-75,overlay-toi_sw,pt-32,y_pad-40/photo.jpg"
Redditor complains about returning to India after 7 years from a 'European country': 'Then go back',https://timesofindia.indiatimes.com/world/europe/redditor-complains-about-returning-to-india-after-7-years-from-a-european-country-then-go-back/articleshow/125227662.cms,"A Redditor made a controversial post questioning his decision to return to India after spending 7 years in a European country.

Here's the Reddit post

A Redditor made a controversial post about his experience of coming back to India after 7 years.





A Redditor's post went viral after the man questioned his decision to come back to India after staying seven years in one of the happiest European countries. The man spoke about pollution, traffic, civic sense of people and also complained about India's fruits and milk. Summing up his experience in India, the Redditor said everything is messed up here.""Returned to india after 7 years from one of the happiest European country. Main reason was, I am a single child so wanted to stay with parents when they are aging. It's been 6 months now but we (me and my wife) are not able to adjust here. We try to find positive things but honestly it's so difficult. Never wanted fancy things in life but simple things like peaceful walk, taking kids to open public spaces nearby , spending time in nature without going far are not possible. Air is polluted, food is not good ( fruits and milk specially ), traffic and roads are so bad. Biggest concern is civic sense. It is so bad that my kid keep asking me so many questions.His life was much better there and I feel I did injustice to him. Approaching 40 in few years and after coming back realized that surviving here professionally with this much experience is very difficult for my skillset. Seems everything is messed up in india,"" the man wrote.As the Redditor did not mention the state in India, social media users pointed out that it's unrealistic to expect that everything in India would change only in seven years. ""You should not have come back. And if you can, go back now. India will become only worse from here,"" one wrote.Some agreed with the Redditor's point of view and opined that India was much different and better when these people left India. ""People have that picture of India and all of a sudden that picture is broken once they are back to this new India,"" one wrote.""What is the purpose of your post? If you can move back to your foreign country please do. Otherwise, what are you even asking here. Or are trying to imply that those who are returning to their home to be with parents or for whatever reasons should not return because YOU do not like it in India. What a way of imposing your personal limited world view on other Indians!"" one wrote. Some pointed out that the person has been ranting against India on Reddit in various posts, not seeking any genuine advice.","A redditor made a controversial post about his experience of coming back to india after 7 years. The man spoke about pollution, traffic, civic sense of people and also complained about india's fruits and milk. Social media users pointed out that it's unrealistic to expect that everything in india would change only in seven years.","https://static.toiimg.com/thumb/msid-125227764,width-1070,height-580,imgsize-null,resizemode-75,overlay-toi_sw,pt-32,y_pad-40/photo.jpg"
China emissions flat in third quarter as solar surges: Study,https://timesofindia.indiatimes.com/world/china/china-emissions-flat-in-third-quarter-as-solar-surges-study/articleshow/125253806.cms,"Representative image

Fujian Vs Ford: China Unveils Its Most Advanced Carrier, Reshaping Indo-Pacific Power Balance





PARIS: China's CO2 emissions remained flat in the third quarter as power generation from solar energy surged and electric car use continued to grow, a study showed on Tuesday.Emissions from the world's biggest polluter have now been flat or falling for 18 straight months, said the analysis published by climate news specialist Carbon Brief.""After the first three quarters of the year, China's CO2 emissions in 2025 are now finely balanced between a small fall or rise, depending on what happens in the last quarter,"" said Lauri Myllyvirta, lead analyst at the Centre for Research on Energy and Clean Air.""A drop in the full-year total became much more likely after September, which recorded an approximately three percent drop in emissions year-on-year,"" said Myllyvirta, who is also a senior fellow at the Asia Society Policy Institute.The new analysis, which is based on official Chinese data, comes as the UN's COP30 climate conference kicked off in Brazil on Monday.""While an emission increase or decrease of one percent or less might not make a huge difference in an objective sense, it has heightened symbolic meaning,"" Myllyvirta said.""China's policymakers have left room for emissions to increase for several more years, leaving the timing of the peak open,"" he added.Emissions from the power sector, China's dominant source of CO2, remained flat in the third quarter despite strong demand for electricity, Myllyvirta said.Electricity generation from solar energy rose 46 percent while wind grew 11 percent compared to the same period last year.Emissions from transport fuel dropped by five percent, with declines also in cement and steel production.Oil demand and emissions grew elsewhere by 10 percent as the production of plastics and other chemicals surged, the analysis found.In September, China issued its first-ever absolute targets for cutting planet-warming gases.Under the new plan, China will reduce economy-wide emissions by seven to 10 percent by 2035 relative to the year of the country's peak emissions, believed to be 2025.China had previously pledged to peak its carbon output before 2030 and achieve carbon neutrality by 2060, without ever previously setting near-term numerical targets for total emissions reductions.",Emissions from the world's biggest polluter have now been flat or falling for 18 straight months. Power generation from solar energy surged and electric car use continued to grow. Oil demand and emissions grew elsewhere by 10 percent as the production of plastics and other chemicals surged.,"https://static.toiimg.com/thumb/msid-125253831,width-1070,height-580,imgsize-1011412,resizemode-75,overlay-toi_sw,pt-32,y_pad-40/photo.jpg"
"Oman cultural visa 2025 : Here's how artists, researchers can live, work, and bring their families along",https://timesofindia.indiatimes.com/world/middle-east/oman-cultural-visa-2025-heres-how-artists-researchers-can-live-work-and-bring-their-families-along/articleshow/125304958.cms,"Oman launches cultural visa to attract global talent / AI-generated illustration

Unprecedented durations

Affordable fees and family inclusion



Applicant Type Visa/Residency Duration Annual Fee (Omani Rials - RO) Main Applicant 1, 5, or 10 Years RO50 Joining Family 1 Year RO10 Joining Family 5 or 10 Years RO50

Eligibility and sponsorship requirements



Oman Vision 2040





The Sultanate of Oman has initiated a monumental shift in its immigration policy, positioning itself as a premier destination for the world's creative elite. Announced through Decision No. 156/2025 and officially taking effect on November 10, 2025, the government has introduced a brand-new Cultural Visa and Cultural Residence category, marking a fundamental update to the country’s existing laws on foreign residency.Oman’s new residency scheme is deliberately structured for longevity, encouraging international contributors to establish deep roots rather than planning transient stays. Applicants are offered highly flexible validity choices: both the visa and the subsequent residency are accessible for periods of one year, five years, or a maximum of ten years.This commitment to long-term residency affords scholars the necessary time to pursue multi-year research projects and allows artists to develop lasting ties to the local community and region. Furthermore, the program is exceptionally inclusive: spouses and first-degree relatives are eligible for a Cultural Joining Visa or Residence, supporting professionals who relocate with their families.One of the most attractive elements of the new policy is the remarkably budget-conscious fee structure.The costs are deliberately low to encourage long-term commitment, signaling that Oman views cultural contribution as a high-value investment. The fees are set at an annual rate, regardless of the chosen validity, and are clearly differentiated for the main applicant versus accompanying family members.This structure ensures that the financial burden of the permit itself remains minimal, allowing professionals to dedicate resources to their creative endeavors. The new resident must remember to enter the Sultanate within three months of the visa's issuance to officially validate the document.Eligibility is broad, encompassing individuals across the entire cultural and academic spectrum. The new visa targets professionals who enrich the creative environment, including writers, poets, performers, designers, researchers, musicians, and curators. The primary administrative requirement involves securing a local sponsor: the visa is processed only upon the request of a recognised Omani cultural body. This institutional sponsor, such as a government ministry, a university, a festival organizer, or an established cultural center confirms the legitimate purpose of the applicant's presence.This program transcends immigration reform; it is a critical strategy underpinning Oman Vision 2040, the national blueprint for economic diversification. By directly attracting global intellectual talent, Oman is making a decisive pivot toward establishing itself as a future creative capital. The policy is designed to foster profound knowledge collaboration, boost cultural tourism, and generate new economic value driven by the arts.The initiative sends a clear message: Oman is looking outward, seeking to augment its national heritage by integrating global ideas and providing a dynamic new stage for the world’s most talented creators.",Oman launches cultural visa to attract global talent. The new visa targets professionals who enrich the creative environment. Spouses and first-degree relatives are eligible for a cultural joining visa or residence. The primary administrative requirement involves securing a local sponsor.,"https://static.toiimg.com/thumb/msid-125305966,width-1070,height-580,imgsize-24362,resizemode-75,overlay-toi_sw,pt-32,y_pad-40/photo.jpg"
