Article Title,Article Link,Article Text,Article Summary,Article Image
"Deepfake danger: If everything can be faked, how do you know what's real?",https://timesofindia.indiatimes.com/india/deepfake-danger-if-everything-can-be-faked-how-do-you-know-whats-real/articleshow/125314919.cms,"Ai-Generated Image

Bihar Alliance View i

Party View Seats: 243 L + W Majority: 122 NDA 0 MGB 0 OTH 0 Experience Bihar Election Results in 3D A new interactive way to explore constituencies Source: PValue

Armour up with TOI to fight deepening threat of deepfakes

In a world where seeing is no longer believing, India is facing a new digital menace: AI-generated deepfakes.These hyper-realistic videos and audio clips don't just distort reality. They manipulate public perception, spread misinformation and undermine trust in democracy itself.With 85.5% of Indian households owning at least one smartphone, mobile phones have become India's bank, classroom and television, making citizens more vulnerable to digital deception.During the 2024 elections, for instance, satirical deepfakes became a campaign tool of sorts. Apart from resurrecting dead leaders, it featured clips such as one that featured PM Narendra Modi dancing the garba with women and Kamal Nath dissing a popular welfare scheme.Though investigations and arrests followed, such videos blur the line between fact and fiction, risking the distortion of voter opinion and the integrity of the democratic process.Cybersecurity experts warn AI is also becoming a key tool in cybercrime: 80% phishing campaigns in 2024 involved AI, with deepfakes exploited for scams. ""When you can fake images, audio, and video, how do you know if a real video is real? Suddenly, everything is in question,"" said Hany Farid, professor at University of California, Berkeley, in a TOI interview last year about the worrying rise in AI misuse.The deepfake threat extends beyond politics. Recently, finance minister Nirmala Sitharaman highlighted the misuse of AI to clone voices and produce fake videos impersonating her, warning of potential financial scams and the erosion of public trust. ""I have seen several deepfake videos of myself being circulated online, manipulated to mislead citizens and distort facts,"" Sitharaman said at an event in Mumbai. ""Criminals are using AI to mimic voices, clone identities, and create lifelike videos that can manipulate people,"" she added.Given that over 97% of India's urban youth aged 15 to 29 owns a smartphone, the impact of such misinformation on a generation is worrying, say observers. ""Deepfakes began in 2016. Back then, it was a joke. But the technology has only gotten better. Earlier, there were photoshopped face swaps. Now there are lipsync fakes,"" said Prof. Farid, warning that the tech has become more refined, raising the risk of harassment of women through the use of non-consensual sexual imagery.In Nov 2023, actress Rashmika Mandanna became a victim of a viral deepfake video that superimposed her face on to compromising content, sparking widespread outrage. ""The very term 'deepfake' comes from a Reddit user who in the early days of this technology used it to create porn,"" said Farid, calling the new term 'Generative AI' clever ""rebranding"" by the male-dominated tech industry.As AI evolves, India must strengthen legal frameworks, enhance digital literacy, and bring together minds across sectors to ensure safety, say experts. ""We need to label everything as real or not real,"" said Farid. ""We need real disclosures,"" he added. To combat the deepening threat of deep fakes, TOI has already started armouring up. Watch out for our 'Don't Get Scammed' stories to stay informed and aware. After all, as Farid puts it, ""if you don't know what's real, how will you know what's false""?","Armour up with toi to fight deepening threat of deepfakes. 85.5% of indian households owning at least one smartphone. Mobile phones have become india's bank, classroom and television. 80% phishing campaigns in 2024 involved ai.","https://static.toiimg.com/thumb/msid-125315194,width-1070,height-580,imgsize-23544,resizemode-75,overlay-toi_sw,pt-32,y_pad-40/photo.jpg"
Why are Stephen Curry and Under Armour parting ways? Major move signals new chapter for Golden State Warriors icon,https://timesofindia.indiatimes.com/sports/nba/top-stories/why-are-stephen-curry-and-under-armour-parting-ways-major-move-signals-new-chapter-for-golden-state-warriors-icon/articleshow/125313239.cms,"Stephen Curry and Under Armour are parting ways (Image via NBA)

Stephen Curry and Under Armour stand at a surprising crossroads facing an unexpected twist

When Stephen Curry of the Golden State Warriors decided to pursue his signature sneakers with Under Armour, he set his own course. However, Under Armour stated on Thursday that they have split from Curry, and now the NBA pro will run the Curry Brand on its own. Following the release of his 13th and last signature shoe, Curry is leaving, concluding a 13-year collaboration.It happened after the debut of Curry's next signature shoe. It puts an end to a long-standing connection that began before Curry's first NBA championship. It is anticipated that Curry would take the ""Curry Brand"" with him as a stand-alone business. He is currently more valuable than ever because he has never been a sneaker free agent.Stephen Curry and Under Armour announced on Thursday that they had mutually decided to terminate their 13-year collaboration with immediate effect. At a time when the sportswear company is having trouble boosting sales, the abrupt move splits Curry Brand from Under Armour.Curry is now free to choose another retail partner. Although there seems to have been some desire for the Curry Brand to remain independent, it's not immediately evident what caused this separation.In a press release, Under Armour said:""Under Armour Inc. and Stephen Curry today announced plans to separate Curry Brand from Under Armour, ending a partnership that has redefined performance product and athlete-led storytelling for more than a decade. Under Armour, with a disciplined focus on its namesake brand, will develop new UA Basketball products and continue to support athletes and programs across every level of the game.""Addressing the whole thing, Steph said during a podcast:“Under Armour believed in me early in my career and gave me the space to build something much bigger and more impactful than a shoe. I'll always be grateful for that. What Curry Brand stands for, what I stand for and my commitment to that mission will never change.”Meanwhile, Under Armour CEO Kevin Plank said in a statement:“For Under Armour, this moment is about discipline and focus on the core UA brand during a critical stage of our turnaround.. And for Stephen, it’s the right moment to let what we created evolve on his terms. We’ll always be grateful for what he’s brought to the UA team.”It is anticipated that Curry would take the ""Curry Brand"" with him as a stand-alone business. According to a statement from Curry, via CNBC:""What Curry Brand stands for, what I stand for and my commitment to that mission will never change, it’s only growing stronger.. I'm excited for a future that's focused on aggressive growth with a continued commitment to keep showing up for the next generation.""After four years with Nike, Steph signed a contract with Under Armour in October 2013. After twelve years, the collaboration is coming to an end. One more Curry shoe is still on the horizon from Under Armour. As scheduled, the Curry 13 will debut in February 2026.Also read: What did Stephen Curry write to Ayesha Curry before dating? Actress recalls how the NBA star’s flirty message later turned into something real","Stephen curry and under armour announced on thursday that they had mutually decided to terminate their 13-year collaboration with immediate effect. It is anticipated that curry would take the ""curry brand"" with him as a stand-alone business. One more curry shoe is still on the horizon, the curry 13 will debut in february 2026.","https://static.toiimg.com/thumb/msid-125313281,width-1070,height-580,imgsize-46246,resizemode-75,overlay-toi_sw,pt-32,y_pad-40/photo.jpg"
"Yonna Jay net worth in 2025: TikTok star’s earnings, sponsorships, and brand deals explored",https://timesofindia.indiatimes.com/world/us-streamers/yonna-jay-net-worth-in-2025-tiktok-stars-earnings-sponsorships-and-brand-deals-explored/articleshow/125298559.cms,"Yonna Jay's estimated net worth in 2025 is roughly $420k (Image via: y0nn.4/Instagram)

Yonna Jay’s net worth and income breakdown

I Bought A New Tiny Home In Atlanta!

Yonna Jay career

“The Problem with Pick Me Girls,”

@yonna.jay

Yonna Jay brand deals , sponsorships, and endorsements

Yonna Jay family, early life, and personal background





Yonna Jay has quietly built one of the fastest-growing creator careers of Gen Z. From posting her first TikTok at just 13 to commanding millions of followers across platforms, her story blends early internet charm with calculated brand partnerships.Back in July 2020, the then–middle schooler from North Carolina uploaded her very first TikTok under the playful username @elmo_love_u2, never revealing her real name until much later. What began as simple lip-syncs and fun clips soon evolved into full-fledged content creation across TikTok, YouTube, and Instagram. Now, at just 18, Yonna Jay is not just another influencer; she’s a name synonymous with the Gen Z digital hustle.As of 2025, Yonna Jay’s net worth is estimated at $420,000, according to verified online sources. Her earnings come primarily from TikTok brand partnerships, YouTube ad revenue, and selective sponsorship deals.Yonna has worked with popular lifestyle and fashion brands, most notably Fashion Nova, a go-to partner for many young creators. Her business inquiries once listed yonna@trendsignite.com, but she’s now represented by Fixated, a known influencer talent agency.That transition marks her growth from being a young viral star to a managed digital brand.It all began in July 2020, when quarantine boredom met teenage creativity. Yonna started posting videos of her best friend and lighthearted skits, unknowingly stepping into the world that would define her future.By 2023, she debuted her YouTube channel, posting her first video,nearly three years after her TikTok launch. Her YouTube presence now includes over 220 videos and more than 36,000 subscribers.Her TikTok account,, currently boasts over 2.7 million followers, with 900,000 followers on Instagram and 213,000 on Twitch, where she interacts directly with her fan base. While her content remains fun and personality-driven, her posting style reflects a creator who understands trends, and how to stay at the center of them.Yonna Jay’s main source of income stems from TikTok brand partnerships. Her collaborations with Fashion Nova and other lifestyle labels showcase her ability to merge Gen Z humor with influencer marketing.These sponsorships, paired with ad revenue from YouTube and platform-based bonuses, make up the bulk of her $420K valuation.Born on November 10, 2006, in North Carolina, Yonna Jay is of African-American and White-American descent. She grew up alongside her older brother, Vora, with whom she often appears in posts.A Christian by faith, she includes “God did” and a cross emoji in her Instagram bio. She’s a high school graduate, celebrating her senior prom in April 2025 and her graduation in June of the same year. While she hasn’t revealed future education plans, Yonna continues to focus on her creator career.","Yonna jay is one of the fastest-growing creator careers of gen z. She has over 2.7 million followers on tiktok, 900,000 followers on instagram and 213,000 on twitch. Her earnings come primarily from tiktok brand partnerships, youtube ad revenue, and selective sponsorship deals.","https://static.toiimg.com/thumb/msid-125298721,width-1070,height-580,imgsize-264599,resizemode-75,overlay-toi_sw,pt-32,y_pad-40/photo.jpg"
What is Beast Land? Everything to know about MrBeast’s first-ever theme park in Saudi Arabia,https://timesofindia.indiatimes.com/world/us-streamers/what-is-beast-land-everything-to-know-about-mrbeasts-first-ever-theme-park-in-saudi-arabia/articleshow/125308612.cms,"Image Via Instagram

Beast Land turns MrBeast’s YouTube universe into a real-world experience

“in the middle of the world,”





MrBeast’s highly anticipated Beast Land is finally open, marking the YouTuber’s boldest leap yet from online entertainment to real-world experiences. The 45-day pop-up theme park, located in Riyadh as part of Riyadh Season 2025, brings his famous YouTube challenges to life through large-scale attractions, obstacle courses, and adrenaline-pumping rides. Open from November 13 to December 27, Beast Land lets fans physically step inside the chaotic, high-energy world that has made MrBeast the most-subscribed YouTuber in history, with over 450 million followers worldwide.The theme park includes rides and games inspired by his viral stunts, from the catapult-powered Tower Siege to the heart-stopping Drop Zone trap doors and a zipline called Air Mail. Visitors can also take on two roller coasters, a 165-foot bungee jump, and a Sling Shot ride, all while exploring themed zones filled with challenges and merchandise. Ticket prices range from $7 for basic entry to $66 for full access, offering multiple tiers of engagement for fans eager to experience MrBeast’s universe beyond the screen.Beast Land isn’t just a theme park; it’s a test of how far creator-driven brands can go offline. With the global creator economy expected to hit $500 billion by 2027, creators like MrBeast are increasingly turning to physical experiences to strengthen fan loyalty and diversify revenue.Riyadh Season’s partnership with the YouTuber also aligns with Saudi Arabia’s mission to position itself as a global entertainment hub, having already surpassed 100 million annual visitors in 2024.For MrBeast, born Jimmy Donaldson, Beast Land represents more than entertainment; it’s an experiment in experiential marketing. By transforming his digital content into real-life challenges, he’s testing whether fans who watch for free online will pay to step inside his world. In a recent X post, he said he chose Riyadh because it sitsallowing his massive non-U.S. fanbase to participate directly.Whether it’s a pop-up success or the start of something bigger, Beast Land could redefine what it means to be a creator brand. If fans show up in droves, MrBeast won’t just have built a theme park, he’ll have built a blueprint for the future of creator-led entertainment.Also Read: Sneako reacts to Kash Patel–Alexis Wilkins ‘honeypot’ claims amid online controversy","Mrbeast’s beast land is a 45-day pop-up theme park in riyadh, saudi arabia. It brings his famous youtube challenges to life through large-scale attractions and obstacle courses. Ticket prices range from $7 for basic entry to $66 for full access, offering multiple tiers of engagement.","https://static.toiimg.com/thumb/msid-125308592,width-1070,height-580,imgsize-164643,resizemode-75,overlay-toi_sw,pt-32,y_pad-40/photo.jpg"
Zoho founder Sridhar Vembu on Arattai app dropping out of top 100 list: ‘I literally told our employees…’,https://timesofindia.indiatimes.com/technology/tech-news/zoho-founder-sridhar-vembu-on-arattai-app-dropping-out-of-top-100-list-i-literally-told-our-employees/articleshow/125278324.cms,"Vembu: Zoho has long-term strategy









Zoho Corporation founder and CEO Sridhar Vembu has responded to his company's messaging app Arattai falling out of the top 100 apps list, calling it a normal part of business development and dismissing critics as wasting their time. In an interview with ANI, Vembu addressed questions about WhatsApp testing a feature that would allow users to message people on other platforms.“There's nothing going wrong. I think, first of all, the idea that something went wrong is what is wrong. It is a normal course of events. Nothing goes straight to the moon. You have to go through these ups and downs,” Vembu was quoted as saying.He emphasised that companies that survive maintain a long-term perspective.“The trick to companies that survive is they have a long-term view on this. In fact, I never thought The number one is anything big. In fact, I literally told our employees, this is a particular moment, it won't last,” he added.“That's why I simply don't pay attention. And the people who pay attention and making fun of this, they are wasting their time. That's all I'll say. We are not wasting time. I am sitting and we are sitting and focused on code.So I said, don't worry about it,” Vembu noted, pointing out that Zoho views Arattai as a five to 15-year project rather than a short-term venture.Vembu revealed that Zoho has worked on messaging technology for 10 years, making the recent ranking drop insignificant.“Our strategy in all this, the messaging is very core. And we have been working on it for 10 years. So this one month is nothing for us. We will continue this and we have a really strong app. It's getting stronger,” the cofounder was quoted as saying.The company plans frequent updates to improve Arattai. Vembu argued that credible competition is necessary to prevent monopolistic practices in the messaging app market.“If we don't have competition, you can't keep the monopolist honest. The only thing that keeps a monopolist honest is competition,” he said.While talking about end-to-end encryption of chats on Arattai, Vembu noted that the encryption feature has been implemented, however, it will take some more time for the updates to take effect.","Vembu: zoho has long-term strategy for messaging app arattai. Company plans frequent updates to improve the app. Vembu argued that credible competition is necessary to prevent monopolistic practices in the messaging app market. He added that the people who pay attention and making fun of this, they are wasting their time.","https://static.toiimg.com/thumb/msid-125278316,width-1070,height-580,imgsize-34710,resizemode-75,overlay-toi_sw,pt-32,y_pad-40/photo.jpg"
Valve unveils Steam Machine console: Features and other details,https://timesofindia.indiatimes.com/technology/gaming/valve-unveils-steam-machine-console-features-and-other-details/articleshow/125290411.cms,"Image credit: X (Twitter)

Valve Steam Machine price and release date





Announcing: New

@Steam Hardware, coming in 2026: Steam Controller, Steam Machine, Steam Frame. Watch our jazzy announcement video and wishlist now: http://steampowered.com/hardware.""

Valve Steam Machine console: Key highlights

Category Details CPU AMD Zen 4 (6 cores / 12 threads, up to 4.8GHz) GPU Custom AMD RDNA 3 (28 compute units, 8GB GDDR6 VRAM) RAM 16GB DDR5 (upgradeable) Storage NVMe SSD (512GB or 2TB), expandable via slot or microSD Performance 4K 60FPS gaming with FSR upscaling and ray tracing; ~6x more power than Steam Deck; handles titles like Cyberpunk 2077 and Starfield smoothly Connectivity HDMI 2.0, DisplayPort 1.4, Wi-Fi 6E, Bluetooth, multiple USB ports Steam Library Support Runs full Steam library on SteamOS Windows Game Support Proton compatibility makes most Windows games work seamlessly Supported Titles examples Baldur’s Gate 3, Counter-Strike 2, Elden Ring Software Flexibility Supports other OSs, game launchers, and emulators Peripherals Support Works with most controllers and accessories; new Steam Controller integrates cleanly





Valve has officially announced a new video-game console -- Stream Machine, designed to bring PC gaming to the living room. Set to launch in 2026, the Steam Machine blends console convenience with PC-grade performance, offering gamers a fresh alternative to traditional platforms like PlayStation and Xbox. The Steam Machine is a cube-shaped compact gaming console which is built to run on Valve’s SteamOS and play games directly from users’ Stream libraries. The gaming console is designed for plug and play use with televisions, making it ideal for gamers who want to experience PC-level performance without a full desktop setup.Valve claims that the Steam Machine is six times more powerful than the Steam Deck. The gaming console is powered by semi-custom AMD Zen 4 CPU ans AMD RDNA3 GPU. Steam Machine also support 4K gaming at 60 FPS with FSR (FidelityFX Super Resolution). The gaming console packs 16GB of RAM and 8GB of GDDR6 VRAM. The company is giving two storage options for Steam Machine which includes — 512GB and 2TB.Valve has also announced that the Stream Machine console will come with a revised Steam Controller which will offer improved ergonomics and haptic feedback. Along with this, Valve has also teased the Steam Frame which is a new VR headset designed to play both virtual and reality titles and standard Steam games on a virtual 2D screen.The Steam Machine is scheduled to launch in 2026, though Valve has not yet confirmed a specific release month or pricing. It will be available both as a standalone console and in bundles with the Steam Controller.Valve also said that the Steam Machine is built for modularity and portability, with a form factor small enough to fit under a TV or in a travel bag. The company also claims that the gaming console is designed to for gamers who want high-end performance without the complexity of building or maintaining a gaming PC.To announce the new hardware, the company took to social media platofrm X and wrote: ""Here are the key specs, features, software support and other detials of the upcoming Valve Steam Machine console:","Valve has officially announced a new video-game console -- stream machine, designed to bring pc gaming to the living room. Set to launch in 2026, the steam machine blends console convenience with pc-grade performance. The gaming console is powered by semi-custom amd zen 4 cpu ans amd rdna3 gpu.","https://static.toiimg.com/thumb/msid-125297485,width-1070,height-580,imgsize-27028,resizemode-75,overlay-toi_sw,pt-32,y_pad-40/photo.jpg"
"Nvidia CEO Jensen Huang to Mark Zuckerberg: I would have dropped out of college, if I had known …",https://timesofindia.indiatimes.com/technology/tech-news/nvidia-ceo-jensen-huang-to-mark-zuckerberg-i-would-have-dropped-out-of-college-if-i-had-known-/articleshow/125125049.cms,"Mutual admiration and playful banter

Microsoft’s AI Bet Pays Off: Company Joins Nvidia in $4 Trillion Club

Nvidia’s journey from $200 startup to $5 trillion company

Mark Zuckerberg’s dorm room to trillion-dollar empire

Nvidia Makes History: First Company to Hit $4 Trillion Market Cap





Nvidia CEO Jensen Huang and Meta CEO Mark Zuckerberg took the stage for a candid and humours conversation. The tech titans shared their thoughts on the future on generative AI and the long road to building tech empires. In a lighthearted moment, Huang joked that if he had known how long it would take to succeed, the he might have followed Meta CEO Mark Zuckerberg’s oath and dropped out of college early. “If I had known it was going to take so long to succeed… I would've dropped out of college just like you,” Huang quipped, drawing laughter from the audience and Zuckerberg himself.The discussion involving Huang and Zuckerberg spanned around decades of innovation. The discussion started with Zuckerberg praising Huang’s role in powering the AI revolution. “It’s all you—you kind of made this happen,” Zuckerberg said, referring to Nvidia’s dominance in AI infrastructure.Responding to Zuckerberg, Jensen Huang said, “Why thank you… CEOs, we're delicate flowers,” poking fun at the need for appreciation even at the top.Along with this, the two tech leaders also joked about aging and appearances.“We’re pretty grizzled at this point,” Zuckerberg said. “I think we’re the two longest-standing founders in the industry.” Huang agreed, noting his gray hair while Zuckerberg commented on his curls.Huang founded Nvidia in 1993 with just the investment of $200. He launched the company on his 30th birthday which was later joined by co-founders Chris Malachowsky and Curtis Priem. Nvidia started with a mission to advance 3D graphics. The breakthrough came in 1999 with the invention of the GPU, a technology that transformed computing.Fast forward to October 2025, Nvidia has entered the $5 trillion club. The chip maker managed to reach the market valuation of $5 trillion in just three months after crossing $ 4 trillion. This growth in Nvidia's market value suggest the escalating momentum in AI adoption across industries. Shares of Nvidia rose more than 4%, pushing its market capitalisation. Nvidia ranks ahead of Microsoft ($4 trillion) and Apple ($3.9 trillion), as well as Google parent Alphabet ($3.2 trillion), Amazon ($2.4 trillion) and Meta ($1.8 trillion).Meta CEO Mark Zuckerberg’s journey started from his dorm room in Harvard in 2004, from where he started Facebook . He famously dropped out in 2005 to focus on the company, turning down his father’s offer to invest in a McDonald’s franchise. Today, Meta is valued at $1.6 trillion.","Nvidia ceo jensen huang and meta ceo mark zuckerberg took the stage for a candid and humours conversation. The tech titans shared their thoughts on the future on generative ai and the long road to building tech empires. Huang joked that if he had known how long it would take to succeed, the he might have followed meta's oath and dropped out of college early.","https://static.toiimg.com/thumb/msid-125125037,width-1070,height-580,imgsize-1035992,resizemode-75,overlay-toi_sw,pt-32,y_pad-40/photo.jpg"
