Article Title,Article Link,Article Text,Article Summary,Article Image
Paul Finebaum reveals surprising ESPN block on Donald Trump interview while weighing Senate run in Alabama,https://timesofindia.indiatimes.com/sports/international-sports/paul-finebaum-reveals-surprising-espn-block-on-donald-trump-interview-while-weighing-senate-run-in-alabama/articleshow/124245159.cms,"Paul Finebaum reveals surprising ESPN block on Donald Trump interview while weighing Senate run in Alabama (Image via Getty)

Paul Finebaum recalls ESPN ‘killed’ his White House plan

“They told me we were not allowed to mix politics with sports,” Finebaum said. “I was devastated. It wasn’t about politics; it was about the game.”

“It was a turning point for me. Just the idea of going to the White House to interview the President of the United States. I never exactly knew where the kill button came from, but it didn’t happen.”

Paul Finebaum weighs Senate run after Charlie Kirk assassination

“It was an awakening,” h

. “I spent four hours numb talking about things that didn’t matter to me.”

Paul Finebaum, the longtime ESPN college football voice, says the network blocked him from interviewing President Donald Trump in 2019. Finebaum revealed this during a recent talk with Clay Travis on OutKick. He shared that a friend in Washington, D.C. had set up the idea before the big LSU vs Alabama football game on November 9, 2019, which Trump attended. Finebaum was ready to travel from New York to the White House for the interview, but ESPN shut it down. Now at 70, the Alabama native is also thinking about running for the United States Senate.Finebaum said the chance came in late 2019 when Trump planned to attend the LSU–Alabama clash, one of the biggest games of the decade. His Washington contact asked if he would want the President on his ESPN show. Finebaum agreed and prepared to travel to the White House. But after calling his bosses, he says ESPN “killed it.”He explained that the network had strict rules on avoiding politics. Finebaum added,This moment, he said, stayed with him for years. He admitted that while ESPN has policies, he felt the situation was special because it was about a game the President was attending.In the same OutKick interview, Finebaum also said he is now considering a Senate run in Alabama. The seat will be open in 2026, as current Senator Tommy Tuberville, a former Auburn football coach, is running for governor. The deadline for candidates to qualify is January 26, 2026, and the election is set for November 3, 2026.Also Read: “Criminal ignoramus”: Martina Navratilova tears into Donald Trump for Zohran Mamdani remarks and abuse of power claims Paul Finebaum said his thinking changed after the assassination of conservative activist Charlie Kirk on September 10, 2025, during an event in Utah.e saidHe explained that the tragedy left him empty and pushed him toward politics.Paul Finebaum confirmed he is a registered Republican and voted for Trump. He said “one or two people in Washington” had already asked if he would consider a Senate run. He admitted that if Trump personally asked him to run, it would be “impossible to say no.”For now, Paul Finebaum says he hopes to decide within the next 30 to 45 days, possibly after the current college football season ends.","Paul finebaum, the longtime espn college football voice, says the network blocked him from interviewing president donald trump in 2019. Finebaum said the chance came in late 2019 when trump planned to attend the lsu–alabama clash, one of the biggest games of the decade.","https://static.toiimg.com/thumb/msid-124245156,width-1070,height-580,imgsize-888406,resizemode-75,overlay-toi_sw,pt-32,y_pad-40/photo.jpg"
Why Donald Trump called Wayne Gretzky a “free agent” and why it stirred debate in Canada,https://timesofindia.indiatimes.com/sports/nhl/news/why-donald-trump-called-wayne-gretzky-a-free-agent-and-why-it-stirred-debate-in-canada/articleshow/124227046.cms,"Wayne Gretzky & Donald Trump (Getty Images)

Donald Trump’s unusual remark about Gretzky sparks questions



Wayne Gretzky’s careful image and the risk of political entanglement



When Wayne Gretzky retired from hockey in 1999, few could have imagined his name would resurface years later in the middle of political controversy. But in February 2025, U.S. President Donald Trump made headlines after referring to the Canadian hockey legend as a “free agent. ” The comment, posted on Donald Trump ’s social media platform, wasn’t about Gretzky lacing up skates again, it was about politics, friendship, and public perception.Donald Trump’s post came after Wayne Gretzky was spotted at his inauguration earlier that year. Trump wrote that he didn’t want Canadians to “turn against Gretzky” because of their personal friendship. He then added that the Great One was a “free agent,” a phrase usually reserved for athletes switching teams. Coming from Trump, the choice of words immediately fueled speculation—was it a joke, a political signal, or an attempt to align Gretzky with his own brand?For Canadians, Gretzky has long stood as more than just a sports hero. His image is tied to national pride, hockey history, and cultural identity. That’s why Donald Trump’s framing of Gretzky as someone up for grabs unsettled some observers, especially at a time when U.S. politics often spills over the border. The idea that Gretzky might be drawn into partisan narratives raised concerns that his carefully neutral public persona could be compromised.Throughout his career and retirement, Gretzky has avoided political drama, focusing instead on business ventures, family, and contributions to the game of hockey.His decision to attend Donald Trump’s inauguration was personal, but the optics made it appear political. For many Canadians, that blurred line felt uncomfortable.Donald Trump’s remark also tapped into a broader debate about celebrity endorsements and the risks athletes face when their names are tied to divisive figures. Unlike players who openly campaign or endorse candidates, Gretzky has rarely taken political stances. Being labeled a “free agent” in this context suggested he could be “claimed” by a side, whether he wanted that or not.Also Read: Wayne Gretzky’s final game-worn Rangers jersey heads to auction with massive fan interest In the end, the episode became a reminder of how iconic figures like Gretzky carry symbolic weight far beyond their sport. Donald Trump may have meant his words as playful, but they highlighted just how delicate the balance is when sports heroes are pulled into political arenas—whether willingly or not.","Donald trump referred to wayne gretzky as a “free agent” in a post on his social media platform. The comment sparked speculation about whether it was a joke, a political signal, or an attempt to align the hockey legend with his own brand. For many canadians, that blurred line felt uncomfortable.","https://static.toiimg.com/thumb/msid-124227043,width-1070,height-580,imgsize-50362,resizemode-75,overlay-toi_sw,pt-32,y_pad-40/photo.jpg"
Samantha Ponder warns America’s biggest problem exposed after Charlie Kirk killing comments triggered massive online abuse,https://timesofindia.indiatimes.com/sports/international-sports/samantha-ponder-warns-americas-biggest-problem-exposed-after-charlie-kirk-killing-comments-triggered-massive-online-abuse/articleshow/124245540.cms,"Samantha Ponder warns America’s biggest problem exposed after Charlie Kirk killing comments triggered massive online abuse (Image via Getty)

Samantha Ponder explains why she reposted Charlie Kirk’s video

“a dad, a husband, a father with little kids.

“This is not about me. It’s about what is going on in our country.”

“real problem,”

Charlie Kirk’s death and the divided reaction across the country

“I saw moms, teachers, nurses, even doctors laughing about his murder.”

Samantha Ponder, the former ESPN host and wife of ex-NFL quarterback Christian Ponder, said she faced “vicious” online attacks after she expressed sympathy for Charlie Kirk ’s family. She shared her story on Saturday in America on Fox News on September 28, 2025. Ponder said she reposted a short video of Kirk with his wife and children after his death, but instead of kindness, she was met with thousands of angry messages and a wave of followers leaving her page. She called it proof of how divided the nation has become.Samantha Ponder told Fox News host Kayleigh McEnany that she never expected backlash. She said she only reshared the family video because she saw Kirk as” Ponder explained that when she posted the clip, she instantly lost thousands of followers. “Who cares?” she said.The former ESPN host admitted that hate messages are common in television, but this time felt different. Many people accused her of supporting “a racist” and “a bigot.”She said she looked into those claims and mostly found short, edited clips meant to make Kirk look bad.Ponder said, “They are being lied to. They’re being tricked. They’re not watching a full debate. They are just seeing what their algorithm gives them.”She also said she was shocked that some users were even laughing at Kirk’s death. Ponder pointed to what she called thethat Americans now live in “two different countries” online, with each side only seeing what social media platforms decide to show.Charlie Kirk, the founder of Turning Point USA, was killed on September 10, 2025 during a speaking event at Utah Valley University in Orem, Utah. Police later arrested Tyler Robinson, who is accused of shooting him. The killing quickly became national news and sparked debate across the country.Many mourned the 31-year-old conservative activist, while others celebrated or mocked his death. Ponder said that division showed up in her own experience:Also Read: “Criminal Ignoramus”: Martina Navratilova Tears Into Donald Trump For Zohran Mamdani Remarks And Abuse Of Power Claims She contrasted that with the grief she saw from Kirk’s supporters, saying the two groups were not even aware of each other because of social media algorithms.Samantha Ponder ended her Fox News interview by warning that America’s biggest challenge is not only political division but the way online platforms fuel it every day.","Samantha ponder, the former espn host and wife of ex-nfl quarterback christian ponder said she faced “vicious” online attacks after she expressed sympathy for charlie kirk ’s family. Ponder shared her story on saturday in america on fox news on september 28, 2025. She said she was shocked that some users were even laughing at kirk’s death.","https://static.toiimg.com/thumb/msid-124245531,width-1070,height-580,imgsize-919388,resizemode-75,overlay-toi_sw,pt-32,y_pad-40/photo.jpg"
