Article Title,Article Link,Article Text,Article Summary,Article Image
Silver prices hit record high! Silver crosses Rs 3 lakh per kg; gold prices up,https://timesofindia.indiatimes.com/business/india-business/silver-prices-hit-record-high-silver-crosses-rs-3-lakh-per-kg-gold-prices-up/articleshow/126669638.cms,"Representative image

Silver prices surged to a record high on Monday, crossing the Rs 3 lakh-per-kg mark in futures trade for the first time. Gold also rebounded sharply, recovering from last week’s losses.On the Multi Commodity Exchange (MCX), silver futures jumped Rs 13,553, or 4.71%, to a record Rs 3,01,315 per kg. Gold futures rose nearly Rs 3,000, or over 2%, to hit a fresh all-time high of Rs 1,45,500 per 10 grams.The rally in precious metals followed renewed geopolitical concerns after US President Donald Trump threatened additional tariffs on several European countries over Greenland.In response, the European Union is preparing retaliatory tariffs worth €93 billion, as reported by ET, citing a Financial Times report. The renewed tensions revived demand for safe-haven assets after easing US-Iran frictions last week had briefly reduced investor interest in gold and silver.Global prices also touched record levels. Spot gold rose 1.7% to $4,673 an ounce, while silver climbed around 3% to about $94 per troy ounce, marking fresh highs in international markets. Silver futures in the overseas market jumped more than 6% to a record $94.35 per ounce.Analysts said that silver has been outperforming gold in recent sessions, supported by strong industrial demand and favourable global trends. Some also pointed to currency movements as an additional factor. The dollar index rose for a third straight week, ending at 99.20, while the USD-INR January 28 futures contract closed higher at 90.8325 on the NSE.Gold, which does not offer interest income, typically benefits when interest rates are low. However, expectations that rate cuts may be delayed have raised the opportunity cost of holding the metal. Despite this, heightened geopolitical risks have continued to support prices.Market participants said precious metals could remain volatile in the near term, with prices driven by developments on the geopolitical front, currency movements and shifts in investor risk appetite.","Silver prices surged to a record high on monday, crossing the rs 3 lakh-per-kg mark in futures trade for the first time. Gold also rebounded sharply, recovering from last week's losses. The rally in precious metals followed renewed geopolitical concerns after us president donald trump threatened additional tariffs on several european countries.","https://static.toiimg.com/thumb/msid-126669905,width-1280,height-720,imgsize-1194458,resizemode-6,overlay-toi_sw,pt-32,y_pad-600/photo.jpg"
Gold price prediction today: Will gold prices continue to hit new highs on Trump tariff threats on EU? Top points to watch out for,https://timesofindia.indiatimes.com/business/india-business/gold-price-prediction-what-is-the-gold-rate-outlook-for-january-19-2026-week-should-you-buy-or-sell-mcx-gold/articleshow/126670268.cms,"On lower end, immediate support remains at ₹143,000 and ₹140,000. (AI image)



Gold price prediction today:

may continue to scale fresh peaks in the coming days on ongoing geopolitical uncertainty, says Manav Modi, Senior Analyst, Commodity Research at Motilal Oswal Financial Services Ltd.

He shares his views and recommendations for gold investors and key levels to watch out for in the near term:

(Disclaimer: Recommendations and views on the stock market, other asset classes or personal finance management tips given by experts are their own. These opinions do not represent the views of The Times of India)

Gold and Silver prices continue to surge higher marking record highs, as intensifying geopolitical risks and shifting US monetary expectations fuelled strong safe-haven demand through the week. Escalating unrest in Iran, where over 500 people were reportedly killed, renewed US threats of military action and tariffs on countries trading with Iran, and the arrest of Venezuela’s President Nicolas Maduro injected both short- and long-term uncertainty into global markets, supporting central bank buying and investor inflows into precious metals. With this President Trump has also levied tariffs on major EU nations with a threat to increase the same after June 1st if the deal to buy Greenland does not go through.Gold prices marked a low of around ₹141,000 and reversed sharply from there, as mentioned previously till prices are sustaining above ₹138,000 momentum for prices will remain on higher side. On lower end, immediate support remains at ₹143,000 and ₹140,000.Bollinger bands which were flat have expanded with prices on the higher side showcasing a positive run through expectations. This surge is more convincing as prices are rising along with a surge in volumes showing the buyers strength. The target of ₹145,000 is achieved, however any closing above the same could take the prices higher towards ₹148,000 and ₹152,000 from a medium to long term perspective.Despite a relatively firm dollar, Gold and Silver continued to mark record highs as geopolitical tensions, weak economic data, policy uncertainty, and easing inflation sustained safe-haven appeal. Focus this week will be on US inflation, GDP and speech from President Trump which could keep the volatility along with updates on uncertainties mentioned above.","Gold and silver prices continue to surge higher marking record highs. Escalating unrest in iran, where over 500 people were reportedly killed, renewed us threats of military action and tariffs on countries trading with iran, and the arrest of venezuela’s president nicolas maduro injected both short- and long-term uncertainty into global markets.","https://static.toiimg.com/thumb/msid-126670300,width-1280,height-720,imgsize-61996,resizemode-6,overlay-toi_sw,pt-32,y_pad-600/photo.jpg"
John Harbaugh’s wife Ingrid turns heads during Giants’ headline-making entrance,https://timesofindia.indiatimes.com/sports/nfl/news/john-harbaughs-wife-ingrid-turns-heads-during-giants-headline-making-entrance/articleshow/126741471.cms,"John Harbaugh’s wife (New York Giants/X)

John Harbaugh's New York Giants era puts family and future in focus



John Harbaugh's New York Giants era has officially begun, and the first signs point to a cultural reset inside one of football’s most scrutinized franchises. The moment the deal became final on January 17, the Giants signaled that stability and experience now sit at the center of their long-term vision. After years of inconsistency, New York turned to a coach known for structure, accountability, and sustained relevance in the NFL.John Harbaugh arrives with context that matters. His exit from Baltimore followed an 8–9 finish in 2025, the Ravens’ first missed postseason since 2021. Injuries to Lamar Jackson shaped that outcome, but after 18 seasons, both sides understood change was inevitable. For the Giants, it was not about chasing trends. It was about leadership, credibility, and setting a tone that can last beyond one season.The hiring did more than reshape the Giants’ coaching staff. It pushed the Harbaugh family into a new spotlight. Fans quickly turned their attention to his inner circle, including his daughter Alison, a former Notre Dame lacrosse player who later continued her academic and athletic journey at the University of South Florida.Just as visible is Ingrid Harbaugh, whose steady presence has followed John through every chapter of his coaching life.Their story began years ago at Western Michigan. John was working as a graduate assistant under his father Jack, while Ingrid held a role in the baseball office as a student. What started on campus became a lifelong partnership that has now landed in New York. That connection felt front and center when the Giants shared a video of the couple together, welcoming them with the caption, ""Coach Harbaugh has arrived"".Beyond the emotion lies real football intrigue. John Harbaugh steps into a roster filled with young talent and unfinished promise. Jaxson Dart represents a quarterback project with upside. Malik Nabers, if healthy, gives the offense a dynamic edge. The appeal of this move rests in Harbaugh’s ability to develop players while demanding discipline from day one.Expectations will rise quickly. The NY Giants are not asking for miracles. They are asking for direction. With John Harbaugh, they finally believe they have it.",John harbaugh's new york giants era has officially begun. The first signs point to a cultural reset inside one of football’s most scrutinized franchises. The giants signaled that stability and experience now sit at the center of their long-term vision.,"https://static.toiimg.com/thumb/msid-126742424,width-1280,height-720,imgsize-56584,resizemode-6,overlay-toi_sw,pt-32,y_pad-600/photo.jpg"
"Rebuild Gaza, Ukraine: Putin responds to Trump’s ‘Board of Peace’ invite — what’s the $1bn frozen-asset offer?",https://timesofindia.indiatimes.com/world/us/rebuild-gaza-ukraine-putin-responds-to-trumps-board-of-peace-invite-whats-the-1bn-frozen-asset-offer/articleshow/127087185.cms,"Russia President Vladimir Putin

Also read |

Putin’s First Reaction On Trump’s Invite To Join Gaza Peace Board; ‘Allocate $1 Billion From Frozen…’

Putin has responded to Trump’s invitation to join his new “Peace Council,” and floated a $1 billion contribution using Russian funds frozen under Joe Biden (my translation):











""As for the Peace Council, yes we really did receive a personal message from the President of the United… pic.twitter.com/XIjckkjCCF









— Brian McDonald (@27khv) January 21, 2026

Russian President Vladimir Putin said he is prepared to allow the use of Russian assets frozen in the United States to help rebuild Ukrainian regions devastated by the war, once a peace treaty between Moscow and Kyiv is concluded.Putin also said Russia could contribute $1 billion from those US-based frozen assets to US President Donald Trump’s proposed Board of Peace, an initiative aimed at overseeing a ceasefire plan in Gaza.The Russian leader said the proposal has already been discussed with Washington and would be taken up further during talks on Thursday with Trump’s envoys, Steve Witkoff and Jared Kushner, in Moscow.“Even before we resolve the issue of participation in the Peace Council and its work, given Russia’s special relationship with the Palestinian people, I believe we could direct one billion dollars to the Peace Council from Russian assets frozen under the previous US administration,” Putin said at a meeting of Russia’s Security Council.",Russian president vladimir putin said he is prepared to allow the use of russian assets frozen in the united states to help rebuild ukrainian regions devastated by the war. Putin also said russia could contribute $1 billion from those us-based frozen assets to us president donald trump’s proposed board of peace.,"https://static.toiimg.com/thumb/msid-127090550,width-1280,height-720,imgsize-601276,resizemode-6,overlay-toi_sw,pt-32,y_pad-600/photo.jpg"
'Very productive meeting': Trump backs off on Greenland tariff threat; claims to have reached 'framework' for deal with European allies,https://timesofindia.indiatimes.com/world/us/very-productive-meeting-trump-backs-off-on-greenland-tariff-threat-claims-to-have-reached-framework-for-deal-with-european-allies/articleshow/127047504.cms,"'Greenland Needs U.S.': Trump Aide Slams Europe’s ‘Weakness,’ Backs POTUS' Tariff War Threats

Also read |

Also read |





US President Donald Trump on Wednesday waived tariffs scheduled to hit European allies after claiming that he had reached a framework for a deal over Greenland.In a social media post on Truth Social, Trump said the tariffs that had been scheduled to take effect on February 1 would no longer go ahead.“Based upon a very productive meeting that I have had with the Secretary General of NATO, Mark Rutte, we have formed the framework of a future deal with respect to Greenland and, in fact, the entire Arctic region. This solution, if consummated, will be a great one for the United States of America and all NATO nations,” Trump said.“Based upon this understanding, I will not be imposing the tariffs that were scheduled to go into effect on February 1. Additional discussions are being held concerning the Golden Dome as it pertains to Greenland. Further information will be made available as discussions progress. Vice President JD Vance, Secretary of State Marco Rubio, Special Envoy Steve Witkoff, and various others, as needed, will be responsible for the negotiations — they will report directly to me. Thank you for your attention to this matter!” he added.Trump, however, did not provide any details on the framework, but added that his threatened tariffs against European countries resisting his push to acquire Greenland were now off the table.Earlier, in a speech on Wednesday at the World Economic Forum in Davos, Trump for the first time ruled out using force but demanded “immediate negotiations” to acquire the island from Denmark.“We probably won’t get anything unless I decide to use excessive strength and force, where we would be, frankly, unstoppable — but I won’t do that,” Trump said.","Us president donald trump on wednesday waived tariffs scheduled to hit european allies after claiming that he had reached a framework for a deal over greenland. Trump, however, did not provide any details on the framework, but added that his threatened tariffs against european countries resisting his push to acquire greenland were now off the table.","https://static.toiimg.com/thumb/msid-127047638,width-1280,height-720,imgsize-990323,resizemode-6,overlay-toi_sw,pt-32,y_pad-600/photo.jpg"
Canada PM's speech rocks Davos: Trump in crosshairs; big 'unite' message for India,https://timesofindia.indiatimes.com/world/rest-of-world/canada-pm-mark-carneys-speech-rocks-davos-trump-in-crosshairs-big-unite-message-for-india-greenland-denmark/articleshow/126975092.cms,"‘Rules No Longer Protect': Canada's Carney Blasts Trump Tariffs Over Greenland | FULL SPEECH





Canadian Prime Minister Mark Carney on Wednesday delivered a hard-hitting speech at the World Economic Forum in Davos, taking aim at President Donald Trump’s approach to global politics while calling on ""middle powers"", including India, to unite as the existing world order weakens.Speaking at the forum, Carney warned that the US-led system which has underpinned global politics and trade for decades is no longer merely evolving but breaking apart. “We are in the midst of a rupture, not a transition,” he told an audience of political leaders, financiers and corporate executives, drawing a rare standing ovation.According to a government official who spoke to the New York Times on condition of anonymity, Carney wrote the speech himself—a notable departure from the usual practice, in which speeches of this scale are typically drafted by senior staff with input from the leader.During the speech, Carney who as worked as the governor of Canada and England's central banks, argued that the “rules-based international order” is fading, replaced by an era in which “the strong do what they can, and the weak suffer what they must”, a direct nod to the growing use of tariffs, supply chains and financial systems as tools of coercion. “Call it what it is: a system of intensifying great power rivalry where the most powerful pursue their interests using economic integration as coercion,” he said.Without naming Trump, the Canadian leader’s message landed amid rising tensions triggered by the US president’s threats to impose sweeping tariffs on allies and his renewed push to wrest control of Greenland from Denmark. Trump has also previously referred to Canada as the “51st state” and imposed tariffs that have hit key Canadian sectors such as steel, aluminium, autos and lumber.Carney cautioned against appeasement, warning that smaller and mid-sized nations can no longer assume that compliance will bring protection. “There is a strong tendency for countries to go along to get along… to hope that compliance will buy safety. It won’t,” he said. “The middle powers must act together because if you are not at the table, we’re on the menu.”He acknowledged that Canada had benefited from American dominance in the past, crediting “American hegemony” with providing “open sea lanes, a stable financial system, collective security, and support for frameworks for resolving disputes”. But he said that bargain no longer works in a world where integration itself has become a vulnerability.Carney’s speech was also a rebuke to transactional diplomacy and one-on-one bargaining with major powers. “Great powers can afford for now to go it alone… Middle powers do not,” he said, warning that bilateral negotiations with hegemons often amount to “the performance of sovereignty while accepting subordination”.Instead, he laid out a strategy of collective resilience, calling for “different coalitions for different issues based on common values and interests”. That approach, he said, would apply to defence, trade, critical minerals, technology and climate policy.India featured prominently in this vision. Carney confirmed that Canada is negotiating a free trade pact with India as part of a broader effort to diversify away from overwhelming dependence on the United States. He also cited negotiations with ASEAN countries, Mercosur, Thailand and the Philippines.""The past few days we've concluded new strategic partnerships with China and Qatar. We're negotiating free trade pacts with India, ASEAN, Thailand, Philippines and Mercosur. We're doing something else to help solve global problems. We're pursuing variable geometry, in other words, different coalitions for different issues based on common values and interests,"" the Canadian PM said.On security, Carney reaffirmed Canada’s support for Greenland and Denmark, declaring: “Canada stands firmly with Greenland and Denmark and fully supports their unique right to determine Greenland’s future.” He added that Ottawa’s commitment to Nato’s Article Five was “unwavering”, even as Trump has threatened tariffs against European allies backing Denmark.","'the strong do what they can, and the weak suffer what they must,' carney says. Canada is negotiating a free trade pact with india as part of a broader effort to diversify away from overwhelming dependence on the united states. ""if you are not at the table, we’re on the menu,"" he warns.","https://static.toiimg.com/thumb/msid-126975349,width-1280,height-720,imgsize-793921,resizemode-6,overlay-toi_sw,pt-32,y_pad-600/photo.jpg"
