Article Title,Article Link,Article Text,Article Summary,Article Image
Mehul Choksi sues India in UK high court for ‘kidnapping him’ in Antigua,https://timesofindia.indiatimes.com/india/mehul-choksi-sues-india-in-uk-high-court-for-kidnapping-him-in-antigua/articleshow/121961130.cms,"Mehul Choksi

'Mehul Choksi's Extradition To India Will Be Tough' Says Former CBI Director

LONDON: Fugitive diamond merchant Mehul Choksi is suing the Indian govt and five other people in the London high court for orchestrating what he refers to as his “kidnapping” from Antigua in 2021 in an alleged honeytrap plot.Choksi has claimed in the preliminary hearing that five people working for R&AW kidnapped him in Antigua and smuggled him on a yacht to Dominica in a plot masterminded by the Indian state in order to extradite him to India to face charges in the Rs 13,500 Punjab National Bank scam.Antigua police named Gurdip Bath, Barbara Jarabik, Gurmit Singh, Gurjit Singh Bhandal and Leslie Farrow-Guy as the five suspects, mostly UK-based, in the kidnapping. They are all being sued by Choksi alongside the Indian govt. They all deny the charges.The court documents were served on the ministry of external affairs by the British high commission in New Delhi.Edward Fitzgerald KC, representing Choksi (66), told Justice Freedman on Monday that Choksi was filing a civil suit against the Indian govt for allegedly ordering Choksi to be kidnapped on May 21, 2021 and smuggled by yacht to Dominica.India denies any involvement, argues it is protected by state immunity and that the UK courts do not have jurisdiction for this case.Harish Salve KC, representing India’s govt, said: “There is no evidence of India having anything to do with the alleged events. The claimant’s account is rife with non sequiturs and unsupported assumptions. Those accused seem a rather unlikely band of state-sponsored conspirators.”Choksi is currently in jail in Belgium where he is fighting extradition proceedings brought by India.Choksi first met Barbara Jarabik, a Hungarian luxury goods expert, in Antigua in Aug 2020. In May 2021 she is alleged to have asked him to visit the apartment she had rented in Jolly Harbour.A group of men of Indian origin burst into the apartment and told Choksi he was “being detained to be interrogated by Indian agencies”, Fitzgerald told the court, London’s Times newspaper reported.Choksi alleges that the men told him they worked for R&AW and beat him up, left him unconscious, and tied him to a wheelchair on the yacht to Dominica to extort a false confession from him and implicate the Congress party.“The evidence points inevitably to India being behind this — they had the motivation, they had the resources,” Fitzgerald told the court, the Daily Telegraph reported.Choksi denies the charges against him. Thenext hearing is expected in September.",Fugitive diamond merchant mehul choksi is suing the indian govt and five other people in the london high court for orchestrating what he refers to as his “kidnapping” from antigua in 2021. The court documents were served on the ministry of external affairs by the british high commission in new delhi.,"https://static.toiimg.com/thumb/msid-121961126,width-1070,height-580,imgsize-1413680,resizemode-75,overlay-toi_sw,pt-32,y_pad-40/photo.jpg"
'Prior programmes': PM Modi declines Donald Trump's US visit invite after G7; invites him to India instead,https://timesofindia.indiatimes.com/india/prior-programmes-pm-modi-declines-donald-trumps-us-visit-invite-after-g7-invites-him-to-india-instead/articleshow/121923870.cms,"PM Modi and US President Donald Trump (PTI file photo)

Poll Do you believe international cooperation strengthens the fight against terrorism? Yes, global alliances are essential to combat terrorism No, each nation should act independently

'Rejected Trump's Invitation Because...': PM Modi's BIG Reveal In Odisha Rally | G7 Summit

NEW DELHI: Foreign secretary Vikram Misri on Wednesday said that US President Donald Trump invited Prime Minister Narendra Modi to visit the United States after the conclusion of G7 Summit in Canada's Calgary.However, PM Modi declined the invitation, citing prior commitments.""Trump asked PM Modi if he could visit the US on his return from Canada; however, the Prime Minister expressed inability, citing prior programmes,"" Misri said.After wrapping up his Canada visit, his first in a decade, PM Modi proceeded to Croatia, marking the first-ever visit by an Indian Prime Minister to the Balkan nation.Although Trump left the G7 Summit early, he and PM Modi held a 35-minute phone call at Trump's request, in place of their planned in-person meeting on the summit sidelines.During the call, PM Modi invited President Trump to India for the next Quad summit, an invitation that Trump accepted. ""While accepting the invitation, President Trump said that he is excited to come to India,"" Misri added.The two leaders also discussed India’s recent counterterrorism actions under Operation Sindoor . Trump expressed strong support for India’s efforts to combat terrorism.After wrapping up his Canada visit, PM Narendra Modi on Wednesday headed to Croatia, the first-ever visit by an Indian Prime Minister to the Balkan nation.Read: 'India will never accept': PM Modi sets record straight on mediation; discusses Operation Sindoor, terrorism with Trump","Us president donald trump invited prime minister narendra modi to visit the united states after the conclusion of g7 summit. Pm modi declined the invitation, citing prior commitments. After wrapping up his canada visit, pm modi proceeded to croatia, marking the first-ever visit by an indian prime minister to the balkan nation.","https://static.toiimg.com/thumb/msid-121923928,width-1070,height-580,imgsize-1480368,resizemode-75,overlay-toi_sw,pt-32,y_pad-40/photo.jpg"
"Amid escalating conflict, India to extend Op Sindhu to Israel as well",https://timesofindia.indiatimes.com/india/amid-escalating-conflict-india-to-extend-op-sindhu-to-israel-as-well/articleshow/121963454.cms,"Junior external affairs minister Kirti Vardhan Singh welcomes first group of Indian students evacuated from Iran as part of Op Sindhu Thursday

'Thank You!' Indian Students Elated After MEA Evacuates 110 Amid Iran-Israel War | Operation Sindhu

Poll Do you support the Indian government's decision to evacuate nationals from Israel? Yes, it's necessary for their safety. No, they should stay.

NEW DELHI: As tensions escalated further between Israel and Iran, the Indian government said Thursday it had decided to evacuate from Israel those Indian nationals who wish to leave. Their travel from Israel will be facilitated through the land borders and thereafter by air to India, said the government.""In view of the above, the embassy of India in Tel Aviv would be making arrangements for the evacuation of Indians,"" said the govt in a statement, requesting Indian nationals to register themselves with the Indian embassy in Tel Aviv.India had on Wednesday launched Operation Sindhu to evacuate Indian nationals from Iran. It had also asked Indian nationals to leave capital Tehran. With Israeli cities like Tel Aviv under attack from Iranian strikes, the govt felt the need to evacuate Indians from Israel too.Also read: India launches ‘Operation Sindhu’ to evacuate citizens from war-hit Iran There are 38,000 Indian nationals living in Israel currently. According to the MEA, these are mostly caregivers - employed by Israeli elders to take care of them - diamond traders, workers employed in construction and agriculture sectors, IT professionals, and students.""Govt of India accords the highest priority to safety and security of Indian nationals abroad. Govt will continue to monitor the situation closely. The Embassy remains continuously in touch with the community with a view to extending all feasible assistance,"" the govt statement read.Also read: 'Will evacuate Indians who wish to leave from Israel,' says MEA- check details for registration Meanwhile, a special flight carrying 110 Indian students from Urmia Medical University in Iran arrived in Delhi Thursday from Yerevan. Minister of state for external affairs Kirti Vardhan Singh received the evacuees at IGI airport. He said govt has received evacuation requests from 350 Indians in Iran.""We, on our part, are making every effort to ensure the safe return of all Indian nationals from Iran. It is a major responsibility, and we are committed to fulfilling it. We have more planes on standby,"" Singh told mediapersons.","India had on wednesday launched operation sindhu to evacuate indian nationals from iran. With israeli cities like tel aviv under attack from iranian strikes, the govt felt the need to evacuate indians from israel too. A special flight carrying 110 indian students from urmia medical university in iran arrived in delhi thursday.","https://static.toiimg.com/thumb/msid-121963614,width-1070,height-580,imgsize-80098,resizemode-75,overlay-toi_sw,pt-32,y_pad-40/photo.jpg"
"‘It's a privilege, not a right’: US embassy warns visa holders after viral deportation video, tightens scrutiny on Indian students",https://timesofindia.indiatimes.com/india/us-embassy-warns-visa-holders-after-viral-deportation-video-a-visa-is-a-privilege-not-a-right/articleshow/121954213.cms,"'Take Cash And...': Trump’s STUNNING Stipend Offer For Illegal Immigrants In U.S. | Watch

Third warning this month

Poll Do you believe the US Embassy's warning about visa misuse is justified? Yes, it's necessary to maintain law and order. No, it seems overly harsh.

Indian student's deportation sparks outrage

Over 1,000 Indians deported in recent months

NEW DELHI: The US Embassy in India has issued a sharp warning to visa holders, reiterating that “a US visa is a privilege, not a right”, and that violating US laws, even after arrival, can lead to visa revocation and ineligibility for future travel.The statement, posted on the embassy’s official X handle on Thursday, emphasized that screening doesn’t end once a visa is issued, and any illegal activity, including drug use or breach of immigration laws while on a student or visitor visa, could have lasting consequences.“Using illegal drugs or breaking any US laws while on a student/visitor visa can make you ineligible for future US visas. A US visa is a privilege, not a right… and we may revoke your visa if you break the law,” the embassy said.This is the third such advisory from the US Embassy in India in June alone, each one stressing Washington’s firm stance against visa misuse and illegal immigration.On June 10, the embassy stated that while the United States welcomes legitimate travellers, it ""cannot and will not tolerate"" illegal entry or violation of laws. A follow-up on June 16 went a step further, noting that the US has established new visa restrictions on foreign officials and facilitators of mass or illegal immigration.The latest statement comes amid a surge in deportation cases and the circulation of a viral video showing an Indian student in handcuffs at Newark Airport, allegedly being deported. The clip, shared by Indian-American author Kunal Jain, triggered a wave of concern across Indian social media.“I witnessed a young Indian student being deported from Newark Airport last night, handcuffed, crying, treated like a criminal. He came chasing dreams, not causing harm,” Jain posted on X. He said the student appeared to be from Haryana and was heard shouting: “I’m not crazy… they are hell bent to prove that I am crazy.”Jain, who tagged the Indian Embassy and External Affairs Minister S Jaishankar, alleged that such deportations were becoming alarmingly routine. “Every day 3-4 such cases are happening,” he wrote, describing the student as “disoriented and helpless.”As per India's Ministry of External Affairs, 1,080 Indian nationals have been deported from the US since the Trump administration returned to power earlier this year. The recent crackdown in Los Angeles has also seen mass immigration sweeps, with Trump declaring, “They spit, we hit,” in a controversial order during unrest in the city.","The us embassy in india has issued a sharp warning to visa holders, reiterating that “a us visa is a privilege, not a right” the statement emphasized that screening doesn’t end once a visa is issued, and any illegal activity, including drug use or breach of immigration laws while on a student or visitor visa, could have lasting consequences.","https://static.toiimg.com/thumb/msid-121954420,width-1070,height-580,imgsize-1176238,resizemode-75,overlay-toi_sw,pt-32,y_pad-40/photo.jpg"
"Operation Sindoor: After PM Modi sets record straight on ceasefire deal, Donald Trump takes U-turn, says India and Pakistan 'decided' to stop conflict",https://timesofindia.indiatimes.com/india/operation-sindoor-after-pm-modi-sets-record-straight-on-ceasefire-deal-donald-trump-takes-u-turn-says-india-and-pakistan-decided-to-stop-conflict/articleshow/121943688.cms,"Poll Do you think President Trump's claims about stopping the war are justified? Yes, he played a crucial role No, it was primarily India and Pakistan's decision

After Phone Call With PM Modi, Trump Repeats Claim He Stopped India-Pakistan War | Op Sindoor

Change in stance after Trump calls PM Modi



After weeks of loudly claiming he brokered peace between nuclear rivals India and Pakistan, US President Donald Trump has shifted his tone, crediting the two countries' leaders directly for ending the hostilities.Speaking from the Oval Office after hosting Pakistan's army chief Asim Munir for lunch on Wednesday, Trump said he was ""so happy that two smart people ... decided not to keep going with that war ... That could have been a nuclear war. Those are two nuclear powers, big ones, big, big nuclear powers, and they decided that"".Notably, Trump refrained from inserting himself as the central figure in the de-escalation – a sharp contrast to his repeated boasts since May 10, when India and Pakistan agreed to cease hostilities.In the same remarks, Trump praised Prime Minister Narendra Modi and General Munir as ""very smart people"" who chose not to escalate a conflict that, in his words, ""could have been a nuclear war"".For weeks, Trump had insisted that it was his personal diplomacy - and the lure of US trade deals - that convinced the two sides to step back. On multiple occasions, he publicly claimed, ""I stopped the war"".That narrative was firmly rejected by India over the weeks, but was decisively put down by PM Modi on Wednesday.Foreign secretary Vikram Misri, speaking from the G7 summit in Kananaskis, Canada, said PM Modi told Trump during a 35-minute call that there was no US mediation, no trade-based incentive, and no discussion of American involvement at any level during Operation Sindoor , India's military response to the April 22 Pahalgam terror attack.""India has never accepted mediation nor would it ever accept it. We have complete political unanimity on this,"" Misri quoted PM Modi as saying.PM Modi also underscored that the decision to end military action came after Pakistan - facing heavy damage to nine of its key air bases - requested a ceasefire through existing military communication channels.Trump's remarks on Wednesday came just hours after he again repeated his earlier claim: ""I stopped the war between Pakistan and India."" But the addition of a more diplomatic framing - placing emphasis on the decisions made by PM Modi and Munir - suggests a quiet climbdown, perhaps prompted by PM Modi's clear pushback and India's public disclosure of the actual sequence of events.Read: 'Two big nuclear powers avoided war': Donald Trump on meeting with Asim Munir; says trade talks on with India, Pakistan Trump's modified tone may not go unnoticed.As PM Modi ensured his side of the story was made public, fact-checkers, diplomats, and world leaders will likely be watching closely to see if Trump’s narrative continues to shift - or reverts to form.Either way, the message from New Delhi is now clear: the credit for ending the conflict lies with India and Pakistan - and not with a third party looking to insert itself into the frame.","After weeks of loudly claiming he brokered peace between nuclear rivals, us president donald trump has shifted his tone. Trump refrained from inserting himself as the central figure in the de-escalation – a sharp contrast to his repeated boasts since may 10.","https://static.toiimg.com/thumb/msid-121943867,width-1070,height-580,imgsize-23818,resizemode-75,overlay-toi_sw,pt-32,y_pad-40/photo.jpg"
"Shashi Tharoor admits differences with party brass, but refuses to discuss them in public",https://timesofindia.indiatimes.com/india/shashi-tharoor-admits-differences-with-party-brass-but-refuses-to-discuss-them-in-public/articleshow/121961288.cms,"Shashi Tharoor

THIRUVANANTHAPURAM: Congress MP Shashi Tharoor on Thursday publicly admitted for the first time that he has differences with some people in the present leadership of the party. However, he refused to give details, saying: ""I would refrain from commenting on those since today is a polling day (Nilambur bypoll). ""The admission comes in the wake of Tharoor praising NDA govt on Operation Sindoor and his visits abroad as part of the all-party delegation sent by the govt to convey its policy of zero tolerance against terror, much to the discomfort of the Congress leadership.""I do have differences with some of the leaders in Congress. I know that you all know about what I am talking about as some of the issues are in public domain. But I am not ready to discuss about this here. I will speak about this at an appropriate forum with the party leadership,"" Tharoor told mediapersons.Tharoor made it clear that he will not put the party in a difficult position by speaking more on the day of the vote and that his primary concern is the country's interest. He said he has been working with Congress for the last 16 years.On staying away from the campaigning for the Nilambur bypoll in Kerala, Tharoor said he was not asked by the party leadership to be part of the campaign. ""I was not invited. If I was invited, I would have certainly gone. But there was not even a missed call from any of the leaders to attend the campaign.""","Congress mp shashi tharoor publicly admitted for the first time that he has differences with some people in the present leadership of the party. He refused to give details, saying: ""i would refrain from commenting on those since today is a polling day (nilambur bypoll).""","https://static.toiimg.com/thumb/msid-121961312,width-1070,height-580,imgsize-23890,resizemode-75,overlay-toi_sw,pt-32,y_pad-40/photo.jpg"
"1,100 Indians back from Iran, 800 more seek evacuation",https://timesofindia.indiatimes.com/india/1100-indians-back-from-iran-800-more-seek-evacuation/articleshow/121999546.cms,"Indians, who were staying in Iran, evacuated safely from war torn country Iran

NEW DELHI: While 827 Indian nationals were back from Iran by Saturday evening, 800 more had approached the Indian embassy in Tehran for evacuation. The number of evacuees, in fact, was expected to exceed 1,100 with 300 more scheduled to arrive in a special flight around midnight.Govt sources said that 600 more Indians are expected to arrive from Iran on Sunday in two separate flights. At the start of the latest flare-up between Iran and Israel, there were 10,000 Indian nationals in Iran, out of which 6,000 were students.""About 800 are willing to be evacuated. They are expected to return in evacuation flights on Monday and Tuesday,"" said a source.The Indian govt said it will also help evacuate the citizens of Nepal and Sri Lanka from Iran. They have been asked to register with the Indian embassy. ""On request of the Govts of Nepal and Sri Lanka, the Indian embassy's evacuation efforts in Iran will also cover citizens of Nepal and Sri Lanka,"" the Indian embassy in Iran posted on X.Nepal foreign minister Arzu Rana Deuba thanked her counterpart S Jaishankar for India's swift assistance"" in helping evacuate Nepali nationals from Iran. ""India's support in Nepal's evacuation efforts is a reflection of the strength of Nepal-India ties,"" she said on X.Earlier in the day, a Mahan Air evacuation flight carrying 256 Indian students, the majority from J&K, landed at the Delhi airport on Saturday. ""Thanks to the Govt of India for its efforts and timely coordination with Iranian authorities. We remain committed to ensuring the safe evacuation of all remaining students, especially those from vulnerable and remote regions,"" said the J&K Students' Association in a statement.","The number of evacuees, in fact, was expected to exceed 1,100 with 300 more scheduled to arrive in a special flight around midnight. 600 more indians are expected to arrive from iran on sunday in two separate flights. At the start of the latest flare-up between iran and israel, there were 10,000 indian nationals in iran.","https://static.toiimg.com/thumb/msid-121999890,width-1070,height-580,imgsize-57078,resizemode-75,overlay-toi_sw,pt-32,y_pad-40/photo.jpg"
French literature influences writers and politicians in Kerala: Tharoor,https://timesofindia.indiatimes.com/india/french-literature-influences-writers-and-politicians-in-kerala-tharoor/articleshow/121997395.cms,"T'puram: Congress MP Shashi Tharoor stressed the cultural bond between France and Kerala, stating that French literature had a deep influence on writers and politicians of the state.Speaking at the launch of the ‘Pardon My French' bookshelf at DC Books, organised by the French Institute of India on Thursday, Tharoor said, ""French culture and ideas have seeped into our consciousness through political writing, appreciation and values of democracy, liberty, equality and fraternity."" He noted that the extraordinary contribution of French writers opened new ways of thinking.""More than 100 years ago, in a transformative act of literary vision, Nalappat Narayana Menon translated Victor Hugo's Les Misérables into Malayalam as ‘Paavangal'. It was a cultural transplantation and the soil of Kerala received it not just out of curiosity but with gratitude and a bit of revolutionary fervour. Our famous communist leader, EMS Namboothiripad, said ‘Paavangal' was one of the sparks that led him to communism. Writers like Thagazhi and O V Vijayan have said that in the translated works of French writing, they found a new idiom of empathy, a new narrative possibility and a new lens through which to view the oppressed and the invisible.With ‘Paavangal', Malayalam found a weapon for awakening and that engagement partly contributed to the decades of remarkable visionary and social ferment in Kerala from the 1930s onwards,"" Tharoor said.He also mentioned that many other Malayalis started to translate works of French and Russian fiction and modernist works and that's how the doors to people like Guy de Maupassant, Victor Hugo and Émile Zola were opened to Malayali minds. ""That's how many Malayalis discovered the challenges of realism and introspection in a literature that mirrors society and questions it,"" he added.""The French, in many ways, have a cultural affinity to us, including in our great conversational habit. The habit of sitting around and discussing over coffee. The Bengali adda, the Malayali tea shop. This is France, except that it is taking place in our languages,"" he said.",Congress mp shashi tharoor stressed the cultural bond between france and kerala. He said french literature had a deep influence on writers and politicians of the state. Nalappat narayana menon translated victor hugo's les misérables into malayalam as 'paavangal',"https://static.toiimg.com/thumb/msid-121997392,width-1070,height-580,imgsize-48582,resizemode-75,overlay-toi_sw,pt-32,y_pad-40/photo.jpg"
"UK F-35 still in Kerala, may be put into hangar",https://timesofindia.indiatimes.com/india/uk-f-35-still-in-kerala-may-be-put-into-hangar/articleshow/121998443.cms,"Representative Image

THIRUVANANTHAPURAM: The Royal Navy F-35 fighter jet continues to be stranded at Thiruvananthapuram airport as engineers from its aircraft carrier have failed to repair a hydraulic snag. A team of engineers is staying at the airport and continuing repair works.There's a move to shift the jet to the hangar as it may have to be here for a long time until a team from the UK and the US can check it. Sources said different teams of technicians keep checking the plane, but are not able to fix the snag.The plane is parked in bay 4. ""We have enough bays to handle commercial aircraft. The presence of fighter jet is not an issue,"" an airport official said.This is the first time that the US-made, fighter jet is stranded in a foreign country.",The royal navy f-35 fighter jet continues to be stranded at thiruvananthapuram airport. Engineers from its aircraft carrier have failed to repair a hydraulic snag. There's a move to shift the jet to the hangar as it may have to be here for a long time.,"https://static.toiimg.com/thumb/msid-121998459,width-1070,height-580,imgsize-46020,resizemode-75,overlay-toi_sw,pt-32,y_pad-40/photo.jpg"
