Article Title,Article Link,Article Text,Article Summary,Article Image
"Pakistan denies ceasefire plea, credits US and Saudi role",https://timesofindia.indiatimes.com/india/pakistan-denies-ceasefire-plea-credits-us-and-saudi-role/articleshow/121998442.cms,"ISLAMABAD: Pakistan has rejected Indian media reports claiming that it sought a ceasefire during the recent four-day military standoff, insisting it responded ""decisively"" to Indian actions and agreed to halt hostilities only after intervention by United States and Saudi Arabia.In a statement issued Friday, the foreign office dismissed interpretations of deputy PM and foreign minister Ishaq Dar's comments as ""baseless"", saying they distorted his actual position. ""Pakistan did not initiate or ask anyone for a ceasefire,"" the statement said, asserting that it acted in self-defence after Indian strikes.The sharp exchange, which included cross-border shelling and heightened troop alert along the LoC, marked one of the most serious escalations since the 2019 Pulwama-Balakot episode. Though both sides have withheld official details, the flare-up triggered urgent calls for restraint from key global players. India has repeatedly denied any third-party mediation in bringing about the ceasefire.Islamabad said the ceasefire materialised only after US secretary of state Marco Rubio called Dar on May 10 and conveyed that India was ready to de-escalate if Pakistan reciprocated. A similar call from Saudi foreign minister Prince Faisal bin Farhan followed shortly after.Dar reportedly confirmed Pakistan's willingness during both conversations.While welcoming ceasefire, Pakistan's tone remained guarded. The foreign office said Islamabad values peace but would not compromise its right to respond to aggression. ""Pakistan's decision to de-escalate followed facilitation by friendly countries,"" it said.","Pakistan rejects indian media reports claiming it sought a ceasefire during the recent military standoff. Islamabad insists it responded ""decisively"" to indian actions and agreed to halt hostilities only after intervention by united states and saudi arabia.","https://static.toiimg.com/thumb/msid-121998485,width-1070,height-580,imgsize-123994,resizemode-75,overlay-toi_sw,pt-32,y_pad-40/photo.jpg"
"Operation Sindoor not over, paused after Pakistan pleading: Rajnath Singh",https://timesofindia.indiatimes.com/india/sindoor-not-over-paused-after-pakistan-pleading-rajnath/articleshow/121998439.cms,"UDHAMPUR/SRINAGAR: Operation Sindoor was paused only after Pakistan pleaded for a ceasefire, defence minister Rajnath Singh said Saturday, adding that the operation was not over yet, and India was ready to take any action against terrorism.Addressing troops of Army's Udhampur-based Northern Command on the 11th International Day of Yoga, Singh said: ""Operation Sindoor is the natural progression of surgical strike of 2016 and the airstrike of 2019. It was executed in such a way that Pakistan requested for a ceasefire, and only then we put a pause. As I have said earlier, Operation Sindoor is not over yet. India is fully prepared to take all kinds of action against terrorism. ""Singh warned Pakistan that the military operation - a response to the Pahalgam attack - was a clear message that it will face the consequences for supporting terror activities against India.Stating that the country's social and communal unity was targeted through the Pahalgam attack, Singh asserted that Operation Sindoor had conveyed to Pakistan that its policy of bleeding India with thousand cuts would not succeed.Pakistan wanted to weaken India from within, but it should never forget that just like Major Somnath Sharma, Brigadier Usman, too, had sacrificed his life for the unity and integrity of the country, Singh said.Singh appreciated the inclination of the armed forces towards yoga, saying it had a direct impact on their discipline and focus. ""Yoga gives clarity to the people in chaos. It is an art, science, philosophy and spirituality. It makes us proactive, not reactive.""","Rajnath singh: operation sindoor was paused only after pakistan pleaded for a ceasefire. Singh warned pakistan that the military operation was a clear message that it will face the consequences for supporting terror activities against india. Singh appreciated the inclination of the armed forces towards yoga, saying it had a direct impact on their discipline and focus.","https://static.toiimg.com/thumb/msid-121998488,width-1070,height-580,imgsize-66804,resizemode-75,overlay-toi_sw,pt-32,y_pad-40/photo.jpg"
FATF flags Pakistan bid to ship in missile gear from China on sly,https://timesofindia.indiatimes.com/india/fatf-flags-pakistan-bid-to-ship-in-missile-gear-from-china-on-sly/articleshow/121998310.cms,"(AI image created using ChatGPT)

NEW DELHI: A new report by Financial Action Task Force has flagged Pakistan's attempts to procure equipment for its missile programme by mislabeling shipment, drawing attention to the country's failure in implementing measures to combat financing of proliferation of weapons of mass destruction, which is one of the recommendations of the global watchdog.The report not only reveals that critical components for ballistic missiles originating from China were mislabeled in documents but also links the importer to Pakistan's National Development Complex which handles missile production.India is likely to use the revelations in its dossier to make another push for Pakistan's return to the FATF 'grey list' which identifies countries with weaknesses in their anti-money laundering and terror financing systems. These countries are subjected to closer monitoring and must demonstrate progress on corrective action plans. Pakistan has been on the list three times with the most recent sanction of 2018 lifted in 2022.In Feb 2020, a Chinese vessel named 'Da Cui Yun', which was en route to Port Qasim in Karachi, was intercepted at Gujarat's Kandla port. While the equipment was seized, the ship and its crew were allowed to leave after investigation.In its latest report titled 'Complex Proliferation Financing and Sanctions Evasion Schemes', FATF refers to the investigation by Indian Customs. ""Indian authorities confirmed that documents mis-declared the shipment's dual-use items. Indian investigators certified the items for shipment to be 'autoclaves', which are used for sensitive high energy materials and for insulation and chemical coating of missile motors,"" it read.""The sensitive items are included in dual-use export control lists of the Missile Technology Control Regime, India, and other jurisdictions. The Bill of Loading of the seized cargo provided evidence of the link between the importer and National Development Complex,"" it added.FATF may release the report next month amid hopes in India that it would expose Pakistan's inadequacies in combating terror financing - something which could potentially result in the country being placed under enhanced monitoring, and being returned to 'grey list'.This move would subject Pakistan to increased financial scrutiny, impacting foreign investment and capital inflows. India has been pushing for Pakistan's return to the list, citing its brazen support for terrorism and failure to comply with FATF norms.",A new report by financial action task force has flagged pakistan's attempts to procure equipment for its missile programme. The report draws attention to the country's failure in implementing measures to combat financing of proliferation of weapons of mass destruction.,"https://static.toiimg.com/thumb/msid-121998379,width-1070,height-580,imgsize-36630,resizemode-75,overlay-toi_sw,pt-32,y_pad-40/photo.jpg"
Operation Sindhu: First rescue flight carrying 110 Indian students lands in Delhi; evacuated from war-hit Iran via Armenia,https://timesofindia.indiatimes.com/india/operation-sindhu-first-rescue-flight-carrying-110-indian-students-lands-in-delhi-evacuated-from-war-hit-iran-via-armenia/articleshow/121938401.cms,"Over 100 students boarding flight to leave Iran

Poll Do you support India's efforts in evacuating citizens from conflict zones? Yes, it's essential for safety. No, it should be handled differently.

Emergency contacts:

Call only: +98 9128109115, +98 9128109109

WhatsApp: +98 901044557, +98 9015993320, +91 8086871709

Regional Contacts: Bandar Abbas: +98 9177699036, Zahedan: +98 9396356649

Email: cons.tehran@mea.gov.in

24x7 Control Room, MEA, New Delhi

Toll-free: 800118797

Landlines: +91-11-23012113, +91-11-23014104, +91-11-23017905

WhatsApp: +91-9968291988

Email: situationroom@mea.gov.in

NEW DELHI: The first evacuation flight carrying 110 Indian citizens, as part of Operation Sindhu, landed in New Delhi from Yerevan, Armenia, on Thursday, amid the escalating military conflict between Iran and Israel.India launched Operation Sindhu, a mission aimed at ensuring the safety and evacuation of Indian nationals from Iran.The ministry of external affairs confirmed that Indian students residing in Tehran were safely evacuated from the city through coordination by the Indian Embassy. ""Indian students in Tehran have been moved out of the city for safety reasons through arrangements made by the Indian Embassy,"" stated the ministry in their official communication.The Indian students left Zvartnots International Airport in Yerevan via a special flight at 14:55 IST on June 18, with their expected arrival in New Delhi during the early hours of June 19.MEA spokesperson Randhir Jaiswal announced through Twitter, ""Operation Sindhu begins. India launched Operation Sindhu to evacuate Indian nationals from Iran. India evacuated 110 students from northern Iran who crossed into Armenia under the supervision of our Missions in Iran and Armenia on 17th June.They departed from Yerevan on a special flight and will arrive in New Delhi in the early hours of 19th June 2025. India accords the highest priority to the safety and security of her nationals abroad.""Read: 'I have plan for everything', Trump doesn’t confirm strike on Iran; leaves option open The Indian authorities expressed appreciation to Iranian and Armenian governments for their support in the evacuation process.The MEA stated in an official release that the Indian Embassy in Iran has been supporting numerous Indian nationals to relocate from conflict-affected regions to safer locations within Iran, while arranging their subsequent evacuation through available options.The ministry emphasised its commitment to protecting Indian citizens abroad and advised those remaining in Iran to maintain contact with the Indian Embassy in Tehran and the MEA's round-the-clock Control Room in New Delhi.Embassy of India in TehranAdditional phases of Operation Sindhu are anticipated to proceed as developments occur.Raed: 'Two big nuclear powers avoided war': Donald Trump on meeting with Asim Munir; says trade talks on with India, Pakistan","India launched operation sindhu, a mission aimed at ensuring the safety and evacuation of indian nationals from iran. 110 students from northern iran who crossed into armenia under the supervision of our missions in iran and armenia on 17th june. They departed from yerevan on a special flight and will arrive in new delhi in early hours of 19th june 2025.","https://static.toiimg.com/thumb/msid-121941104,width-1070,height-580,imgsize-26750,resizemode-75,overlay-toi_sw,pt-32,y_pad-40/photo.jpg"
Dwyane Wade’s wife Gabrielle Union shares hilarious moment he signed on actual banana boat for fans,https://timesofindia.indiatimes.com/sports/nba/top-stories/dwyane-wades-wife-gabrielle-union-shares-hilarious-moment-he-signed-on-actual-banana-boat-for-fans/articleshow/121987961.cms,"Gabrielle Union and Dwyane Wade. Image via: Getty Images

Gabrielle Union shared Dwyane Wade’s actual banana boat signing moment



Gabrielle Union shared Dwyane Wade's banana boat signing incident. Image via: gabunion/ Instagram

Dwyane Wade’s legendary NBA career has produced unforgettable moments, but a recent fan interaction may have added one of the most bizarre to his post-retirement highlight reel. While attending Fanatics Fest, the former Miami Heat star came face-to-face with a life-sized banana boat, courtesy of some creative fans. They actually asked him to sign it. What followed was a hilarious callback to one of the most iconic off-court images in NBA history, all thanks to his wife, Gabrielle Union , who reposted the incident on her Instagram story.The banana boat has long been part of Dwyane Wade’s public lore. Back in 2015, Wade, Gabrielle Union, LeBron James , and Chris Paul vacationed in the Bahamas. During that trip, they were photographed riding an inflatable banana boat, a photo that instantly went viral and became an internet sensation. Despite its global reach, Wade insists it wasn’t meant to be seen.Fast forward, the incident has resurfaced, and Dwyane actually signed on the banana boat. “D-Wade signed on actual banana boat…” the video caption read on the story of Union. In the video, Wade was seen with his swift chuckles. “What you want me to sign in as?” Wade asked. “To the gang,” the fans responded, prompting Wade to repeat with the same chuckle. Wade obliged and later shared the surreal moment on Instagram.Speaking on the Pardon My Take podcast, Wade previously shared, “My wife wanted to go on a banana boat. So, Chris Paul, Bron, and I all got on a banana boat. Now, we were in the middle of nowhere, no one was supposed to know this but us.” He continued, “Someone took a photo from God knows where. No one was supposed to have seen us on a banana boat!”Adding a playful touch, he joked, “If I knew they were taking a photo, we would have looked a little cooler.”Gabrielle Union also had fun with the moment. She once revealed that it was her idea to go on the banana boat in the first place, unknowingly setting the stage for one of the most talked-about images in sports pop culture.The ""Banana Boat Crew"" eventually became an unofficial nickname for Wade, LeBron, Chris Paul, and Carmelo Anthony, even though Anthony wasn’t in the original photo. “Melo showed up late,” Wade said. “Had he been there on time, he’d be in it too.”Also Read: Dwyane Wade’s wife Gabrielle Union keeps their love alive with touching tributes and romantic gestures amid vacation in France Now, years later, fans are still keeping the memory alive, this time with a Sharpie and a floating yellow tribute. Wade’s signature on the real-life banana boat may not go down in NBA stats, but it definitely scores points for fan love and nostalgia.",Gabrielle union shared dwyane wade’s actual banana boat signing moment on instagram. The former miami heat star came face-to-face with a life-sized banana boat at fanatics fest. Wade obliged and later shared the surreal moment.,"https://static.toiimg.com/thumb/msid-121988065,width-1070,height-580,imgsize-null,resizemode-75,overlay-toi_sw,pt-32,y_pad-40/photo.jpg"
Savion Hiter slammed by fans after bold move to visit Josh Heupel and Tennessee Volunteers,https://timesofindia.indiatimes.com/sports/international-sports/savion-hiter-slammed-by-fans-after-bold-move-to-visit-josh-heupel-and-tennessee-volunteers/articleshow/121994968.cms,"Savion Hiter slammed by fans after bold move to visit Josh Heupel and Tennessee Volunteers (Image via Getty)

Savion Hiter faces strong backlash from fans over Tennessee visit

Sherrone Moore and Michigan push hard to land Savion Hiter

Also Read:

A top high school football player is getting a lot of attention this week. Savion Hiter is the No 1 ranked running back in the Class of 2026 and one of the most talked-about names in college football recruiting right now. Savion Hiter has just wrapped up a big visit to Michigan and is now heading to Tennessee to meet with the Volunteers. But as he makes this move fans online are reacting in ways he probably didn’t expect. Some are excited while others are already upset with his next steps.Savion Hiter is currently visiting the University of Tennessee in Knoxville after completing an official visit with Michigan on the weekend of June 15 2025. The 5-foot-11.5 running back from Louisa County High School in Virginia has narrowed his college choices to four schools — Michigan Georgia Ohio State and Tennessee.As news spread about his trip to Tennessee fans began posting harsh messages online. One fan wrote If he goes to Tennessee I am adding an L to his name so fast. Another fan posted Go to Tennessee and win nothing. These strong reactions came as Savion Hiter continues exploring his options and looking at different football programs.According to Brent Hubbs from VolQuest who spoke on the 1045 The Zone podcast on Friday June 21 Michigan and Tennessee are now seen as the top two schools in the race to sign him. Savion Hiter is also being offered Name Image and Likeness (NIL) deals worth between 600000 and 800000 for his first year as reported by Pete Nakos of On3 on Tuesday June 18.Michigan head coach Sherrone Moore is working to bring Savion Hiter to the Wolverines after losing another running back Javian Osbourne to Notre Dame earlier this year.Savion Hiter visited Michigan last week and took part in a photo shoot with five-star quarterback Bryce Underwood in Ann Arbor.Recruiting expert Adam McCann of Jordan Sports Group told On3 that Hiter fits perfectly with Michigan’s values. On3’s EJ Holland also said Michigan has a strong history of developing running backs and keeping them healthy and ready for the NFL.",Savion hiter is the no 1 ranked running back in the class of 2026. The 5-foot-11.5 running back from louisa county high school in virginia has narrowed his college choices to four schools — michigan georgia ohio state and tennessee. Michigan and tennessee are now seen as the top two schools in the race to sign him.,"https://static.toiimg.com/thumb/msid-121994990,width-1070,height-580,imgsize-27274,resizemode-75,overlay-toi_sw,pt-32,y_pad-40/photo.jpg"
