Article Title,Article Link,Article Text,Article Summary,Article Image
Priority of trade talks is to secure fair pacts in India’s interest: Shaktikanta Das,https://timesofindia.indiatimes.com/india/priority-of-trade-talks-is-to-secure-fair-pacts-in-indias-interest-shaktikanta-das/articleshow/124492899.cms,"Das said that amid the uncertain global environment, India continues to demonstrate remarkable dynamism and resilience

Donald Trump’s New Envoy To India Sergio Gor Arrives In Delhi With Big Agenda On Trade And Security

NEW DELHI: The underlying priority of India’s trade negotiations is to secure fair and balanced agreements in the best interest of the nation and the people, a top PMO official said on Saturday, asserting that the economy continues to demonstrate remarkable dynamism and resilience amid global uncertainty.Delivering the Kale memorial lecture at the Punebased Gokhale Institute of Politics and Economics, principal secretary-2 to PM Modi Shaktikanta Das said the global economy is going through a phase of unprecedented uncertainty and fundamental reset.“A rules-based trading framework that promoted globalisation and free trade for over eight decades is under challenge. Established rules are being increasingly questioned while new norms are yet to be firmly established,” said the former RBI governor. He said the pandemic and the Ukraine-Russia conflict have accelerated the move toward self-reliance.“This transformation is also evident in the growing influence of regional trade agreements (RTAs), which reflect a shift towards more fragmented yet practical trade alliances,” said Das, adding that India is a signatory to 14 free trade agreements (FTAs) and six preferential trade agreements (PTAs), with the UK, Australia and the UAE being the recent additions among FTAs.He said that at present, India is in free trade agreement negotiations with the US, the EU, Peru, Oman, New Zealand, among several others.Das said that amid the uncertain global environment, India continues to demonstrate remarkable dynamism and resilience.“Guided by a decade of structural reforms and strategic global positioning under the vision of ‘Atmanirbhar Bharat’, the nation has successfully weathered multiple global headwinds,” said Das who has helped navigate several economic headwinds in the past during his stint at RBI and the finance ministry.“India’s robust domestic demand, together with prudent macroeconomic and financial sector policies, has enabled the country to withstand many external shocks. India is now poised to contribute about one-fifth of the world’s GDP growth.”The former RBI governor said India continues to record impressive growth, as several favourable factors, such as a younger demography and greater reliance on domestic demand, provide the strength to withstand the negative spillovers from global turbulence. Das also said India’s average economic growth during 2014-15 to 202425 was 7.1% (excluding the Covid-19 years of 2020-21 and 2021-22) and in the last three years (2022-23 to 2024-25), GDP growth averaged 7.8%.",Shaktikanta das said the global economy is going through a phase of unprecedented uncertainty and fundamental reset. He said the pandemic and the ukraine-russia conflict have accelerated the move toward self-reliance. Das also said india’s average economic growth during 2014-15 to 202425 was 7.1%.,"https://static.toiimg.com/thumb/msid-124492897,width-1070,height-580,imgsize-611913,resizemode-75,overlay-toi_sw,pt-32,y_pad-40/photo.jpg"
IndiGo to start Delhi-China direct flights from November 10,https://timesofindia.indiatimes.com/india/indigo-to-start-delhi-china-direct-flights-from-november-10/articleshow/124492662.cms,"Representative image

NEW DELHI: After an over fiveyear lull, India and China will ramp up their direct air connectivity. IndiGo Saturday announced a daily direct flight between Delhi and Guangzhou from Nov 10, shortly after the airline links Kolkata and Guangzhou from October 26. Air India is also set to fly to China before the end of the year and many Chinese carriers will have India flights. IndiGo has been among the first airlines to reinstate flights between the two countries.In 2019, India and China had 539 direct flights operated by airlines including Air India, IndiGo, China Southern and China Eastern. In March 2020, flights were halted during Covid. Since then, travelling between India and China meant doing so through a third country.On October 2, aviation ministry said direct flights “follow continuous technical-level engagement between civil aviation authorities as part of broader efforts to normalise ties.”","Indigo saturday announced a daily direct flight between delhi and guangzhou. Air india is also set to fly to china before the end of the year. In 2019, india and china had 539 direct flights operated by airlines including air india, indigo, china southern and china eastern.","https://static.toiimg.com/thumb/msid-124492660,width-1070,height-580,imgsize-537617,resizemode-75,overlay-toi_sw,pt-32,y_pad-40/photo.jpg"
ICJ to Antonio Guterres: Top contenders for Nobel Peace Prize 2025; does Donald Trump stand a chance?,https://timesofindia.indiatimes.com/world/rest-of-world/icj-to-antonio-guterres-top-contenders-for-nobel-peace-prize-2025-does-donald-trump-stand-a-chance/articleshow/124445109.cms,"US President Donald Trump listens during a news conference with Russia's President Vladimir Putin at Joint Base Elmendorf-Richardson, Alaska, Friday, Aug. 15, 2025. (AP)

'Let Them Decide': Trump At Oval Office When Asked About NOBEL PRIZE After Gaza Deal

Will Trump get the Peace Prize?



Also read:

Who are the contenders?







The Norwegian Nobel Committee will announce the winner of the Nobel Peace Prize on Friday. The award is considered one of the most anticipated and unpredictable honours.Experts say the committee usually focuses on lasting peace, international cooperation, and the work of institutions that promote these goals.The announcement will be made in Oslo, Norway, where the committee will name the laureate who reflects the values of Alfred Nobel, the 19th-century Swedish industrialist who founded the prize.There has been speculation about the possibility of US President Donald Trump winning the prize, a discussion partly driven by Trump himself. However, experts who follow the Nobel process say his chances are low despite his involvement in several international peace efforts.The announcement comes just hours after Israel and Hamas agreed to a ceasefire and hostage release deal that could help end the two-year conflict in Gaza.While Trump has claimed credit for pressuring both sides to reach the deal, the timing makes it unlikely that the Nobel Committee considered it.The five-member committee held its final meeting on Monday, when it completed the statement explaining its choice, which is usually decided days in advance.""The Gaza deal has absolutely no significance for the choice of the 2025 laureate because the Nobel Committee has already made its decision,"" historian and Peace Prize expert Asle Sveen told news agency AFP.""Trump will not win the prize this year. I’m 100 percent certain,"" he said.A total of 338 individuals and organisations have been nominated for the 2025 Peace Prize, but the list remains secret for 50 years. With no clear favourite, several possible names are being discussed in Oslo.Among them are Sudan’s Emergency Response Rooms, a network of volunteers helping civilians during war and famine; Yulia Navalnaya, widow of Russian opposition leader Alexei Navalny; and the Office for Democratic Institutions and Human Rights, which monitors elections.The committee could also choose a laureate that signals its position on global issues, even if it invites criticism from the United States.Possible choices include UN secretary-general Antonio Guterres , the UN refugee agency (UNHCR), the UN Relief and Works Agency for Palestine Refugees (UNRWA), or international courts such as the International Court of Justice (ICJ) and the International Criminal Court (ICC).Organisations defending press freedom, such as the Committee to Protect Journalists (CPJ) or Reporters Without Borders (RSF), are also being discussed as potential winners.Last year’s prize went to Nihon Hidankyo, an organisation of survivors of the Hiroshima and Nagasaki bombings that campaigns against nuclear weapons.The Nobel Peace Prize includes a diploma, a gold medal, and a $1.2 million cash award.The economics prize, to be announced on Monday, will conclude the 2025 Nobel season, which has already seen awards for medicine, physics, chemistry, literature, and peace.","The norwegian nobel committee will announce the winner of the nobel peace prize on friday. The award is considered one of the most anticipated and unpredictable honours. There has been speculation about the possibility of us president donald trump winning the prize. However, experts who follow the nobel process say his chances are low.","https://static.toiimg.com/thumb/msid-124445373,width-1070,height-580,imgsize-409080,resizemode-75,overlay-toi_sw,pt-32,y_pad-40/photo.jpg"
'Terrorism in any form unacceptable': PM Modi calls Netanyahu; Israeli PM pauses key cabinet meet on Gaza peace plan to receive it,https://timesofindia.indiatimes.com/india/terrorism-in-any-form-unacceptable-pm-modi-calls-his-friend-netanyahu-congratulates-israeli-pm-on-gaza-peace-plan-progress/articleshow/124428900.cms,"File photo

NEW DELHI: Prime Minister Narendra Modi on Thursday called Israeli counterpart Benjamin Netanyahu to congratulate him on the implementation of Gaza peace plan. The Israeli PM paused the ongoing cabinet meeting to receive PM Modi's call.""Called my friend, Prime Minister Netanyahu, to congratulate him on the progress made under President Trump’s Gaza peace plan. We welcome the agreement on the release of hostages and enhanced humanitarian assistance to the people of Gaza. Reaffirmed that terrorism in any form or manifestation is unacceptable anywhere in the world,"" he said in a post on X.Netanyahu paused the security cabinet meeting on the Gaza ceasefire and hostage-release deal to take a phone call fromPrime Minister Narendra Modi , according to a statement from his office.The statement said PM Modi congratulated Netanyahu on the agreement for the release of all hostages, noting that the Israeli leader ""has always been a close friend and that their friendship will remain strong.” Netanyahu thanked PM Modi “for his support of Israel, and the two agreed to continue working in close cooperation,"" the readout added.Before this, PM had also revealed that he also spoke to US President Donald Trump regarding Gaza peace plan. ""Spoke to my friend, President Trump and congratulated him on the success of the historic Gaza peace plan.Also reviewed the good progress achieved in trade negotiations. Agreed to stay in close touch over the coming weeks,"" he said.This development follows the hostage-ceasefire agreement with Israel accepted by Hamas . The group stated that the exchange of hostages and Palestinian prisoners would begin within 72 hours of the deal’s implementation.Under the first phase of the agreement to end the war in Gaza, Hamas said it would release 20 surviving hostages in exchange for nearly 2,000 Palestinian prisoners. The group added that the deal includes an end to the war in Gaza, the withdrawal of Israeli forces, the delivery of humanitarian aid, and a prisoner exchange.In further details revealed on Thursday, Trump claimed that the two-year Gaza war has ""ended"", assuring that the hostages would be released on ""Monday or Tuesday"" as a part of the first phase of a newly signed Gaza ceasefire deal.","Prime minister narendra modi called israeli counterpart benjamin netanyahu to congratulate him on the implementation of gaza peace plan. The israeli pm paused the ongoing cabinet meeting to receive pm modi's call. Netanyahu thanked pm modi “for his support of israel, and the two agreed to continue working in close cooperation""","https://static.toiimg.com/thumb/msid-124429196,width-1070,height-580,imgsize-686344,resizemode-75,overlay-toi_sw,pt-32,y_pad-40/photo.jpg"
Trump's Hamas-Israel peace deal: Putin says backed US President's efforts from the start; Zelenskyy hopeful on Ukraine-Russia solution,https://timesofindia.indiatimes.com/world/us/trumps-hamas-israel-peace-deal-putin-says-backed-us-presidents-efforts-from-the-start-zelenskyy-hopeful-on-ukraine-russia-solution/articleshow/124427775.cms,"Putin Offers To Help Gaza, Aligns With Trump’s Plan As Hamas, Israel ‘Iron Out’ Issues | Watch





Ukrainian President Volodymyr Zelenskyy and Russian President Vladimir Putin on Thursday backed US President Donald Trump as Hamas and Israel agreed on the phase one of the peace deal brokered by him.Putin said that the Russia supported Trump’s Gaza initiative from the start and hoped that initiatives of the US President will indeed be implemented in practice.""Against the backdrop of the humanitarian tragedy and disaster in the Gaza strip, active efforts are underway to find options for ending the Palestine-Israel conflict,"" Putin said.""President Trump put forward his well-known initiatives, and as you saw, Russia supported them almost immediately. We see what is happening now, based on information and media reports and the final decisions, we sincerely hope that these initiatives of the US President will indeed be implemented in practice,"" he added.Meanwhile, Zelenskyy also welcomed Trump's efforts toward establishing lasting peace in the Middle East, calling it a crucial development not only for the region but for global stability.In a post on X, Zelenskyy said, ""It is important that the prospect of establishing lasting peace in the Middle East is drawing closer to being realised.This matters not only for that one region, but for the whole world. An agreement is moving forward that could help everyone.""Zelenskyy also voiced hope for the release of hostages and an end to civilian suffering in Gaza. ""We hope that the Israeli hostages, held for more than two years, will be released, and there will be no more victims in Gaza,"" he said.Drawing a parallel to Ukraine's own struggle, the President added, ""And we hope that global efforts will likewise be sufficient to achieve real peace for our country, in our region."" Condemning ongoing aggression by Moscow, Zelenskyy said, ""Russia remains the largest source of war and terror in the world today, and we expect just and firm international pressure on this aggressor to bring about lasting peace and guaranteed security. ""This comes after Hamas announced that it has reached a hostage-ceasefire agreement with Israel during indirect talks in Egypt, saying the exchange of hostages and Palestinian prisoners would take place within 72 hours of the deal’s implementation.The group confirmed that, as part of the first phase of a deal to end the war in Gaza, it will exchange 20 surviving hostages for nearly 2,000 Palestinian prisonersHamas said the deal “provides for an end to the war in Gaza, the withdrawal of Israeli forces, the entry of humanitarian aid, and a prisoner exchange.”Hamas also thanked the mediators and US President Donald Trump for brokering an end to the conflict with Israel, while urging them “to compel the occupation government to fully implement the obligations of the agreement and to prevent it from evading or delaying the implementation of what has been agreed upon.”Earlier, Trump gave Hamas a deadline of October 5 to agree to the deal or face ""all hell."" Hamas responded by highlighting Trump’s promise to secure the release of all hostages in Gaza, a cause he had publicly championed. Trump claimed victory and reposted Hamas’s statement, despite the group not agreeing to all terms.","Putin offers to help gaza, aligns with trump’s plan as hamas, israel ‘iron out’ issues. Zelenskyy also welcomed trump's efforts toward establishing lasting peace in the middle east. Earlier, trump gave hamas a deadline of october 5 to agree to the deal or face ""all hell""","https://static.toiimg.com/thumb/msid-124427735,width-1070,height-580,imgsize-22322,resizemode-75,overlay-toi_sw,pt-32,y_pad-40/photo.jpg"
No role in Taliban presser that kept women out: MEA,https://timesofindia.indiatimes.com/india/no-role-in-taliban-presser-that-kept-women-out-mea/articleshow/124491863.cms,"No role in Taliban presser that kept women out

MEA Reacts To Outrage Over No Women Journalist at Taliban Press Meet, Says India Had No Involvement

Darul Uloom honours Taliban minister

NEW DELHI: Amid a growing controversy over absence of women journalists from a press meet of visiting Afghan foreign minister Amir Khan Muttaqi on Friday, Taliban head of political office Suhail Shaheen on Saturday denied allegations that women scribes were deliberately kept out. “It was done unintentionally,”he said.“This is not true. We have women journalists in Afghanistan, working in media outlets. Mr Muttaqi meets women journalists and delegates in his office in Kabul regularly; there’s no restriction,” Shaheen told TOI. MEA has said that it had no involvement in the press interaction held by the Afghan foreign minister.Afghan minister Amir Khan Muttaqi was conferred the honorary title ‘Qasmi’ and granted a sanad (cerificate) to teach Hadith during his visit to Darul Uloom Deoband. His speech was cancelled due to overcrowding .","No role in taliban presser that kept women out of afghan foreign minister's presser. Taliban head of political office suhail shaheen on saturday denied allegations that women scribes were deliberately kept out. “it was done unintentionally,”he said.","https://static.toiimg.com/thumb/msid-124491889,width-1070,height-580,imgsize-393558,resizemode-75,overlay-toi_sw,pt-32,y_pad-40/photo.jpg"
Taliban seek opening of India-Pak border for trade with India; government to accept Taliban diplomats,https://timesofindia.indiatimes.com/india/india-stand-on-recognising-kabul-regime-will-be-aligned-with-international-communitys/articleshow/124465388.cms,"Taliban foreign minister Amir Khan Muttaqi

Jaishankar-Muttaqi Meet Marks Strategic Shift in India-Afghan Ties, Pak Faces Pressure: Experts

Afghanistan foreign minister Amir Khan Muttaqi backed trade through the Chabahar port route and called for opening the India-Pakistan Attari-Wagah border for trade with India. At a press conference in the Afghanistan embassy, following his meeting with external affairs minister S Jaishankar, Muttaqi also announced that the Taliban will appoint diplomats in India.Pakistan does not allow India to export to Afghanistan via the land route, and the Indian government has used the Chabahar port in Iran for trade and commerce with Afghanistan. The US, however, last month revoked the 2018 sanctions waiver that allowed India to develop the port and access Afghanistan and Central Asia, bypassing Pakistan.Muttaqi said trade is meant to benefit people and should not be mixed with politics. “Pakistan and India should open the Wagah border to facilitate trade between Afghanistan and India. It will benefit the people of all 3 countries,’’ said Muttaqi, addressing a press conference at the Afghanistan embassy for which no woman journalist was invited. He also announced the formation of a trade committee to remove obstacles in commercial ties with India.Muttaqi also reiterated Afghanistan’s position that it won’t allow the US to take control of the Bagram airbase, even as it remains open to diplomatic ties with Washington. Indian government sources later confirmed India had agreed to work with the Taliban to have their diplomats stationed here but added India’s position on formal recognition will remain broadly aligned with that of the international community.Muttaqi addressed the media with a small flag of the Islamic Emirate of Afghanistan (IEA), Taliban’s name for the country, placed on the table. He told reporters the embassy building, which still flies the flag of the erstwhile Islamic Republic, belonged to the IEA. “The appointment of diplomats will be a step towards normalisation and further improvement of ties,” said Muttaqi. The appointment will not be at the ambassador level, in the absence of formal recognition by India. The diplomats appointed by the Taliban will be allowed to work from the embassy.Asked about women’s rights, a sticking point in the Taliban’s ties with the international community, Muttaqi said all countries have their own customs and traditions and these should be respected. He was also non-committal on whether girls or women would be allowed to travel to India for studies.""In the recent earthquake in Afghanistan, India was the first responder. Afghanistan looks at India as a close friend. Afghanistan wants relations based on mutual respect, trade and people-to-people relations. We are ready to create a consultative mechanism of understanding, which helps towards strengthening our relations,” said Muttaqi.The issue of women rights has been flagged by Indian authorities from several multilateral forums. India believes Taliban must work towards the formation of a truly inclusive government and preservation of women, children and minorities.Muttaqi also said he and Jaishankar discussed security concerns in detail. “The IEA has proven in the last four years that the territory of Afghanistan will not be used against others. And it remains committed to that policy that the territory of Afghanistan is not used to threaten others,” said Muttaqi.","Afghanistan foreign minister amir khan muttaqi called for opening the india-pakistan attari-wagah border for trade with india. Pakistan does not allow india to export to afghanistan via the land route, and the indian government has used the chabahar port in iran for trade and commerce with afghanistan.muttaqi also reiterated afghanistan’s position that it won’t allow the us to take control of the bagram airbase.","https://static.toiimg.com/thumb/msid-124465453,width-1070,height-580,imgsize-644559,resizemode-75,overlay-toi_sw,pt-32,y_pad-40/photo.jpg"
