Article Title,Article Link,Article Text,Article Summary,Article Image
"'Nakal karne ke liye akal chahiye': AIMIM chief Asaduddin Owaisi's jibe at Pakistani PM Shehbaz Sharif, Asim Munir over fake image of 'Operation Bunyan'",https://timesofindia.indiatimes.com/india/nakal-karne-ke-liye-akal-chahiye-aimim-chief-asaduddin-owaisis-jibe-at-pakistani-pm-shehbaz-sharif-gifting-fake-image-of-operation-bunyan-to-asim-munir/articleshow/121424628.cms,"NEW DELHI: AIMIM MP Asaduddin Owaisi took a jibe at Pakistani PM Shehbaz Sharif and its army chief Asim Munir over fake image of 'Operation Bunyan' saying that it ""requires brains to copy"". He advised against taking Pakistan's claims seriously, ""not even with a pinch of salt"".Speaking to Indian diaspora in Kuwait, he said, "" Yesterday, the Pakistani Army chief gifted a photo to the Pakistani PM Shehbaz Sharif...these stupid jokers want to compete with India, they had given a photograph of a 2019 Chinese Army drill claiming it is a victory over India. This is what Pakistan indulges in...'Nakal karne ke liye akal chahiye'...inke pass akal bhi nahi hai'...whatever Pakistan is saying, do not take even with a pinch of salt. ""The reaction came after an image went viral on social media where the Pakistani PM and newly-appointed field marshal Gen Asim Munir were seen holding a photo of military operation to commemorate ""Operation Bunyan-ul-Marsoos"".The photo, however, was of a 2019 Chinese rocket artillery drill. The incident drew a myriad reactions from netizens, especially at a time when the central government has taken concrete steps to bust the Pakistani propaganda against India, especially on Operation Sindoor.Operation Sindoor was launched by armed forces targeting nine terror sites in Pakistan and Pakistan-occupied Kashmir. This came in retaliation to Pahalgam terror attack on April 22 that killed 26 people.","Aimim mp asaduddin owaisi took a jibe at pakistani pm shehbaz sharif and its army chief asim munir over fake image of 'operation bunyan' he advised against taking pakistan's claims seriously, ""not even with a pinch of salt""","https://static.toiimg.com/thumb/msid-121424711,width-1070,height-580,imgsize-1041029,resizemode-75,overlay-toi_sw,pt-32,y_pad-40/photo.jpg"
"‘It was Indian military action’: Jaishankar denies US role in ceasefire with Pakistan, says 'draw your conclusions' on China link",https://timesofindia.indiatimes.com/india/it-was-indian-military-action-jaishankar-denies-us-role-in-ceasefire-with-pakistan-says-draw-you-conclusions-on-china-link/articleshow/121423798.cms,"NEW DELHI: External affairs minister S Jaishankar has firmly rejected claims that the United States played a decisive role in brokering the recent ceasefire between India and Pakistan, asserting instead that it was India’s military response that forced Islamabad to halt hostilities. In an interview with German newspaper Frankfurter Allgemeine Zeitung, Jaishankar also raised concerns over Pakistan’s close defence ties with China, encouraging observers to ""draw your own conclusions.""“The cessation of firing was agreed between the military commanders of both sides through direct contact,” Jaishankar said. “The morning before, we effectively hit and incapacitated Pakistan's main airbases and air defence system. So who should I thank for the cessation of hostilities? I thank the Indian military because it was the Indian military action that made Pakistan say: We are ready to stop.”Pushing back against suggestions that the standoff during Operation Sindoor brought the nuclear-armed neighbours close to atomic conflict, Jaishankar called such claims baseless and alarmist.“Very, very far away. I’m frankly astonished by your question,” he said when asked how close the world was to nuclear war.“We had terrorist targets. Those were very measured, carefully considered and non-escalating steps. After that, the Pakistani military opened fire on us. We were able to show them that we could disable their air defence systems. Then the firing stopped at their request.”He criticised what he called the West’s persistent tendency to frame South Asian conflicts as potential nuclear flashpoints. “Anything that happens in South Asia is promptly linked to a nuclear crisis by the West,” he said, calling the narrative “disturbing” and warning that it inadvertently “encourages terrible activities like terrorism.”On Pakistan’s continued support for terrorism, Jaishankar said: “Anyone who is not blind can see that the terrorist organisations are openly operating from the cities and towns of Pakistan... In Pakistan, terrorism is a very open business. A business that is supported, financed, organised and used by the state. And by their military.”When asked about China's involvement in the India-Pakistan dynamic, Jaishankar pointed to Islamabad’s defence dependency on Beijing. “Many of the weapons systems that Pakistan has are of Chinese origin and the two countries are very close. You can draw your own conclusions from that,” he said.Jaishankar’s remarks were part of a wide-ranging conversation on India’s evolving foreign policy, its relationship with Germany and the European Union, and its longstanding strategic partnership with Russia. Defending New Delhi’s ties with Moscow, he criticised what he described as European double standards.“You sound as if you can do business with states that are different, but we cannot... My neighbour Pakistan has caused every conceivable problem under the sun... But doesn't Germany also do business with Pakistan?” he asked.On Europe’s changing approach to global affairs, Jaishankar said the continent was beginning to move away from the assumption that its concerns automatically translate into global priorities. “I see big changes in Europe and Europe’s thinking... that it feels it should be more independent and more resilient,” he said.He welcomed Germany’s increasing role in global security, particularly in the Indo-Pacific, and expressed hope for stronger India-Germany defence cooperation. However, he acknowledged that “the conditions are not yet perfect” and India continues to press for deeper technological collaboration.Regarding the long-pending India-EU Free Trade Agreement, Jaishankar struck an optimistic tone. “Prime Minister Modi and EU Commission President von der Leyen have made it clear that the project should be completed by the end of the year... The agreement has strategic importance.”He also expressed confidence in Germany’s growing engagement with the Indo-Pacific and its understanding of India’s concerns over China. “When I look at Germany ten years ago, I see an enormous evolution... I see much stronger prospects for our partnership,” he said.","S jaishankar rejects claims that the united states played a decisive role in brokering the recent ceasefire between india and pakistan. He says it was india’s military response that forced islamabad to halt hostilities. In an interview with german newspaper frankfurter allgemeine zeitung, he also raised concerns over pakistan's close defence ties with china.","https://static.toiimg.com/thumb/msid-121423864,width-1070,height-580,imgsize-640501,resizemode-75,overlay-toi_sw,pt-32,y_pad-40/photo.jpg"
Pakistan was told of Operation Sindoor after May 7 strikes: EAM Jaishankar to parliament panel,https://timesofindia.indiatimes.com/india/pakistan-was-told-of-operation-sindoor-after-may-7-strikes-eam-jaishankar-to-parliament-panel/articleshow/121423489.cms,"EAM on info-share row: Never used word 'before'

NEW DELHI: External affairs minister S Jaishankar Monday termed LoP Rahul Gandhi 's charge that Pakistan was told of Operation Sindoor in advance ""utter misrepresentation of facts and events"" that amounted to questioning the version of the armed forces.Briefing members of Parliament's consultative panel on external affairs, Jaishankar cited press briefings to say that armed forces had clearly stated that Pakistan was informed about Op Sindoor only after nine terror bases had been destroyed; a reference to the press briefing by DGMO Lt General Rajiv Ghai, who had said Pakistan was informed after India had struck the targets.Some reports said Jaishankar had informed Pakistan about the strikes 30 minutes after they commenced but this could not be confirmed.Sources said Jaishankar dismissed talk of US ""interference"", saying the decision to halt military operations was made bilaterally following a request from Pakistan, and on a ""you shoot, we shoot; you stop, we stop"" understanding.Jaishankar also said govt had responded to the US's suggestion that it engage with Pakistan by making it clear that ""terror and talks cannot coexist"".Rahul Gandhi has alleged that Jaishankar said he informed Pakistan ahead of the Indian strikes on terror targets and this made him an informant of Pakistan. ""I never used the word 'before' while talking about information sharing with Pakistan,"" a source quoted the minister as telling members of the parliamentary committee.Jaishankar never personally spoke with Pakistani officials and emphasised that India's DGMO notified Pakistan about the strikes on terror camps only after they were executed. The minister asserted the importance of unity at this juncture and said the govt needed the support of all. He also told members to reach out to him for any clarifications and not go by the media, sources said.Sources confirmed that the DGMO was the only line of communication with Pakistan during the conflict.Jaishankar said India had made it plain that it was prepared to counter any escalation, in what appeared to be a reference to PM Narendra Modi's response to US vice president J D Vance when the latter called on the night of May 9 to convey Pakistan's preparation for a massive retaliation.He told members that developments were in the works as far as the Indus Waters Treaty issue was concerned and the govt would share that with the committee when things materialised.He was asked to take measures to address the concerns of Punjab where young lives are being lost to narcotics terrorism. He heard the concerns and assured members that these would be discussed and addressed.He also addressed the geopolitical alignments that surfaced during the standoff. ""Only Turkiye and Azerbaijan stood openly with Pakistan,"" he told the committee.Foreign secretary Vikram Misri presented details of Operation Sindoor to the MPs, while Jaishankar addressed their queries.","Eam on info-share row: never used word 'before' while talking about information sharing with pakistan. Lop rahul gandhi's charge that pakistan was told of operation sindoor in advance ""utter misrepresentation of facts and events"" jaishankar cited press briefings to say that armed forces had clearly stated pakistan was informed about op sindoor only after nine terror bases had been destroyed.","https://static.toiimg.com/thumb/msid-121423568,width-1070,height-580,imgsize-431889,resizemode-75,overlay-toi_sw,pt-32,y_pad-40/photo.jpg"
"Terrorism is very open business in Pak, aided by state & army: EAM Jaishankar",https://timesofindia.indiatimes.com/india/terrorism-is-very-open-business-in-pak-aided-by-state-army-eam-jaishankar/articleshow/121423207.cms,"NEW DELHI: In Pakistan, terrorism is a very open business that is supported, financed, organised and used by the State and by the military, said foreign minister S Jaishankar. In an interview in Germany, during his three-nation trip to Europe last week, the minister also said anyone who is not blind can see that terrorist organisations are openly operating from the cities and towns of Pakistan.""That is no secret. The UN Security Council terror list is full of Pakistani names and places, and these are the very places we have targeted. So please don't think that something is only going on behind the scenes,"" he said.Jaishankar also said all the focus on the nuclear-weapon issue between India and Pakistan was only encouraging terrorism, adding that at no point was a nuclear level reached during the recent India-Pakistan military conflict. ""There is a narrative as if everything that happens in our part of the world leads directly to a nuclear problem. That disturbs me a lot because it encourages terrible activities like terrorism. If anything, much more is happening with the nuclear issue in your part of the world,"" said the minister, adding that India sent a clear signal to the terrorists through Operation Sindoor that there is a price to be paid for carrying out Pahalgam-like attacks.""The firing was then started by the Pakistani military. We fired back in self-defence and once the Pakistanis understood that they were taking a harmful course, we were able to stop firing. This situation has not changed for two weeks, that is the status,"" he said. Asked about the role played by the US in reaching the ""ceasefire"", Jaishankar said only the Indian military can be thanked for it. ""I thank the Indian military because it was the Indian military action that made Pakistan say: We are ready to stop,"" he said.Asked about the differences between India and Germany over the Russia-Ukraine war and India's ties with Moscow, the minister said relationships do not develop because one partner simply adopts the concerns of the other as their own. ""Relationships are built on finding common ground. For you in Europe, other concerns and worries are important than for me in Asia. When you think of conflict, you think of Ukraine. When I think of conflict, I think of Pakistan, terrorism, China and our borders. Our perspective cannot be the same,'' he said.",S jaishankar says anyone who is not blind can see that terrorist organisations are openly operating from the cities and towns of pakistan. He also said all the focus on the nuclear-weapon issue between india and pakistan was only encouraging terrorism.,"https://static.toiimg.com/thumb/msid-121423236,width-1070,height-580,imgsize-603517,resizemode-75,overlay-toi_sw,pt-32,y_pad-40/photo.jpg"
"'Roti khao, varna meri goli to hai': PM Modi to Pakistan",https://timesofindia.indiatimes.com/india/roti-khao-varna-meri-goli-to-hai-pm-modi-to-pakistan/articleshow/121422812.cms,"RAJKOT/VADODARA: PM Modi Monday launched a scathing attack on Pakistani govt and its Army for using terrorism for their vested interests and asked people of the neighbouring country to choose between living in peace and facing India's bullets.""Pakistan ko atank ki bimari se mukt karne ke liye Pakistan ki avaam ko aage aana hoga, naujavanon ko aage aana hoga. Sukh chain ki zindagi jio aur roti khao, varna meri goli to hai hi (To free Pakistan from terrorism, its people, its youth need to come forward. They can choose to lead a peaceful life; else, my bullet is there against terror),"" the PM said at a rally in Bhuj town in the border district of Kutch.It was his first visit to his home state after Op Sindoor.Modi recalled that in his first public meeting in Bihar's Madhubani district after Pahalgam massacre, he had declared he would destroy terror bases in Pakistan.""We waited for 15 days to see if Pakistan would take action against terrorism, but maybe terrorism is their bread and butter. When they did nothing, I gave a free hand to our armed forces.""Also read: Terrorism is very open business in Pak, aided by state & army: EAM Jaishankar Modi said, ""I want to ask the people of Pakistan, 'What have you achieved? India has become the fourth largest economy in the world. What is your condition? Who ruined the future of your children? The perpetrators of terrorism, the Pakistani army, have their own agenda. Your govt and your Army are supporting terrorism.' It has become their means of income. The youth and children of Pakistan have to decide whether they are on the right track. ""","Pm modi asks people of pakistan to choose between living in peace and facing india's bullets. ""pakistan ko atank ki bimari se mukt karne ke liye pakistan ki avaam ko aage aana hoga,"" he said. It was his first visit to his home state after op sindoor.","https://static.toiimg.com/thumb/msid-121423171,width-1070,height-580,imgsize-1767253,resizemode-75,overlay-toi_sw,pt-32,y_pad-40/photo.jpg"
"With Rs 44,000 crore, India to revive minesweepers plan amid China threat",https://timesofindia.indiatimes.com/india/with-rs-44000-crore-india-to-revive-minesweepers-plan-amid-china-threat/articleshow/121399040.cms,"'Delulu Land PM...': Pakistan Frames Its Fakery; Passes Off Chinese Drill Pic As India Strike

China To Attack Taiwan? 'Invasion Anytime' As U.S. Confirms HUGE Preps; Fighters, Warships Deployed

NEW DELHI: India has revived its long-pending case for the indigenous construction of 12 specialized warships to detect, track and destroy underwater mines laid by enemy forces to choke harbours and ports, disrupt shipping and maritime trade.Defence ministry sources say the procurement case for the 12 advanced minesweepers or mine countermeasure vessels (MCMVs) for the Navy, at an estimated cost of around Rs 44,000 crore, will soon be placed before the Rajnath Singh-led defence acquisitions council for the grant of “acceptance of necessity (AoN)”.The “open tender” or RFP (request for proposal) will then be issued for Indian shipyards to submit their techno-commercial bids. “It will take at least 7-8 years, if not more, for the first MCMV to roll out after the contract is inked,” a source said.The MCMVs are crucial in the backdrop of Chinese nuclear and conventional submarines, which can quietly lay mines, regularly coming to the Indian Ocean Region. Pakistan, too, is rapidly adding to its underwater combat fleet, with eight new Yuan-class diesel-electric submarines to be delivered by China.The Indian Navy, alarmingly, does not have a single MCMV at present, with its earlier six Karwar-class and two Pondicherry class of minesweepers having progressively retired several years ago.The force is making do with “clip-on mine countermeasure suites” mounted on some ships to plug the critical capability gap when it needs 24 MCMVs to guard the country’s 7,516-km long coastline with 13 major ports and over 200 minor ones.Both state and non-state actors can choke harbours and ports by planting underwater mines, which are cheap and relatively easy to use, to blow up warships, merchant vessels and tankers.The acquisition case for 12 MCMVs had begun way back in July 2005, which eventually led to Goa Shipyard tying up with South Korea firm Kangnam to build the specialized vessels. The negotiations, however, remained deadlocked on the costs, technology transfer and build strategy. The Rs 32,000 crore project was finally scrapped by the MoD in 2017-2018.With a displacement of around 900-1,000 tonne, the MCMVs have non-magnetic hulls and high-definition sonars, acoustic and magnetic sweeps to detect marooned and drifting mines. The vessels then use remote-controlled systems like small underwater vehicles to detonate the mines at safe distances.The over 130-warship Navy, of course, played a silent but crucial role during Operation Sindoor earlier this month in dissuading Pakistan from escalating hostilities by forward deploying its aircraft carrier INS Vikrant, warships and submarines in the northern Arabian Sea.The force currently has 60 warships and vessels under construction in Indian shipyards, while it will also commission its second 3,900-tonne multi-role frigate built in Russia as INS Tamal at Kaliningrad next month.It also has the initial approval or AoNs for another 31 warships, including seven new-generation frigates, eight corvettes and six stealth diesel-electric submarines. The MCMVs will add to the numbers.The Navy, however, will reach a force-level of just about 160 warships by 2030, given the slow pace of construction in Indian shipyards as well as the progressive decommissioning of older warships, as earlier reported by TOI.","Defence ministry sources say the procurement case for the 12 advanced minesweepers or mine countermeasure vessels (mcmvs) for the navy will soon be placed before the rajnath singh-led defence acquisitions council. “it will take at least 7-8 years, if not more, for the first mcmv to roll out after the contract is inked,” a source said.","https://static.toiimg.com/thumb/msid-121399201,width-1070,height-580,imgsize-1096204,resizemode-75,overlay-toi_sw,pt-32,y_pad-40/photo.jpg"
Inside Operation Sindoor war room: Army releases first-ever photos of Tri-services chiefs monitoring precision strikes,https://timesofindia.indiatimes.com/india/inside-operation-sindoor-war-room-army-releases-first-ever-photos-of-tri-services-chiefs-monitoring-precision-strikes/articleshow/121414817.cms,"Photo released by Army

'Delulu Land PM...': Pakistan Frames Its Fakery; Passes Off Chinese Drill Pic As India Strike

NEW DELHI: The Indian Army on Monday released a photo of the operations room from the night Operation Sindoor was under way against terrorist camps in Pakistan and Pakistan-occupied Jammu and Kashmir (PoJK) on May 7.In the photo, top military brass, including Army chief Gen Upendra Dwivedi, Navy chief Admiral Dinesh K Tripathi and Air Force chief Air Chief Marshal AP Singh, could be seen monitoring the operation.Under 'Operation Sindoor', the Indian Army targeted nine terror hideouts belonging to banned organisations Jaish-e-Mohammed Lashkar-e-Taiba and Hizbul Mujahideen in Pakistan and PoJK.The strategic operation involved striking four locations within Pakistan's territory, while other five targets were situated in Pakistan-occupied-Kashmir. The military strikes were carried out two weeks after the deadly Pahalgam terror attack that claimed 26 lives.'Operation Sindoor' was executed through coordinated efforts of the Army, Navy and Air Force, conducted from Indian territory. The defence ministry described the operation as ""focused, measured and non-escalatory"", deliberately avoiding Pakistani military installations.On Saturday, Prime Minister Narendra Modi reiterated that Operation Sindoor should not be treated as a one-off initiative and civil defence preparedness must be institutionalised by the states.During the Governing Council meeting of Niti Ayog, PM Modi said that the states must modernise their approach to civil preparedness. He also added that the recent mock drills have reignited our attention to civil defence states should institutionalize Civil Defence preparedness.Meanwhile, external affairs minister S Jaishankar on Monday chaired a meeting of the Consultative Committee of Parliament on External Affairs to discuss cross-border terrorism and the military strikes carried out under Operation Sindoor.The meeting addressed concerns raised by the opposition and shed light on diplomatic, military and international aspects of the operation.According to ANI sources, the panel was briefed that the government deliberately chose high-value terror targets early to deliver a strong message and expose the inability of Pakistani forces to protect the epicentres of terrorism. The strikes, officials said, had a major psychological impact on the Pakistani military. The EAM also highlighted India’s diplomatic strategy.Following Operation Sindoor, the Modi government deployed seven multi-party delegations across capitals to convey India’s zero-tolerance approach to terrorism. Most countries welcomed India’s action, with only Turkey, China, and Azerbaijan withholding support.","Photo released by army shows top military brass, including army chief gen upendra dwivedi, navy chief admiral dinesh k tripathi and air force chief air chief marshal ap singh. Under 'operation sindoor', the indian army targeted nine terror hideouts belonging to banned organisations.","https://static.toiimg.com/thumb/msid-121415082,width-1070,height-580,imgsize-56472,resizemode-75,overlay-toi_sw,pt-32,y_pad-40/photo.jpg"
