Article Title,Article Link,Article Text,Article Summary,Article Image
Balancing Islamabad: Why India’s Kabul outreach matters now - the Afghan comeback explained,https://timesofindia.indiatimes.com/india/balancing-islamabad-why-indias-kabul-outreach-matters-now-the-afghan-comeback-explained/articleshow/124482931.cms,"MEA Reacts To Outrage Over No Women Journalist at Taliban Press Meet, Says India Had No Involvement

Clear messaging to Pakistan



Strategic recalibration: Delhi steps in



Economics, connectivity and regional stakes



Security calculus: Terrorism and recognition



Presence restored, recognition withheld



Regional balancing act



Strategic hedging, not endorsement



NEW DELHI: In a diplomatic manoeuvre that could reshape regional equations, India announced on Friday that it will upgrade its technical mission in Kabul to a full-fledged embassy. The decision was announced during Taliban foreign minister Amir Khan Muttaqi’s high-profile visit to New Delhi. On the same day, the Afghan foreign minister, from Indian soil, condemned Pakistan for bombing civilian areas in Paktika, Afghanistan — the first of its kind that came against the backdrop of escalating tensions between Kabul and Islamabad.During the meetings, external affairs minister S Jaishankar underlined that India’s engagement “contributes to Afghanistan’s national development, as well as regional stability and resilience,” while announcing a fresh round of development projects across Afghan provinces. The upgrade of India’s technical mission to a full-fledged embassy signals a significant deepening of diplomatic ties without extending formal recognition to the Taliban regime.Later the same day, Muttaqi held a press briefing in New Delhi, sharply condemning Pakistan for bombing civilian areas in Paktika, calling it a “provocative act” and a violation of Afghanistan’s sovereignty. “Such issues cannot be resolved by strength.Countries with disputes should resolve them internally. Peace and prosperity are good for all,” he said, stressing the widening rift between Kabul and Islamabad.India had shut its Kabul embassy in August 2021 after the Taliban’s return to power, maintaining only a skeletal presence through a technical team since June 2022 to oversee humanitarian aid. The embassy upgrade marks the deepest level of engagement between India and the Taliban since the fall of the Ashraf Ghani government. This move stops short of formal recognition but signals a decisive shift in India’s Afghanistan strategy.The timing of the announcement was significant. It came just hours after Afghanistan’s defence ministry accused Pakistan of bombing civilian areas in Paktika near the Durand Line. “Pakistan violated Afghanistan’s airspace, bombing a civilian market in the Marghi area of Paktika near the Durand Line and also violating Kabul’s sovereign territory,” the ministry said in a post on social media. Calling it “an unprecedented, violent, and provocative act”, Kabul warned that defending its territory is its right.From Indian soil, Muttaqi chose to respond sharply. “I think it’s a wrong step by the Pakistan government. Such issues cannot be resolved by strength. Countries with disputes should resolve them internally. Peace and prosperity are good for all,” he told reporters in Delhi. “Some attacks happened in border areas, and we condemn them. We have opened doors for dialogue and diplomacy.”The unusually strong language stressed the widening rift between the Taliban and Pakistan, their uneasy patron for decades. Relations have deteriorated over Islamabad’s military operations against Tehreek-e-Taliban Pakistan (TTP) fighters allegedly sheltering in Afghanistan. In March 2024, Pakistani airstrikes in Khost and Paktika killed several civilians, triggering warnings from Kabul of “consequences”. This fracture, analysts say, has created a new strategic opening for India.India has historically had a fraught relationship with the Taliban. During the 1990s, New Delhi backed the anti-Taliban Northern Alliance while Islamabad openly supported the Taliban regime. After 2001, India became one of Afghanistan’s largest regional donors, pledging over USD 3 billion for development projects. But the Taliban’s return to power in 2021 disrupted India’s presence and leverage in the country. New Delhi maintained limited contact, focusing on humanitarian assistance and regional coordination with Iran and Central Asian partners.Now, with Pakistan–Taliban ties fraying, India is recalibrating. By reopening its embassy, hosting Muttaqi, and accepting Taliban-appointed diplomats (though not at the ambassadorial level), India is signalling a willingness to engage without granting formal recognition. Strategic analysts describe this as “hedging” — positioning itself to gain influence should Pakistan’s grip weaken further, while safeguarding its own security concerns.Professor Rajan Kumar of the School of International Studies at Jawaharlal Nehru University says this evolving situation presents India with a rare diplomatic opening.“The ongoing conflict with Afghanistan and Pakistan certainly offers an opportunity for India can be a stabilising factor even in the ongoing conflict with Pakistan. India’s presence matters a lot to Afghanistan because it will provide some kind of legitimacy to the Taliban government, even though India is unlikely to recognise the regime as such,” he says.The engagement carried clear economic undertones as well. Muttaqi invited Indian companies to invest in Afghanistan’s mining sector and called for the opening of the Attari–Wagah border for direct India–Afghanistan trade. “Pakistan and India should open the Wagah border to facilitate trade between Afghanistan and India. It will benefit the people of all three countries,” he said.Currently, India trades with Afghanistan primarily via Iran’s Chabahar port due to Pakistan’s denial of overland access. But the route faces uncertainty after the United States revoked India’s sanctions waiver for Chabahar in September 2024, complicating transit. While Chabahar remains a strategic hedge, its operational limitations make direct India–Afghanistan connectivity via Pakistan attractive in theory — though politically fraught.India also announced a new slate of development projects: a Thalassemia Centre and 30-bed hospital in Bagrami district, oncology and trauma centres in Kabul, maternity clinics across Paktika, Khost and Paktia, and donations of ambulances, medical equipment and vaccines. These announcements draw on India’s legacy of over 500 development projects across all 34 Afghan provinces, including the Parliament building and the Salma Dam.Security remains at the core of India’s engagement. Without naming Pakistan, both sides “unequivocally condemned all acts of terrorism emanating from regional countries” in their joint statement. Jaishankar said, “We have a common commitment towards growth and prosperity. However, these are endangered by the shared threat of cross-border terrorism that both our nations face. We must coordinate efforts to combat terrorism in all its forms and manifestations.” Muttaqi, meanwhile, pledged that Afghanistan “won’t allow any group to use the country against others”, identifying Daesh (ISIS) as the main regional threat.For India, the key is ensuring Afghan soil is not used for anti-India activities — a core concern since the IC-814 hijacking in 1999. Prof. Kumar explains this strategic bottom line:“What can happen, and what India is probably thinking, is that the land of Afghanistan may not be used for terrorist activities against India. That would be a huge achievement from the Indian perspective,” he says.India has so far avoided pressing the Taliban hard on human rights. Muttaqi remained vague when asked about women’s rights, saying, “All countries have their own customs and traditions and these should be respected.” While India has consistently raised rights issues at multilateral forums, officials have avoided making them a precondition for engagement.Perhaps the most consequential element of India’s strategy is its decision to reopen its embassy in Kabul without formally recognising the Taliban regime — a nuanced diplomatic line that gives New Delhi both flexibility and leverage. By restoring a physical diplomatic presence, India can deepen engagement on the ground and signal its relevance in Afghanistan’s evolving power dynamics, without extending official legitimacy to a government that remains internationally unrecognised and controversial for its human rights record.This approach reflects a clear distinction between establishing an embassy and granting diplomatic recognition. India has previously maintained similar diplomatic arrangements, such as with Palestine, where the presence of an embassy does not automatically translate into full diplomatic recognition of a government. In the Afghan context, this allows India to engage pragmatically while aligning its policy with the broader stance of the United Nations, the European Union and Western countries, most of which have opted for functional engagement without recognition.By doing so, New Delhi positions itself strategically. It can build channels of communication, potentially shape outcomes on critical security and connectivity issues, and apply pressure on regional actors like Pakistan and China, both of which are wary of India expanding its influence in Afghanistan. At the same time, India avoids prematurely endorsing a regime whose policies on women’s rights and governance remain at odds with international norms.India’s outreach is also informed by broader regional considerations. Russia and China have already established working relationships with the Taliban. Western governments are engaged in dialogue on counterterrorism and aid. New Delhi, analysts say, does not want to be the outlier.As Prof. Kumar notes, “Since Russia is talking, China is already there, and American and Western governments are also talking, India should not be left out. We may have ideological differences with the Taliban regime, but since other countries are talking to the Taliban in different forms, we should also try to moderate our policy and engage on several issues.”This balancing act is not without challenges. The Taliban regime remains ideologically rigid, especially on women’s rights and governance. Connectivity through Chabahar faces geopolitical headwinds. And there is no guarantee that the Taliban will limit anti-India groups indefinitely. Yet, by opening formal diplomatic channels, India aims to secure a seat at the table rather than watch from the sidelines as others shape Afghanistan’s future.Muttaqi’s visit to Delhi, marked by strong rhetoric against Pakistan, overtures for trade, and assurances on terrorism, reflects Kabul’s attempt to diversify its diplomatic bets. For India, the outreach is less about endorsing the Taliban regime and more about strategic positioning: insulating itself against security risks, reasserting influence in a region long dominated by Pakistan, and adapting to a shifting geopolitical landscape.New Delhi’s approach remains cautious but deliberate. It is engaging the Taliban to pursue its security and strategic objectives, without abandoning its normative concerns or rushing into recognition. In the complex triangle of India–Afghanistan–Pakistan, this marks the beginning of a new phase — one where India is no longer merely reacting to developments in Kabul, but actively shaping them.","India announced on friday that it will upgrade its technical mission in kabul to a full-fledged embassy. The decision was announced during taliban foreign minister amir khan muttaqi’s high-profile visit to new delhi. On the same day, the afghan foreign minister condemned pakistan for bombing civilian areas in paktika, afghanistan.","https://static.toiimg.com/thumb/msid-124482977,width-1070,height-580,imgsize-36624,resizemode-75,overlay-toi_sw,pt-32,y_pad-40/photo.jpg"
"As ties thaw, Canada foreign min on two-day India visit",https://timesofindia.indiatimes.com/india/as-ties-thaw-canada-foreign-min-on-two-day-india-visit/articleshow/124490163.cms,"Canadian foreign minister Anita Anand

NEW DELHI: Canadian foreign minister Anita Anand will hold talks with her counterpart S Jaishankar and commerce and industry minister Piyush Goyal as both countries move toward establishing a framework for strategic cooperation on issues such as trade diversification, energy transformation and security, Global Affairs Canada announced Saturday.Anand will arrive in Delhi late Sunday for a two-day visit that will see her travelling to Mumbai. The visit comes as a boost for recent efforts by both sides to rebuild the relationship after the diplomatic strife over the killing of a Khalistan separatist. ""Minister Anand will also travel to Mumbai, India, where she will meet with Canadian and Indian firms working to support investment, job creation and economic opportunity in Canada and India,"" said Canada in its announcement.Ottawa said India is expected to become world's fourth largest economy in 2025 and Canada remains committed to supporting and growing its commercial ties with India, including in agriculture, critical minerals, and energy sectors. Anand is also travelling to Singapore and China from India.",Canadian foreign minister anita anand will arrive in delhi late sunday for a two-day visit that will see her travelling to mumbai. The visit comes as a boost for recent efforts by both sides to rebuild the relationship after the diplomatic strife over the killing of a khalistan separatist.,"https://static.toiimg.com/thumb/msid-124490167,width-1070,height-580,imgsize-468254,resizemode-75,overlay-toi_sw,pt-32,y_pad-40/photo.jpg"
Taliban foreign minister visits Darul Uloom Deoband in UP. What’s the seminary's connection to Afghanistan? Explained,https://timesofindia.indiatimes.com/india/afghanistan-foreign-minister-visits-darul-uloom-deoband-in-up-whats-the-connection-explained/articleshow/124481775.cms,"Afghanistan foreign minister visits Darul Uloom Deoband in UP (Pictur ecredit: PTI)

Taliban's Diplomatic Signal From Darul Uloom Deoband: Muttaqi Says India-Afghan Ties Look ‘Bright’

What is Darul Uloom Deoband?



The Afghan connection: How Deobandi Islam reached Afghanistan



NEW DELHI: Taliban ’s foreign minister Amir Khan Muttaqi visited the Darul Uloom Deoband in Saharanpur on Saturday, meeting Jamiat Ulema-e-Hind President Maulana Arshad Madani and other senior officials of the seminary.Muttaqi expressed gratitude for the warm reception and optimism about India-Afghanistan ties. “I am thankful to all of you for the warm welcome given to me by everyone in Deoband and the love showered upon me. I will pray to God that India-Afghanistan relations improve further,” he said, as quoted by news agency ANI.The Afghan leader highlighted the significance of educational and cultural ties, noting that no political discussions took place but that historical connections were celebrated.As per news agency ANI, Maulana Arshad Madani emphasised the historical role of Afghanistan in India’s independence struggle and reassured that Afghanistan would not allow terrorists to use its soil against India.This visit is part of a week-long trip to India by Muttaqi, marking the first high-level delegation from Kabul since the Taliban took power in 2021.Darul Uloom Deoband, established in 1866 in present-day Uttar Pradesh, is one of South Asia’s most influential Islamic seminaries.It was founded by scholars including Maulana Muhammad Qasim Nanautawi and Maulana Rashid Muhammad Gangohi to educate Muslim youth in a rigorous, orthodox understanding of Islam, known as Deobandi Islam.The seminary was originally part of an anti-colonial movement aimed at revitalising Islam and resisting British rule in India. Over the decades, Deobandi schools spread throughout India, Pakistan, Afghanistan, and other parts of South Asia.While Darul Uloom Deoband is in India, its teachings spread across the border into Pakistan and Afghanistan. Pashtun communities were instrumental in establishing Deobandi seminaries along the Afghanistan-Pakistan border, according to The Conversation.The Soviet invasion of Afghanistan in 1979 accelerated this process as Deobandi madrassas, supported by Pakistani authorities and funding from Saudi Arabia and the CIA, educated Afghan refugee youth who would join the anti-Soviet resistance.Many of these students later became key figures in the Taliban. The movement’s founder, Mullah Mohammad Omar, and other Taliban leaders were educated in Deobandi-inspired seminaries in Pakistan, adopting a version of the ideology that included ultraconservative Wahhabi influences, as per NPR.While the Taliban identify as Deobandis, scholars at the original Indian seminary emphasise that their interpretation diverged from classical Deobandi teachings.“The Taliban say they are doing what we did in India. The way we kicked the British out of India, that’s what the Taliban are doing in Afghanistan,” said Maulana Arshad Madani back in 2021 when the Taliban took control over Afghanistan, clarifying that there is no organisational link between the seminary and the Taliban, as per NPR.This visit of Taliban’s foreign minister comes amid efforts to improve India-Afghanistan relations, as Muttaqi emphasised hopes for increased exchanges and cooperation, including in regional projects like the Chabahar port in Iran.The visit reinforces the soft-power and cultural dimension of diplomacy between the two countries while acknowledging the centuries-old educational and religious links that connect them.","Afghanistan foreign minister visits darul uloom deoband in up. This visit is part of a week-long trip to india by muttaqi, marking the first high-level delegation from kabul since the taliban took power in 2021.","https://static.toiimg.com/thumb/msid-124482018,width-1070,height-580,imgsize-72426,resizemode-75,overlay-toi_sw,pt-32,y_pad-40/photo.jpg"
'Women have equal rights in our country': Rahul Gandhi slams PM Modi over Taliban presser; oppn flags empty Nari Shakti slogans,https://timesofindia.indiatimes.com/india/women-have-equal-rights-in-our-country-rahul-gandhi-slams-pm-modi-over-taliban-presser-oppn-flags-empty-nari-shakti-slogans/articleshow/124471489.cms,"Amit Khan Muttaqi and S Jaishankar (PTI photo)

MEA Reacts To Outrage Over No Women Journalist at Taliban Press Meet, Says India Had No Involvement

Poll Which approach helps promote equality more effectively? Government and policy initiatives Community and social efforts

BJP hits back at Rahul



Oppn slams Centre



Taliban presser in New Delhi



NEW DELHI: Rahul Gandhi on Saturday led a wave of opposition outrage after women journalists were barred from a Taliban press conference in New Delhi. Taking direct aim at Prime Minister Narendra Modi, the Congress MP addressed PM Modi and said, ""you are telling every woman in India that you are too weak to stand up for them. ”The remark came as several opposition leaders condemned the government for allowing such an event, calling it a shameful affront to women’s rights and democratic values.Leader of opposition in Lok Sabha, Rahul Gandhi, voiced his disappointment over the incident and criticised Prime Minister Narendra Modi, writing on X, ""Mr. Modi, when you allow the exclusion of women journalists from a public forum, you are telling every woman in India that you are too weak to stand up for them.""He added, ""In our country, women have the right to equal participation in every space. Your silence in the face of such discrimination exposes the emptiness of your slogans on Nari Shakti.""BJP responded sharply to Rahul Gandhi's criticism of the Taliban press conference, denying the allegations and linking him to Pakistan, while calling Congress the ""best friend of Pakistan.""BJP spokesperson Pradeep Bhandari said, ""Yet again Rahul Gandhi is batting for Pakistan by spreading fake news!""He also fact-checked Rahul on X, noting, ""Vienna Convention on Diplomatic Relations, 1961 Article 22 declares embassy land as 'inviolable' and belonging to the embassy.""It was not just Rahul Gandhi, but several other opposition leaders also targeted PM and Centre. Lok Sabha member Priyanka Gandhi also addressed the issue, asking the prime minister to clarify the government’s position. She wrote on X, ""Prime Minister Narendra Modi ji, please clarify your position on the removal of female journalists from the press conference of the representative of the Taliban on his visit to India. ""Priyanka added, ""If your recognition of women’s rights isn’t just convenient posturing from one election to the other, then how has this insult to some of India’s most competent women been allowed in our country, a country whose women are its backbone and its pride.""Former home minister P Chidambaram expressed shock over the exclusion, writing, ""I am shocked that women journalists were excluded from the press conference addressed by Mr Amir Khan Muttaqi of Afghanistan. In my personal view, the men journalists should have walked out when they found that their women colleagues were excluded (or not invited).""TMC MP Mahua Moitra also targeted the Modi-led government, saying, ""The government has dishonoured every single Indian woman by allowing Taliban minister to exclude women journalists from presser. Shameful bunch of spineless hypocrites.""She added in another post on X, ""How dare our government allow Taliban foreign minister Amir Muttaqi to exclude women journalists & hold a ‘male-only’ news conference on Indian soil with full protocol? How dare EAM Jaishankar agree to this? & why did our emasculated spineless male journos remain in room?""The press conference was held at the Afghanistan embassy hours after Taliban FM talks with external affairs minister S Jaishankar, where women journalists were barred from entry. The forum was only opened to a few male journalists, reflecting the Taliban’s ongoing record of gender discrimination.Sources say the decision on journalist invitations was made by Taliban officials accompanying Muttaqi. The Taliban government in Kabul has faced sustained global condemnation, including from the United Nations, for its restrictions on women’s rights, education, and participation in public life.Amid backlash, the ministry of external affairs clarified to ANI that India had ""no involvement"" in the press interaction held by Muttaqi.When asked about the condition of women in Afghanistan, Muttaqi sidestepped the question, saying, ""Every country has its own customs, laws and principles, and there should be respect for them."" He claimed Afghanistan’s situation had improved since the Taliban takeover in August 2021, contrasting current conditions with previous years. ""Some 200 to 400 people died in Afghanistan every day before Taliban started ruling the country,"" he said.","Rahul gandhi led a wave of opposition outrage after women journalists were barred from a taliban press conference in new delhi. Opposition leaders condemned the government for allowing such an event, calling it a shameful affront to women’s rights and democratic values.","https://static.toiimg.com/thumb/msid-124471877,width-1070,height-580,imgsize-1061538,resizemode-75,overlay-toi_sw,pt-32,y_pad-40/photo.jpg"
