Article Title,Article Link,Article Text,Article Summary,Article Image
CEC cites success of SIR in Bihar at global meet,https://timesofindia.indiatimes.com/india/cec-cites-success-of-sir-in-bihar-at-global-meet/articleshow/127064227.cms,"Democracy Took Roots In India In 600 BC, Long Before The World: CEC Gyanesh Kumar

NEW DELHI: Chief election commissioner Gyanesh Kumar Wednesday utilised the India International Conference on Democracy and Election Management (IICDEM) 2026 - which got underway in Delhi with the participation of delegates from 70 nations - as a forum to showcase the successful conduct of special intensive revision (SIR) in Bihar, citing the zero appeals received after publication of the final electoral roll and the subsequent assembly election that witnessed no repolls.""Pure electoral roll, including each and every eligible elector as per law, is essential to strengthen democracy and all elections which will be held on the basis of that electoral roll. The second segment is conduct of polls, which becomes a very challenging, logistical affair, because a large number of people have to obey and follow the electoral laws and the instructions issued by EC,"" Kumar said while highlighting how Bihar election had delivered on both the fronts.Stating that the purpose of IICDEM 2026 is to not only celebrate democracy but also understand the future path, challenges, the expectations of electors and how to make the electoral process smoother and more transparent, free and fair, the CEC explained to the foreign delegates, who included top representatives of 42 electoral management bodies and 27 ambassadors/high commissioners, how Indian elections have become one of the largest exercises on the planet in terms of logistics, numbers and transparency needs.""More than a billion voters, (with) 640 million exercising their franchise at more than a million polling stations....and roughly 2 crore people involved in the exercise is a feat,"" Kumar underlined.Election commissioner S S Sandhu described the faith placed by citizens in electoral management bodies (EMBs) as precious, saying that it is the collective responsibility of EMBs to preserve it.Election commissioner Vivek Joshi said IICDEM-2026 brings together EMBs, researchers, students and practitioners, who view elections from different angles, to brainstorm on all issues relating to democracy & electoral management.Earlier, secretary general of International Institute for Democracy and Electoral Assistance (International IDEA) Kevin Casas-Zamora welcomed India's chairship of International IDEA, saying that India must share with the world how it has dealt with challenges to build a legacy of ""free and fair elections, respect for the rule of law, tolerance, secularism, press freedom and all the things that constitute a democracy"".Recalling how recent elections across many countries had witnessed political polarisation, illicit funding flows, online and offline aggression and digital misinformation, Casas-Zamora also raised concerns over outright election denialism, with politicians from the US, Peru, Georgia and Bangladesh ""using spurious arguments to question credible results"". He said that 2024 saw 1.6 billion people casting ballots in 74 national elections, including India. ""Yet, global electoral turnout that year was down nearly 10 percentage points compared to 15 years before, while around 40% of elections suffered some form of dispute over their credibility,"" he pointed out.At the same time, he said, elections had helped reverse democratic backsliding in Poland, Senegal, Guatemala and Brazil. ""Democracy can be restored as long as electoral routes for political change remain open,"" he emphasised.Speaking on the theme of IICDEM-2026 - democracy for an inclusive, peaceful, resilient and sustainable world - DG IIIDEM Rakesh Verma said that it reflects a broad and multi-dimensional understanding of what democracy must deliver in the 21st century.","Democracy took roots in india in 600 bc, long before the world: cec gyanesh kumar. Cec utilised the india international conference on democracy and election management (iicdem) 2026 as a forum to showcase the successful conduct of special intensive revision (sir) in bihar.","https://static.toiimg.com/thumb/msid-127064477,width-1280,height-720,imgsize-875111,resizemode-6,overlay-toi_sw,pt-32,y_pad-600/photo.jpg"
"World must show zero tolerance for terror, EAM tells Spain counterpart",https://timesofindia.indiatimes.com/india/world-must-show-zero-tolerance-for-terror-eam-tells-spain-counterpart/articleshow/127063802.cms,"EAM Jaishankar Calls For United Fight Against Terror As India Spain Mark Shared Democratic Values

NEW DELHI: India and Spain condemned terrorism in all its forms and manifestations and emphasised the need for strengthening international cooperation to combat terrorism, as external affairs minister S Jaishankar hosted his Spanish counterpart José Manuel Albares for a bilateral meeting on Wednesday.For the second time this week, Jaishankar told a visiting European foreign minister the world must display zero tolerance towards terrorism. Jaishankar had conveyed the same message to Polish foreign minister Radoslaw Sikorski who visited India this week, albeit more bluntly because of Poland’s recent courting of Pakistan.“The world order is clearly undergoing a profound change. It is more imperative than ever before for nations to collaborate on shared challenges. This is particularly the case with respect to combating terrorism where both India and Spain have been victims. The world must display zero tolerance towards terrorism,” said Jaishankar in his opening remarks in the meeting with Albares.According to the MEA, the ministers reviewed the entire gamut of India-Spain relationship, including trade and investment, defence and security, culture, tourism and people-to-people ties. “The ministers discussed recent developments in Europe and the Indo-Pacific, and exchanged views on other issues of shared interest,” said the govt, as Albares handed over to Jaishankar a declaration of Spain’s accession to India’s Indo-Pacific Oceans Initiative. Albares said Spanish President Pedro Sanchez will visit India soon and expressed hope Modi too would visit Spain.","India and spain condemned terrorism in all its forms and manifestations. External affairs minister s jaishankar hosted his spanish counterpart josé manuel albares for a bilateral meeting on wednesday. The ministers reviewed the entire gamut of india-spain relationship, including trade and investment, defence and security.","https://static.toiimg.com/thumb/msid-127064023,width-1280,height-720,imgsize-990454,resizemode-6,overlay-toi_sw,pt-32,y_pad-600/photo.jpg"
"Stock market today: Nifty50 ends below 25,200; BSE Sensex settles below 82,000",https://timesofindia.indiatimes.com/business/india-business/stock-market-today-nifty50-bse-sensex-january-21-2026-dalal-street-indian-equities-global-markets-donald-trump-tariffs/articleshow/126914358.cms,"Stock market today (AI image)

Vaishnaw Rules Out Trade Talks At WEF; Assures India's Engagement With Major Economies On All Fronts

(Disclaimer: Recommendations and views on the stock market, other asset classes or personal finance management tips given by experts are their own. These opinions do not represent the views of The Times of India)

Stock market today: Indian equity benchmarks, Nifty50 and Sensex, closed lower on Wednesday as investors booked profits amid weak global cues and cautious sentiment ahead of key macro triggers. The Nifty50 slipped 75 points, or 0.30 per cent, to close at 25,157.50, while the 30-share BSE Sensex declined 270.84 points, or 0.33 per cent, to settle at 81,909.63.Heavy selling in select banking, financial and auto stocks dragged the benchmark indices lower on Wednesday, even as gains in a handful of index heavyweights capped sharper losses.Among the Sensex pack, ICICI Bank, Trent, Bharat Electronics, Axis Bank, HDFC Bank, Larsen & Toubro, State Bank of India and Maruti emerged as the top laggards. On the other hand, Eternal, UltraTech Cement, InterGlobe Aviation and Reliance Industries provided some support to the market.Foreign institutional investors (FIIs) continued to pare exposure, offloading equities worth Rs 2,938.33 crore during the session, while domestic institutional investors (DIIs) stepped in with net purchases of Rs 3,665.69 crore, exchange data showed.“Indian equity markets ended the session on a cautious to negative note as mixed cues from Asian peers and sharp losses in overseas markets, along with continued weakness in the rupee, kept investor risk appetite subdued,” said Ponmudi R, CEO of Enrich Money, an online trading and wealth-tech firm.Asian markets presented a mixed picture. Japan’s Nikkei 225 closed lower, while South Korea’s Kospi, China’s SSE Composite, and Hong Kong’s Hang Seng ended the day in positive territory. European markets were trading in the red in mid-session deals.Overnight, Wall Street witnessed a sharp sell-off. The Nasdaq Composite slumped 2.39 per cent, the S&P 500 fell 2.06 per cent, while the Dow Jones Industrial Average dropped 1.76 per cent, adding to global risk aversion.“Domestic markets were gripped by volatility as global risk factors dampened sentiment. However, value buying towards the close helped the market recover some early losses. The weakening rupee and uncertainties surrounding trade ties may prolong this volatility,” said Vinod Nair, Head of Research at Geojit Investments Limited.Meanwhile, crude oil prices eased, with Brent crude, the global benchmark, slipping 1 per cent to USD 64.27 per barrel, offering limited relief to market sentiment.","The nifty50 slipped 75 points, or 0.30 per cent, to close at 25,157.50, while the 30-share bse sensex declined 270.84 points, to settle at 81,909.63. Heavy selling in select banking, financial and auto stocks dragged the benchmark indices lower on wednesday.","https://static.toiimg.com/thumb/msid-126915145,width-1280,height-720,imgsize-481472,resizemode-6,overlay-toi_sw,pt-32,y_pad-600/photo.jpg"
India-Pakistan conflict: Congress takes jibe at PM Modi over 'good friend' Trump's remarks; claims 'count now 70',https://timesofindia.indiatimes.com/india/india-pakistan-conflict-congress-takes-jibe-at-pm-modi-over-good-friend-trumps-remarks-claims-count-now-70/articleshow/126937649.cms,"Congress general secretary in-charge communications Jairam Ramesh

Donald Trump Cites India Pakistan Ceasefire While Defending Nobel Gesture But Facts Raise Questions

Also read |

NEW DELHI: The Congress on Wednesday stepped up its attack on Prime Minister Narendra Modi after US President Donald Trump once again claimed that he was responsible for ending the India-Pakistan conflict last year. The opposition party said the count of such assertions has now risen to 70.The swipe came after Trump highlighted ending the India-Pakistan conflict as one of the major accomplishments of the first year of his second term in the White House. He claimed the two countries “were going to go nuclear” and said millions of lives were saved because of his intervention. The US president said he ended “eight unendable wars in 10 months”.Reacting to Trump’s remarks, Congress general secretary in-charge communications Jairam Ramesh said in a post on X, “Before yesterday the count stood at 68. Yesterday itself the count shot up not to 69 but to 70 - once in the opening statement of his White House Press Conference and later in the Q&A.”“That is the number of times the PM's ‘good friend’ and the recipient of his many forced hugs has declared that he was responsible for the sudden and unexpected halt of Operation Sindoor on May 10, 2025,” Ramesh said.At a press conference in Washington, Trump said, “These were unendable wars - Cambodia and Thailand fighting for years, Kosovo and Serbia, the Congo and Rwanda. Pakistan and India, they were really going at it. Eight planes shot down. They were going to go nuclear in my opinion.”Addressing a packed White House press briefing room, Trump said “the prime minister of Pakistan, who visited him in Washington last year, said that ‘President Trump saved 10 million people, and maybe much more than that’. They’re both nuclear countries.”Later in the 105-minute press conference, Trump again claimed credit for ending the war between India and Pakistan.Responding to a question on how winning the Nobel Peace Prize would have improved the lives of everyday Americans, Trump said he had saved probably tens of millions of lives by ending eight wars across the world.“If you add up the numbers, just if you look at any one of those wars, you're talking about millions of people. You multiply it eight times. But when you look at India and Pakistan, that could have been 10,15,20 million people. It could have been more than that. So I saved millions of people. So that to me is the big thing,” Trump said.Trump has repeatedly claimed that he stopped the conflict between India and Pakistan, making the assertion on various platforms in the US and around the world since May 10 last year, when he announced on social media that the two countries had agreed to a full and immediate ceasefire after talks mediated by Washington.India has consistently denied any third-party intervention.Trump also said that he should have been awarded the Nobel Peace Prize for ending wars, including conflicts between Israel and Iran, Egypt and Ethiopia, and Armenia and Azerbaijan.",Congress steps up attack on prime minister narendra modi. Opposition party says the count of such assertions has now risen to 70. The swipe came after trump highlighted ending the india-pakistan conflict as one of the major accomplishments of the first year of his second term in the white house.,"https://static.toiimg.com/thumb/msid-126937845,width-1280,height-720,imgsize-780221,resizemode-6,overlay-toi_sw,pt-32,y_pad-600/photo.jpg"
Government advises kin of Indian officials in Bangladesh to return,https://timesofindia.indiatimes.com/india/govt-advises-kin-of-indian-officials-in-bangladesh-to-return/articleshow/126870249.cms,"Bangladesh Admits 645 Minority Incidents In 2025 But Downplays Communal Angle Amid Hindu Killings

NEW DELHI: Amidst the threat of violence against Indian establishments in Bangladesh, the Indian govt has advised the families of Indian diplomats and officials in the country to return to India.""Given the security situation, as a precautionary measure, we have advised the dependents of mission and post officials to return to India. The mission and all posts in Bangladesh continue to remain open and operational,"" said an official source, adding that the Indian mission in the country continues to work at full strength.According to sources, the decision was taken in the light of recent anti-India protests that threatened to get out of hand. ""It's for the time being and will be reviewed later,"" said an official on condition of anonymity.In India's neighbourhood, Afghanistan remains the only non-family posting for Indian officials. While diplomats in Pakistan are allowed to take their families along, they generally avoid it because the govt had advised them after the Peshawar school attack to not send their children to local schools.",The indian govt has advised the families of indian diplomats and officials in the country to return to india. The decision was taken in the light of recent anti-india protests that threatened to get out of hand. Afghanistan remains the only non-family posting for indian officials.,"https://static.toiimg.com/thumb/msid-126937879,width-1280,height-720,imgsize-1229986,resizemode-6,overlay-toi_sw,pt-32,y_pad-600/photo.jpg"
'Zero appeals received': CEC Gyanesh Kumar hails 'successful' SIR at IICDEM 2026,https://timesofindia.indiatimes.com/india/zero-appeals-received-cec-gyanesh-kumar-hails-sir-at-iicdem-2026/articleshow/127019246.cms,"Gyanesh Kumar, Chief Election Commissioner

NEW DELHI: Chief election commissioner (CEC) Gyanesh Kumar on Wednesday utilised the India International Conference on Democracy and Election Management (IICDEM) 2026 — which got underway here with the participation of delegates from 70 nations — as a forum to showcase the successful conduct of special intensive revision (SIR) in Bihar, citing the zero appeals received after publication of the final electoral roll, and the subsequent assembly election that witnessed zero repolls.“Pure electoral roll, including each and every eligible elector as per law, is essential to strengthen democracy and all elections which will be held on the basis of that electoral roll. The second segment is the conduct of elections, which becomes a very challenging, logistical affair, because a large number of people have to obey and follow the electoral laws and the instructions issued by the EC,” Kumar said while highlighting how the Bihar election had delivered on both the fronts.Stating that the purpose of the IICDEM 2026 is to not only celebrate democracy but also understand the future path, challenges, the expectations of the electors and how to make the electoral process smoother, transparent, free and fair, the CEC explained to the foreign delegates, which included top representatives of 42 electoral management bodies and 27 ambassadors/High Commissioners, how Indian elections have become one of the largest exercises on the planet in terms of logistics, numbers and transparency.“More than a billion voters, (with) 640 million exercising their franchise at more than a million polling stations….and roughly. 1.8-2 crore people involved in the exercise, is a feat,” he underlined.Election commissioner SS Sandhu described the faith placed by citizens in electoral management bodies (EMBs) as precious, saying that it is the collective responsibility of EMBs to preserve it.Election commissioner Vivek Joshi said IICDEM-2026 brings together EMBs, researchers, students and practitioners who view elections from different angles, to brainstorm on all issues related to democracy and electoral management.Earlier, secretary general of the International Institute for Democracy and Electoral Assistance (international IDEA) Kevin Casas-Zamora welcomed India’s chairship of International IDEA, saying that India must share with the world how it has managed the odds to build a legacy of “free and fair elections, respect for the rule of law, tolerance, secularism, press freedom and all the things that make a democracy worth”.Recalling how recent elections across many countries witnessed political polarisation, illicit funding flows, online and offline aggression and digital misinformation, Casas-Zamora also raised concern over outright election denialism, with politicians from the US, Peru, Georgia, and Bangladesh “using spurious arguments to question credible results”. He said that 2024 saw 1.6 billion people casting ballots in 74 national elections, including India. “Yet, global electoral turnout that year was down nearly 10 percentage points when compared to 15 years before, while around 40% of elections suffered some form of dispute over their credibility,” he pointed out.Casas-Zamora however said elections had also helped reverse democratic backsliding in Poland, Senegal, Guatemala and Brazil. “Democracy can be restored as long as electoral routes for political change remain open,” he emphasised.Speaking on the theme of IICDEM 2026 — democracy for an inclusive, peaceful, resilient and sustainable world — DG IIIDEM Rakesh Verma said that it reflects a broad and multi-dimensional understanding of what democracy must deliver in the 21st century.The participants viewed glimpses from the upcoming docu-series, “India Decides” produced in collaboration with Warner Bros. Discovery.","Chief election commissioner (cec) gyanesh kumar utilised the india international conference on democracy and election management (iicdem) 2026. The purpose of the iicdem 2026 is to not only celebrate democracy but also understand the future path, challenges, the expectations of the electors.","https://static.toiimg.com/thumb/msid-127022942,width-1280,height-720,imgsize-113618,resizemode-6,overlay-toi_sw,pt-32,y_pad-600/photo.jpg"
"Evening news wrap: Trump lands in Switzerland ahead of Davos address; IAF aircraft makes 'forced landing' in UP, and more",https://timesofindia.indiatimes.com/india/evening-news-wrap-trump-lands-in-switzerland-ahead-of-davos-address-iaf-aircraft-makes-forced-landing-in-up-and-more/articleshow/126985267.cms,"Donald Trump arrived at Davos amid sharp transatlantic tensions over tariffs and Greenland ownership .

arrived at Davos amid sharp over and . An Indian Air Force training aircraft made an emergency landing in Prayagraj due to engine failure, with both officers safe.

A Mumbai sessions court warned TISS students that a criminal case linked to a campus event could permanently harm their careers.

Police in Karnataka registered a case against a Hindu leader over alleged gestures and slogans said to hurt religious sentiments.

Canadian Prime Minister Mark Carney used his Davos speech to criticise US unilateralism and urge middle powers, including India, to unite.

Here are the top 5 news stories of the day

Trump lands in Davos as US–Europe tensions dominate forum

Indian Air Force aircraft makes emergency landing in Prayagraj

Court cautions TISS students over Saibaba anniversary case

Karnataka police book Hindu leader over alleged communal gesture

Carney urges middle powers to unite in rebuke to US approach

‘Rules No Longer Protect': Canada's Carney Blasts Trump Tariffs Over Greenland | FULL SPEECH

Donald Trump arrived in Switzerland for the World Economic Forum as European leaders voiced concern over his tariff threats and territorial ambitions. EU Commission President Ursula von der Leyen called planned US tariffs linked to Greenland a “mistake”, while France warned of possible retaliation. Trump is expected to promote his “America First” agenda in his address, with several bilateral meetings planned. The backdrop highlights widening rifts between Washington and its allies.A training aircraft from Air Force Station Bamrauli crash-landed near Prayagraj after an engine failure during a routine sortie. An emergency parachute deployed, preventing a major accident, and both officers on board were reported stable. The incident is the second aviation emergency this month, following a forced landing of a civilian aircraft in Odisha. Authorities said investigations would follow standard procedures.A sessions court warned nine TISS students seeking anticipatory bail that their involvement in a criminal case could damage future employment prospects. The students are under investigation for organising an unauthorised event marking the death anniversary of academic GN Saibaba.Interim protection from arrest was extended until February 5, with the court underlining the long-term impact of a criminal record. The case includes charges related to unlawful assembly and promoting enmity.Police in Belagavi registered a case against Maharashtra-based Hindu leader Harshita Thakur and others over alleged acts that hurt religious sentiments. The complaint relates to a procession where Thakur is accused of making a gesture towards a dargah, accompanied by slogans. Organisers of the event were also named for speeches said to risk communal disharmony. Police said further investigation is underway.Canadian Prime Minister Mark Carney delivered a forceful speech at Davos warning that the US-led global order is “breaking apart”. Without naming Trump, he criticised the use of tariffs and economic leverage as tools of coercion and cautioned against appeasement. Carney called on middle powers, including India, to act collectively through flexible coalitions. He also reaffirmed Canada’s support for Denmark and Greenland and its commitment to Nato.","Donald trump arrived at davos amid sharp transatlantic tensions over tariffs and greenland ownership. Canadian prime minister mark carney used his davos speech to criticise us unilateralism and urge middle powers, including india, to unite. An indian air force training aircraft made an emergency landing in prayagraj due to engine failure, with both officers safe.","https://static.toiimg.com/thumb/msid-126985728,width-1280,height-720,imgsize-906214,resizemode-6,overlay-toi_sw,pt-32,y_pad-600/photo.jpg"
