Article Title,Article Link,Article Text,Article Summary,Article Image
'Come forward or...': PM Modi's strong message to people of Pakistan on tackling terrorism,https://timesofindia.indiatimes.com/india/sukh-chain-ki-zindagi-jiyo-warna-meri-goli-pm-modis-strong-message-to-people-of-pakistan/articleshow/121416079.cms,"PM Modi's strong message to people of Pakistan

'Delulu Land PM...': Pakistan Frames Its Fakery; Passes Off Chinese Drill Pic As India Strike

NEW DELHI: In a fiery address from Bhuj, Prime Minister Narendra Modi on Monday delivered a powerful message to Pakistan and its people, warning that peace is a choice, but retaliation is certain if terrorism continues.Speaking during a rally after launching development projects worth over Rs 53,400 crore, PM Modi said, “I want to tell the people of Pakistan— sukh chain ki zindagi jiyo, roti khao, warna meri goli to hai hi (live a life of peace and eat your roti in calm, or else, my bullet is always ready).”The Prime Minister said the onus now lies with ordinary Pakistanis, urging, “The people of Pakistan need to come forward to get their country rid of terrorism. Their youth will have to come forward.”PM Modi’s sharp remarks came days after the Indian armed forces’ large-scale strike under Operation Sindoor , conducted in response to the deadly Pahalgam terror attack, which claimed the lives of 26 people.He said the mission wasn’t just retaliation but “a mission to save humanity and end terrorism.” He added, “We waited for 15 days hoping Pakistan would act against terrorism. But it seems terrorism is their bread and butter.”The Prime Minister hailed the strength of India’s response, saying, “Our retaliation was so strong that their airbases are still in ICU. It was the valour and bravery of our forces that made Pakistan wave the white flag.”Referring to Pakistan’s reaction post-strike, PM Modi said, “They sent drones to border areas including Kutch, but even there, brave women had stood firm before. In 1971, women of Kutch rebuilt the Bhuj runway in just 72 hours. Those same women blessed me recently and gifted me a sindoor plant, which I will plant at the PM House.”Criticising Pakistan’s ideology, he stated, “India believes in tourism, it connects nations. But Pakistan considers terrorism as tourism. This is dangerous for the world.”Modi reiterated India’s stance of zero tolerance against terrorism, asserting, “Whoever will make us bleed will face the same fate. At no cost will they be spared.”The PM’s visit to Bhuj included the inauguration of major power, port, and infrastructure projects. He lauded the region's development and resilience, noting, “Bhuj’s growth story is remarkable. The projects launched today will accelerate progress in renewable energy, ports, and infrastructure.”","Pm modi's sharp remarks came days after the indian armed forces’ large-scale strike under operation sindoor. He said the mission wasn’t just retaliation but “a mission to save humanity and end terrorism” he added, “we waited for 15 days hoping pakistan would act against terrorism. But it seems terrorism is their bread and butter”","https://static.toiimg.com/thumb/msid-121416077,width-1070,height-580,imgsize-669195,resizemode-75,overlay-toi_sw,pt-32,y_pad-40/photo.jpg"
'Balasaheb would've hugged Modi': Amit Shah slams Uddhav's 'baraat' dig at India's Operation Sindoor delegations,https://timesofindia.indiatimes.com/india/balasaheb-wouldve-hugged-modi-amit-shah-slams-uddhavs-baraat-dig-at-indias-operation-sindoor-delegation/articleshow/121416915.cms,"Union home minister Amit Shah (PTI photo)

NEW DELHI: Union home minister Amit Shah on Monday took a strong exception to former ally Uddhav Thackeray 's remark ridiculing India's Operation Sindoor delegations.Hitting back at Thackeray, who had called all-party delegations ""baraat"", Amit Shah said he couldn't comprehend ""what has happened to Uddhav Sena"".Shah further claimed that if Uddhav's father, Balasaheb Thackeray, had been alive he would would have hugged PM Modi for Operation Sindoor against Pakistan-backed terrorists.""Had Balasaheb Thackeray been alive, he would have hugged Modi. But a Sena (UBT) leader called the delegations a baraat. I don't know what has happened to the Uddhav Sena. They are calling the delegations a baraat even though their own members are a part of it,"" said the Union home minister, while addressing a 'Shankhnaad' rally in Maharashtra's Nanded.Shah hailed the success of Operation Sindoor, saying it had sent a strong signal not just to Pakistan but to the entire world that India's armed forces, its citizens, and its borders are not to be trifled with.""Operation Sindoor has sent the message to not just Pakistan but also the world that no one can mess with our armed forces, people and borders. Else, the perpetrators will have to face consequences,"" Shah said.Condemning the Pahalgam terror attack as a cowardly act by Pakistan-sponsored terrorists, Shah recalled Prime Minister Narendra Modi’s firm stance in Patna following the incident.""Pakistan forgot that 11 years ago, there was a Congress government, which has now changed. We responded to the Uri, Pulwana and Pahalgham strikes and struck terror bases,"" he said.Highlighting the swiftness of India’s counter-offensive, Shah noted that nine terror camps were taken out in just 22 minutes during Operation Sindoor on May 7. He added that India’s air defence system successfully intercepted all incoming Pakistani missiles and drones, preventing any damage to Indian territory.On May 9, the Indian armed forces neutralised Pakistan’s air defence system, Shah said.""Modiji has declared that there would be retaliation if the blood of innocent Indian civilians is shed. If our women's sindoor is harmed, the response will be bloodier,"" he added, stating that Operation Sindoor stands as a testament to the government's unwavering resolve to defend the nation's borders.","Union home minister amit shah hits back at former ally uddhav thackeray. Shah says he can't comprehend ""what has happened to uddhav sena"" shah hails the success of operation sindoor against pakistan-backed terrorists.","https://static.toiimg.com/thumb/msid-121418200,width-1070,height-580,imgsize-41424,resizemode-75,overlay-toi_sw,pt-32,y_pad-40/photo.jpg"
NSA Ajit Doval pulls out of Moscow security meet due to seasonal flu: Report,https://timesofindia.indiatimes.com/india/nsa-ajit-doval-pulls-out-of-moscow-security-meet-due-to-seasonal-flu-sources/articleshow/121410091.cms,"NEW DELHI: India’s National Security Adviser (NSA) Ajit Doval will not participate in the 13th International Meeting of High Representatives for Security Issues scheduled in Moscow from May 27 to 29, PTI reported, citing sources on Monday.According to officials, Doval was slated to attend the key multilateral security forum hosted by Russia but had to withdraw due to a seasonal flu. “He is, however, unable to participate in the meeting due to indisposition with a seasonal flu,” sources said, adding that the NSA looks forward to early bilateral engagements with Russia on strategic and security matters, reported PTI.His absence comes after earlier reports had indicated that Doval was expected to travel to Russia this week for the event.During his last visit to Russia for the BRICS NSA-level meeting in St Petersburg in 2024, Doval met Russian President Vladimir Putin. A statement from the Russian Embassy in India at the time highlighted the significance of the Indo-Russian strategic partnership. “President Putin noted the successful development of the Special and Privileged Strategic Partnership between India and Russia and stressed the importance of security issues in bilateral relations,” the embassy had said.On the sidelines of the BRICS meeting, Doval also held a bilateral meeting with Sergei Shoigu, Secretary of the Russian Federation's Security Council. The Russian Embassy had described India as one of Moscow’s “main like-minded partners,” emphasizing a “multi-level trust-based political dialogue” between the two countries.Shoigu had stated that “New Delhi is one of Moscow's main like-minded partners in the world arena,” and noted that both nations continue to jointly address global security challenges.While Ajit Doval’s absence from this week’s Moscow meet is seen as a temporary setback, both sides have signaled continued cooperation on security and strategic matters in the near future.",India’s national security adviser (nsa) ajit doval will not participate in the 13th international meeting of high representatives for security issues scheduled in moscow from may 27 to 29. Doval was slated to attend the key multilateral security forum hosted by russia but had to withdraw due to a seasonal flu.,"https://static.toiimg.com/thumb/msid-121416658,width-1070,height-580,imgsize-22828,resizemode-75,overlay-toi_sw,pt-32,y_pad-40/photo.jpg"
"In their first phone conversation, Jaishankar, Canadian foreign minister Anand discuss ways to boost economic ties",https://timesofindia.indiatimes.com/india/in-their-first-phone-conversation-jaishankar-canadian-foreign-minister-anand-discuss-ways-to-boost-economic-ties/articleshow/121398194.cms,"NEW DELHI: External affairs minister S Jaishankar and his Canadian counterpart Anita Anand held their first phone conversation on Sunday that focused on deepening the bilateral economic ties and advancing shared priorities. Anand assumed charge as Canada's foreign minister this month in Prime Minister Mark Carney's new Cabinet. He led the Liberal Party to its remarkable victory in the parliamentary elections last month.Carney's election victory was seen as an opportunity to repair ties between India and Canada that came under severe strain during the prime ministership of Justin Trudeau.""Discussed the prospects of India-Canada ties. Wished her a very successful tenure,"" Jaishankar said in a social media post.Anand said she had a ""productive discussion"" with Jaishankar.""Thank you Minister @DrSJaishankar for the productive discussion today on strengthening Canada' India ties, deepening our economic cooperation, and advancing shared priorities. I look forward to continuing our work together,"" she said on 'X'.The ties between India and Canada were severely hit following Trudeau's allegations in September 2023 of the ""potential"" involvement of Indian agents in the killing of Hardeep Singh Nijjar on Canadian soil.New Delhi strongly rejected Trudeau's charges as ""absurd"".The relations nose-dived further in the second half of the last year after Ottawa linked several Indian diplomats, including High Commissioner Sanjay Verma, to the murder of Nijjar.In October last, India withdrew Verma and five other diplomats. India also expelled an equal number of Canadian diplomats from New Delhi.In the last few months, the security officials of India and Canada resumed contacts and both sides were looking at the possibility of appointing new high commissioners.The exit of Trudeau was seen as an opportunity to improve bilateral ties.India had accused Trudeau's government of allowing pro-Khalistani elements to operate from Canadian soil.After Trudeau's exit, New Delhi said it hoped to rebuild ties with Canada based on ""mutual trust and sensitivity"".""The downturn in India-Canada relations was caused by the license that was given to the extremist and secessionist elements in that country,"" external affairs ministry spokesperson Randhir Jaiswal had said in March.",S jaishankar and his canadian counterpart anita anand held their first phone conversation on sunday. Anand assumed charge as canada's foreign minister this month in prime minister mark carney's new cabinet.carney's election victory was seen as an opportunity to repair ties between india and canada that came under severe strain during justin trudeau's government.,"https://static.toiimg.com/thumb/msid-121398233,width-1070,height-580,imgsize-933187,resizemode-75,overlay-toi_sw,pt-32,y_pad-40/photo.jpg"
'Aimed to flush out Pakistani intruders': IAF on why Operation Safed Sagar was historic,https://timesofindia.indiatimes.com/india/aimed-to-flush-out-pakistani-intruders-iaf-on-why-operation-safed-sagar-was-historic/articleshow/121406118.cms,"Jaguar jet (File photo)

Poll Do you believe Operation Safed Sagar was a turning point in military aviation history? Yes No

Guyana Stands With India: Slams Terror, Backs Peace | Tharoor Team Meets PM, VP | Operation Sindoor

NEW DELHI: The Indian Air Force on Monday shared a commemorative video marking the anniversary of 'Operation Safed Sagar', its 1999 air campaign during the Kargil War against Pakistan.Operation Safed Sagar was the IAF’s codename for its air operations conducted in support of the Indian Army’s Operation Vijay, which was launched to evict Pakistani troops and infiltrators who had illegally occupied Indian positions along the Line of Control (LoC) in the Kargil sector.In a post on X, the IAF said: “Operation Safed Sagar — the Indian Air Force’s codename for its air operations during the KargilWar1999 — was launched in support of ground forces under Operation Vijay. It aimed to flush out Pakistani regulars and intruders who had occupied Indian positions along the LoC in the Kargil sector.”The operation was historic, being the first large-scale use of air power in the Kashmir region since the 1971 Indo-Pak war. The IAF executed high-altitude precision operations in some of the world’s most challenging mountainous terrain, redefining the role of air power in limited conflicts.The IAF also shared the list of aircraft used during Operation Safed Sagar to take on Pakistan in the Kargil War. These included Mirage 2000s, MiG-21s, MiG-29s, MiG-23s, MiG-27s, Jaguars, Mi-17 helicopters, and Chetak helicopters.The IAF mentioned: “Never before had an air force been tasked with such high-altitude precision operations in rugged mountainous terrain - making it a watershed moment in military aviation history.”Operation Safed Sagar also broke conventional thinking about air power. It demonstrated that limited, targeted air strikes could have a decisive impact without escalating into a full-scale war.“The operation not only showcased the versatility and resolve of the Indian Air Force but also established the deterrent value of calibrated air strikes—even in a low-intensity conflict,” the IAF said.“It proved that air power could decisively alter the course of battle without crossing international boundaries.”The Kargil War lasted from May to July 1999 in the Kargil district of then Jammu and Kashmir, now part of the Union Territory of Ladakh. The conflict began when Pakistani troops and militants infiltrated across the LoC.India responded with full force, and Operation Vijay led to the successful recapture of key positions.The IAF’s tribute to Operation Safed Sagar comes weeks after its recent offensive under Operation Sindoor , a retaliatory strike launched on May 7 in response to the Pahalgam terror attack.In that action, nine known terrorist hubs sponsored by Pakistan were destroyed, showing India’s continued calibrated use of air power in counterterror operations.","The indian air force on monday shared a commemorative video marking the anniversary of 'operation safed sagar', its 1999 air campaign during the kargil war against pakistan. The iaf also shared the list of aircraft used during operation safing sagar to take on pakistan.","https://static.toiimg.com/thumb/msid-121406094,width-1070,height-580,imgsize-597871,resizemode-75,overlay-toi_sw,pt-32,y_pad-40/photo.jpg"
Viral photo: Pak PM Shehbaz Sharif gifts Asim Munir a fake image of 'Operation Bunyan' against India,https://timesofindia.indiatimes.com/india/viral-photo-pak-pm-shehbaz-sharif-gifts-asim-munir-a-fake-image-of-operation-bunyan/articleshow/121410458.cms,"Viral photo of X

Poll Should military response be more about direct actions rather than symbolic gestures? Yes, direct actions are essential. No, symbolism has its own importance.

Pakistan's JF17 Aircraft Runs Into Russia Trouble? India Seeks 'Friend' Putin's Help | Report

NEW DELHI: In what can only be described as a bizarre mashup of fantasy and farce, Pakistan’s Prime Minister Shehbaz Sharif gifted a framed photograph to Army chief and newly-appointed field marshal Gen. Asim Munir to commemorate ""Operation Bunyan-ul-Marsoos"". The only catch? The image is not from any Pakistani battlefield. It’s a 2019 Chinese rocket artillery drill.In a gesture that may go down as a new low in military cosplay, the Pakistani leadership chose a stock image of Chinese rocket systems, publicly available on multiple defence websites, and passed it off as a symbol of their military prowess.While India executed Operation Sindoor , a high-precision, retaliatory military operation in the aftermath of the April 22 Pahalgam terrorist attack, Pakistan appears to have responded with a JPEG!""Pakistan just hit a new low in military cosplay. PM Shehbaz Sharif gifts Gen. Asim Munir a Chinese rocket drill photo from 2019, claiming it’s Operation Bunyad-ul-Marsus. When your “victories” need stock images from Beijing: it’s not strategy, it’s national embarrassment,"" wrote a BJP leader, BL Sreenivas Solanky, on X.Another user wrote: ""Pakistan's PM Shehbaz Sharif presented Army Chief Asim Munir with a framed photo of a 2019 Chinese military exercise, portraying it as Operation Bunyan-um-Marsoos against India in 2025"".India’s Operation Sindoor, launched just past midnight on May 7, marked its most assertive military response yet to cross-border terrorism. Triggered by the Pahalgam massacre - where tourists were targeted in a brutal execution-style killing - the Indian military executed coordinated strikes deep inside Pakistan, hitting high-value terrorist infrastructure.The response was swift, multi-domain, and precise. India used stand-off weapons, including air-launched cruise missiles, loitering munitions, and long-range drones, to hit nine locations across Pakistan - including Muridke and Bahawalpur, the symbolic and operational hubs of Lashkar-e-Taiba and Jaish-e-Mohammed.Unlike earlier military responses such as the 2016 Uri surgical strikes or the 2019 Balakot airstrike, Operation Sindoor wasn’t about symbolism or deterrent threats. It was about imposing direct, material costs - degrading terrorist capabilities and forcing Pakistan’s military-terrorist nexus to rethink its operational latitude.Operation Sindoor didn’t just demolish infrastructure - it pierced the sense of impunity long enjoyed by Pakistan-based terror groups. By launching precise, visible strikes on their most symbolic sanctuaries, India has forced Lashkar-e-Taiba, Jaish-e-Mohammed, and others into a psychological recalibration.The message was clear: no place is beyond India’s reach. As War on the Rocks notes, these groups will now have to constantly watch their backs, draining energy, focus, and resources that were once singularly aimed at India. Terrorist leaders now operate under constant fear of targeted Indian strikes, forcing them to adopt a survival-first mindset that undermines their ability to plan large-scale attacks.","Pakistan's prime minister shehbaz sharif gifted a framed photograph to army chief and newly-appointed field marshal gen. asim munir to commemorate ""operation bunyan-ul-marsoos"" the only catch? The image is not from any pakistani battlefield. It's a 2019 chinese rocket artillery drill.","https://static.toiimg.com/thumb/msid-121410482,width-1070,height-580,imgsize-62448,resizemode-75,overlay-toi_sw,pt-32,y_pad-40/photo.jpg"
"‘Waited 15 days for Pakistan to act, but terrorism is their bread & butter’: PM Modi on Operation Sindoor",https://timesofindia.indiatimes.com/india/waited-15-days-for-pakistan-to-act-but-terrorism-is-their-bread-butter-pm-modi-on-operation-sindoor/articleshow/121415556.cms,"Roti Khao, Warna Meri Goli...': PM Modi Advises Pakistani Citizen to Get Rid of Terror | Op Sindoor

NEW DELHI: Prime Minister Narendra Modi on Monday said India exercised restraint for 15 days after the April 22 Pahalgam terror attack , hoping Pakistan would act against terrorists. But when no steps were taken, he gave the armed forces a free hand under Operation Sindoor , a mission he described as a clear assertion of India's zero-tolerance policy on terror.“After the Pahalgam attack, we waited for 15 days to see if Pakistan would take any action. But it seems terrorism is their bread and butter. When they did nothing, I gave our armed forces a free hand,” the PM said, addressing a large gathering in Bhuj after inaugurating development projects worth over Rs 50,000 crore.PM Modi said Operation Sindoor not only dismantled terror infrastructure but sent a strong message globally. “Whoever makes us bleed will see a similar response. At no cost will they be spared,” he said.He further said, “Our retaliation was so strong that their airbases are still in ICU. It was the valour and bravery of our forces that forced Pakistan to wave the white flag. We had already told them, our target was your terror infrastructure; all you had to do was stay quiet. Now that you made a mistake, you have to deal with the consequences.”Calling terrorism a global threat, PM Modi added, “India believes in tourism, but Pakistan thinks terrorism is tourism. The people of Pakistan need to come forward to get their country rid of terrorism. Their youth will have to take the lead.”Also read: PM Modi's strong message to people of Pakistan on tackling terrorism Referring to earlier conflicts, he recalled the courage of local women during the 1971 war who repaired the Bhuj runway in just 72 hours. “They blessed me and gifted me a sindoor plant, which will be planted in the PM House,” he said.The Prime Minister also emphasized the scale of development in Kutch, saying, “There was a time when the entire Gujarat didn’t receive this scale of investment. Today, a single district is witnessing Rs 50,000 crore worth of development that will make India a hub of the blue economy and green energy.”Meanwhile, in Maharashtra's Nanded, Union home minister Amit Shah said the PM turned Operation Sindoor into a national effort by sending multi-party MP delegations abroad to expose Pakistan. He slammed Shiv Sena (UBT) for mocking the move, saying, “If Balasaheb Thackeray were alive, he would have supported Modi.”","Prime minister narendra modi said india exercised restraint for 15 days after the april 22 pahalgam terror attack. He said when no steps were taken, he gave the armed forces a free hand under operation sindoor. Pm modi said the people of pakistan need to come forward to get their country rid of terrorism.","https://static.toiimg.com/thumb/msid-121415987,width-1070,height-580,imgsize-824554,resizemode-75,overlay-toi_sw,pt-32,y_pad-40/photo.jpg"
Pakistan’s defence budget hike sparks fiscal priorities debate amid cash crunch,https://timesofindia.indiatimes.com/india/pakistans-defence-budget-hike-sparks-fiscal-priorities-debate-amid-cash-crunch/articleshow/121400156.cms,"ISLAMABAD: Pakistan’s decision to boost defence spending by 18% to over Rs 2.5 lakh crore in the 2025-26 budget has ignited fresh debate over the cash-strapped nation’s fiscal priorities as economic woes deepen and inflation hits more than 38%.Economists warned the latest defence allocation framed as a response to escalating tensions with India following the April 22 Pahalgam attack that killed 26, mostly tourists, risks derailing economic reforms and squeezing social spending.Cross-border firing along LoC intensified in 2025. In response, Islamabad has vowed to ramp up military preparedness while simultaneously pushing forward with costly hydropower projects.Planning and development minister Ahsan Iqbal identified water security as a strategic imperative, accusing India of “water aggression” through upstream dam projects on rivers shared under Indus Waters Treaty. “We will not allow India to exploit our water resources,” Iqbal said, pledging accelerated work on the $14bn Diamer-Bhasha Dam.Expected to produce 4,500MW and store 8.1mn acre-feet of water, Diamer-Bhasha is still years from completion, hindered by funding gaps and logistical setbacks.Analysts questioned whether Islamabad can sustain simultaneous defence and infrastructure pushes. Economist Dr Kaiser Bengali called the approach risky. “Diverting funds to defence and megaprojects like Diamer-Bhasha could undermine social spending and economic reforms, leaving ordinary Pakistanis to bear the brunt,” he said Sunday.Pakistan’s debt-to-GDP ratio stands near 70%. With a trade deficit of $25bn in 2024 and import cover for barely three months, fiscal space remains tight. Facing a severe financial crunch with foreign reserves hovering at $3bn, Islamabad is under pressure from a $7bn IMF bailout programme that demands strict fiscal controls.Govt denied IMF pressure delayed the federal budget, attributing it instead to PM Shehbaz Sharif’s foreign travel and Eid holidays. Analysts remain unconvinced.“IMF’s oversight is inescapable,” Bengali said. “This budget reflects a juggling act between security concerns and economic survival.”",Pakistan's decision to boost defence spending by 18% to over rs 2.5 lakh crore in the 2025-26 budget has ignited fresh debate over the cash-strapped nation’s fiscal priorities.economists warned the latest defence allocation framed as a response to escalating tensions with india risks derailing economic reforms.,"https://static.toiimg.com/thumb/msid-121400180,width-1070,height-580,imgsize-894651,resizemode-75,overlay-toi_sw,pt-32,y_pad-40/photo.jpg"
