Article Title,Article Link,Article Text,Article Summary,Article Image
India emerging as wellness hub: PM Modi on yoga day,https://timesofindia.indiatimes.com/india/india-emerging-as-wellness-hub-pm-modi-on-yoga-day/articleshow/122000645.cms,"Prime Minister Narendra Modi

VISHAKHAPATNAM: The country is emerging as a global hub for wellness under the mantra of 'Heal in India', with yoga playing a leading role in that effort, PM Narendra Modi said Saturday while addressing a record-breaking gathering of 3,02,087 yoga practitioners along Visakhapatnam's beachfront.Modi highlighted yoga's global rise and its integration into modern medicine. ""AIIMS-Delhi has shown yoga's impact on cardiac and neurological disorders, women's health, and mental well-being,"" he said, adding that premier medical institutions are now supporting evidence-based yoga therapies.He recalled India's proposal to UN to mark June 21 as International Day of Yoga , backed by 175 countries. ""This rare global consensus was not just support for a proposal - it was a collective effort for humanity,"" he said. ""After 11 years, yoga is now part of daily life for millions worldwide.""Modi said this year's theme, Yoga for One Earth, One Health, reflects how human well-being is intertwined with environmental health. ""Yoga awakens us to this interconnectedness and guides us toward unity with the world,"" he said.The PM cited examples of yoga's universal appeal - from astronauts practicing it in space to sailors performing asanas aboard Navy ships, and visually impaired people reading yoga texts in Braille. ""Whether at Sydney Opera House, the summit of Everest, or in the vast ocean, the message is the same - yoga belongs to everyone,"" he said.He said yoga is both personal and collective. ""It transforms our journey from 'Me' to 'We',"" he said. ""In times of global unrest, yoga acts as a pause button, helping humanity breathe, restore balance, and become whole again.""","Prime minister narendra modi addressed a record-breaking gathering of 3,02,087 yoga practitioners along visakhapatnam's beachfront. Modi highlighted yoga's global rise and its integration into modern medicine. He recalled india's proposal to mark june 21 as international day of yoga.","https://static.toiimg.com/thumb/msid-122000706,width-1070,height-580,imgsize-69804,resizemode-75,overlay-toi_sw,pt-32,y_pad-40/photo.jpg"
Operation Sindoor: Deputy PM admits Pakistan asked for ceasefire after India struck 2 airbases - Watch,https://timesofindia.indiatimes.com/india/operation-sindoor-deputy-pm-admits-pak-asked-for-ceasefire-after-india-struck-2-airbases-watch/articleshow/121957791.cms,"Pakistan foreign minister Ishaq Dar

'Insult To India': Political Uproar Over Trump's Credit to PM Modi, Pak Army Chief For Ceasefire

Poll What should be the top priority in responding to terror attacks? Ensuring national security through strong action Avoiding escalation through diplomatic efforts

Nur Khan airbase

Pak Deputy PM Ishaq Dar Reveals Pakistan Sought Saudi Help to Stop India’s Operation Sindoor Strikes

Rafiqui airbase

Operation Sindoor

NEW DELHI: Dragging his feet to the truth after repeated denials, Pakistan’s deputy prime minister Ishaq Dar on Thursday admitted that India struck Rawalpindi's Nur Khan airbase and the Shorkot airbase during Operation Sindoor , which was carried to avenge the Pahalgam terrorist attack, in which ISI-groomed terrorists killed 26 civilians.India attacked the Nur Khan and Shorkot airbases on the intervening night of May 6 and 7. Within 45 minutes of the strike, Saudi Prince Faisal offered to speak to external affairs minister S Jaishankar on behalf of Pakistan's deputy PM, seeking to halt further action against Pakistan.Dar's statement strongly suggests that Islamabad desperately scrambled to find help in persuading India to halt its kinetic action, which was ""precise, measured and non-escalatory"". Pakistan air force Base Nur Khan, situated in Chaklala, Rawalpindi is around 10km from Islamabad, Pakistan capital. It is an active airbase that encompasses the former Benazir Bhutto International Airport within its grounds.The facility, originally established as RAF Station Chaklala and later known as PAF Base Chaklala, continues to serve as a vital military installation in Pakistan.The base is also home to PAF College Chaklala, which trains Aviation Cadets, and Fazaia Inter College Nur Khan, providing additional educational facilities on the premises.Imtiaz Gul, a defence analyst, claimed that the strategically important Nur Khan airbase in Rawalpindi is “under American control.”Pakistan air force base Rafiqui, situated near Shorkot in Jhang District, is a major military installation located 337 kilometers south of Islamabad. The base features a 10,000-foot runway with a parallel taxiway that serves as an emergency landing strip.The airbase was previously known as PAF Base Shorkot before being renamed after Sarfaraz Ahmed Rafiqui, a fighter pilot from the Indo-Pakistani War of 1965.The base's infrastructure includes a primary runway and an emergency taxiway system that allows for aircraft recovery operations when needed.Operation Sindoor was India's swift, calculated tri‑service cross-border assault on the dead night of May 6 and 7, targeting nine terror camps deep inside Pakistan and Pakistan‑occupied Kashmir in retaliation for the brutal April 22 Pahalgam massacre that claimed 26 innocent lives.Within 25 minutes, India’s Army, Navy and Air Force deployed SCALP cruise missiles, HAMMER smart bombs, loitering munitions and ground-to-ground weaponry, killing around 70 to 100 militants and crippling key Lashkar‑e‑Taiba, JeM and Hizbul Mujahideen infrastructure at Bahalwalpur and Muridke in Pakistan.Pahalgam's terrorists thought they were sending a message when they murdered husbands in front of their wives, after selecting victims by their religion. Via the name Operation Sindoor, the government sent an immeasurably bigger message back as India avenged the loss suffered by those women.Sindoor, vermillion, is a symbol of marriage in Hindu custom. Pakistan's military-intelligence-jihadi complex would have been among the first to note the image put out by Indian Army right after government's confirmation of the strikes - Operation Sindoor in block letters, with the first 'O' represented by a bowl of vermillion.","Pak deputy pm ishaq dar reveals pakistan sought saudi help to stop india’s operation sindoor. Within 45 minutes of the strike, saudi prince faisal offered to speak to external affairs minister s jaishankar on behalf of pakistan's deputy pm, seeking to halt further action against pakistan.","https://static.toiimg.com/thumb/msid-121958345,width-1070,height-580,imgsize-1674392,resizemode-75,overlay-toi_sw,pt-32,y_pad-40/photo.jpg"
Israel unleashes fresh strikes across Iran; nuclear facility among targets — 10 key developments,https://timesofindia.indiatimes.com/world/middle-east/israel-iran-war-trump-weighs-us-strike-netanyahu-cites-personal-cost-10-key-points/articleshow/121964961.cms,"Iran Launches Mega New Missile Strike On Israel; IRGC Releases Attack Video

Here are 10 key developments:

Confirms major strikes on Tehran military and nuclear sites: IDF

Poll Do you think diplomatic talks in Geneva will lead to a resolution? Yes, diplomacy can de‑escalate the situation No, it's unlikely to change anything

Trump: Decision on US strike in 'next two weeks'

IRGC intel chief among those targeted by Israel

Cluster bomb used in strike on Israeli hospital

' Khamenei should not continue to exist,' Says Israel Katz



US military aircraft no longer visible in Qatar: Satellite images

Netanyahu reveals 'personal cost' of war with Iran

Geneva diplomatic talks offer glimmer of hope

Internet blackout in Iran obscures situation

Regional conflict still looms large





A week into the war between Israel and Iran, tensions continue to rise as missile strikes, and drone attacks continue . The conflict was triggered by Israeli airstrikes on Iranian nuclear and military targets last Friday, prompting swift retaliation from Tehran. Hundreds have died, and fears are mounting of a wider regional escalation.Also read: Iran strikes southern Israel; thick black smoke fills sky as missile hits high-rise apartment In the midst of this turmoil, US President Donald Trump said he will decide within two weeks whether the United States will intervene militarily, depending on the prospect of renewed nuclear negotiations. Israeli leaders, meanwhile, continue to issue aggressive statements, with Defence Minister Israel Katz saying Iran's Supreme Leader “should not continue to exist.”The Israel Defense Forces (IDF) said it carried out a large-scale overnight operation in Tehran, targeting “dozens of military industrial sites for missile production” and the Spand nuclear R&D headquarters. According to the IDF, over 60 fighter jets struck around 120 targets using “precise intelligence guidance.”“These sites were built over years and were the industrial centre of gravity of the Iranian Ministry of Defence,” the IDF said, adding that it also struck a key facility used for producing raw materials for rocket engines.The Spand headquarters, founded in 2011 by Mohsen Fakhrizadeh, was also hit. The IDF described it as central to Iran’s nuclear weapons programme. During the same operation, four Iranian drones were intercepted.President Donald Trump has said he will decide “within two weeks” whether the US military will become directly involved in the conflict. His remarks, delivered by White House press secretary Karoline Leavitt, signal a short diplomatic window to avoid further escalation.Also read: Donald Trump to decide on Iran strike in 2 weeks; White House cites 'substantial' chance of negotiations to end conflict Trump said from the Oval Office, “I’m not looking to fight. But if it’s a choice between fighting and having a nuclear weapon, you have to do what you have to do.” He added, “I may do it, I may not do it. I mean, nobody knows what I’m going to do. Nothing is finished until it is finished. The next week is going to be very big — maybe less than a week.”His comments come amid reports that the US is considering striking Iran’s underground Fordo facility, which is heavily fortified and believed to be unreachable except by America’s “bunkerbuster” bombs.Israel's opening strikes last Friday reportedly killed several senior Iranian officials, including key figures in Iran's nuclear and military command. Among them was the intelligence chief of Iran’s Islamic Revolutionary Guard Corps (IRGC), although Tehran has not officially confirmed his death.The strikes were aimed at Iran’s nuclear research hubs, ballistic missile sites, and facilities linked to the IRGC’s Quds Force. Israel’s strategy appears to be focused on decapitating Iran’s ability to launch retaliatory operations and to disrupt nuclear infrastructure, which it believes poses an existential threat.While the Israeli military has remained tightlipped on identities, analysts believe the loss of senior IRGC figures will have significant implications for Iran’s military coordination and may have triggered the intensity of its missile response.An Iranian missile that struck Soroka Medical Center in Beersheba, Israel, was rigged with a cluster munition warhead, according to Israel’s Home Front Command. This type of weapon carries dozens of submunitions that explode on impact, posing severe risks over a wide area.Also read: Hospital bombed, nuclear sites hit: Iran-Israel clash spirals; Netanyahu vows to make 'tyrants' pay The strike wounded at least 80 patients and medical staff. Although most injuries were minor, the hospital's infrastructure suffered heavy damage. Gas, water and airconditioning systems were all disrupted.Iran denied targeting the hospital, claiming the missile was aimed at a nearby Israeli military tech facility. An Israeli military official, speaking anonymously, admitted there was no specific intelligence suggesting Iran planned to hit the hospital.Israel’s hospitals, including Soroka, had preemptively moved vulnerable patients underground. This preparedness likely saved lives during the strike.Israel's defence minister, Israel Katz, directly blamed Iran's Supreme Leader Ayatollah Ali Khamenei for the missile strike on Soroka Medical Center. Katz said Israel’s military “has been instructed and knows that in order to achieve all of its goals, this man absolutely should not continue to exist.”Also read: Ayatollah Khamenei 'can no longer be allowed to exist,' warns Israel; seeks Iran Supreme Leader's accountability over hospital attack His statement was one of the most direct threats ever issued by an Israeli official against Iran’s top leader. While Israel has often accused Khamenei of orchestrating regional terrorism, such overt calls for his elimination are rare and risky.US officials later said President Trump had vetoed an Israeli plan to assassinate Khamenei. Trump confirmed there were “no plans to kill him, at least not for now.”The war of words has added fuel to an already explosive situation and underscores the deeply personal nature of the conflict's rhetoric.New satellite imagery has revealed a notable absence of visible US military aircraft at Al Udeid Air Base in Qatar, one of Washington’s most strategic sites in the region. The images, captured on Thursday, show that aircraft normally stationed at the base have either been relocated or concealed.While the US Department of Defense has not confirmed any repositioning, analysts say this could be part of a strategic redeployment to either prepare for a strike or to shield key assets from potential Iranian retaliation.Military watchers suggest the US may be trying to reduce its exposure ahead of Trump’s decision. Others believe assets may have been repositioned to naval platforms in the Persian Gulf, which are harder to detect and more flexible in combat operations.Prime Minister Benjamin Netanyahu faced fierce backlash after citing his son’s postponed wedding as a symbol of personal sacrifice during wartime. Standing in front of the missilestruck Soroka hospital, he said, “Each of us bears a personal cost, and my family has not been exempt.”Also read: 'Son's wedding cancelled for second time': Netanyahu shares 'personal cost' of war with Iran “This is the second time that my son Avner has cancelled a wedding due to missile threats. It is a personal cost for his fiancée as well, and I must say that my dear wife is a hero, and she bears a personal cost.”He continued: “It really reminds me of the British people during the blitz. We are going through a blitz.”While Netanyahu intended to strike a Churchillian tone, the remarks were ridiculed online, with critics accusing him of being emotionally detached from the actual suffering of citizens. With over 20 Israeli civilian deaths already reported, many found the analogy inappropriate.A diplomatic opening may be emerging, with Iran’s foreign minister Abbas Araghchi scheduled to meet EU and UK leaders in Geneva. British Foreign Secretary David Lammy said, “A window now exists within the next two weeks to achieve a diplomatic solution.” The meetings follow President Trump’s statement allowing a two-week pause before making a military decision. EU foreign policy chief Kaja Kallas and representatives from France and Germany will also participate. The talks aim to halt escalation and revive negotiations around Iran’s nuclear capabilities.Also read: European FMs aim to meet Iran for nuclear talks Friday in Geneva With Iranian internet access restricted, information about the strikes and casualties has become increasingly difficult to verify. Israel had warned civilians in the city of Rasht to evacuate industrial zones ahead of targeted airstrikes. However, it's unclear how widely that warning was received. In Tehran and Isfahan, residents reported hearing anti-aircraft fire. The media blackout has complicated the international response and has limited humanitarian organisations’ ability to assess needs on the ground.While the current battle is between Israel and Iran, the implications stretch far beyond. Iran’s close ties to groups like Hezbollah and Hamas raise the risk of a multi-front war. The ongoing Gaza conflict, following Hamas’ attack in 2023, has already destabilised the region. Any miscalculation now—whether by airstrike or political move—could draw in additional players and ignite a broader Middle Eastern war. The coming days will likely prove critical in determining whether diplomacy can rein in the chaos—or whether the region is poised for deeper conflict.","A week into the war between israel and iran, tensions continue to rise as missile strikes, and drone attacks continue. The conflict was triggered by israeli airstrikes on iranian nuclear and military targets last friday, prompting swift retaliation from tehran. Hundreds have died, and fears are mounting of a wider regional escalation.","https://static.toiimg.com/thumb/msid-121965042,width-1070,height-580,imgsize-886013,resizemode-75,overlay-toi_sw,pt-32,y_pad-40/photo.jpg"
"Income Tax Return: Are capital gains from MFs taxed differently under new & old regime? What taxpayers should know about new LTCG, STCG rules",https://timesofindia.indiatimes.com/business/financial-literacy/taxation/income-tax-return-fy-2024-25-are-capital-gains-from-mutual-funds-taxed-differently-under-new-old-regime-what-taxpayers-should-know-about-new-ltcg-stcg-rules/articleshow/121995606.cms,"Capital gains from sale of mutual funds (MFs) are taxable In India, under both the old and new income tax regimes. (AI image)



Capital Gains From MFs: How Does Taxation Work?

Gains from sale of non - equity MFs, held for more than 24 months, are considered LTCG and taxable at 12.50%.

STCG from sale of non-equity MFs are taxable as per the income tax slab rates.

Further, gains from specified MFs are deemed to be STCG irrespective of the holding period and taxable as per the tax slab rates. Applicable surcharge and cess apply on the above tax rates

Income Tax Return Filing AY 2025-26: One important aspect of income tax return filing, apart from reporting income from salary, is also filling in details of any capital gains - short-term or long-term - that you have made during the financial year.If you are wondering whether taxation of capital gains made from mutual funds differs between the new and the old income tax regime, we have you covered.Capital gains from sale of mutual funds (MFs) are taxable In India, under both the old and new income tax regimes. The categorization of the MF, method of computation of capital gains, is not impacted by the choice of the income tax regime by an individual.“All the deductions available while computing the capital gains, including towards reinvestment in the specified new asset, continue to be equally available under both the new and old income tax regimes,” says Parizad Sirwalla, Partner and Head, Global Mobility Services, Tax, KPMG in India.Also Read | ITR e-filing FY 2024-25: What is the benefit of pre-filled ITR forms on the income tax portal? Top points In general, from a taxability perspective, MFs are broadly categorized into equity MFs and non-equity MFs. There is also a special category of specified MFs within the non-equity MFs.Parizad Sirwalla tells TOI, “Effective 23 July 2024, gains from sale of equity MFs, if held for more than 12 months, are classified as Long-term (LTCG) and gains (exceeding Rs 1.25 lakh) are taxable at 12.50%. Short Term Capital Gains (STCG) from sale of equity MFs are taxable at 20%.”“The tax slab rates, surcharge rates and applicable rebates, will apply qua the tax regime chosen. The maximum surcharge under the old tax regime is 37% (triggers beyond income of Rs 5 crore) while under the new regime it is restricted to 25% (triggers beyond income of Rs 2 crore). It may be noted that under both tax regimes, surcharge is restricted to 15% on all LTCG and STCG on equity MF,” Parizad Sirwalla adds.Also Read | ITR e-filing AY 2025-25: What is Annual Information Statement (AIS) and how is it different from Form 26AS? Top points for taxpayers","Capital gains from sale of mutual funds (mfs) are taxable in india, under both the old and new income tax regimes. The categorization of the mf, method of computation of capital gains, is not impacted by the choice of the income tax regime by an individual.","https://static.toiimg.com/thumb/msid-121995661,width-1070,height-580,imgsize-119754,resizemode-75,overlay-toi_sw,pt-32,y_pad-40/photo.jpg"
"Ignored for Nilambur campaign, Shashi Tharoor's message to Congress: 'Strong bond with party workers, some differences with leadership'",https://timesofindia.indiatimes.com/india/ignored-in-nilambur-bypoll-shashi-tharoors-message-to-congress-strong-bond-with-workers-some-differences-with-leadership/articleshow/121958412.cms,"NEW DELHI: Will the outcome of the Nilambur byelection decide the future of ties between Congress and its Kerala leader Shashi Tharoor - that have remained frosty since January when the Thiruvananthapuram MP surprised his party with out-of-turn praise for Prime Minister Narendra Modi and his foreign policies?Tharoor, who was kept away from party's campaign in Nilambur, on Thursday admitted to ""differences with some in Congress leadership on some issues."" This even as Tharoor asserted that the Congress, its values, and its workers were very dear to him as he had worked closely with party workers for 16 years and regarded them as close friends and brothers and sisters. Tharoor also reminded the party of the close relations he shares with party workers in Kerala that ""saw him through in 4 elections in his own constituency of Thiruvananthapuram.""Interestingly, Tharoor's candid admission came on the day people of Nilambur were voting to select their new MLA. The Congress, which is going all out to wrest power from the Left Democratic Front after two consecutive defeats in the state, had pitched the Nilambur byelection as a semi-final ahead of the assembly elections next year.Little wonder, the party's byelection campaign saw active involvement of Priyanka Gandhi Vadra - who is the MP from Wayanad after Rahul Gandhi opted for Rae Bareli in Uttar Pradesh.So, will the byelection result on June 23 impact the relations between Congress and Tharoor? Well, it certainly can.If the Congress wins the byelection without Tharoor, who has been an integral part of several party campaigns in the state, it may harden its stance further. On the other hand, if the Congress loses the byelection, it might increase the bargaining power of Tharoor vis-à-vis the state leadership.When Tharoor praised Prime Minister Narendra Modi for the first time in January, it evoked a very strong response from the Congress. Party chief Mallikarjun Kharge warned all leaders to toe the party line. However, the Thiruvananthapuram MP continued with his ""personal"" praise of PM Modi's foreign policies, much to the embarrassment of the Congress. Post-Pahalgam terror attack, Tharoor raised his praise pitch, completely moving away from the party line. The situation turned from bad to worse when the government picked Tharoor for its global diplomacy mission even as the Congress ignored and sidelined its leader.It will be interesting to see how Congress and Shashi Tharoor reach a truce in the near future given the recent strain in ties, which saw one Congress leader dub Tharoor as ""super spokesperson of the BJP"". The assembly elections in Kerala is scheduled for next year, but for the Congress the immediate challenge would perhaps be the upcoming Parliament session. The Congress and other opposition parties will surely go all out to corner Prime Minister Modi over the Pahalgam terror attack and US President Donald Trump's mediation claims on Operation Sindoor. It remains to be seen if Tharoor, who strongly defended the government during his global outreach post Sindoor, comes to the rescue of the government on the floor of the House. Already the BJP leaders are citing Tharoor to school the Congress on nationalism.Will Congress and Tharoor bury their differences or will they walk their own separate ways? Well, we may have an answer after the Nilambur results are out.",The outcome of the nilambur byelection will decide the future of ties between congress and its kerala leader shashi tharoor. Ties have remained frosty since january when the thiruvananthapuram mp surprised his party with out-of-turn praise for prime minister narendra modi and his foreign policies.,"https://static.toiimg.com/thumb/msid-121958972,width-1070,height-580,imgsize-49622,resizemode-75,overlay-toi_sw,pt-32,y_pad-40/photo.jpg"
