Article Title,Article Link,Article Text,Article Summary,Article Image
"Safest time to be alive, in India & the world?",https://timesofindia.indiatimes.com/india/safest-time-to-be-alive-in-india-the-world/articleshow/124245208.cms,"Representative image

This may seem very hard to believe, but now is probably the safest time to be alive. Murder rates in India are at their lowest since we started tracking such data, according to the latest report of the National Crime Records Bureau (NCRB).And it’s the same story for most countries globally. NCRB started releasing data for murder and culpable homicide in 1957. In that year, India’s murder rate per lakh was 2.57. By 2023, the latest year for which NCRB has released its data, this had dropped to 2.25.The murder rate rose steadily since 1957, and peaked in the 1990s, after which it has kept dropping. It fell below 4 in 2001, and dropped to under 3 in 2013.Among large states that registered more than 1,000 cases of murder and culpable homicide, the rate is the highest in Jharkhand – at 3.8 per lakh population. Jharkhand is followed by Haryana, Chattisgarh, Assam, Odisha and Telangana – each reporting a rate of 3 or higher. Globally, Japan is the safest country and South Africa the most dangerous, according to World Bank data. Japan, in 2020 – the last year for which comparable data across countries is available – saw only 0.3 murders per lakh population.","The murder rate rose steadily since 1957, and peaked in the 1990s, after which it has kept dropping. Among large states that registered more than 1,000 cases of murder and culpable homicide, the rate is the highest in jharkhand. Globally, japan is the safest country and south africa the most dangerous, according to world bank data.","https://static.toiimg.com/thumb/msid-124245212,width-1070,height-580,imgsize-604397,resizemode-75,overlay-toi_sw,pt-32,y_pad-40/photo.jpg"
"After Ladakh group, Kargil bloc quits talks; sets conditions",https://timesofindia.indiatimes.com/india/after-ladakh-group-kargil-bloc-quits-talks-sets-conditions/articleshow/124245180.cms,"After Ladakh group, Kargil bloc too quits talks, sets conditions

SRINAGAR: Kargil Democratic Alliance (KDA) joined Apex Body Leh (ABL) in withdrawing from talks with the Centre, demanding a judicial probe into the Sept 24 firing by security forces in Leh that killed four protesters and wounded more than 80.Talks with the Union home ministry’s high-powered committee had been scheduled for Oct 6. Both ABL and KDA stressed Tuesday they remain open to dialogue, but only after their conditions are met.KDA co-chairman Asgar Ali Karbalai said in New Delhi no talks would be possible unless a retired Supreme Court judge is appointed to investigate the firing, those arrested are freed, and charges against climate activist Sonam Wangchuk are withdrawn.“Our demands are genuine and legitimate. Dialogue cannot happen at gunpoint,” he said. The KDA team was already in New Delhi, while an ABL delegation was to travel to the national capital Tuesday.","After ladakh group, kargil bloc too quits talks, sets conditions. Both abl and kda stressed tuesday they remain open to dialogue, but only after their conditions are met. Talks with the union home ministry’s high-powered committee had been scheduled for oct 6.","https://static.toiimg.com/thumb/msid-124245179,width-1070,height-580,imgsize-77660,resizemode-75,overlay-toi_sw,pt-32,y_pad-40/photo.jpg"
26/11 attack: Chidambaram says foreign pressure blocked retaliation; BJP hits out,https://timesofindia.indiatimes.com/india/26/11-fallout-chidambaram-says-foreign-pressure-blocked-retaliation-bjp-hits-out/articleshow/124244271.cms,"BJP MP Ravi Shankar Prasad

NEW DELHI: BJP on Tuesday launched a major onslaught on Congress over former Union minister P Chidambaram ’s statement that foreign pressure restrained the Manmohan Singh govt from retaliating against Pakistan after the 26/11 terror attack on Mumbai, saying the country has “paid a heavy price” for sins committed by Congress.BJP’s Ravi Shankar Prasad said Chidambaram’s comments have raised a big question as to “how weak the govt headed by Singh was”. “P Chidamabram, home minister in the Manmohan Singh govt, has now admitted that after the 26/11 attacks, he favoured retaliatory action against Pakistan, but the external affairs department... did not agree, and Singh remained silent,” he said, seeking answers from Sonia Gandhi and Rahul Gandhi as to what compulsions prevented them from acting on the home minister’s suggestions. “It took around 16–17 years for Chidambaram to acknowledge that they failed to give a decisive response to Pakistan for the 26/11 attacks. Why was this wisdom kept hidden for so long? It took years to arrive at this realisation; it’s shameful. The foreign ministry and other ministries overruled the matter, and Singh just watched as the country suffered. Hundreds were killed; the attacks were clearly linked to Pakistan-based terrorists.”Contrasting Congress’s response with the surgical strikes, air strikes and Operation Sindoor conducted by India under PM Modi, Prasad asked, “Who was running the country then? Where was Sonia Gandhi?”In a TV interview, Chidambaram said India had considered military retaliation after the 26/11 attacks but chose not to do so, apparently under pressure from other countries. “The whole world was descending upon Delhi to tell us don’t start a war... For example, Condoleezza Rice, who was then (US) secretary of state, flew in two or three days after I took over to meet me and the PM and to say, please don't react. I said this is a decision which the govt will take. ”“Without disclosing any official secret, it did cross my mind that we should do some act of retribution.” he added. Chidambaram said the PM had discussed this even when the attack was going on ... and “the conclusion was largely influenced by the MEA and IFS (Indian Foreign Service) that the Indian govt should not physically react to the situation”.BJP MP Sudhanshu Trivedi said that instead of taking action against Pakistan after 26/11 attack, UPA govt just seven months later agreed to address Pakistan’s unsubstantiated accusation about India stoking trouble in Balochistan.",Former union minister p chidambaram said foreign pressure restrained the manmohan singh govt from retaliating against pakistan after the 26/11 terror attack on mumbai. Bjp’s ravi shankar prasad said the country has “paid a heavy price’ for sins committed by congress.,"https://static.toiimg.com/thumb/msid-124244323,width-1070,height-580,imgsize-1638892,resizemode-75,overlay-toi_sw,pt-32,y_pad-40/photo.jpg"
‘Mishandled due to foreign pressure’: BJP blasts Chidambaram over 26/11 retaliation remark; questions role of Sonia Gandhi,https://timesofindia.indiatimes.com/india/mishandled-due-to-foreign-pressure-bjp-blasts-chidambaram-over-26/11-retaliation-remark-questions-role-of-sonia-gandhi/articleshow/124226495.cms,"P Chidambaram (left), Pralhad Joshi (ANI)

Poll Should past decisions regarding military retaliation be re-evaluated? Yes, for better future strategies No, the past should remain unchanged

Was in Mumbai During 26/11, Worked with ISI and Lashkar e Taiba: Tahawwur Rana's Shocking Confession

NEW DELHI: The Bharatiya Janata Party launched a sharp attack on former Union home minister P Chidambaram over his recent remarks on the UPA government's decision not to retaliate militarily against Pakistan following the 26/11 Mumbai terror attacks, accusing the Congress of “mishandling” the situation under foreign pressure.Reacting to Chidambaram’s statements made during an interview, union minister Pralhad Joshi posted on X, “After 17 years, Chidambaram, former home minister, admits what the nation knew - 26/11 was mishandled due to pressure from foreign powers. Too little, too late.”In the interview, Chidambaram said that the idea of retaliation “did cross [his] mind”, but the government eventually decided against military action. He said this decision was influenced largely by the ministry of external affairs and senior diplomats.“The whole world descended upon Delhi to tell us 'don't start a war'. Condoleezza Rice, who was then US secretary of state, flew in two or three days after I took over… to say, 'please don't react',” he said.Also read: PM Modi's 'Operation Sindoor' post: Congress takes '3rd umpire' jibe, says battlefield comparison not app

Chidambaram, who took over as home minister just days after the attack, also acknowledged that he discussed possible retributive steps with the then Prime Minister Manmohan Singh and other key figures.“The Prime Minister had discussed this even when the attack was going on... And the conclusion was, largely influenced by the ministry of external affairs and the IFS, that we should not physically react to the situation,” he recalled.The remarks have sparked a political row, with BJP spokesperson Shehzad Poonawalla questioning whether then Prime Minister Manmohan Singh or UPA chairperson Sonia Gandhi had overruled Chidambaram’s personal view in favour of retaliation.Posting on X, he wrote, “Why was UPA taking orders from [Condoleezza Rice]? Why did Sonia Gandhi prevail over the Home Minister?” he asked.Poonawalla further accused the Congress of giving Pakistan a “clean chit” not only on the 26/11 attacks but also in the 2007 Samjhauta Express bombing case. He alleged that the UPA government advanced a “Hindu terror” narrative and granted Pakistan ‘most favoured nation’ (MFN) status despite repeated cross-border terror incidents.He added, “Congress gave clean chit to Pak on 26/11 and Samjhauta & induced Hindu Terror angles. Today too they doubt Surgical Strike, Balakote and Operation Sindoor.”On November 26, 2008, ten heavily armed Pakistani terrorists carried out coordinated attacks across Mumbai, killing over 166 people and injuring hundreds. One attacker, Ajmal Kasab, was captured alive and later executed in 2012.","P chidambaram said the idea of retaliation “did cross [his] mind”, but the government eventually decided against military action. He said this decision was influenced largely by the ministry of external affairs and senior diplomats.","https://static.toiimg.com/thumb/msid-124226548,width-1070,height-580,imgsize-861940,resizemode-75,overlay-toi_sw,pt-32,y_pad-40/photo.jpg"
Extremist violence dips 63% in 2023; jihadi attacks down 87% - NCRB report,https://timesofindia.indiatimes.com/india/extremist-violence-dips-63-in-2023-jihadi-attacks-down-87-ncrb-report/articleshow/124245050.cms,"File photo

NEW DELHI: Incidents of extremist, insurgent and terrorist violence have recorded a sharp fall from 446 in 2022 to 163 in 2023. The decline spans across categories, with left-wing extremism, jihadi terrorism and North-East insurgency showing significant reductions.The steepest fall has been in jihadi terrorist activities, which dropped from 126 in 2022 to just 15 in 2023. Violence linked to North-East insurgents also came down to 10 cases, from 26 in 2022, according to the NCRB 2023 report.While the civilian casualties have decreased, the number of police and army personnel killed has risen. The report also noted a steep increase in arms and ammunition looted by the extremists.The report said that incidents of insurgency int he North-East reduced by over 61% compared to 2022, and Left-wing extremist violence dipped by over 44%. Jihadi terrorist activities saw the sharpest decline — over 87% — followed by “other terrorist” incidents, down by more than 77%. Registered cases too reflected this pattern, with a fall of more than 58%.The total casualties — civilians and security personnel — fell from 118 in 2022 to 103 in 2023.However, within this figure, deaths among police, state and army personnel rose by 50%. With fewer operations, extremist fatalities also dropped by more than 54%, from 131 to 60.Number of surrenders has also fallen, from 417 in 2022 to 318 in 2023, marking a 23% decline, according to the report. Of these, 316 were left-wing extremists. Among North-East insurgency-related crimes in 2023, 85% were categorised under “unlawful activities”.A major concern flagged in the NCRB report is the spike in looted weapons. In 2023, extremists seized 706 arms and 19,946 rounds of ammunition from police and central armed police forces. This is dramatically higher than 2022, when only 36 arms and 99 rounds were reported stolen.","Incidents of extremist, insurgent and terrorist violence have recorded a sharp fall from 446 in 2022 to 163 in 2023. The decline spans across categories, with left-wing extremism, jihadi terrorism and north-east insurgency showing significant reductions. While the civilian casualties have decreased, the number of police and army personnel killed has risen.","https://static.toiimg.com/thumb/msid-124245051,width-1070,height-580,imgsize-120386,resizemode-75,overlay-toi_sw,pt-32,y_pad-40/photo.jpg"
India re-elected to ICAO council with highest-ever mandate: Min Ram Mohan Naidu,https://timesofindia.indiatimes.com/india/india-re-elected-to-icao-council-with-highest-ever-mandate-min-ram-mohan-naidu/articleshow/124244586.cms,"Ram Mohan Naidu (File photo)

NEW DELHI: India has been re-elected to the council of International Civil Aviation Organization (ICAO) with a “stronger mandate”. The election took place on Sept 27 during the 42nd ICAO assembly session at Montreal and India secured more votes as compared to the 2022 elections.Union aviation minister Ram Mohan Naidu said: “Proud to share India has been re-elected to ICAO council with its highest-ever mandate for the 2025–28 term. Global support for India’s membership reflects our rising stature under PM Narendra Modi’s leadership and the growing confidence in India’s commitment to aviation safety, security an sustainability... During my visit to ICAO general assembly in Montreal, I (saw) strong interest from global stakeholders in our aviation sector, especially in aircraft component manufacturing, MRO and skill development. ”Naidu had on Sept 2 hosted a reception for ambassadors and high commissioners in New Delhi ahead of the ICAO assembly session, where he had sought the support of member states for India’s candidature for re-election for the 2025-2028 term.For the 2025–2028 term, India has reaffirmed its commitment to: Strengthening international aviation safety, security and sustainability; promoting equitable growth in air connectivity; advancing technology and innovation and supporting ICAO’s ‘No Country Left Behind initiative’, a govt statement said on Tuesday.India’s foreign ministry had also reaffirmed the country’s strong commitment to ICAO objectives through continuous engagement with other member states. During his Montreal visit, Rammohan Naidu held bilateral meetings with other member states and engaged with aviation industry stakeholders.","India has been re-elected to the council of international civil aviation organization (icao) the election took place on sept 27 during the 42nd icao assembly session at montreal. India secured more votes as compared to the 2022 elections. For the 2025–2028 term, india reaffirmed its commitment to: strengthening international aviation safety, security and sustainability.","https://static.toiimg.com/thumb/msid-124244643,width-1070,height-580,imgsize-41372,resizemode-75,overlay-toi_sw,pt-32,y_pad-40/photo.jpg"
"Break old institutional silos, move towards jointness: Min to forces",https://timesofindia.indiatimes.com/india/break-old-institutional-silos-move-towards-jointness-min-to-forces/articleshow/124244118.cms,"Rajnath Singh

Prepare to deal with biothreats , says CDS



NEW DELHI: With the Army , Navy and Air Force yet to resolve their differences over the creation of integrated theatre commands, defence minister Rajnath Singh on Tuesday said the armed forces must break their old institutional silos and move together towards “jointness” to deal with adversaries and challenges across all domains, including cyber & information warfare.The evolving character of warfare, combined with the complex interplay of traditional and non-traditional threats, makes jointness “a core operational necessity” and a fundamental requirement for national security rather than a matter of choice, Singh said.“While each of our Services possesses the capacity to respond independently, the interconnected nature of land, sea, air, space & cyberspace makes collaborative strength the true guarantor of victory,” he said, speaking at a seminar organised by IAF.“Our govt’s objective is to further promote jointness & integration among the three Services. This is not only a matter of policy but a matter of survival in the fast-changing security environment.”India must step-up preparedness to deal with biothreats as well as radiological contamination from nuclear weapons in the future, even though the possibility of the latter is low, CDS General Anil Chauhan said on Tuesday.Noting that the world has been through a period of intense trials and tribulations during Covid-19 pandemic, the CDS said biothreats — man-made, accidental or natural — are likely to increase in future. “While possibility of use of nuclear weapons in our context is low, it is prudent to take this into our security calculus,” he said.","Rajnath singh said the armed forces must break their old institutional silos and move together towards ‘jointness’ the evolving character of warfare, combined with the complex interplay of traditional and non-traditional threats, makes jointness ‘a core operational necessity’","https://static.toiimg.com/thumb/msid-124244172,width-1070,height-580,imgsize-1158104,resizemode-75,overlay-toi_sw,pt-32,y_pad-40/photo.jpg"
"Last round a missed opportunity, need to engage in earnest for FTA by year-end: EU envoy",https://timesofindia.indiatimes.com/india/last-round-a-missed-opportunity-need-to-engage-in-earnest-for-fta-by-year-end-eu-envoy/articleshow/124220553.cms,"EU ambassador to India Herve Delphin

Poll Should India prioritize expanding its ties with the EU over its relationship with Russia? Yes, focus on the EU No, maintain ties with Russia

The 13th round of India-EU negotiations for a Free Trade Agreement (FTA) this month was a missed opportunity, but the EU remains committed to concluding a “meaningful package” by the end of this year, EU ambassador to India Herve Delphin has said. India and the EU will hold another round of FTA talks in Brussels on October 6, hoping to close several chapters that both sides could not in the last round here.Delphin’s remarks confirm that there are lingering issues that both sides need to address to be able to meet the year-end deadline. EU trade commissioner Maroš Šefčovič, who visited India this month, had said that he expected more progress in the last round.Separately, Germany’s ambassador to India Philipp Ackermann told TOI last week the 13th round was good but not good enough, while expressing confidence that India and the EU will get down to closing more chapters in the next round. Before the 13th round, only 12 of the 24 chapters, including SMEs, transparency, dispute settlement and customs and trade facilitation - had been closed.“The 13th round earlier in September was a bit of a missed opportunity to make some breakthrough. The EU was and is still ready to conclude on a meaningful package. We look forward to India engaging in earnest and moving, like the EU has shown readiness to do, towards a mutually beneficial deal,” said Delphin, addressing an event that explored the way forward in India-EU relations against the backdrop of global disorder.Delphin said that the EU and India offer each other important strategic options to “de-risk the economic turmoil and the security uncertainties, to tap into our complementarities and combine respective strengths and scale to serve each other’s interests”.The EU push towards strategic autonomy and India’s own, as Delphin said, strategic conundrum in the form of challenges posed by the US, China and Russia have forced both sides to diversify their partnerships. However, India’s energy ties with Russia, as EU foreign policy chief Kaja Kallas said this month, remains an impediment to progress in India-EU ties. On its part, India wants EU to shun “double standards” on the issue of Russian oil, with the MEA reminding the EU last week of President Donald Trump’s remarks urging Europe to not purchase Russian energy.Delphin said it is for India to consider how it can square its position on Russia, a strategic partner, with its support for peace and its desire to enhance ties with the EU. Apart from its energy ties with Russia, India’s participation in the Russia-Belarus military exercise Zapad-2025 has also been met with disapproval in Europe.“We also have to be clear-eyed about those issues on which we are not aligned...there is a Russia question - specifically linked to its war of aggression against Ukraine and its hostile attitude towards as seen in past weeks and days and the violation of European air space by Russian drones,” said Delphin.“India has pronounced itself for peace. Russia is a strategic partner for India. And India wants to deepen its ties with the EU. This will require further consideration in Delhi on how to square those terms,” he added.","The 13th round of india-eu negotiations for a free trade agreement (fta) this month was a missed opportunity, says eu ambassador to india herve delphin. India and the eu will hold another round of fta talks in brussels on october 6, hoping to close several chapters that both sides could not in the last round here.","https://static.toiimg.com/thumb/msid-124220558,width-1070,height-580,imgsize-57134,resizemode-75,overlay-toi_sw,pt-32,y_pad-40/photo.jpg"
"Myanmar earthquake: North-East region hit with 4.7 magnitude quake; tremors felt across Assam, Manipur",https://timesofindia.indiatimes.com/india/myanmar-earthquake-north-east-region-hit-with-4-7-magnitude-quake-tremors-felt-across-assam-manipur/articleshow/124223517.cms,"Representative image

Poll Should seismology data be more accessible to the public? Yes No

NEW DELHI: An earthquake of magnitude 4.7 struck Myanmar near the India border early Tuesday, with tremors felt in Manipur , Nagaland, and Assam.The quake occurred at 6.10am, about 27 km southeast of Ukhrul in Manipur, at a depth of 15 km. According to the national center for seismology (NCS), the epicentre was located at latitude 24.73 N and longitude 94.63 E. The location was around 155 km south-southeast of Nagaland’s Wokha, 159 km southeast of Dimapur, 177 km south of Mokokchung, 171 km northeast of Mizoram’s Ngopa, and 193 km northeast of Champhai.The tremor in Myanmar came hours after a magnitude 3.4 earthquake hit Maharashtra’s Satara district at 12.09am on Tuesday, at a shallow depth of 5 km, 91 km northwest of Kolhapur.Another quake of magnitude 3.3 was also recorded in Tibet at 4.28 am, with its epicentre 227 km north of Arunachal Pradesh’s Pangin and 303 km north of Assam’s Dibrugarh. Its depth was measured at 10 km, NCS data showed.","The quake occurred at 6.10am, about 27 km southeast of ukhrul in manipur. The epicentre was located at latitude 24.73 n and longitude 94.63 e. it came hours after a magnitude 3.4 earthquake hit maharashtra’s satara district.","https://static.toiimg.com/thumb/msid-124223507,width-1070,height-580,imgsize-26586,resizemode-75,overlay-toi_sw,pt-32,y_pad-40/photo.jpg"
