Article Title,Article Link,Article Text,Article Summary,Article Image
US peace plan for Gaza: PM Modi welcomes Donald Trump's 20-point proposal; terms it 'viable pathway' to peace,https://timesofindia.indiatimes.com/india/us-peace-plan-for-gaza-pm-modi-welcomes-donald-trumps-20-point-proposal-terms-it-viable-pathway-to-peace/articleshow/124224719.cms,"What if Hamas rejectes deal?



NEW DELHI: Prime Minister Narendra Modi on Tuesday welcomed US President Donald Trump 's announcement of a comprehensive plan to end Gaza conflict.""We welcome President Donald J Trump's announcement of a comprehensive plan to end the Gaza conflict. It provides a viable pathway to long-term and sustainable peace, security and development for the Palestinian and Israeli people, as also for the larger West Asian region,"" said PM Modi in a post on X.PM Modi expressed hope that ""all concerned will come together behind President Trump's initiative and support this effort to end conflict and secure peace.""Trump and Israeli Prime Minister Benjamin Netanyahu announced on Monday that they have agreed on a plan to end the Gaza war, though it is unclear if Hamas will accept the terms.Also read: Who will govern Gaza? Donald Trump's 20-point peace plan — Explained The GOP leader’s plan on the Israel-Hamas war, which started on October 7, 2023, involves a 20-point peace proposal aimed at ending the conflict and preventing further escalation in the region. The plan calls for an immediate ceasefire, the release of hostages, and the protection of civilians on both sides. It also stresses the need for stronger regional cooperation and international monitoring to ensure compliance.Trump has argued that only a detailed, step-by-step framework can restore stability.Later, PM Modi posted his welcome of the comprehensive plan in Arabic and Hebrew as well.Hamas has yet to give its judgement on the 20-point plan. The plan calls for a ceasefire, the release of hostages by Hamas within 72 hours, the disarmament of Hamas, and a gradual Israeli withdrawal from Gaza, followed by a post-war transitional authority headed by Trump himself.""I support your plan to end the war in Gaza which achieves our war aims,"" Netanyahu said during a joint press conference with US President. ""If Hamas rejects your plan, President, or if they supposedly accept it and then basically do everything to counter it, then Israel will finish the job by itself.""Trump said that Israel would have his ""full backing"" if Hamas did not accept the deal. However, he insisted that peace in the Middle East was ""beyond very close"" and described the announcement of the plan as ""potentially one of the great days ever in civilisation.""India was one of the first countries to recognise a Palestinian state in 1988 and also supported a two-state solution at the UN.Since the nearly three-year war, over 65,000 Palestinians have been killed, according to Gaza’s health ministry.","Prime minister narendra modi welcomed us president donald trump's announcement of a comprehensive plan to end gaza conflict. Pm modi expressed hope that ""all concerned will come together behind president trump's initiative and support this effort to end conflict and secure peace"" trump and israeli prime minister benjamin netanyahu announced on monday that they have agreed on a plan.","https://static.toiimg.com/thumb/msid-124224789,width-1070,height-580,imgsize-1046889,resizemode-75,overlay-toi_sw,pt-32,y_pad-40/photo.jpg"
“I'm going to be alone raising these kids” - Gabrielle Union shared her biggest fear when Dwyane Wade was diagnosed with life threatening cancer,https://timesofindia.indiatimes.com/sports/nba/top-stories/im-going-to-be-alone-raising-these-kids-gabrielle-union-shared-her-biggest-fear-when-dwyane-wade-was-diagnosed-with-life-threatening-cancer/articleshow/124187003.cms,"Dwyane Wade with Gabrielle Union (Image via Getty)

Gabrielle Union talks about her biggest fear when Dwyane Wade was diagnosed with kidney cancer

Dwyane Wade Reveals Cancer Diagnosis Led to Kidney Surgery | E! News

Gabrielle Union reveals how Dwyane Wade’s cancer diagnosis took a toll on their relationship

Gabrielle Union and Dwyane Wade open up about their surrogacy journey

Former NBA star Dwyane Wade and his wife Gabrielle Union have been married for over a decade. They celebrated their 11th wedding anniversary on August 30 and even shared a montage of videos on Instagram marking their special day. Despite showcasing the bright sunny side on social media, the Wade couple has been through one of the toughest times. Gabrielle Union revealed her biggest fear when the former NBA star was diagnosed with Cancer.During an interview with the reputed media outlet Marie Clare, Dwyane Wade’s wife Gabrielle Union opened up about one of the most toughest time in their life. While talking about the Miami Heat alum’s cancer diagnosis, Gabrielle Union shared one of her biggest fears. She said,""It was hard to navigate publicly the things that were happening privately. Even though we all know plenty of survivors, immediately you go to death, immediately we all internalize his cancer. It's our cancer.""According to Union, she was scared and even worried that she would have to raise the kids in Dwyane Wade’s absence. The Bring It On star further mentioned,""I'll speak for myself when I say that the decisions that he was making hurt me about his cancer. It felt like, 'Oh, you're trying to kill me.And I'm going to be alone raising these kids. It's a very selfish response that I had, and it caused all kinds of problems, but [so did] his need for secrecy about his cancer decisions. It just starts sowing the seeds of distrust.""After coming across the life-threatening tumor in Wade’s kidney, Gabrielle Union felt as if the NBA icon was almost near to death. She explained,""It just felt like he was trying to leave us—not in a marital sense, but a life and death sense. By the time he got it removed, I felt like we were more on the same page.""Dwyane Wade underwent a kidney removal surgery in December 2023. Reportedly, his 40% right kidney was removed due to the cancer diagnosis. During this particular period of time, Gabrielle Union-Wade and the Heat's alum went through a lot in terms of trauma and anxiety. However, after leaving behind the tumor with a succesful surgery, the Wades' make the most of their time along with their daughter Kaavia.During an appearance on Today with Jenna & Friends, Gabrielle Union revealed how her husband Dwyane Wade’s cancer diagnosis took a toll on their relationship. According to the Hollywood star, within 9 years of marriage their marriage almost hit rock bottom when the NBA star was diagnosed with kidney cancer. She revealed,“It was year nine of our marriage and ... year nine was very hard. When you mention year nine being hard, he hadn’t revealed his cancer diagnosis and his own cancer journey, so now we can put it in more context.”She further elaborated,""Obviously him getting that diagnosis was traumatic for him: Being faced with your own mortality in your early 40s, and you’re like, ‘Am I going to be here to see my family? Who am I without this big life, and without this healthy body? But you also don’t understand the journey and the toll that it takes on your marriage, on your family, on your kids.”After being married for 11 long years, Dwyane Wade and Gabrielle Union share a daughter named Kaavia via surrogacy. The Hollywood star has struggled with health issues which left her with no option but to go ahead with surrogacy.Also Read: “I see what yall saw""- Dwyane Wade reflects on the 'actual reason' behind his crazy fan following with a throwback clip",Former nba star dwyane wade and his wife gabrielle union have been married for over a decade. They celebrated their 11th wedding anniversary on august 30 and even shared a montage of videos on instagram marking their special day. The hollywood star has struggled with health issues which left her with no option but to go ahead with surrogacy.,"https://static.toiimg.com/thumb/msid-124187019,width-1070,height-580,imgsize-96646,resizemode-75,overlay-toi_sw,pt-32,y_pad-40/photo.jpg"
“Criminal ignoramus”: Martina Navratilova tears into Donald Trump for Zohran Mamdani remarks and abuse of power claims,https://timesofindia.indiatimes.com/sports/international-sports/criminal-ignoramus-martina-navratilova-tears-into-donald-trump-for-zohran-mamdani-remarks-and-abuse-of-power-claims/articleshow/124245045.cms,"Martina Navratilova tears into Donald Trump for Zohran Mamdani remarks and abuse of power claims (Image via Getty)

Martina Navratilova reacts to Donald Trump’s Zohran Mamdani comments

“fake Communist promises.”

Trump broke 18 U.S.C. § 595,

: “The criminal ignoramus is at it again.”

Martina Navratilova slams Donald Trump over US Open final delay

“It is absolutely insane.” S

“Let’s spare a thought for the thousands of people waiting outside … it’s been raining … they paid thousands of dollars … it’s half empty still.”

Martina Navratilova has once again spoken out against Donald Trump . On September 29, 2025, she reacted after the U.S. President attacked New York City mayoral candidate Zohran Mamdani . Trump wrote on Truth Social that Mamdani was a “self-proclaimed New York City Communist” and claimed he would never give him federal funds. Political commentator Brian Krassenstein said this could violate U.S. laws and the Constitution. Navratilova joined the debate with one direct line.Donald Trump’s comments about Zohran Mamdani quickly caused controversy. Mamdani is running for mayor of New York City in 2025. Trump wrote that Mamdani would help the Republican Party but called his campaign promisesHe also said Mamdani would never receive money from him as President.Brian Krassenstein, a political writer, shared the post on X. He claimeda law that bars officials from using authority to influence elections.He also mentioned § 201 on bribery, § 872 on extortion, and § 241/242 on violations of voting rights. Krassenstein said Trump’s message may also go against the Appropriations Clause, the Take Care Clause, and the First Amendment. He added that even if charges are not filed, the comments could be seen as abuse of power.Martina Navratilova reacted quickly. On X, she shared the post and wroteHer message was short, but it showed her strong view. She has often been one of Donald Trump’s sharpest critics in sports and politics.This was not the first time Martina Navratilova criticized Trump in September 2025. On September 8, at the US Open men’s singles final in New York, his presence led to heavy security checks. The match between Carlos Alcaraz and Jannik Sinner was set for 2:00 p.m. ET at Arthur Ashe Stadium.Because of Donald Trump’s arrival and Secret Service protocols, the start was delayed by nearly 30 minutes. Thousands of fans waited outside in the rain.Alao Read: Andre Agassi And Steffi Graf Relationship Timeline: Tennis Power Couple, Love Story, Wedding, Children And Life After Retirement Martina Navratilova voiced her anger on Sky Sports. She said:he pointed out how the delay affected the players.She explained that players need to eat, warm up, and prepare on a tight schedule. She also asked people to think of the fans. She said:In the end, Carlos Alcaraz defeated Jannik Sinner and won the U.S. Open. But the focus was also on Trump. His presence, the delays, and the complaints from fans made headlines. Martina Navratilova’s voice added even more weight to the criticism.","Martina navratilova reacted to donald trump’s zohran mamdani comments on september 29, 2025. Trump wrote on truth social that mamdari was a “self-proclaimed new york city communist” and claimed he would never give him federal funds. Navratillova joined the debate with one direct line: “the criminal ignoramus is at it again”","https://static.toiimg.com/thumb/msid-124245041,width-1070,height-580,imgsize-787086,resizemode-75,overlay-toi_sw,pt-32,y_pad-40/photo.jpg"
“Selena beat me to the altar”: Taylor Swift’s wedding speech sparks Rhode Island marriage buzz with Travis Kelce,https://timesofindia.indiatimes.com/sports/nfl/news/selena-beat-me-to-the-altar-taylor-swifts-wedding-speech-sparks-rhode-island-marriage-buzz-with-travis-kelce/articleshow/124235496.cms,"Taylor Swift marriage with Travis Kelce rumors heat up after the singer joked about weddings during her emotional speech at Selena Gomez and Benny Blanco’s Santa Barbara ceremony. With fresh $1.7M renovations to her Rhode Island mansion and Watch Hill’s reputation for privacy, fans think the seaside town could host one of pop culture’s most anticipated weddings.","Taylor swift joked about weddings during her emotional speech at selena gomez and benny blanco’s santa barbara ceremony. With fresh $1.7m renovations to her rhode island mansion and watch hill's reputation for privacy, fans think the seaside town could host one of pop culture's most anticipated weddings.","https://static.toiimg.com/thumb/msid-124236479,width-1070,height-580,imgsize-59902,resizemode-75,overlay-toi_sw,pt-32,y_pad-40/photo.jpg"
“They didn’t want a Black character”: Dwyane Wade's wife Gabrielle Union opens up about being rejected from a movie due to her ethnicity,https://timesofindia.indiatimes.com/sports/nba/top-stories/they-didnt-want-a-black-character-dwyane-wades-wife-gabrielle-union-opens-up-about-being-rejected-from-a-movie-due-to-her-ethnicity/articleshow/124095651.cms,"Gabrielle Union opens up about facing discrimination.(Image via Shareif Ziyadat/FilmMagic)

Dwyane Wade’s wife, Gabrielle Union, opens up about being rejected by a film because of her ethnicity



Dwyane Wade enjoys a lavish life with Gabrielle Union

Dwyane Wade’s wife, Gabrielle Union , has built a pretty successful career for herself in Hollywood, even though she has gone through a lot of traumatic experiences while doing so. A few hours ago, Gabrielle Union reunited with her “Bring It On” cast to celebrate the film's 25th anniversary. While Gabrielle Union looked excited at the event, she had opened up about the reason behind working on the movie and being rejected by another movie for her ethnicity.A few months ago, the ""Bring It On"" star, Gabrielle Union, revealed that 25 years ago, she was actually aiming for another movie.Speaking to MTV, Gabrielle Union said, ""The cheerleading movie I wanted about bank robbing [Sugar and Spice]...”The popular actress added, “They didn't want to go Black on any of the characters…So it's interesting, the group that didn't want to commit to diversity didn't seem to do well and the movie that was about righting the wrongs did well, and that included diversity.""This is not the first time that Gabrielle Union opened up about the discrimination that African American actors have faced while working in Holywood.In March 2025, Gabrielle Union made an appearance on Apple TV+'s new series, Number One on the Call Sheet, where she revealed the discrimination she has faced in Hollywood.Gabrielle Union said, “When you have a more coarse grade of hair, when you have melanin, thicker nose, wider nose, wider lips, you're not considered, you know, a classic beauty…”Despite all the traumatic experiences she has faced, the “Being Mary Jane” star has paved her own path in Hollywood and is considered to be one of the most popular and talented actresses working in the industry.While Gabrielle Union has a highly successful career in Hollywood, her marriage to Dwyane Wade has also inspired millions of fans around the globe.Both Gabrielle Union and Dwyane Wade were separated from their former spouses when the two fell in love with one another after their divorces as the NBA legend was involved in a brutal custody battle with his ex wife. The two left their past behind and started a pretty committed relationship, soon after they met.The two dated for several years before they finally tied the knot in 2014. Now, Dwyane Wade enjoys a lavish life with his wife and their daughter, away from the drama, as the two lead comfortable lives in their lavish mansion.Also Read: “No job is worth feeling uneasy”: Dwyane Wade’s wife Gabrielle Union opens up about protecting herself in Hollywood and the dark side of the film industry","Gabrielle union opened up about being rejected by a film because of her ethnicity. The actress revealed that 25 years ago, she was actually aiming for another movie. Gabrielle union is considered to be one of the most popular and talented actresses working in hollywood.","https://static.toiimg.com/thumb/msid-124095654,width-1070,height-580,imgsize-1338406,resizemode-75,overlay-toi_sw,pt-32,y_pad-40/photo.jpg"
“I’m so f**** lost”: Olivia Ponton breaks down in Paris airport while boyfriend Joe Burrow remains sidelined,https://timesofindia.indiatimes.com/sports/nfl/news/im-so-f-lost-olivia-ponton-breaks-down-in-paris-airport-while-boyfriend-joe-burrow-remains-sidelined/articleshow/124237682.cms,"Joe Burrow is sidelined with a Grade 3 turf toe injury, and now his girlfriend Olivia Ponton has gone viral after breaking down in tears at Paris Charles de Gaulle Airport. The Sports Illustrated model shared a frustrated video saying she was “so f****** lost” while trying to navigate the confusing terminal, sparking reactions from NFL fans and followers online.",Olivia ponton broke down in tears at paris charles de gaulle airport. The sports illustrated model shared a frustrated video saying she was “so f****** lost” the video sparked reactions from nfl fans and followers online.,"https://static.toiimg.com/thumb/msid-124237806,width-1070,height-580,imgsize-49580,resizemode-75,overlay-toi_sw,pt-32,y_pad-40/photo.jpg"
Kirill Kaprizov makes history as he signed the biggest deal in NHL with Minnesota Wild,https://timesofindia.indiatimes.com/sports/nhl/news/kirill-kaprizov-makes-history-as-he-signed-the-biggest-deal-in-nhl-with-minnesota-wild/articleshow/124238549.cms,"On September 30, 2025, Kirill Kaprizov signed an eight-year, $136 million extension with the Minnesota Wild, marking the richest deal in NHL history. This record-breaking contract, commencing after the 2025-26 season, solidifies Kaprizov as the franchise's cornerstone. The Wild anticipate his superstar performance will finally help them overcome their decade-long playoff struggles.","On september 30, 2025, kirill kaprizov signed an eight-year, $136 million extension with the minnesota wild. It is the richest deal in nhl history. The wild anticipate his superstar performance will finally help them overcome their decade-long playoff struggles.","https://static.toiimg.com/thumb/msid-124238521,width-1070,height-580,imgsize-86220,resizemode-75,overlay-toi_sw,pt-32,y_pad-40/photo.jpg"
Tyson Fury hits back after critics slam Venezuela Fury’s engagement at 16 with young boxer Noah Price,https://timesofindia.indiatimes.com/sports/international-sports/tyson-fury-hits-back-after-critics-slam-venezuela-furys-engagement-at-16-with-young-boxer-noah-price/articleshow/124245323.cms,"Tyson Fury hits back after critics slam Venezuela Fury’s engagement at 16 with young boxer Noah Price (Image via Getty)

Tyson Fury and Paris Fury celebrate Venezuela Fury’s engagement

“Congratulations to @venezuelafuryofficial and @7noahprice on getting engaged. Both only young but when you know you know! Still in shock but very happy for you both.

Me and your Dad couldn’t be prouder xxx.”

“50 years ago people got married at 18 and stayed together until death. Today people wait until 30 to get married and divorce within three years.”

Venezuela Fury’s engagement compared to Tyson and Paris Fury’s own story

Tyson Fury has reacted after many people questioned his daughter Venezuela Fury’s engagement at the age of 16. The news was first shared by his wife, Paris Fur,y on Instagram on September 26, 2025, during Venezuela’s 16th birthday party in the UK. Paris posted pictures and wrote a message to congratulate her daughter and her fianc,é Noah Price, who is also a young boxer. Soon after, many fans said Venezuela was too young. Tyson then appeared to defend the couple by posting a video on Instagram.On Instagram, Paris Fury shared the happy news with her followers. She wrote:The proposal took place at Venezuela’s 16th birthday party on September 26, 2025. The young couple posed together in photos, and Paris shared them online.Soon after, comments began to appear, with many people asking if 16 was too early for such a commitment. Some fans wished the couple well, while others voiced concerns about their future.Tyson Fury, who is a former heavyweight world boxing champion, responded indirectly.On September 28, 2025, he reposted a video from Minaret Minds, an Instagram page that shares stories and religious reflections.The video talked about marriage in past generations. The narrator said:The message suggested that older generations valued commitment more, and Tyson’s repost showed his agreement.The engagement of Venezuela and Noah Price has similarities to Tyson and Paris Fury’s relationship. Tyson and Paris met when he was 17 and she was 15. They later started dating on Paris’s 16th birthday. The couple married in 2008 in Doncaster, England, when Paris was 19 and Tyson was 21.Also Read: Tyson Fury’s Daughter Venezuela Fury Gets Engaged To Young Boxer Noah Price At Her 16th Birthday Party They have since renewed their vows multiple times. In 2013, they held a ceremony in New York City, and most recently, in August 2025, they married for the third time in the South of France, joined by their seven children.For many fans, this family history explains why Tyson Fury and Paris are supporting Venezuela’s young engagement. Just like their own love story, it began early.","Venezuela fury got engaged to young boxer noah price at her 16th birthday party. Her father, tyson fury, posted a video on instagram defending the couple. Tyson and paris fury married in 2008 when paris was 19 and tyson was 21. They have since renewed their vows multiple times.","https://static.toiimg.com/thumb/msid-124245314,width-1070,height-580,imgsize-2514079,resizemode-75,overlay-toi_sw,pt-32,y_pad-40/photo.jpg"
