Article Title,Article Link,Article Text,Article Summary,Article Image
"Indus water pact, Donald Trump's role and who supported Pakistan: Key takeaways from House panel meet on cross-border terrorism, Operation Sindoor",https://timesofindia.indiatimes.com/india/indus-water-pact-donald-trumps-role-and-who-supported-pakistan-key-takeaways-from-house-panel-meet-on-cross-border-terrorism-operation-sindoor/articleshow/121410944.cms,"'No prior tip-off to Pakistan': Govt counters Congress claim

Poll Do you think the Indus Water Treaty should be honored despite current tensions? Yes, it's crucial for long-term peace. No, it should be re-evaluated.

India’s strategy and diplomatic outreach

Congress flags concerns: IMF loan, China-Pak ties, and US comments

Trump’s role and EAM’s appeal for unity

Indus Water Treaty : In abeyance, govt to brief MPs on next steps

NEW DELHI: External Affairs Minister S Jaishankar on Monday chaired a meeting of the Consultative Committee of Parliament on External Affairs to discuss cross-border terrorism and the military strikes carried out under Operation Sindoor Launched on May 7 in response to the April 22 Pahalgam terror attack, the operation targeted key terror hubs across Pakistan and Pakistan-occupied Jammu and Kashmir, killing over 100 terrorists affiliated with groups like Jaish-e-Mohammed, Lashkar-e-Taiba, and Hizbul Mujahideen.The meeting addressed concerns raised by the opposition and shed light on diplomatic, military and international aspects of the operation. Here are the key takeaways:Congress MPs raised concerns about whether the government had informed Pakistan in advance of the strikes.The government, however, clarified that there was ""absolutely no conversation"" between India and Pakistan prior to the operation, except at the Director General of Military Operations (DGMO) level, and only after the strikes were complete. “The misrepresentation of this sequence is dishonest,” sources quoted EAM Jaishankar as saying.The official timeline shared in the meeting was: strikes on terror hubs, followed by a PIB press release, and then communication from the Indian DGMO to his Pakistani counterpart.The minister told the parliamentary panel that Pakistan was informed by the DGMO about Indian strikes on terror camps in their territory only after they were executed, sources said. He also said he never spoke to Pakistan and cleared the air about alleged US ""interference"", saying the decision to halt the military operation was taken bilaterally after a request from the Pakistan side.The Congress and Rahul Gandhi have been targeting Jaishankar, alleging that he had informed Pakistan beforehand about the Indian strikes at terror camps.According to ANI sources, the panel was briefed that the government deliberately chose high-value terror targets early to deliver a strong message and expose the inability of Pakistani forces to protect the epicentres of terrorism. The strikes, officials said, had a major psychological impact on the Pakistani military.The EAM also highlighted India’s diplomatic strategy. Following Operation Sindoor, the Modi government deployed seven multi-party delegations across capitals to convey India’s zero-tolerance approach to terrorism. Most countries welcomed India’s action, with only Turkey, China, and Azerbaijan withholding support.A recent statement by German foreign minister Johann Wadephul was cited as an example of global backing. Speaking alongside Jaishankar in Berlin, Wadephul said, “India has every right to defend itself against terrorism… We were appalled by the brutal terrorist attack on April 22 and appreciate the current truce. What matters now is ensuring its stability.”Congress sources, however, expressed dissatisfaction with the government’s explanations. They questioned India’s abstention from IMF-related decisions on Pakistan and flagged concerns over Pakistan’s growing military and strategic proximity to China. They also referred to US senator Marco Rubio's comment on brokering peace between India and Pakistan.The committee also sought clarification on remarks made by US President Donald Trump about India-Pakistan tensions. According to the government, Jaishankar had repeatedly communicated to international counterparts that “terror and talks cannot go together.”The minister told the parliamentary panel that the decision to halt the military operation was taken bilaterally after a request from the Pakistan side.The cessation of Operation Sindoor was done only after Pakistan DGMO asked for the halting of hostilities and there was no question of US mediation between the two, the sources said.Jaishankar said the US was urging India to speak with Pakistan and it was told that terror and talks would not go together. The minister further said that the DGMO had informed his Pakistani counterpart that if they would fire, India would fire back.The EAM concluded by calling for national unity, urging MPs to reflect the same bipartisan spirit seen in foreign delegations back home.MPs also inquired whether India would continue to honour the Indus Water Treaty with Pakistan. The government clarified that the treaty is currently in abeyance and that parliamentarians would be updated on subsequent developments.Jaishankar summarised the session in a post on X, writing, “Chaired the Consultative Committee Meeting of MEA this morning in Delhi. Discussed Op Sindoor and India's zero-tolerance policy against terrorism in all its forms and manifestations. Underlined the importance of sending a strong and united message in that regard.”","'no prior tip-off to pakistan': govt counters congress claim. India’s strategy and diplomatic outreach highlighted. Congress flags concerns: imf loan, china-pak ties, and us comments.indus water treaty : in abeyance, govt to brief mps on next steps. Mps also inquired whether india would continue to honour the indus water treaty with pakistan.","https://static.toiimg.com/thumb/msid-121411784,width-1070,height-580,imgsize-962298,resizemode-75,overlay-toi_sw,pt-32,y_pad-40/photo.jpg"
"Coast Guard, Kerala in race to stave off marine disaster",https://timesofindia.indiatimes.com/india/coast-guard-kerala-in-race-to-stave-off-marine-disaster/articleshow/121421827.cms,"KOCHI: Three capital ships - ICG Samarth, ICG Saksham and ICG Vikram - were deployed off Kochi coast Monday and a pollution response vessel set sail from Mumbai to help stave off the threat of a marine disaster from chemical and oil-laden containers washing ashore from the Liberian ship MSC ELSA 3 that capsized and sank near Thottappally harbour in Alappuzha the previous morning.The accelerated response also involved tug boats to move the 29 cargo containers and assorted debris - thermocol, powder and textiles - spotted floating along the Kollam coast.Union shipping minister Sarbananda Sonowal, who took stock of the response at a meeting with the DG and secretary of shipping, wrote on X that all efforts were focused on ""complete salvage of marine fuel and other hazardous materials"" transported in the containers. ""The pollution response vessel Sagar Prahari is en route to the site. Regular aerial surveillance is being carried out using Dornier aircraft equipped with the MSS 6000 system to monitor any oil spillage. All four company representatives of MSC have arrived in Kochi,"" he said.The DG of shipping is probing the circumstances in which the Liberian vessel reported a critical ""26-degree list"" (tilt) towards starboard side when it was around 38 nautical miles southwest of Kochi.The vessel sank 14.6 nautical miles off Thottappally at 7.50am on Sunday.""The logbook should say if there were any collisions or other impediments on the way. When exactly they realised the listing should find mention too,"" an official said.The mercantile marine dept in Kochi has already issued a pollution liability warning to the vessel owners, M/s MSC, under Merchant Shipping Act, 1958. MSC has appointed TT Salvage for container recovery, oil removal, and environmental clean-up.CM Pinarayi Vijayan convened another emergency meeting Monday to review the situation, after which his office outlined the series of steps aimed at safeguarding the coastal population, averting an environmental crisis, and coordinating response mechanisms involving state and national agencies.","Three capital ships - icg samarth, icg saksham and icg vikram - deployed off kochi coast. Pollution response vessel set sail from mumbai to help stave off the threat of a marine disaster from chemical and oil-laden containers. Liberian ship msc elsa 3 capsized and sank near thottappally harbour in alappuzha on sunday.","https://static.toiimg.com/thumb/msid-121421854,width-1070,height-580,imgsize-1851877,resizemode-75,overlay-toi_sw,pt-32,y_pad-40/photo.jpg"
"Result unchanged, but vote recount puts SC Bar Association under cloud",https://timesofindia.indiatimes.com/india/result-unchanged-but-vote-recount-puts-sc-bar-association-under-cloud/articleshow/121421783.cms,"NEW DELHI: Supreme Court on Monday ordered a recount of votes cast in the election to the Supreme Court Bar Association (SCBA) following a spate of challenges, a development that is seen as taking away from the aura of the country's premier bar body.A partial working day (PWD) bench of Justices Surya Kant and Dipankar Datta found itself dealing with a barrage of challenges from various groups supporting different candidates since morning on Monday. Exasperated, the bench asked election committee chairperson and senior advocate Vijay Hansaria to do a recounting of votes for the president's post.""We will ensure that the elections are free and fair,"" the bench said. Hansaria apprised the bench about undertaking recounting of votes because of certain errors in counting.Senior advocate Vikas Singh was declared president in the poll with a tally of 1,048 votes. Pradeep Rai and Adish Aggarwala finished first and second with 834 and 683 votes, respectively. A recount, prompted by challenges to the result and done in the presence of the SC registrar, returned the following result - Singh 1,051; Rai 825 and Aggarwala 611.Thus, the results announced earlier - Singh as president - remained unaffected but the vote tally of Aggarwala, who was warned against browbeating the election committee by the Justice Kant-led bench on Monday, came down by 72.","Supreme court orders a recount of votes cast in the election to the supreme court bar association. The development is seen as taking away from the aura of the country's premier bar body. Senior advocate vikas singh was declared president in the poll with a tally of 1,048 votes.","https://static.toiimg.com/thumb/msid-121421785,width-1070,height-580,imgsize-1428575,resizemode-75,overlay-toi_sw,pt-32,y_pad-40/photo.jpg"
Watch: Colonel Sofiya Qureshi's family showers flower petals at PM Modi in Vadodara,https://timesofindia.indiatimes.com/india/watch-colonel-sofiya-qureshis-family-showers-flower-petals-at-pm-modi-in-vadodara/articleshow/121405040.cms,"Colonel Sofiya Qureshi's family at PM Modi's roadshow in Vadodara

NEW DELHI: Prime Minister Narendra Modi began his two-day Gujarat visit with a roadshow in Vadodara on Monday, as a large crowd gathered on both sides of the road to greet him.Among the crowd was the family of Colonel Sofiya Qureshi, an Army officer from Vadodara. They were seen showering flower petals at PM Modi, a former chief minister of Gujarat.Colonel Qureshi's sister Shayna Sunsara told news agency ANI, ""We felt good meeting PM Modi. He has done a lot for women's empowerment. Sofiya is my twin. When your sister does something for the country, it inspires not only me but others as well. She is no longer just my sister but the country's sister as well.""The army officer was the face of the government's daily briefings, along with foreign secretary Vikram Misri and Wing Commander Vyomika Singh of the Air Force, on India's "" Operation Sindoor "".On May 7, Indian armed forces conducted Operation Sindoor, targeting nine terrorist camps in Pakistan and Pakistan-occupied Kashmir in retaliation to the terrorist attack in Jammu and Kashmir's Pahalgam on April 22.This triggered a military confrontation with Pakistan. On May 10, New Delhi accepted Islamabad's ceasefire request, which came after the Indian Air Force destroyed 11 of the neighbouring nation's 12 airbases.This is PM Modi's first visit to his home state since Operation Sindoor, On the first day, will inaugurate multiple development projects in Dahod and Bhuj, and will be in state capital Gandhinagar on Tuesday.","Prime minister narendra modi began his two-day gujarat visit with a roadshow in vadodara. A large crowd gathered on both sides of the road to greet him. Among the crowd was the family of colonel sofiya qureshi, an army officer.","https://static.toiimg.com/thumb/msid-121405520,width-1070,height-580,imgsize-1000426,resizemode-75,overlay-toi_sw,pt-32,y_pad-40/photo.jpg"
'This is what lotus symbol stands for': Mallikarjun Kharge's sharp attack on 11 years of Modi government,https://timesofindia.indiatimes.com/india/this-is-what-lotus-symbol-stands-for-mallikarjun-kharges-sharp-attack-on-11-years-of-modi-government/articleshow/121406104.cms,"Youth - Promise of two crore jobs per year, in reality crores are missing

Farmers – Income did not double, on top of that they had to eat rubber bullets

Women - conditions apply to reservation, security in tatters

Weaker sections - SC/ST/OBC/Minorities are facing terrible atrocities, their participation is lost

Economy - inflation at its peak, unemployment on the rise, consumption at a standstill,

Make in India flopping and inequality at its peak

Foreign Policy - Promised to become ""Vishwaguru"" but spoiled relations with every country

Democracy - RSS attacks every pillar, misuse of ED/CBI, autonomy of institutions destroyed

NEW DELHI: As Narendra Modi-government completed 11 years later at the Centre, leader of opposition in Rajya Sabha Mallikarjun Kharge offered a critical assessment of how the central government has fared in fulfilling its promise of ""achhe din"".Taking to X, Kharge highlighted several concerns about the current regime, including rising unemployment, unfulfilled job and income promises, challenges faced by marginalized communities, increasing inflation and inequality, setbacks in initiatives like Make in India, strained foreign relations, and perceived weakening of democratic institutions.Every section of society, he said, has been adversely affected, turning the promise of ""achhe din"" (good days) into a ""dreadful dream."" ""Every section of the 140 crore population is troubled, This is how the Lotus symbol has been in 11 years!!"" he said.""26 May 2014: In 11 years, by turning tall “promises” into hollow “claims”, the Modi Government has ruined the country in such a way that the talk of “good days” has now turned out to be a “dreadful dream,"" he said as he went on to list those claims:The BJP’s uninterrupted run at the Centre began in 2014, when the saffron party secured a clear majority.It went on to retain power in both the 2019 and 2024 general elections, marking three consecutive terms in office.Additionally, Congress leader Jairam Ramesh called the day an ""undeclared emergency"".""India has won! India is victorious. Good days are coming,"" PM Modi had said after his party secured victory in 2014.Modi was sworn in as 14th prime minister on May 26, 2014, after a decisive victory in the general elections. Since then, he has remained in power for 11 consecutive years, securing a third straight mandate in the 2024 general elections — a first for any Indian prime minister.","Mallikarjun kharge says modi-government has ruined the country in such a way that the talk of “good days” has now turned out to be a “dreadful dream” kharge highlights concerns about rising unemployment, unfulfilled job and income promises, challenges faced by marginalized communities, increasing inflation and inequality.","https://static.toiimg.com/thumb/msid-121406873,width-1070,height-580,imgsize-30834,resizemode-75,overlay-toi_sw,pt-32,y_pad-40/photo.jpg"
