Article Title,Article Link,Article Text,Article Summary,Article Image
"'Will continue working bilaterally': Spanish President Sánchez to visit India; strategic partnership, EU trade talks on agenda",https://timesofindia.indiatimes.com/india/will-continue-working-bilaterally-spanish-president-snchez-to-visit-india-strategic-partnership-eu-trade-talks-on-agenda/articleshow/126944238.cms,".

EAM Jaishankar Calls For United Fight Against Terror As India Spain Mark Shared Democratic Values

NEW DELHI: Spanish President Pedro Sánchez Pérez-Castejón is expected to visit India soon, Spanish Foreign Minister Jose Manuel Albares said on Wednesday. He also expressed hope that Prime Minister Narendra Modi would be able to visit Spain.Albares, who met external affairs minister S Jaishankar in New Delhi, said the two countries aim to elevate their relationship to a strategic partnership, the highest level of diplomatic engagement.“President Sánchez will visit India very soon, and I hope Prime Minister Modi will be able to visit Spain as well. We will continue working bilaterally, through the European Union, and in the multilateral sphere. We are also happy to join the Indo-Pacific Ocean Initiative and have brought the letter to mark this moment,” he said.He added, “We also wish to upgrade our relationship to a strategic association, the highest level we have with friends like India. In these complicated times globally, it is very important for Spain to strengthen ties with a reliable country like India, which believes in international law, upholds the principles of the UN Charter, and supports multilateralism,"" as quoted by news agency ANI.Albares thanked India for its message of solidarity following a recent train accident in Barcelona that killed over 40 people: “Thank you for your message of solidarity to the Spanish people in this very painful moment.”He highlighted ongoing cooperation in culture, tourism, and technology, unveiling the joint logo for the dual year of culture, tourism, and artificial intelligence. “It has been a pleasure to present our common logo, which fully represents our shared vision for this year and the future of our relationship, which has grown significantly in recent years. Both countries are working on a packed program of events for this year, and I look forward to its presentation in Spain. I am also glad that public participation was encouraged through crowdsourcing,” he said.Trade and industrial collaboration were also emphasised, with Albares pointing to the EU-India Free Trade Agreement and partnerships like Airbus and Tata as examples of successful cooperation.“A very positive development would be the finalisation of the FTA with the EU, which we hope will happen soon. Spain and India are among the fastest-growing economies in the world, and our businesses are benefiting from this. We will discuss ways to further increase trade relations and strengthen the presence of Spanish companies in India and Indian companies in Spain. The Airbus-Tata partnership is a prime example of what we can achieve,” he said.Albares arrived in India on Wednesday to hold talks with Jaishankar on bilateral, regional, and international issues of mutual interest.",Spanish president pedro sánchez pérez-castejón is expected to visit india soon. Spanish foreign minister jose manuel albares also expressed hope that prime minister narendra modi would be able to visit spain. Albares arrived in india on wednesday to hold talks with external affairs minister s jaishankar.,"https://static.toiimg.com/thumb/msid-126944737,width-1280,height-720,imgsize-1067887,resizemode-6,overlay-toi_sw,pt-32,y_pad-600/photo.jpg"
'365 wins in 365 days': Trump revives India-Pakistan truce claim in White House speech — watch video,https://timesofindia.indiatimes.com/india/365-wins-in-365-days-trump-revives-india-pakistan-truce-claim-in-white-house-speech-watch-video/articleshow/126926697.cms,"Donald Trump Says He Stopped India-Pakistan Nuclear War Again As India Rejects White House Claims

#WATCH | US President Donald Trump says, ""...I ended eight unendable wars in 10 months...Pakistan and India. They were really going at it. Eight planes were shot down. They were going to go nuclear, in my opinion. The Prime Minister of Pakistan was here and he said, President… pic.twitter.com/kTDa912iLQ



— ANI (@ANI) January 20, 2026

US President Donald Trump listed the India-Pak truce as one of the ""wars he ended"" during his tenure, claiming that his intervention stopped the countries from nuking each other. Appearing as a ""special guest"" during the latest White House press briefing, the US President went on to list the ""unendable wars"" he stopped during the first year of his second term.Briefing the press, he said, ""I ended eight unendable wars in 10 months, these were unendable wars... Pakistan and India, they were really going at it, eight planes shot down. They were going nuclear in my opinion.""","Donald trump says he stopped india-pakistan nuclear war again. India rejects white house claims as 'absolutely untrue' us president donald trump listed the india-pak truce as one of the ""wars he ended"" during his tenure, claiming that his intervention stopped the countries from nuking each other.","https://static.toiimg.com/thumb/msid-126923444,width-1280,height-720,imgsize-855956,resizemode-6,overlay-toi_sw,pt-32,y_pad-600/photo.jpg"
"First thing I did after reaching space was to locate countries of my father, mother; I missed meeting Grp Capt Shukla on ISS who came after I left: Sunita Williams",https://timesofindia.indiatimes.com/india/first-thing-i-did-after-reaching-space-was-to-locate-countries-of-my-father-mother-i-missed-meeting-grp-capt-shukla-on-iss-who-came-after-i-left-sunita-williams/articleshow/126886277.cms,"Indian-origin NASA Astronaut Sunita Williams Says Her First Act In Space Was To Spot India, Home

NEW DELHI: “When I reached International Space Station for the first time, the first thing I did was to locate India (on Earth), from where my father belonged to, and Slovenia, from where my mother belonged,” said Indian American astronaut Sunita Williams in Delhi on Tuesday — the only female astronaut who has set the world record for most cumulative spacewalking time by a woman with a total of 62 hours and 6 minutes. During her lifetime, Williams went to space three times as a Nasa astronaut, totalling 608 days in space.Williams’s father, Deepak Pandya, is from Jhulasan village in Gujarat’s Mehsana district, where he was born before migrating to the US. Her mother, Ursuline Bonnie Pandya, is of Slovenian-American descent. Nicknamed ‘Suni’ or ‘Soncka’ in Slovenia, Williams was born in the US state of Ohio and has an elder brother, Jay Thomas, and a sister, Dina Ann.“Though I spent nine months in space during my latest trip to the ISS, I missed meeting Group Captain Subhanshu Shukla who reached the station just after I left,” Williams said during an interactive session, 'Eyes on the Stars, Feet on the Ground' at American Center here.During her last trip to space before hanging her astronaut suit, Williams went to ISS in 2024 for a scheduled 8-day space trip but had to spend 9 months on ISS as the Boeing Starliner that took her to ISS malfunctioned and had to return empty-handed.Later, SpaceX's Dragon brought Williams and her crewmate Butch Wilmore back to Earth on March 18, 2025, with the duo ending up spending 286 days in space. India’s Group Capt Shukla went to space as part of the Axiom mission on June 25, 2025.Williams faced several health issues after returning to Earth after remaining in zero gravity for a long time. However, the 60-year-old was seen in high spirits in Delhi on Tuesday, guiding and inspiring Indian students to join the space sector. To cheer her at the Delhi event was the mother of another Indian-American astronaut, Kalpana Chawla, who died in the Space Shuttle Columbia crash in 2003. Williams, wearing a trademark deep blue space overalls and sporting a pair of space-themed canvas shoes, stepped off the dais and reached out to Chawla’s mother, Sanyogita Chawla, 90, who was sitting in the front row, and gave her a warm hug.When asked about the renewed global interest in the Moon, Williams acknowledged the existence of a modern “space race”. “I think there is a space race going on. We want to get back to the moon sustainably and start the conversation about rules of engagement— how we actually work together with other countries. We want to do this in a productive, democratic way, much like Antarctica,” she said.Williams asserted that the horizon of space exploration is rapidly expanding beyond traditional boundaries, stating that the commercialisation of space is creating unprecedented opportunities for innovation. “Commercialisation of space is great. It means there are opportunities for people to work in so many different companies— not only rockets and spacecraft, but parts of space, experiments, satellites, and 3D printing of metals,” she said.“In my childhood, I never dreamt of becoming an astronaut. We used to watch Star Trek on black & white TV. After I did my schooling and graduated, my brother pushed me to join the military and, thereafter, I became a Navy officer,” she said. Williams had logged more than 3,000 flight hours in more than 30 types of aircraft during her career in the US Navy before donning the astronaut suit. While flying aircraft as a Navy commander, I then wished that I should go to the Moon. From then on, I pursued the career of an astronaut,” Williams recalled.“When I reached the ISS, I was craving for Indian food. I was delighted to see that somebody sent me an Indian dish (in the food cargo) though others were making faces. I was glad to also receive 3D printed models of my dogs on ISS.” In Nasa circles, Williams was called the ‘samosa astronaut’, as she liked carrying samosas to space.An athlete since childhood, Williams wanted to participate in a marathon. “So, my sister told me, ‘I will run on your behalf on the ground and you run in space. So that is how I decided to run a marathon in space,” she revealed. Williams ran the Boston Marathon in space in 2007 after qualifying by running the Houston Marathon in 2006, marking the first time a marathon was completed in orbit. She ran on a treadmill aboard the ISS, finishing in 4 hours and 24 minutes while her sister and others ran on Earth.Recalling her most difficult space job, Williams said she went for a spacewalk after the Starliner faced a technical issue and returned to Earth and the Dragon spacecraft was docking at ISS. “While I was replacing a defected reflector, I had ensured that the Dragon capsule was not damaged with my steel helmet. So, I did the job of replacing the reflector by bending my head on one side for over 1.5 hours. After I returned to my space cabin, I faced neck cramps the whole time. ”Williams, during her extended 9-month stay on ISS, conducted along with her crew over 150 scientific experiments and technological demonstrations, accumulating more than 900 hours of research across various fields like space gardening, microgravity biology, and water recovery systems.The Nasa astronaut said the perception about life on Earth changes when people go to space. “I am married and I argue with my husband like other couples do. But after reaching space (seeing the vast expanse of universe), I used to wonder why we argue (on minor issues) at all,” she said, adding, “The first thing I ate after returning to Earth was the bread my husband baked for me.”","Indian-origin nasa astronaut sunita williams says her first act in space was to spot india, home of her father. During her lifetime, williams went to space three times as a nasa astronaut, totalling 608 days in space. Williams had logged more than 3,000 flight hours in more than 30 types of aircraft during her career.","https://static.toiimg.com/thumb/msid-126886365,width-1280,height-720,imgsize-1125902,resizemode-6,overlay-toi_sw,pt-32,y_pad-600/photo.jpg"
US ambassador Sergio Gor: Will ensure senior US officials visit India regularly,https://timesofindia.indiatimes.com/india/us-ambassador-sergio-gor-will-ensure-senior-us-officials-visit-india-regularly/articleshow/126882218.cms,"'Real Friends Always...': Trump's New Envoy Sergio Gor Pledges To Reset India-US Ties

NEW DELHI: US ambassador Sergio Gor said Tuesday he would ensure that senior US officials regularly travel to India, as both sides work to take the partnership to the next level in cooperation. Gor made the remark in the context of the just-concluded visit to India by Senator Steve Daines, a member of Senate Foreign Relations Committee, that the US described as productive.“As a member of Senate Foreign Relations Committee with experience in Asia, Senator Daines’ meetings with official and private sector stakeholders in Delhi were instrumental in advancing our bilateral relationship,” added Gor.During his visit, Daines met external affairs minister S Jaishankar, commerce minister Piyush Goyal, MPs, and US and Indian business leaders. According to the US embassy, while in India, Daines pursued interests of Trump administration as well as the people of Montana, including urging favourable pulse crop provisions in any future trade agreements between the US and India.“Montana is the top producer of pulse crops in the US, and India is the top consumer in the world. Senator Daines sought acceleration of the active and ongoing talks towards concluding a fair and reciprocal bilateral trade deal,” said the embassy in a statement.“I came to India to reaffirm our countries’ shared values and strategic ties and to advocate on behalf of Montana’s pulse crop farmers. I appreciated minister Goyal for listening to farmers’ concerns and will continue to work with President Trump to press this important priority,” said Daines. TNN","'real friends always...': trump's new envoy sergio gor pledges to reset india-us ties. Gor made the remark in the context of the just-concluded visit to india by senator steve daines, a member of senate foreign relations committee.","https://static.toiimg.com/thumb/msid-126882685,width-1280,height-720,imgsize-1020072,resizemode-6,overlay-toi_sw,pt-32,y_pad-600/photo.jpg"
"Congress slams BJP: You pick president first, then say there’s a poll",https://timesofindia.indiatimes.com/india/congress-slams-bjp-you-pick-president-first-then-say-theres-a-poll/articleshow/126880029.cms,"‘Helped Infiltrators For Vote Bank’: PM Modi Slams Congress In Poll-Bound Assam

NEW DELHI: After Prime Minister Narendra Modi flagged the challenge from “urban Naxals” on Tuesday, Congress took a swipe at him, citing a reply from Centre in Parliament stating that home ministry does not use the term “urban Naxals” and asking the PM whether he believes that anybody opposed to him is deemed so.Reacting to the PM’s remarks during his address at BJP headquarters after Nitin Nabin was declared elected as the party’s national president, Congress general secretary Jairam Ramesh, in a post on X, said, “The PM spoke today of the danger from what he called ‘urban Naxals’.” “On March 11 2020, the minister of state of home answered a question in Rajya Sabha saying home ministry does not use the phrase ‘urban Naxals’. On April 29 2024, the PM himself accused those calling for a caste census and those expressing concern on economic inequalities as suffering from an ‘urban Naxal’ mindset,” he said.“Will the prime minister clarify or does he believe that anyone opposed to him is an ‘urban Naxal’?” he asked.Meanwhile, Congress also took a dig at BJP after it formally declared Nabin as its new chief, after being elected unopposed. When asked about the development, Congress’s media and publicity department head Pawan Khera said, “Where is the election? Why do you even call it an election? You announce the president first and then say there will be an election, and then there is no election.”","Pm narendra modi flagged the challenge from “urban naxals’ on tuesday. Congress took a swipe at him, citing a reply from centre in parliament. Congress also took a dig at bjp after it formally declared nabin as its new chief.","https://static.toiimg.com/thumb/msid-126880266,width-1280,height-720,imgsize-764624,resizemode-6,overlay-toi_sw,pt-32,y_pad-600/photo.jpg"
Rule change: Lok Sabha MPs can mark attendance only from their seats,https://timesofindia.indiatimes.com/india/rule-change-ls-mps-can-mark-attendance-only-from-their-seats/articleshow/126879146.cms,"LUCKNOW/NEW DELHI: Lok Sabha MPs will be able to punch in their attendance only from their designated seats inside the House from the upcoming Budget session of Parliament , Speaker Om Birla said on Tuesday. The earlier practice that allowed members to mark their attendance from lobbies as well is set to be discontinued in a move aimed at encouraging parliamentarians to be a part of the proceedings.Speaking to reporters on the sidelines of the 86th All India Presiding Officers’ Conference in Lucknow, Birla emphasised the need for seriousness and discipline in Parliament, which has often seen days-long interruptions by opposition members protesting over different issues.Now, MPs will be able to register their presence only when the House is functioning and will be unable to do so when it is adjourned, even due to disruptions. The Budget session is beginning from Jan 28.Birla said that the decision is aimed at ensuring that MPs’ attendance accurately reflects their active participation in the proceedings rather than their mere presence within the Parliament complex.Designated consoles that allow MPs to register their presence are already installed at every seat inside the Lok Sabha chamber. The reform is part of a broader effort to modernise parliamentary procedures and improve the overall productivity of legislative sessions, he said.In his remarks at the event, Birla said Parliament has formed a committee to look into ways to bring uniformity in rules and traditions applicable in the legislative bodies across India as he highlighted the significance of healthy competition among state legislatures on various parameters.A responsive, inclusive and forward-looking legislature is central to sustaining the vitality of parliamentary democracy, which is a must to enhance public confidence in democratic institutions, he added.",Lok sabha mps will be able to punch in their attendance only from their designated seats inside the house from the upcoming budget session. The earlier practice that allowed members to mark their attendance from lobbies as well is set to be discontinued. The budget session is beginning from jan 28.,"https://static.toiimg.com/thumb/msid-126879488,width-1280,height-720,imgsize-1333424,resizemode-6,overlay-toi_sw,pt-32,y_pad-600/photo.jpg"
‘Most consequential board ever’: Trump invites India to join Gaza ‘Board of Peace’; what is it,https://timesofindia.indiatimes.com/india/gaza-plan-trump-invites-india-to-be-part-of-board-of-peace-what-is-it/articleshow/126649312.cms,"Why Donald Trump Wants PM Modi On Gaza Peace Board As US Pushes Bold Plan For Lasting Peace

What is the Board of Peace?

Who has been invited?

Board of Peace:

US President Donald Trump, chair

US Secretary of State Marco Rubio

Steve Witkoff, Trump's special negotiator

Jared Kushner, Trump's son-in-law

Tony Blair, former UK prime minister

Marc Rowan, billionaire US financier

Ajay Banga, World Bank president

Robert Gabriel, loyal Trump aide on the National Security Council

Gaza Executive Board:

Steve Witkoff

Jared Kushner

Tony Blair

Marc Rowan

Nickolay Mladenov, Bulgarian diplomat

Sigrid Kaag, UN humanitarian coordinator for Gaza

Turkish Foreign Minister Hakan Fidan

Ali Al-Thawadi, Qatari diplomat

General Hassan Rashad, director of Egypt's intelligence agency

Reem Al-Hashimy, Emirati minister

Yakir Gabay, Israeli billionaire

Leaders who said they were invited to join

Albanian Prime Minister Edi Rama

Argentine President Javier Milei

Brazilian President Luiz Inacio Lula da Silva

Canadian Prime Minister Mark Carney

Cypriot President Nikos Christodoulides

Egyptian President Abdel Fattah al-Sisi

Hungarian Prime Minister Viktor Orban

Italian Prime Minister Giorgia Meloni

Jordanian King Abdullah II

Romanian President Nicusor Dan

Turkish President Recep Tayyip Erdogan

NEW DELHI: US President Donald Trump has invited India to be part of a proposed international “Board of Peace” aimed at overseeing post-war governance and reconstruction in Gaza. The initiative forms a key pillar of Trump’s broader Gaza ceasefire plan and is now beginning to take shape, with the White House confirming the involvement of several global figures.In a letter, shared by US Ambassador to India Sergio Gor, Trump framed the initiative as part of a sweeping 20-point “Comprehensive Plan” to end the Gaza conflict, first announced in September last year. He said the plan had since received wide backing from global leaders across the Arab world, Israel and Europe, and was formally endorsed by the United Nations Security Council through Resolution 2803 in November.Trump wrote that the moment had come to “turn dreams into reality”, with the centrepiece of the initiative being the creation of an international “Board of Peace”. The body, Trump said, would be established as a new international organisation and transitional governing administration, tasked with delivering what he called “lasting peace” through governance reform, reconstruction and economic investment.""Now it is time to turn all of these Dreams into reality. At the heart of the Plan is The Board of Peace, the most impressive and consequential Board ever assembled, which will be established as a new International Organization and Transitional Governing Administration,"" the letter read.The invitation places India among a growing list of countries and global figures being courted by Washington as Trump seeks to operationalise a 20-point “Comprehensive Plan” aimed at ending the Gaza conflict and managing the transition to long-term stability.According to the White House, the Board of Peace will serve as the central strategic body overseeing Gaza’s post-war transition. Chaired by Trump himself, it is expected to focus on governance capacity-building, regional relations, reconstruction, investment mobilisation and large-scale funding.Confirmed members include US Secretary of State Marco Rubio, Trump’s special negotiator Steve Witkoff, his son-in-law Jared Kushner, former UK prime minister Tony Blair, billionaire financier Marc Rowan, World Bank president Ajay Banga and senior National Security Council aide Robert Gabriel. More appointments are expected in the coming weeks.Alongside the main board, two additional structures have been announced. The National Committee for the Administration of Gaza (NCAG), led by Palestinian technocrat Dr Ali Sha’ath, will oversee the restoration of public services, rebuilding of civil institutions and stabilisation of daily life in Gaza. The White House has described this as a key step in implementing Phase Two of Trump’s plan.A separate Gaza Executive Board will support governance delivery on the ground and includes international diplomats and regional figures from Turkey, Qatar, Egypt, Israel and the UAE, as well as UN humanitarian coordinator Sigrid Kaag.Apart from India several countries including Argentina, Canada, Egypt, Turkey, Albania and Cyprus have been invited. Pakistan has also been invited to join the Board of Peace. Pakistan's foreign office spokesperson Tahir Andrabi said that the prime minister received the invitation, adding that Pakistan will continue supporting international efforts for peace and security in Gaza.As per a report by Bloomberg, a draft charter proposes of the Trump-led “Board of Peace,” allegedly requires nations to contribute $1 billion to secure long-term membership. The draft gives Trump authority over membership, renewals, and final approval of decisions.",Us president donald trump has invited india to be part of a proposed international “board of peace” the board of peace is aimed at overseeing post-war governance and reconstruction in gaza. The initiative forms a key pillar of trump’s broader gaza ceasefire plan and is now beginning to take shape.,"https://static.toiimg.com/thumb/msid-126654465,width-1280,height-720,imgsize-765628,resizemode-6,overlay-toi_sw,pt-32,y_pad-600/photo.jpg"
