Article Title,Article Link,Article Text,Article Summary,Article Image
'Donald Trump considers Modi as great & personal friend': US ambassador-designate meets PM — Key takeaways,https://timesofindia.indiatimes.com/india/trump-considers-modi-as-great-personal-friend-us-ambassador-designate-meets-pm-key-takeaways/articleshow/124481107.cms,"US ambassador-designate Sergio Gor meets PM Modi

Sergio Gor Calls Meeting With PM Modi 'Incredible', Says ‘Trump Considers Him Great Friend’

Key takeaways



The two leaders discussed the importance of critical minerals, Gor said.

Bilateral issues, including defence, trade and technology were also discussed, he said.

Gor noted that the United States“values its relationship with India” and emphasised that his visit underscored Washington’s commitment to strengthening bilateral cooperation.

He also gifted a portrait to PM Modi with Trump's signature on it saying: ""Mr Prime Minister, you are great.""

NEW DELHI: Prime Minister Narendra Modi on Saturday met US Ambassador-designate Sergio Gor in New Delhi, marking the first high-level interaction between the two since Gor’s Senate confirmation as the next American envoy to India.The meeting comes amid ongoing trade tensions and hopes for renewed momentum in the India-US Comprehensive Global Strategic Partnership.Speaking to reporters after the meeting, Sergio Gor said, “I had an incredible meeting with Prime Minister Modi. We discussed bilateral issues, including defence, trade and technology. We also discussed the importance of critical minerals.”He added, “President Trump considers Prime Minister Modi a great and personal friend. In fact, just before I left for New Delhi, they had an incredible phone call. And that is something that will continue over the weeks and months ahead.”PM Modi wrote on X, “Glad to receive Mr. Sergio Gor, Ambassador-designate of the US to India. I’m confident that his tenure will further strengthen the India–US Comprehensive Global Strategic Partnership.”Earlier in the day, he also held discussions with external affairs minister S Jaishankar and foreign secretary Vikram Misri.“We had a great series of meetings,” Gor said, adding that both sides exchanged views on expanding defence ties and economic collaboration.EAM Jaishankar described his meeting with Gor as “productive,” saying on X, “Discussed the India-US relationship and its global significance. Wish him the best for his new responsibility.”Gor, accompanied by US deputy secretary for management and resources Michael J Rigas, is currently on a six-day visit to India.The trip comes amid ongoing strains in India-US relations following Washington’s decision to impose 50 per cent tariffs on Indian exports — including 25 per cent additional duties on crude oil purchases from Russia.Despite these challenges, the recent phone call between PM Modi and Trump, and Gor’s outreach in New Delhi, are being seen as signs of optimism in resetting trade negotiations.Earlier, during his Senate confirmation hearing, Gor had highlighted the “deep friendship” between Trump and PM Modi, calling it a “unique strength” in advancing bilateral relations.He said, “India is a strategic partner whose trajectory will shape the region and beyond.”Gor’s formal presentation of credentials is expected to take place at a later date, according to the US embassy.","Us ambassador-designate sergio gor meets pm modi in new delhi. Gor: we discussed bilateral issues, including defence, trade and technology. He also gifted a portrait to pm modi with trump's signature on it saying: ""mr prime minister, you are great""","https://static.toiimg.com/thumb/msid-124481187,width-1070,height-580,imgsize-54458,resizemode-75,overlay-toi_sw,pt-32,y_pad-40/photo.jpg"
"Modi meets Sergio Gor raising hopes of trade deal, Trump meet; Optimistic about days ahead: Gor",https://timesofindia.indiatimes.com/india/us-values-india-ties-gor-after-incredible-meeting-with-pm-modi/articleshow/124490283.cms,"Sergio Gor presented an autographed photo of PM Modi and Trump

Sergio Gor Calls Meeting With PM Modi 'Incredible', Says ‘Trump Considers Him Great Friend’

In a rare gesture, amidst ongoing efforts to repair the India-US relationship, PM Narendra Modi Saturday received US ambassador-designate Sergio Gor who delivered a message to him from President Donald Trump in the form of a framed photograph of their White House press conference earlier this year signed by the president as, “Mr. Prime Minister, you are great!”.Modi later said in a post on X he was glad to meet Gor. “I’m confident that his tenure will further strengthen the India–US Comprehensive Global Strategic Partnership,” said Modi, who spoke to Trump for the second time in less than a month on Thursday. Gor responded by saying it was an honour to meet Modi, who is considered a “great and personal” friend by Trump, and the relationship with India will only strengthen over the months ahead.Gor’s engagements on Saturday - including with external affairs minister S Jaishankar, NSA Ajit Doval and foreign secretary Vikram Misri - have raised hopes of an early conclusion of the trade talks as well as a summit level meeting. A diplomatic source said positive outcomes are in the works.Gor also said that in his “incredible” meeting with Modi, both sides discussed bilateral issues, including defence, trade, and technology.In the middle of a fresh US-China row over rare earths and critical minerals, he also discussed the importance of critical minerals and the “importance of that to both of our nations”.“The U.S. values its relationship with India, and under the strong leadership of President Donald J. Trump and Prime Minister Modi, I'm optimistic about the days ahead for both of our nations,” said Gor, adding he arrived from Washington in the morning and hit the ground running.It’s rare for the PM to meet an ambassador before the person has assumed office and the development suggests both sides might be within striking distance of a trade deal that could act as an antidote to the dramatic downturn in ties since May this year, if not earlier. The contentious negotiations for the agreement have threatened to undermine other aspects of the relationship. Modi had congratulated Trump on Thursday for the success of his Gaza peace plan, while also endorsing what he described as good progress in the negotiations and said the leaders agreed to being in close touch in the coming weeks.Whether or not that translates into a meeting on the margins of the Asean and East Asia summits in Malaysia later this month remains to be seen. Both leaders are expected to participate, but neither has officially confirmed it yet. Both sides seem keen on a bilateral meeting this year. The possibility of a Quad summit in the next few months is also not ruled out.The ambassador’s appointment has been confirmed by the Senate but he’s currently in India only for a 6-day trip, apparently to familiarise himself with his new responsibility. He will take charge at a later date. After his meeting with Gor, Jaishankar said in a post on X later that he discussed the India-US relationship and its global significance and wished him the best for his new responsibility.Gor is travelling to India, accompanied by deputy secretary for management and resources Michael J Rigas. In his engagements, there was focus on expediting the trade negotiations and building upon the several major initiatives announced during Modi’s visit to Washington in February to further strengthen the relationship. That Trump chose to remind him about the meeting then in the form of the photograph is being viewed positively by India, even as the US shows no sign of lifting the additional 25 percent tariff on India for its oil purchase from Russia.","Sergio gor presented an autographed photo of pm modi and trump. Gor said it was an honour to meet modi, who is considered a ‘great and personal’ friend by trump. Both sides seem keen on a bilateral meeting this year. The possibility of a quad summit in the next few months is also not ruled out.","https://static.toiimg.com/thumb/msid-124490284,width-1070,height-580,imgsize-975610,resizemode-75,overlay-toi_sw,pt-32,y_pad-40/photo.jpg"
"'Mr PM, you are great': US ambassador-designate gifts Trump-signed portrait to PM Modi — See pic",https://timesofindia.indiatimes.com/india/mr-pm-you-are-great-us-ambassador-designate-gifts-trump-signed-portrait-to-pm-modi-see-pic/articleshow/124481431.cms,"Sergio Gor Calls Meeting With PM Modi 'Incredible', Says ‘Trump Considers Him Great Friend’

NEW DELHI: US Ambassador Sergio Gor called upon Prime Minister Narendra Modi as he took charge of the vacant post since Donald Trump's re-election as US President.During the meeting, Gor presented a signed picture of PM Modi and Trump to the Prime Minister. ""Mr Prime Minister, you are great,"" Trump wrote.In a social media post on X, PM Modi shared the moment and said, ""Glad to receive Mr. Sergio Gor, Ambassador-designate of the US to India. I’m confident that his tenure will further strengthen the India–US Comprehensive Global Strategic Partnership.""As Gor joined as US envoy in New Delhi, he said that US President Trump considers PM Modi a ""great and personal friend.""""President Trump considers Prime Minister Modi a great and personal friend. In fact, just before I left for New Delhi, they had an incredible phone call. And that is something that will continue over the weeks and months ahead. It's an honour to serve as President Donald Trump's ambassador to India. I look forward to this very important relationship and continuing to grow and deepen the relationship between our two nations,"" Gor said.Gor's first meeting in India took place earlier today with External Affairs Minister S. Jaishankar, where the two discussed the India–US relationship and its growing global significance, calling it a unique strength in advancing bilateral ties.Speaking before the Senate Foreign Relations Committee, Gor said, ""India is a strategic partner whose trajectory will shape the region and beyond. India's geographic position, economic growth, and military capabilities make it a cornerstone of regional stability and a critical part of promoting prosperity and advancing the security interests that our nations share.""He further noted, ""As Secretary Rubio said, India is one of the most important relationships our nation has in the world. If confirmed, I will prioritise deepening defence and security cooperation with India.""In August, Trump nominated Sergio Gor as India's next ambassador and Special Envoy for South and Central Asian Affairs.","Sergio gor calls meeting with pm modi 'incredible', says ‘trump considers him great friend’ gor presented a signed picture of pm modi and trump to the prime minister. Gor's first meeting in india took place earlier today with external affairs minister s. jaishankar.","https://static.toiimg.com/thumb/msid-124481499,width-1070,height-580,imgsize-782655,resizemode-75,overlay-toi_sw,pt-32,y_pad-40/photo.jpg"
DGCA orders Air India to reinspect Boeing jets,https://timesofindia.indiatimes.com/india/dgca-orders-air-india-to-reinspect-boeing-jets/articleshow/124491994.cms,"Representative image

NEW DELHI: Investigating the uncommanded deployment of the ram air turbine (RAT) - a procedure triggered during engine failures - on an Air India Boeing 787 flight on October 4, Directorate General of Civil Aviation (DGCA) has directed the airline to reinspect RATs on all aircraft where the power conditioning module (PCM) was recently replaced.The directive aims to determine whether there is any correlation between the newly replaced PCM and the uncommanded RAT deployment. DGCA has also asked the US aerospace major to submit a ""comprehensive report outlining the preventive measures to be implemented"" to address such uncommanded RAT deployments.On Oct 4, an Air India B787-8 (VT-ANO) experienced an uncommanded RAT deployment while approaching Birmingham, UK. ""During landing, at about 400 feet, a RAT unlock message appeared and RAT deployed. The pilot did not report any associated abnormality,"" an official said.","The directive aims to determine whether there is any correlation between the newly replaced pcm and the uncommanded rat deployment. Dgca has also asked the us aerospace major to submit a ""comprehensive report outlining the preventive measures to be implemented""","https://static.toiimg.com/thumb/msid-124492015,width-1070,height-580,imgsize-475127,resizemode-75,overlay-toi_sw,pt-32,y_pad-40/photo.jpg"
"Pakistan fumes over India-Afghanistan talks: Rattled over joint statement, lodges protest to Kabul; objects to terror remarks",https://timesofindia.indiatimes.com/india/pakistan-fumes-over-india-afghanistan-talks-rattled-over-joint-statement-lodges-protest-to-kabul-objects-to-terror-remarks/articleshow/124491600.cms,"shehbaz sharif (left), Amir Muttaqi and S Jaishankar (File - agencies)

Pakistan Panics After Taliban Issues Warning, Accuses India of Using Afghanistan Soil for Terror

Pakistan has lodged formal objections with Afghanistan’s Ambassador in Islamabad over several ‘elements of the India‑Afghanistan joint statement’, particularly the reference to Jammu and Kashmir as 'part of India'.It also rejected remarks by Afghan foreign minister Mawlawi Amir Khan Muttaqi that “terrorism is an internal problem of Pakistan,” the Pakistani ministry of foreign affairs (MOFA) said.The foreign office said: “It was conveyed that the reference to Jammu and Kashmir as part of India is in clear violation of the relevant UN Security Council resolutions and the legal status of Jammu and Kashmir. The Joint Statement is highly insensitive to the sacrifices and sentiments of the people of Indian Illegally Occupied Jammu and Kashmir in their just struggle for the right to self‑determination.”In addition, Islamabad strongly rebutted Muttaqi’s claim, saying: “Pakistan has repeatedly shared details regarding the presence of Fitna‑e‑Khawarij and Fitna‑e‑Hindustan terrorist elements operating from Afghan soil against Pakistan with support from elements within Afghanistan.”The Pakistani statement added that deflecting responsibility by branding terrorism in Pakistan as an ""internal matter"" does not relieve Afghanistan’s interim government of its duty to ensure regional peace and security.It also urged that “unauthorised Afghan nationals residing in Pakistan” return to their country.These protests follow a joint statement issued on October 10 during Muttaqi’s visit to India, where both nations reiterated condemnation of terrorism emanating from regional countries, affirmed respect for sovereignty and territorial integrity, and affirmed that the Afghan government would not permit any group or individual to use Afghan territory against India.In that statement, external affairs minister S Jaishankar expressed gratitude for Afghanistan’s condemnation of the April 22 terrorist attack in Pahalgam, Jammu & Kashmir, while Afghanistan reaffirmed its support in counterterrorism.""Both sides emphasised respect for each other's sovereignty and territorial integrity. The external affairs minister appreciated the Afghan side's understanding of India's security concerns. The Afghan foreign minister reiterated the commitment that the Afghan government will not allow any group or individual to use the territory of Afghanistan against India,"" the statement issued by the ministry of external affairs (MEA) read.Muttaqi is on a week-long visit to India (October 9–16), the first such high-level visit since the Taliban takeover in 2021. Earlier, he said the “future of India‑Afghanistan relations seems very bright.”","Pakistan has lodged formal objections with afghanistan’s ambassador in islamabad over several ‘elements of the india‑afghanistan joint statement’ it also rejected remarks by afghan foreign minister mawlawi amir khan muttaqi that “terrorism is an internal problem of pakistan,” the pakistani ministry of foreign affairs (mofa) said.","https://static.toiimg.com/thumb/msid-124491584,width-1070,height-580,imgsize-null,resizemode-75,overlay-toi_sw,pt-32,y_pad-40/photo.jpg"
"India, UK sign $468m-missile deal: All you need to know about Martlets; how it will boost defence",https://timesofindia.indiatimes.com/india/india-uk-sign-468m-missile-deal-all-you-need-to-know-about-martlets-how-it-will-boost-defence/articleshow/124412109.cms,"British PM Keir Starmer and PM Narendra Modi

Poll What do you think is more important in international defense deals? Strengthening national defense. Economic benefits for local communities.

What are Lightweight Multirole Missiles?

NEW DELHI: India and the UK have signed a £350 million ($468 million) deal under which the Indian Army will receive UK-made missiles.In a joint statement, the Centre said that the deal will further support India's air defence capabilities and, in the spirit of Atmanirbhar Bharat, meet the current and future requirements of the Indian Ministry of Defence, and support a long-term collaboration on complex weapons between the two countriesThe missile supply is also expected to directly create over 700 jobs in Northern Ireland, one of the United Kingdom’s four constituent nations alongside England, Wales, and Scotland, the UK Ministry of Defence said on Thursday.The announcement came on the second and final day of British Prime Minister Keir Starmer's first official visit to India, during which he is accompanied by a delegation of 125 business leaders.Starmer met Prime Minister Narendra Modi in Mumbai, India’s financial capital.""The contract is set to deliver UK-manufactured Lightweight Multirole Missiles (LMM) built in Belfast to the Indian Army, representing another significant boost for the UK defence industry and delivering on the Government’s Plan for Change,” the UK Ministry of Defence said. “It will secure over 700 jobs in Northern Ireland, as the air defence missiles and launchers being manufactured for India are the same as those currently produced in Belfast for Ukraine. ”Also read: Which UK universities are planning to open campuses in India? According to the statement, the agreement could ""pave the way for a broader complex weapons partnership"" between the two countries, which is currently under negotiation.In addition, New Delhi and London signed an Implementing Agreement to advance collaboration on electric-powered engines for naval ships.“The defence deals announced today show how our growing strategic partnership with India will boost UK business and jobs. I am hopeful this will pave the way for a deeper relationship between our two defence industries, particularly in the development of electric engines for naval ships and in air defence,” British Defence Secretary John Healey said. “As we deepen our defence relationship with India, we will harness the UK defence industry as an engine for growth, securing vital jobs in Northern Ireland and throughout the UK. ”Also read: PM Modi, Keir Starmer chart 'roadmap for shared progress'; target $100 billion bilateral trade by 2030 The LMMs, also known as Martlets, are lightweight air-to-surface, air-to-air, surface-to-air, and surface-to-surface missiles developed by Belfast-based defence contractor Thales Air Defence. These have been named after the mythical Martlet, a bird that never roosts, and has been taken from the English heraldry.The LMM was developed from the Starburst surface-to-air missile to meet the UK's ""Future Air-to-Surface Guided Weapon (Light)"" requirement for the Royal Navy.These missiles, which the UK is also supplying to Ukraine under a separate deal signed in March, are commonly used for air defense and can strike various types of military platforms including drones and armored vehicles.",India and the uk have signed a £350 million ($468 million) deal under which the indian army will receive uk-made missiles. The missile supply is also expected to directly create over 700 jobs in northern ireland. The announcement came on the second and final day of british prime minister keir starmer's first official visit to india.,"https://static.toiimg.com/thumb/msid-124414961,width-1070,height-580,imgsize-829475,resizemode-75,overlay-toi_sw,pt-32,y_pad-40/photo.jpg"
Tragic death of Korean streamer Yoon Ji-ah leads to arrest of her major fan,https://timesofindia.indiatimes.com/sports/international-sports/yoon-ji-ahs-death-shocks-korea-after-fatal-attack-by-longtime-fan-who-donated-70k/articleshow/124412498.cms,"Image via: Yoon Ji-ah/TikTok

Korean TikToker Murdered by $70K-Donor Fan



Obsession and Lies Behind Yoon Ji-ah’s Tragic Death



The Tragic Story Behind Korean Influencer Yoon Ji-ah’s Passing

Confession and Arrest of Yoon Ji-ah’s Killer



The Man Who took the life of TikToker Yoon Ji-ah — The Dark Truth Behind “Black Cat”

The digital world in South Korea is mourning after losing Yoon Ji-ah who was known for being a TikToker and live streamer with more than 300,000 fans. On September 11, she was found dead on a secluded mountain in Muju County, North Jeolla Province, only a few hours after her last live stream. The terrifying circumstances of her passing have once again raised the issues of the dark side of fan communities and influencer security in the era of the internet.Police have indicated that Yoon Ji-ah met with her death about 30 minutes after cutting off her last stream. The 30-year-old digital star was pronounced dead with serious physical injuries inflicted on her body through beating, strangling, and asphyxias. Later, the medical examiner declared the cause of death to be suffocation from neck compression.Initially, the fan's affection reportedly transformed into obsession. Choi, who presented himself as a CEO enjoying success, was actually an individual who had gotten into deep financial trouble and lost his home through auction. He had created a fake persona and was financially supported which led him to create a close bond with Yoon and even convince her to go into business together.But there were reports about Yoon having recently sought to break the ties claiming controlling behavior and demanding schedule as reasons. The CCTV clips released by the detectives showed Choi kneeling and asking for forgiveness just before the tragic event. As per his later confession, he dragged her into her car before killing.After the murder, Choi made an effort to hide his actions, dressing up with a suitcase, and taking several stops to misdirect the police before he left Yoon's body on the mountainside. He was captured 12 hours after the incident. He first proclaimed his innocence but later admitted it when the police found the corpse.The death of Yoon Ji-ah has created a wave of nationwide protests and mourning compared to which the calls for more effective safety measures for content creators against the obsessive online behavior are stronger than ever. Her death serves as a grim reminder of the dangers influencers face, prompting urgent calls for stronger digital safety laws, mental health awareness, and accountability within online communities to prevent similar tragedies. Yoon Ji-ah’s story stands as a haunting reminder of love turned obsession, fame turned fear, and the urgent need to protect those who bring light to the digital world.","Yoon ji-ah, 30, was found dead on a secluded mountain in muju county, north jeolla province, only a few hours after her last live stream. Police have indicated that she met with her death about 30 minutes after cutting off her last stream. Her death serves as a grim reminder of the dangers influencers face, prompting urgent calls for stronger digital safety laws.","https://static.toiimg.com/thumb/msid-124412470,width-1070,height-580,imgsize-14764,resizemode-75,overlay-toi_sw,pt-32,y_pad-40/photo.jpg"
