Article Title,Article Link,Article Text,Article Summary,Article Image
'PM not bigger than country': Owaisi's latest on Op Sindoor delegation— Watch,https://timesofindia.indiatimes.com/india/pm-not-bigger-than-country-owaisis-latest-on-op-sindoor-delegation-watch/articleshow/124477307.cms,"AIMIM chief Asaduddin Owaisi (PTI file photo)

India On High Alert As Pakistan's Terror Groups Adopt New Tactics After Operation Sindoor Debacle

NEW DELHI: AIMIM chief Asaduddin Owaisi on Saturday said that the Prime Minister is not bigger than the country and that he went on the Operation Sindoor delegation “not for the Prime Minister, but for the country.”Speaking to the news agency ANI, Owaisi said, ""Political battle will continue to be fought over ideology, and there cannot be two sides of the ocean. But the BJP is not bigger than the country. Neither is the Prime Minister bigger than the country. When such a tragic terrorist attack took place in Pahalgam, and everyone knows that these ISI-trained individuals from Pakistan came and killed people in a military style. Obviously, we are always ready to present the country's side. We did not go for the Prime Minister. We went for the country.""In June, all-party delegations went on diplomatic missions to several countries, discussing India’s firm position against Pakistan-linked terrorism post-Operation Sindoor. The initiative aimed to show national unity in countering terrorism, with opposition members including Owaisi and Congress MP Shashi Tharoor joining ruling alliance representatives to advocate India’s stance internationally.Owaisi visited Saudi Arabia, Kuwait, Bahrain, and Algeria. In Bahrain, he said, “Pakistan is an aggressor, not a victim. We presented India’s side and shared data on terror attacks carried out by Pakistan-aided groups, including the Mumbai blasts, train blasts, the suicide attack in front of the Jammu and Kashmir Assembly, Pulwama, and Pathankot.”","Aimim chief asaduddin owaisi said that the prime minister is not bigger than the country. He said that he went on the operation sindoor delegation “not for the pm, but for the country’ owaisi visited saudi arabia, kuwait, bahrain, and algeria.","https://static.toiimg.com/thumb/msid-124477448,width-1070,height-580,imgsize-38848,resizemode-75,overlay-toi_sw,pt-32,y_pad-40/photo.jpg"
Did Marco Rubio betray Trump? Florida leaders' letter supporting Machado for Nobel surfaces as Trump loses,https://timesofindia.indiatimes.com/world/us/did-marco-rubio-betray-trump-florida-leaders-letter-supporting-machado-for-nobel-surfaces-as-trump-loses/articleshow/124466025.cms,"Did Marco Rubio betray Trump in nominating Machado for Nobel Peace Prize?

Trump In 'Nobel' SHOCK As Venezuelan Maria Machado Clinches Coveted Peace Prize | America 360

Poll What has the bigger impact on promoting global peace? Diplomatic efforts Grassroots movements

Marco Rubio's 2024 letter endorsing Machado for Nobel Peace Prize

Rick Scott, Marco Rubio signed the letter among others.





A letter signed by Donald Trump's close allies, like Secretary of State Marco Rubio , Florida Republican leaders Rick Scott, nominating Maria Corina Machado for the Nobel Peace Prize, surfaced the day the prize was announced and Trump lost despite pushing hard on the Gaza Peace Plan. The letter was dated August 26, 2024, long before the election that elected Trump as the president but now the letter could cause enough embarrassment for Trump's most-trusted aide Marco Rubio.One passage of the letter, held in the archives of Senator Scott, reads, ""María Corina Machado's peaceful resistance to tyrants and her ability to organize and lead a non‑violent movement for democracy and human rights is exemplary."" The letter also states, ""We hope that the Nobel Committee will recognize Venezuelan María Corina Machado's remarkable contributions and grant her the distinction she so rightly deserves. ""Rubio was a senator representing Florida at the time.National security expert Marcy Wheeler posted on Bluesky that Secretary of State Marco Rubio may face awkwardness due to his endorsement of a letter urging the committee to award Machado the peace prize.""Gonna be an awkward day for Secretary of State-National Security Advisor-Acting Archivist Marco Rubio,"" Wheeler wrote.Steven Cheung, White House communications director, said on X, ""President Trump will continue making peace deals, ending wars, and saving lives. He has the heart of a humanitarian, and there will never be anyone like him who can move mountains with the sheer force of his will. The Nobel Committee proved they place politics over peace.""Though Trump lost the prize, Machado dedicated her Nobel Peace Prize to the people of Venezuela, and US President Donald Trump, for his ""decisive support"" for her country's pro-democracy movement. ""I dedicate this prize to the suffering people of Venezuela and to President Trump for his decisive support of our cause!"" she wrote on X.""We are on the threshold of victory and today, more than ever, we count on President Trump, the people of the United States, the peoples of Latin America, and the democratic nations of the world as our principal allies to achieve Freedom and democracy,"" she added.","A letter signed by donald trump's close allies, like secretary of state marco rubio, nominating maria corina machado for the nobel peace prize surfaced the day the prize was announced. The letter was dated august 26, 2024, long before the election that elected trump as the president but now the letter could cause enough embarrassment for rubio.","https://static.toiimg.com/thumb/msid-124466111,width-1070,height-580,imgsize-null,resizemode-75,overlay-toi_sw,pt-32,y_pad-40/photo.jpg"
