Article Title,Article Link,Article Text,Article Summary,Article Image
'Don't ask permission': Shashi Tharoor posts cryptic message; message for Congress top brass?,https://timesofindia.indiatimes.com/india/dont-ask-permission-shashi-tharoor-posts-cryptic-message-message-for-congress-top-brass/articleshow/122069700.cms,"Poll Do you agree with Shashi Tharoor's statement that PM Modi is a key asset for India on the global stage? Yes, he has done a great job No, I disagree with that Unsure

NEW DELHI: Minutes after Congress president Mallikarjun Kharge ’s veiled attack on party leader Shashi Tharoor for calling Prime Minister Narendra Modi ""a prime asset for India"" globally, the Thiruvananthapuram MP on Wednesday put up a cryptic post on social media.""Don't ask permission to fly. The wings are yours. And the sky belongs to no one,"" Tharoor posted on X.The post came just minutes after Kharge, without naming Tharoor, said that ""for some, Modi is first"". Kharge was responding to a question on Tharoor’s recent article in The Hindu.""I can’t read English, but his language is very good — that’s why we made him a member of the party’s working committee. But what I want to say is that all of us, the entire opposition, have come together and said we stand with our Army — our Army that is fighting — we are with them,"" Kharge said.Read also: 'For some, Modi is first': Mallikarjun Kharge takes dig at Shashi Tharoor; remains mum on disciplinary action ""We say nation first, but some consider Modi first, country later. What can we do about that?"" he asked.Earlier, Tharoor had clarified that his article praising Prime Minister Modi’s diplomatic efforts under Operation Sindoor should not be misconstrued as an indication of him ""leaping to join"" the BJP.“It is not a sign of my leaping to join the Prime Minister's party (the BJP), as some people unfortunately have been implying,” Tharoor said when asked about the article during an event.“It is a statement of national unity, of national interest, and of standing up for India — which, to my mind, is fundamentally why I came back to India after 25 years of service at the UN. I did so to serve India, and I am very proud to have the opportunity to do so,"" Tharoor told news agency PTI.In his article, Tharoor praised PM Modi’s “energy, dynamism and willingness to engage” as a key asset for India on the global stage, adding that it “deserves greater backing.” The Prime Minister’s Office later shared the article on X, triggering speculation about Tharoor’s growing distance from the Congress leadership. The timing raised eyebrows, as the Congress has been sharply critical of the Modi government’s foreign policy, accusing it of isolating India internationally.“People always tend to see all this in the context of today’s news,” Tharoor said, after rumours began to gain ground. “It is an article in which I describe the success of this outreach mission, which, among other things, showcased the unity of all parties behind the matter of vital national interest,"" he said.“So, I said the Prime Minister himself has demonstrated dynamism and energy in engaging with other countries. He has travelled to more countries than any Prime Minister and done so in order to take the message of India around the world,” he added.Tharoor led a multi-party delegation to the United States and four other countries following the Pahalgam terror attack and subsequent military operation, aiming to convey India’s position to the international community.","Thiruvananthapuram mp shashi tharoor put up a cryptic post on social media. The post came just minutes after congress president mallikarjun kharge said that ""for some, modi is first"" kharge was responding to a question on throor’s recent article in the hindu.","https://static.toiimg.com/thumb/msid-122070153,width-1070,height-580,imgsize-1020063,resizemode-75,overlay-toi_sw,pt-32,y_pad-40/photo.jpg"
'Too hard on brain': Flight phobia grips travellers after Ahmedabad Air India crash; bookings drop & cancellations spike,https://timesofindia.indiatimes.com/india/too-hard-on-brain-flight-phobia-grips-travellers-after-ahmedabad-air-india-crash-bookings-drop-cancellations-spike/articleshow/122072220.cms,"This is a representational AI image

'I'm bloody terrified currently,'

'flying fear.'

Air India Flight AI171 Crashes in Ahmedabad, 150 Feared Dead in Worst Airline Tragedy in Years

Crash footage sparks anxiety

Airlines under scrutiny, bookings nosedive

Travellers are now filtering bookings by aircraft type, actively avoiding Dreamliners and Boeing planes.

this is how people are reacting when it comes to taking flights after Air India plane crash in Ahmedabad on June 12. The flying anxiety has skyrocketed among flyers after the deadly incident that claimed 242 lives, with many taking experts' help to overcome theA wave of panic has gripped flyers and led to a sharp surge in fear-of-flying therapy requests, ticket cancellations, and unusually specific questions about aircraft types.Dinesh K, a retired Indian Air Force wing commander and founder of Cockpit Vista, told Reuters that demand for his $500 therapy course has exploded since the Air India flight crash incident.""Fear of flying is typically to do with things happening on an aeroplane - the sounds, motion, vibrations ... exposure therapy is the only solution,"" Dinesh told Reuters.His centre used to receive about 10 enquiries a month. Since the crash, it's logged over 100.Chilling videos of the Dreamliner bursting into flames shortly after take-off have gone viral across social media. It's not just fuelling fear, it's inducing insomnia, panic attacks, obsessive checking of flight trackers, and even refusal to let loved ones fly, say mental health professionals, according to Reuters.Some people are unable to focus on daily life while a loved one is flying, said psychologist Pankti Gohel, describing cases of ""debilitating anxiety"".According to Google Trends, searches for ""flying fear"" in India peaked the day after the crash and remain high.The impact is being felt across the travel industry. Tour operators report a dramatic drop in bookings and a spike in cancellations, especially on Air India routes.""Flight bookings are down by 15–20%. Cancellations are up by 30–40%,"" Ravi Gosain, president of the Indian association of tour operators, told Reuters.Even more telling:""People don't want to hear about Dreamliners,"" he added.For many flyers in India, the crash and its terrifying visuals were a psychological tipping point. While flying remains statistically one of the safest modes of transport, with only 1.87 accidents per million departures in 2023, emotions, not stats, are now driving decisions.","Air india flight crash in ahmedabad on june 12 left 242 people dead. Fear of flying has led to a surge in fear-of-flying therapy requests, ticket cancellations, and unusually specific questions about aircraft types. Tour operators report a dramatic drop in bookings and a spike in cancellations.","https://static.toiimg.com/thumb/msid-122072430,width-1070,height-580,imgsize-52128,resizemode-75,overlay-toi_sw,pt-32,y_pad-40/photo.jpg"
Air India crash: Rene Joshilda claimed she crashed AI 171 too,https://timesofindia.indiatimes.com/india/air-india-crash-rene-joshilda-claimed-she-crashed-ai-171-too/articleshow/122036260.cms,"Air India Flight AI171 Crashes in Ahmedabad, 150 Feared Dead in Worst Airline Tragedy in Years

On June 13, Ahmedabad's BJ Medical College received an email referencing the Air India crash: ""We crashed the Air India plane yesterday. You thought it was a hoax. Now you know we're serious. ""The email warned that more attacks would follow. Investigation revealed the threat was also sent by Rene Joshilda as part of her plan to escalate fear and implicate her colleague.","On june 13, ahmedabad's bj medical college received an email referencing the air india crash. The email warned that more attacks would follow. Investigation revealed the threat was also sent by rene joshilda as part of her plan to escalate fear and implicate her colleague.","https://static.toiimg.com/thumb/msid-122036260,width-1070,height-580,imgsize-null,resizemode-75,overlay-toi_sw,pt-32,y_pad-40/photo.jpg"
"In UP village, forgotten Indian roots of Ayatollah Khomeini",https://timesofindia.indiatimes.com/india/in-up-village-forgotten-indian-roots-of-ayatollah-khomeini/articleshow/122010671.cms,"KINTOOR (BARABANKI): In Kintoor, a tranquil village of 13,000 nestled along the Ghaghara, 70 kilometres from Lucknow, only five Shia families remain. Among them, the Kazmis claim a distant kinship with Syed Ahmad Musavi Hindi, grandfather of Ayatollah Ruhollah Musavi Khomeini, the fiery cleric who ignited Iran’s 1979 Islamic Revolution and became its first Supreme Leader.Born in Kintoor in the early 19th century, Ahmad’s journey from this unassuming village wove a legacy that reshaped West Asia’s history. He left India, escaping colonial rule in 1830, migrating to Najaf, and then finally settling in Khomeyn in 1834. Hence the family name.A portrait of Ruhollah Khomeini still hanging in his drawing room, septuagenarian Syed Nihal Kazmi says, “My great-great-great-grandfather Mufti Mohammad Quli Musavi and Syed Ahmad Musavi were cousins. Ahmad’s story began here in Kintoor, but he became Iran’s forever.” The village, once a vibrant hub of Shia scholarship in the kingdom of Oudh, is concerned with the war in West Asia.BBC journalist and author Baqer Moin, in his book Khomeini: Life of the Ayatollah, writes that Syed Ahmad Musavi Hindi left Kintoor around 1830, drawn to Najaf, Iraq, for pilgrimage. There, he befriended Yusef Khan Kamarchi, a landowner from Farahan, near Khomeyn, Iran.Persuaded by Yusef, Ahmad settled in Iran in 1839, purchasing a sprawling house and garden in Khomeyn that remained in the family for over a century.Ahmad went to become a Twelver Shia cleric. From his third wife, Sakineh Ahmad, who was his friend Yusef’s sister, Ahmad had three daughters and a son, Syed Mostafa, father of Ruhollah Khomeini. Ahmad died in 1869 and was buried in Karbala.The Musavi family’s roots trace back to Nishapur (or Neyshabur), Iran, over 2,500 kilometres from Kintoor. “In the early 18th century (1700), they migrated to India, settling in Kintoor,” Moin notes. The family, Musavi Syeds, claimed descent from the Prophet through his daughter and the seventh Shia Imam, Musa al-Kazim, a lineage rooted in Nishapur.Syed Adil Kazmi, Nihal’s youngest son and an LLB graduate, says, “Our ancestors’ journey from Nishapur to Kintoor, and Ahmad’s return to Iran, tied two worlds together.”Today, Iran’s defiance under Supreme Leader Ayatollah Ali Khamenei echoes Khomeini’s unyielding spirit. “Long before Khamenei or the 1979 revolution led by Khomeini, it was Ahmad, born in our Kintoor, whose choice to settle in Iran changed West Asia’s discourse,” Adil says.From Ahmad’s departure to Khomeini’s revolution, Kintoor’s quiet lanes hold stories of faith, migration, and a family that bridged continents, leaving an indelible mark on history.Kintoor’s legacy also includes Justice Syed Karamat Husain, a Musavi Syed who rose to the position of a judge at the Allahabad high court and founded the Karamat Husain Muslim Girls’ PG College in Lucknow, championing education for women.","The kazmis claim a distant kinship with syed ahmad musavi hindi, grandfather of ayatollah ruhollah musavi khomeini. He left india, escaping colonial rule in 1830, migrating to najaf, and then finally settling in khomeyn in 1834. The family’s roots trace back to nishapur (or neyshabur), iran, over 2,500 kilometres from kintoor.","https://static.toiimg.com/thumb/msid-122010679,width-1070,height-580,imgsize-49798,resizemode-75,overlay-toi_sw,pt-32,y_pad-40/photo.jpg"
India-born B-2 engineer's espionage revisited as US targets Iran with stealth bomber,https://timesofindia.indiatimes.com/india/india-born-b-2-engineers-espionage-revisited-as-us-targets-iran-with-stealth-bomber/articleshow/122060148.cms,"Poll Which measure is more effective in preventing espionage? Strong surveillance and intelligence systems Strict laws and harsher punishments

A brilliant Bombay-born engineer helped build America's deadliest ghost in the sky. Then he betrayed it. Sold its secrets to China. Decades later, the same B-2 stealth bombers he helped perfect unleashed bunker busters on Iran's nuclear facilities on June 22.Noshir Sheriarji Gowadia, now 81, sits behind bars in Colorado's Florence, serving a 32-year sentence handed down on Jan 24, 2011. The former Northrop engineer helped design B-2 stealth bomber's propulsion system, held top-level security clearance, and taught classified aeronautics. He was convicted of espionage after passing classified information to Beijing.Born April 11, 1944, to a Parsi family, Gowadia reportedly earned the equivalent of a PhD by 15. At 19, he left for US to study aeronautical engineering and became a naturalised American on July 25, 1969. A year later, he joined Northrop, where he was instrumental in developing the B-2 Spirit's infrared-shielded propulsion system.""The entire geometry came from me,"" Gowadia said. His internal codename: ""Blueberry Milkshake"". Northrop secured the B-2 contract in 1981, the bomber's defining breakthrough being its radar-elusive profile.Gowadia's work reduced visual, infrared, and radar signatures - vital to B-2's stealth edge.He left Northrop to start his own defence consultancy in Albuquerque. He advised on CIA aircraft and nuclear weapons at Los Alamos, and in 1999, launched NS Gowadia Inc. But mounting expenses drove him to look abroad for clients - a search that ended in China. Gowadia made three trips to China, providing details on stealth propulsion. Beijing used the information to build an undetectable exhaust system for cruise missiles. His payment: $110,000. Years later, satellites picked up what looked like a B-2 clone drone at a Chinese air base.On Oct 13, 2005, FBI agents knocked on Gowadia's Hawaii home. Seeing handcuffs, Gowadia muttered: ""No."" The agent tucked them away. On Oct 26, he was arrested and charged with one count of sharing national defence secrets with a foreign nation. On Oct 22, 2005, he wrote his final confession: ""On reflection what I did was wrong to help the PRC make a cruise missile. What I did was espionage and treason because I shared military secrets with the PRC. ""Gowadia was convicted on 14 counts under Espionage Act and Arms Export Control Act. His son Ashton said the jury was barred from seeing exonerating documents and vowed to appeal. Now, the engineer's betrayal resurfaces in the shadow of bombs falling over Iran. He sits in Florence, far from Mumbai - a traitor of stealth, undone by his own signature.","Noshir sheriarji gowadia helped design b-2 stealth bomber's propulsion system. He was convicted of espionage after passing classified information to beijing. Gowadia, now 81, sits behind bars in colorado's florence, serving a 32-year sentence.","https://static.toiimg.com/thumb/msid-122060171,width-1070,height-580,imgsize-25430,resizemode-75,overlay-toi_sw,pt-32,y_pad-40/photo.jpg"
"Mallikarjun Kharge takes a jibe at Shashi Tharoor, he hits back",https://timesofindia.indiatimes.com/india/mallikarjun-kharge-takes-a-jibe-at-shashi-tharoor-he-hits-back/articleshow/122081298.cms,"Shashi Tharoor and Mallikarjun Kharge (File photos)

NEW DELHI: Congress president Mallikarjun Kharge said his party believes in ""country first"" but some people believe in ""Modi first"", in a sharp reply to questions about party MP Shashi Tharoor's article praising the PM over global outreach on Operation Sindoor. But the jibe was met with an immediate riposte from Tharoor who posted a cryptic note on social media that he did not need ""permission"" from anyone.Faced with persistent queries about the Kerala MP, Kharge said, ""The people of the opposition said in one voice that they are with the army that is fighting (with Pakistan). We said the country is foremost and we will work together (with the govt). We said 'country first, party later'. Some people say 'Modi first, country later'. What can we do with that.""After Kharge's comments, Tharoor posted on X an image of a bird with the caption - ""Don't ask permission to fly. The wings are yours. And the sky belongs to no one..."" TNN","Mallikarjun kharge said his party believes in ""country first"" but some people believe in ""modi first"" kharge was responding to questions about party mp shashi tharoor's article praising the pm over global outreach on operation sindoor. But the jibe was met with an immediate riposte from thar door.","https://static.toiimg.com/thumb/msid-122081353,width-1070,height-580,imgsize-74066,resizemode-75,overlay-toi_sw,pt-32,y_pad-40/photo.jpg"
Bharat Mata row: Kerala chief minister to write to governor,https://timesofindia.indiatimes.com/india/bharat-mata-row-kerala-chief-minister-to-write-to-governor/articleshow/122081282.cms,"AI imagines how Bollywood divas might look at the age of 75. And the word is graceful!

Entertainment","Ai imagines how bollywood divas might look at the age of 75. And the word is graceful! Entertainment entertainment is one of the fastest-growing industries in the world. It is also the fastest growing industry in india, overtaking the us and china.","https://static.toiimg.com/thumb/msid-122081282,width-1070,height-580,imgsize-null,resizemode-75,overlay-toi_sw,pt-32,y_pad-40/photo.jpg"
"Axiom-4 mission: President Murmu, PM Modi hail Shubhanshu Shukla to space; ‘It’s a deja vu moment’, says IAF",https://timesofindia.indiatimes.com/india/axiom-4-mission-president-murmu-pm-modi-hail-shubhanshu-shukla-to-space-its-a-deja-vu-moment-says-iaf/articleshow/122080757.cms,"NEW DELHI: As Group Captain Shubhanshu Shukla creates a new milestone in space for India, the whole nation is excited and proud of an Indian's journey to the stars, said President Droupadi Murmu on Wednesday. ""He and his fellow astronauts have proved the world is indeed one family, Vasudhaiva Kutumbakam,"" Murmu said.Group Captain Shubhanshu Shukla carries with him the wishes, hopes and aspirations of 1.4 billion Indians, said Prime Minister Narendra Modi , adding, ""Wish him and other astronauts all success.""""From conquering the skies to touching the stars - a journey powered by the indomitable spirit of the IAF air warrior,"" Indian Air Force posted on X, while lauding the ""indomitable spirit"" of its boy who is piloting the Axiom-4 mission. ""This is a deja vu moment for India, 41 years after the mission of Squadron Leader Rakesh Sharma, who first carried our tricolour beyond Earth,"" the post read.""Under President Donald Trump's leadership, America has expanded international participation and commercial capabilities in low-Earth orbit.... It's a powerful example of American leadership bringing nations together in pursuit of science, discovery, and opportunity,"" said Nasa acting administrator Janet Petro.Union space minister Jitendra Singh claimed India's ascent to the pedestal of Viksit Bharat has started via space, while Congress' Rahul Gandhi said it was a proud moment for every Indian. ""Jai Hind, Jai Bharat,"" he added.","Group captain shubhanshu shukla carries with him the wishes, hopes and aspirations of 1.4 billion indians. Indian air force lauds the ""indomitable spirit"" of its boy who is piloting the axiom-4 mission. Congress' rahul gandhi said it was a proud moment for every indian.","https://static.toiimg.com/thumb/msid-122080818,width-1070,height-580,imgsize-48498,resizemode-75,overlay-toi_sw,pt-32,y_pad-40/photo.jpg"
'Some countries sheltering terrorists': Rajnath Singh slams Pakistan at SCO Summit; Khawaja Asif present,https://timesofindia.indiatimes.com/india/some-countries-sheltering-terrorists-rajnath-slams-pakistan-at-sco-summit-khawaja-asif-present/articleshow/122080659.cms,"Rajnath Singh at SCO meet

NEW DELHI: Defence Minister Rajnath Singh addressed the Shanghai Cooperation Organisation (SCO) Defence Ministers' Meeting in China's Qingdao on Thursday, where he delivered a sharp message on terrorism , slamming Pakistan in the wake of April's Pahalgam terror attack ""Some countries use cross-border terrorism as an instrument of policy and provide shelter to terrorists. There should be no place for such double standards. SCO should not hesitate to criticise such nations,"" Singh said in a strong statement.Then directly referring to the April 22 terror attack in Kashmir's Pahalgam and Operation Sindoor launched by India in May, ""The pattern of Pahalgam terror attack matches with LeT's previous terror attacks in India. In exercising its right to defend against terrorism and pre-empt as well as deter further cross border terrorist attacks, India on 7th May 2025 successfully launched Operation Sindoor to dismantle cross border terrorist infrastructure. """"Any acts of terrorism are criminal and unjustifiable regardless of their motivation, whenever, wherever and by whom-so-ever committed. SCO members must condemn this evil unequivocally,"" he added.""We reiterate the need to hold the perpetrators, organizers, financiers and sponsors of reprehensible acts of terrorism, including cross-border terrorism, accountable and bring them to justice,"" he further stated.Referring to the broader geopolitical challenges, Singh called for greater unity among SCO members in facing threats to peace and stability. ""I believe that the biggest challenges that we are facing in our region are related to peace, security and trust-deficit. The root cause of these problems is increasing radicalisation, extremism and terrorism. Peace and prosperity cannot co-exist with terrorism and proliferation of Weapons of Mass Destruction in the hands of non-state actors and terror groups. Dealing with these challenges require decisive action and we must unite in our fight against these evils for our collective safety and security,"" he said.Expressing gratitude for welcome at the SCO, Rajnath further said, ""The world we live in is undergoing a drastic transformation. Globalisation, which once brought us closer together, has been losing momentum. The weakening of multilateral systems has made it harder to address urgent challenges—from maintaining peace and security to rebuilding economies after the pandemic.""Singh arrived in Qingdao on Thursday and was received by Chinese Defence Minister Admiral Dong Jun. Before the official proceedings, he joined his SCO counterparts, including Pakistan’s Defence Minister Khawaja Asif, for a group photograph.The two-day SCO Defence Ministers’ Meeting, taking place from June 25 to 26, provides a platform for regional defence leaders to deliberate on shared security threats, counter-terrorism measures, and military cooperation.The Shanghai Cooperation Organisation (SCO) is a regional intergovernmental body established in 2001 to foster mutual trust, political dialogue, and security cooperation among member states. It also works toward strengthening economic, cultural, and humanitarian ties, while promoting stability and peace across the region.India became a full member of the SCO in 2017 and has since taken an active role in its multilateral engagements. In 2023, India held the organisation’s rotating chairmanship. The SCO currently comprises ten member countries: China, India, Kazakhstan, Kyrgyzstan, Pakistan, Russia, Tajikistan, Uzbekistan, Iran, and Belarus.The organisation operates on key principles such as respect for sovereignty and territorial integrity, non-interference in internal affairs, and equality among states. China is chairing the SCO in 2025 under the theme, ‘Upholding the Shanghai Spirit: SCO on the Move’.",Rajnath singh addressed the shanghai cooperation organisation (sco) defence ministers' meeting in china's qingdao. He slammed pakistan in the wake of april's pahalgam terror attack. Singh called for greater unity among sco members in facing threats to peace and stability.,"https://static.toiimg.com/thumb/msid-122080723,width-1070,height-580,imgsize-798752,resizemode-75,overlay-toi_sw,pt-32,y_pad-40/photo.jpg"
