Article Title,Article Link,Article Text,Article Summary,Article Image
Pakistan Major who 'nabbed' Abhinandan killed,https://timesofindia.indiatimes.com/india/pakistan-major-who-nabbed-abhinandan-killed/articleshow/122081687.cms,"NEW DELHI: In a big setback for the ISI and Pakistan army, a Major rank officer and over a dozen other security personnel were killed in separate ambush attacks by Tehreek-e-Taliban Pakistan (TTP) fighters in Waziristan, Khyber Pakhtunkhwa, Tuesday. The slain Major, Moiz Abbas, from the 6 CDO battalion (SSG), had claimed he had captured IAF pilot Abhinandan Varthaman in 2019.Abbas was honorarily promoted to the rank of Major for his act. While Pakistan army chief Field Marshal Asim Munir attended his funeral prayers on Wednesday, President Asif Zardari and PM Shehbaz Sharif offered condolences and praised him for fighting against the operatives of ‘Fitna-Al-Khwarij’, a term used by Pakistan for referring to TTP fighters.On Feb 27, 2019, Varthaman, then a Wing Commander, had downed an enemy jet (F-16) during an aerial combat with Pakistan in the aftermath of the Balakot airstrikes a day before. His own jet was subsequently hit, prompting an ejection and landing on enemy soil. He was held captive for three days and released by Pakistan on March 1. He was later conferred with the Vir Chakra, India's thirdhighest war-time gallantry medal, and promoted to the rank of Group Captain.Abbas (37) was an SSG commando from Chakwal. He was seen in an interview to the Pakistani media describing Varthaman’s capture and rescue from angry civilians.Confirming Abbas’s death, Inter-Services Public Relations (ISPR) said in a statement that Abbas led his troops from the front. “He fought gallantly and paid the ultimate sacrifice along with another brave son of the soil, Lance Naik Jibran Ullah, during the intense fire exchange,” it said.The ISPR also claimed that 11 TTP fighters were killed and called them “Indiasponsored terrorists”, their usual ploy to avoid naming Afghanistan or Taliban.Sources said the TTP fighters targeted Pakistan army personnel in two separate ambushes in Kurram and Sararogha in south Waziristan. While eight Pakistani soldiers were killed and 10 injured in Kurram, at least six soldiers were killed in south Waziristan. TTP operatives also destroyed army vehicles and seized weapons before leaving.In a statement issued on its Telegram account, TTP said videos of both attacks would be released soon. ISPR, however, said, “During the operation, our troops effectively engaged the Khwarij location and 11 Indian-sponsored Khwarij were killed and seven got injured by the security forces.”","A major rank officer and over a dozen other security personnel were killed in separate ambush attacks by tehreek-e-taliban pakistan (ttp) fighters in waziristan. The slain major, moiz abbas, from the 6 cdo battalion (ssg), had claimed he had captured iaf pilot abhinandan varthaman in 2019.","https://static.toiimg.com/thumb/msid-122081712,width-1070,height-580,imgsize-745614,resizemode-75,overlay-toi_sw,pt-32,y_pad-40/photo.jpg"
'Custody no longer needed': Bombay high court bail to 9 Nagpur riots accused,https://timesofindia.indiatimes.com/india/custody-no-longer-needed-bombay-high-court-bail-to-9-nagpur-riots-accused/articleshow/122081480.cms,"NAGPUR: The Nagpur bench of Bombay high court on Wednesday cautioned against hate crimes and vigilantism, observing that mob violence strikes at the heart of Constitutional order. However, the court granted bail to nine persons accused in the Nagpur riots, observing their custody was not required any further, reports Vaibhav Ganjapure.The riots erupted on March 17 after a row surrounding Mughal emperor Aurangzeb's tomb in Chhatrapati Sambhajinagar.""Mobs can't be allowed to take law into their own hands. Nobody has the right to become a self-appointed guardian of law and forcibly administer his or her interpretation of law on others, especially not with violent means,"" Justice Urmila Joshi-Phalke said, citing Supreme Court rulings.Quoting an apex court order in the Kodungallur Film Society case, the judge described hate crimes as ""a product of intolerance, ideological dominance and prejudice"", and emphasised that such conduct must not be tolerated, ""lest it results in a reign of terror"".",Nagpur bench of bombay high court warns against hate crimes and vigilantism. Court grants bail to nine persons accused in the nagpur riots. Riots erupted on march 17 after row surrounding mughal emperor aurangzeb's tomb in chhatrapati sambhajinagar.,"https://static.toiimg.com/thumb/msid-122081480,width-1070,height-580,imgsize-null,resizemode-75,overlay-toi_sw,pt-32,y_pad-40/photo.jpg"
"Air India Flight Incident: Health scare at 35,000 feet: 11 fall ill during Air India London-Mumbai flight, cabin crew collapses, food poisoning suspected",https://timesofindia.indiatimes.com/city/mumbai/11-feel-dizzy-on-ai-flight-to-mumbai-from-uk-cause-being-probed/articleshow/122032028.cms,"Air India

Poll Do you believe airline safety measures are adequate? Yes, they are sufficient No, more measures are needed

2 Air India Flights Cancelled, One Mumbai-Bound Plane Grounded In Kolkata Over Engine Snag





MUMBAI: At least 11 persons, including six cabin crew members, felt dizzy and nauseated on an Air India flight from London to Mumbai on Monday, said sources. Air India confirmed the incident but said only five passengers and two crew members took ill.The flight AI-130 was operated with a Boeing 777 aircraft. The aircraft that's under increased scrutiny following the Ahmedabad accident is Boeing 787 Dreamliner.The cause for the illness is under probe. Poor oxygen supply, which can lead to hypoxia, can cause nausea and dizziness on flights, as can food poisoning.""On board flight AI-130 from London Heathrow to Mumbai, five passengers and two crew reported feeling dizzy and nauseous during different phases of the flight,"" said Air India in a statement. ""The flight landed safely in Mumbai where our medical teams were ready to provide immediate medical assistance. After landing, two passengers and two cabin crew, who continued to feel unwell, were taken to the medical room for further examination and were later discharged. We are investigating the incident and have duly notified the regulator.""A source said a cabin depressurisation problem could cause lower levels of oxygen in the passenger cabin, but then oxygen masks drop from the overhead panel, which didn't happen during this flight.""So, drop in cabin pressurisation is not likely to be the cause."" Food poisoning appears to be the more likely cause, said the source.The pilots of the flight were not affected. ""Pilots get their meal after the passengers have been served. They get the same food as the passengers. Earlier, the commander and the first officer would get separate meal trays, which came from two different kitchens. Serving pilots meals from different kitchens is a proactive safety measure grounded in aviation risk management. It ensures that a single point of failure in catering does not compromise both pilots, preserving flight safety through crew redundancy,"" the source said.","At least 11 people felt dizzy and nauseated on an air india flight from london to mumbai. Air india confirmed the incident but said only five passengers and two crew members took ill. poor oxygen supply, which can lead to hypoxia, can cause nausea and dizziness on flights, as can food poisoning.","https://static.toiimg.com/thumb/msid-122036647,width-1070,height-580,imgsize-862855,resizemode-75,overlay-toi_sw,pt-32,y_pad-40/photo.jpg"
Noshir Gowadia: India-born engineer developed propulsion system of B-2 bombers; later jailed for helping China build cruise missile,https://timesofindia.indiatimes.com/world/us/noshir-gowadia-indian-origin-engineer-developed-propulsion-system-of-us-b-2-spirit-bombers-jailed-for-32-years-for-helping-china-build-cruise-missile/articleshow/122037524.cms,"Noshir Gowadia





Noshir Gowadia and the B-2 Spirit bomber

Poll What is your opinion on international espionage in defense technology? It's a serious threat to national security It's inevitable but can be managed with strong safeguards

Noshir Gowadia and visits to China

The sentencing





The United States deployed its B-2 Spirit bombers in Sunday's strikes on three key nuclear facilities in Iran. The aircraft, sometimes also referred to as the “Stealth” bomber, has an Indian connection - a naturalized US citizen from India was involved in the development of the plane's propulsion system.The engineer, Mumbai-born Noshir Gowadia, was later sentenced to over 30 years in prison for sharing classified military information with China, with which Beijing developed a cruise missile exhaust system to make Chinese cruise missiles resistant to detection.According to the Federal Bureau of Investigation (FBI), Gowadia, now 81, was first arrested in October 2005 on a criminal complaint which alleged that he ""wilfully communicated"" national defense-related information to a person ""not entitled to receive it.""As per information produced during the trial, Gowadia worked with Northrop Grumman Corporation - the makers of B2 bombers - for almost 20 years, from approximately 1968 to 1986. During this time, he contributed to the development of the unique propulsion system and low observable capabilities of the B-2; he also continued to work on classified matters as a contractor with the with the United States government until 1997, when his security clearance was revoked.Evidence displayed at the trial showed that Gowadia visited China six times between June 2003 and July 2005 to provide defense services in the form of design, test support and test data analysis of technologies for the purpose of helping Beijing build a cruise missile system by developing a stealthy exhaust nozzle.At the time of his arrest, Gowadia had been paid at least $110,000 by the Chinese.Gowadia was found guilty in August 2010, following six days of deliberation after a trial spanning nearly four months in Honolulu. In January 2011, he was handed a jail term of 32 years.(This is a top Google Trends topic)",Mumbai-born noshir gowadia was sentenced to over 30 years in prison for sharing classified military information with china. Beijing developed a cruise missile exhaust system to make chinese cruise missiles resistant to detection. Gowadia worked with northrop grumman corporation - the makers of b2 bombers - for almost 20 years.,"https://static.toiimg.com/thumb/msid-122038143,width-1070,height-580,imgsize-411846,resizemode-75,overlay-toi_sw,pt-32,y_pad-40/photo.jpg"
India's time in space: Axiom-4 lifts off; how Dragon will put Shubhanshu Shukla inside ISS,https://timesofindia.indiatimes.com/india/indias-time-in-space-axiom-4-finally-takes-off-shubhanshu-shukla-becomes-first-indian-to-cross-karman-line/articleshow/122078919.cms,"As night enveloped Cape Canaveral, India entered a new dawn when the Falcon-9 rocket lifted off from the Kennedy Space Center in Florida at 2.31am ET (12.01pm IST). In the pilot seat of 'Dragon', the Axiom-4 space capsule that would take a four-member crew to the International Space Station on Thursday, was India's Group Captain Shubhanshu Shukla ""Namaskar, mere pyaare desh vasiyon,"" Shukla radioed to Earth minutes after entering space. ""What a ride! We are orbiting Earth at a velocity of 7.5km per second (27,000 kmph)."" Later, PM Modi congratulated the mission and posted that Shukla ""is on the way to become the first Indian to go to the ISS"".Shukla becomes the first Indian to cross the 'Karman line' in over 41 years, after Wing Commander Rakesh Sharma's flight on the Soviet Soyuz T-11 on April 3, 1984. Shukla's message from space - ""this isn't the beginning of my journey to ISS, but beginning of India's human space flight programme"" - reflects India's ambition to have its own space station by 2035 and crewed missions to Moon and beyond.After multiple postponements, Ax-4 mission lifted off Wednesday carrying commander Peggy Whitson (US), 65, mission pilot Shukla, 39, and mission specialists Sławosz Uznanski (Poland), 41, and Tibor Kapu (Hungary), 34, on a 14-day mission to ISS.Earlier, the symbolic ""crew handover"" took place. The four astronauts waved to their families before heading to the launchpad in a Tesla. Strapped into the Dragon capsule, the crew underwent final checks as the countdown proceeded. Post lift-off, the capsule separated from the second stage nine minutes, 38 seconds later, beginning its journey to ISS. The capsule, now named 'Grace', is expected to dock with ISS at 4.30pm IST on Thursday.Dragon capsule ""Grace"" separated from Falcon 9 nine minutes after launch and is now orbiting Earth at 27,000kmph. Nose cone deployed. Navigation instruments and docking sensors exposed as the spacecraft begins its precision chase of International Space Station.Grace circles Earth once every 90 minutes. The journey isn't a straight line and docking isn't immediate. Over the next 24 to 28 hours, the capsule will execute a series of thruster burns - each timed to the second - to raise & fine-tune its orbit, aligning perfectly with the station's trajectory.A slight delay could shift the narrow rendezvous window. Onboard systems track position in real-time using GPS, radar, and sensors, continuously updating Grace's path against that of the ISS.F inal approach begins Thursday. Dragon will stop at predetermined waypoints, starting 400m out and moving in stages. At each halt, ground controllers and onboard software assess whether conditions are right to proceed.At 20 metres, laser sensors and cameras take over. Grace creeps forward at just a few centimetres a second, lining up precisely with Harmony module's docking port.Soft capture comes first - magnetic guides gently pull the capsule into place. Then hard capture follows, as mechanical latches lock and seal the connection. Hatch opening is not immediate. Engineers on Earth conduct pressure and leak checks before approving crew transfer.Aboard are four Axiom-4 astronauts and a fifth member - Joy, a soft, white baby swan toy serving as the mission's zero-gravity indicator. Joy carries personal meaning: chosen with Group Captain Shubhanshu Shukla's six-year-old son, Kiash - fondly called Sid - in mind.""Our first ideas all included animals,"" said mission specialist Tibor Kapu. ""We have one kid with the crew, Shux's kid Sid, who basically just loves animals. We wanted dinosaurs and lions, but we couldn't find the right one. We were extremely happy when we found Joy.""","India's group captain shubhanshu shukla becomes the first indian to cross the 'karman line' in over 41 years. The capsule, now named 'grace', is expected to dock with iss at 4.30pm ist on thursday. Dragon capsule ""grace"" separated from falcon 9 nine minutes after launch and is now orbiting earth at 27,000kmph.","https://static.toiimg.com/thumb/msid-122079177,width-1070,height-580,imgsize-48498,resizemode-75,overlay-toi_sw,pt-32,y_pad-40/photo.jpg"
‘Just praise him a little’: Trump repeats mediation claim; Congress taunts PM Modi again,https://timesofindia.indiatimes.com/india/just-praise-him-a-little-trump-repeats-mediation-claim-congress-rebukes-pm-modi-again/articleshow/122074470.cms,"NEW DELHI: Congress on Wednesday launched a scathing attack on Prime Minister Narendra Modi after US President Donald Trump, yet again, claimed that he stopped the war between India and Pakistan using trade as leverage.Congress leader Pawan Khera said that PM Modi will undermine India's interests for a little praise.""From China to the US, the world knows that the greatest weakness of Prime Minister Modi is applause, approval, validation,"" Khera wrote in a social media post on X.""Just praise him a little and Modi will undermine India’s interests - giving clean chits to China and surrendering to threats of the US,"" he added.This comes after Trump, once again, claimed that he ended the war between India and Pakistan through a series of calls.""The most important of all, India and Pakistan...I ended that with a series of phone calls on trade. I said if you're going to go fighting each other, we're not doing any trade deal. The General from Pakistan was in my office last week,"" Trump said.""Prime Minister Modi is a great friend of mine. He's a great gentleman, he's a great man. I got them to reason, and I said, we're not doing a trade deal if you're going to fight. They said, no, I want to do the trade deal.We stopped the nuclear war,"" he added.However, India has firmly denied any foreign mediation in its engagement with Pakistan. In a conversation with President Trump, Prime Minister Narendra Modi clarified that India rejects any form of external mediation in its bilateral matters with Pakistan.India will never countenance any form of mediation in its relations with Pakistan and there was no discussion at any level between India and the US about the proposed trade deal, or American intervention, during the events that unfolded after Operation Sindoor , PM Modi told Trump in his recent telephonic conversation.Tensions between India and Pakistan flared following the April 22 terror attack in Jammu and Kashmir's Pahalgam. India conducted precision strikes on terror infrastructure located in Pakistan and Pakistan-occupied Kashmir in the early hours of May 7.Pakistan retaliated with attempted strikes on Indian military installations on May 8, 9, and 10, which were met with strong responses from India. Hostilities ceased after a mutual understanding was reached between the Directors General of Military Operations (DGMOs) of both nations on May 10. India has consistently maintained that this de-escalation was achieved through direct military-to-military dialogue and not through any third-party intervention.","Congress leader pawan khera said that pm modi will undermine india's interests for a little praise. This comes after trump, once again, claimed that he ended the war between india and pakistan through a series of calls. ""i said if you're going to go fighting each other, we're not doing any trade deal,"" trump said.","https://static.toiimg.com/thumb/msid-122074460,width-1070,height-580,imgsize-1116413,resizemode-75,overlay-toi_sw,pt-32,y_pad-40/photo.jpg"
Point of no return? Kharge takes 'Modi first' swipe at Tharoor; Congress MP responds with cryptic message,https://timesofindia.indiatimes.com/india/point-of-no-return-kharge-takes-modi-first-swipe-at-tharoor-congress-mp-responds-with-cryptic-message/articleshow/122074771.cms,"NEW DELHI: Mallikarjun Kharge 's 'Modi first, country later' swipe at Shashi Tharoor on Wednesday added a new chapter to the ongoing saga of an open, often bitter, fight between the Congress and its Thiruvananthapuram MP.That Congress and Shashi Tharoor are at loggerheads does not make news anymore. Since February this year, when Tharoor made his first ""out-of-turn"" praise for Prime Minister Narendra Modi over his Trump meet and Ukraine war policy, we have seen the two sides locked in an open, often embarrassing, war of words.Also read: 'Don't ask permission': Shashi Tharoor posts cryptic message; message for Congress top brass? Interestingly, it appeared till now that both were leaving some room for a possible rapprochement in the future. While the top Congress leadership had till now refrained from reacting directly to Tharoor's repeated ""transgressions"" of the party's political line, the Thiruvananthapuram MP on his part had only last week stated that he did have some differences with some in the party leadership, but refused to discuss them in the open.However, that seemed to have changed today when Kharge did not held himself back and took digs at Tharoor for his repeated Modi praise - the latest being an article in Hindu in which the Thiruvananthapuram MP wrote, ""PM Modi's energy, dynamism and willingness to engage remained a 'prime asset' for India on the global stage but deserved greater backing.""Also read: Ignored for Nilambur campaign, Shashi Tharoor's message to Congress: 'Strong bond with party workers, some differences with leadership' Asked about Tharoor's article on Operation Sindoor outreach, Kharge's reaction was sharp and strong: ""I can't read English well. His (Tharoor's) (English) language is very good, that's why we have made him a Congress Working Committee member. But I want to say that the people of the opposition together said they are with the Army that is fighting (during Operation Sindoor)... We (the Congress) said the country is paramount and we will work together (with the government). We said 'country first, party later'. Some people say 'Modi first, country later'. What can we do about that?""Also read: 'Prime asset for India on global stage': Tharoor praises PM Modi again; BJP uses his remark to target Rahul Kharge also tried to play down the remarks of Tharoor directed against the party.""Whoever knows how to write, will write it, we do not want to think about that. Our target is to maintain unity in the country, to ensure the security of the country. We will keep fighting for the country, there is no need to pay attention to anyone's words,"" the Congress chief said.Pressed further on the Thiruvananthapuram MP's comments, Kharge said Tharoor is speaking according to his will, but ""we do not want to keep harping on it as we are more concerned about how to save the country"".Interestingly, this is also Tharoor's defence for his words and actions. The Congress MP has said that his article on Operation Sindoor's global outreach was not a sign of him ""leaping to join"" Prime Minister Modi's party but a statement of national unity, interest and standing up for India.Hours after Congress chief Kharge's barbs directed at him, Tharoor responded with yet another cryptic message for the Congress leadership.The Thiruvananthapuram MP's post on X had an image of a bird with the caption -- ""Don't ask permission to fly. The wings are yours. And the sky belongs to no one...""The differences between them seems to have reached a point of no return. Tharoor has already made it clear to the Congress leadership that he has wings and he does not need anyone's permission to fly. So, the big question is: Will Tharoor fly? If yes, when? Well, we will have to keep an eye on the sky.(With inputs from agencies)","Mallikarjun kharge's swipe at shashi tharoor adds a new chapter to the ongoing saga of an open, often bitter, fight between the congress and its thiruvananthapuram mp. It appeared till now that both were leaving some room for a possible rapprochement in the future. The differences between them seems to have reached a point of no return.","https://static.toiimg.com/thumb/msid-122075155,width-1070,height-580,imgsize-1137015,resizemode-75,overlay-toi_sw,pt-32,y_pad-40/photo.jpg"
"After English, a lesson in French: Shashi Tharoor slams Pakistan in Russia - video goes viral",https://timesofindia.indiatimes.com/india/after-english-a-lesson-in-french-shashi-tharoor-slams-pakistan-in-russia-video-goes-viral/articleshow/122074188.cms,"Shashi Tharoor. (PTI photo)

Viral: Tharoor’s Sharp Swipe At Pakistan In Moscow; After English, Fiery Takedown In French

NEW DELHI: Congress MP Shashi Tharoor , widely recognised for his eloquence in English, drew widespread praise this week for speaking fluent French while strongly criticising Pakistan’s inclusion in an upcoming anti-terrorism conference organised by Russia.During a meeting in Moscow with Russian Liberal Democratic Party chairman Leonid Slutsky, Tharoor responded in French to Slutsky’s remarks regarding a proposed summit on combating terrorism.Slutsky had announced Russia’s plans to host a conference early next year involving the parliamentary heads of six countries: Turkey, Iran, Russia, India, Pakistan, and China. He emphasised the need for concrete action, not just discussion, on the issue of terrorism.In a striking moment, Tharoor replied in French, directly addressing the problem of Pakistan’s involvement. ""There is a country that unfortunately provides a safe haven for these terrorist groups,"" Tharoor said. ""They have their headquarters, they train terrorists in their country, fund them, arm them, and send them to other nations. It’s difficult for us to ignore the fact that they enjoy patronage in Pakistan.The video of Tharoor’s French-language exchange with Slutsky quickly went viral on social media, earning him praise for both his linguistic skill and diplomatic clarity.Following the meeting, Tharoor posted on X: “Good to renew my acquaintance with my Russian counterpart, Mr Slutsky, who had visited Parliament in New Delhi a few months ago with a Russian delegation. We exchanged views on regional peace, Operation Sindoor , and possible avenues of future parliamentary cooperation.”Tharoor has long been vocal about Pakistan's links to terrorism and reiterated India’s concerns abroad while leading the Indian delegation under the government’s Operation Sindoor global outreach initiative.",Congress mp shashi tharoor drew widespread praise this week for speaking fluent french. He strongly criticised pakistan’s inclusion in an upcoming anti-terrorism conference organised by russia. The video of his french-language exchange with slutsky quickly went viral on social media.,"https://static.toiimg.com/thumb/msid-122074585,width-1070,height-580,imgsize-1588926,resizemode-75,overlay-toi_sw,pt-32,y_pad-40/photo.jpg"
